评论用户,评论概述,评论链接,星级评分,评论地点,评论时间,类型,是否购买,评论详情,觉得该评论有帮助的人数
Candi,Stars fell off,https://www.amazon.com/gp/customer-reviews/R39DHN0UK5VKL5/ref=cm_cr_getr_d_rvw_ttl?ie=UTF8&ASIN=B0CKB9RR1S,"1.0 "," the United States "," January 6, 2025",Color: StarSize: S Fit Pant 30-35'' （Length 39''),,"This belt is not good quality. As soon as my daughter put the belt on, one of the stars began to fall off which are poor quality as well and not secured very well to the belt. Will be returning.",
Amanda Hughey,Item as described!,https://www.amazon.com/gp/customer-reviews/R27J0BE9BRT0BP/ref=cm_cr_getr_d_rvw_ttl?ie=UTF8&ASIN=B0CKB9RR1S,"5.0 "," the United States "," December 12, 2024",Color: StarSize: M Fit Pant 34-39'' （Length 43''),Verified Purchase,We ordered the star belt from this seller and received it in a timely manner. The item was exactly as described by seller and of great quality. Looks to be in brand new condition and good value for the money. Would order again!,
Tammy M. Davis,I bought it as a LARGE to wrap it and hang it off to one side. It looks cool like that!,https://www.amazon.com/gp/customer-reviews/R27SO45M0C6OA1/ref=cm_cr_getr_d_rvw_ttl?ie=UTF8&ASIN=B0CKB9RR1S,"5.0 "," the United States "," December 4, 2024",Color: BulletSize: L Fit Pant 38-43'' （Length 47''),Verified Purchase,"Love the material, it's made nice with weight for strength and durability. Looks amazing with silver faux bullets! Awesome purchase! ❤️",
Jennifer,All around a+,https://www.amazon.com/gp/customer-reviews/R20IA2STON0W9D/ref=cm_cr_getr_d_rvw_ttl?ie=UTF8&ASIN=B0CKB9RR1S,"5.0 "," the United States "," December 4, 2024",Color: SilverSize: L Fit Pant 38-43'' （Length 47''),Verified Purchase,"The packaging, the fit, the quality, the shipping time. Very impressed. Will definitely be buying from this shop again",
steph,Eh,https://www.amazon.com/gp/customer-reviews/RMZWR2XFQRRNR/ref=cm_cr_getr_d_rvw_ttl?ie=UTF8&ASIN=B0CKB9RR1S,"3.0 "," the United States "," November 14, 2024",,Verified Purchase,Cheap and kinda small. Not like the good ones from back in the day. Chinese knock off I expect.,
David Bankson,Too small,https://www.amazon.com/gp/customer-reviews/RH9U3B6YF70I6/ref=cm_cr_getr_d_rvw_ttl?ie=UTF8&ASIN=B0CKB9RR1S,"1.0 "," the United States "," October 31, 2024",Color: SilverSize: S Fit Pant 30-35'' （Length 39''),Verified Purchase,"The item sizing is described as a 32-34"" waist for size small. This is absolutely not the case. I should have gotten a medium like normal.",
Aiden hewitt,Works great,https://www.amazon.com/gp/customer-reviews/R1E1JKW69O16QH/ref=cm_cr_getr_d_rvw_ttl?ie=UTF8&ASIN=B0CKB9RR1S,"5.0 "," the United States "," October 30, 2024",Color: SilverSize: M Fit Pant 34-39'' （Length 43''),Verified Purchase,Fits perfect,
Nicole B.,Perfect little punk belt,https://www.amazon.com/gp/customer-reviews/REBN3399MDZIR/ref=cm_cr_getr_d_rvw_ttl?ie=UTF8&ASIN=B0CKB9RR1S,"4.0 "," the United States "," October 14, 2024",Color: Black GrommetSize: S Fit Pant below 35'' （Length 39''),,Goes with just about anything. Nice quality material. Lots of grommets to use and belt holes.,
Bobby,Great quality,https://www.amazon.com/gp/customer-reviews/R2AZBE55A45EN8/ref=cm_cr_getr_d_rvw_ttl?ie=UTF8&ASIN=B0CKB9RR1S,"5.0 "," the United States "," August 29, 2024",Color: DarkSize: XL Fit Pant 42-47'' （Length 51''),Verified Purchase,Great quality belt packaged with care.,
Ghost,👍,https://www.amazon.com/gp/customer-reviews/R2UM0XSVSKPF2U/ref=cm_cr_getr_d_rvw_ttl?ie=UTF8&ASIN=B0CKB9RR1S,"5.0 "," the United States "," August 2, 2024",Color: BulletSize: L Fit Pant 38-43'' （Length 47''),Verified Purchase,Supero mis expectativas me gustó mucho,
Dino,Loved this belt!,https://www.amazon.com/gp/customer-reviews/R24KBTUBCYSOHB/ref=cm_cr_getr_d_rvw_ttl?ie=UTF8&ASIN=B0CKB9RR1S,"5.0 "," the United States "," July 9, 2024",Color: BulletSize: S Fit Pant 30-35'' （Length 39''),Verified Purchase,Got a few compliments and it looked bada$$!,
Mimi London,Not for me,https://www.amazon.com/gp/customer-reviews/R1YK8D6DT356QD/ref=cm_cr_getr_d_rvw_ttl?ie=UTF8&ASIN=B0CKB9RR1S,"1.0 "," the United States "," June 20, 2024",Color: Silver and StarSize: L Fit Pant 38-43'' （Length 47''),Verified Purchase,"If you’re a bigger girl, these probably won’t be the best for you. They do not fit. They’re cute but the material is cheap. I wouldn’t buy them",
SKHAN,Nicely made,https://www.amazon.com/gp/customer-reviews/RQ5KL60KCDNX5/ref=cm_cr_getr_d_rvw_ttl?ie=UTF8&ASIN=B0CKB9RR1S,"5.0 "," the United States "," June 12, 2024",Color: StarSize: S Fit Pant 30-35'' （Length 39''),Verified Purchase,"Both the sizing chart and the actual photo were exact. Since my friend is not much larger than I am, I took my waist measurement and ordered one size larger, which suits her flawlessly.",
Jed G.,Don't do it,https://www.amazon.com/gp/customer-reviews/R3BBZE0URQAFUL/ref=cm_cr_getr_d_rvw_ttl?ie=UTF8&ASIN=B0CKB9RR1S,"1.0 "," the United States "," June 11, 2024",Color: SilverSize: L Fit Pant 38-43'' （Length 47''),,Ridiculously cheap. Not true to size at all. I'm not one to complain but this is crap.,
Stephen h.,Good,https://www.amazon.com/gp/customer-reviews/R2CMW4YFWDZ9DK/ref=cm_cr_getr_d_rvw_ttl?ie=UTF8&ASIN=B0CKB9RR1S,"4.0 "," the United States "," June 4, 2024",Color: BulletSize: L Fit Pant 38-43'' （Length 47''),Verified Purchase,4 stars because the bullets are poopy but the rest of the belt is very good,
Erica M. Levesque,Cool belt,https://www.amazon.com/gp/customer-reviews/R11X06K55ELAY9/ref=cm_cr_getr_d_rvw_ttl?ie=UTF8&ASIN=B0CKB9RR1S,"5.0 "," the United States "," May 2, 2024",Color: Black GrommetSize: M Fit Pant below 39'' （Length 43''),,"I got this for my husband, who loves studded belts. He likes this one a lot. It fit well, looks cool, and has lasted quite a while now. It’s a stiff, almost plastic-feeling material but it works well for him.",
Mekhiyah,Great product,https://www.amazon.com/gp/customer-reviews/R1LTS6Q90PM49A/ref=cm_cr_getr_d_rvw_ttl?ie=UTF8&ASIN=B0CKB9RR1S,"5.0 "," the United States "," April 24, 2024",Color: BulletSize: L Fit Pant 38-43'' （Length 47''),Verified Purchase,bought for my sister and she loved it,
kysha Shante,True to size.,https://www.amazon.com/gp/customer-reviews/R35H912XYA1OE0/ref=cm_cr_getr_d_rvw_ttl?ie=UTF8&ASIN=B0CKB9RR1S,"5.0 "," the United States "," April 21, 2024",Color: Black GrommetSize: M Fit Pant below 39'' （Length 43''),,This belt is great quality. It’s a great fit very true to size.,
Holly R.,Oh how I’ve missed the Emo,https://www.amazon.com/gp/customer-reviews/RQTBRD0GXL8Y7/ref=cm_cr_getr_d_rvw_ttl?ie=UTF8&ASIN=B0CKB9RR1S,"5.0 "," the United States "," March 21, 2024",Color: Black GrommetSize: L Fit Pant below 43'' （Length 47''),,"Reminds me so much of that era, totally hot topic vibes. Great quality and fits true and no the metal spikes don’t come off",
JijieF,sturdy,https://www.amazon.com/gp/customer-reviews/R1FCD2A1T210TY/ref=cm_cr_getr_d_rvw_ttl?ie=UTF8&ASIN=B0CKB9RR1S,"5.0 "," the United States "," March 13, 2024",,,"these belts are well made and plenty of colors to choose from. sometimes when it's too tight, the adjustable back kind of become lose, nothing bad though.",
Felicia Graf,Nice looking. A little thinner than expected,https://www.amazon.com/gp/customer-reviews/R39UW1RCVPLO1E/ref=cm_cr_getr_d_rvw_ttl?ie=UTF8&ASIN=B0CKB9RR1S,"4.0 "," the United States "," February 27, 2024",,,I like the look of the product but it is not a heft as they look. Quality-ish looking hardware. Not a bad price.,
moe,Stud for a Stud,https://www.amazon.com/gp/customer-reviews/R19BBVIJ33I45V/ref=cm_cr_getr_d_rvw_ttl?ie=UTF8&ASIN=B0CKB9RR1S,"3.0 "," the United States "," February 24, 2024",Color: Black GrommetSize: M Fit Pant below 39'' （Length 43''),,"I thought that it was kinda clever to get a studded belt for my stud of a husband. LOL! it was definitely a unique belt that he now owns and appreciates. It's a bold looking belt, it's sleek and seems like a very durable belt.",
Sxy_Jojo,nice,https://www.amazon.com/gp/customer-reviews/R2IL4A14L8LD83/ref=cm_cr_getr_d_rvw_ttl?ie=UTF8&ASIN=B0CKB9RR1S,"5.0 "," the United States "," February 20, 2024",,,"I love this belt and bracelets.  The studded belt is study and last a long time without showing any damage. The belt feels firm, and fits as expected.",
Courtney,Must have accessory,https://www.amazon.com/gp/customer-reviews/R1E8VN1CDZKR3L/ref=cm_cr_getr_d_rvw_ttl?ie=UTF8&ASIN=B0CKB9RR1S,"5.0 "," the United States "," February 11, 2024",Color: Black GrommetSize: S Fit Pant below 35'' （Length 39''),,I like having versatile style accessories. A chunky belt is always in style.,
Jennifer Dunlap,nice belt,https://www.amazon.com/gp/customer-reviews/R63WA1WMFGLJB/ref=cm_cr_getr_d_rvw_ttl?ie=UTF8&ASIN=B0CKB9RR1S,"4.0 "," the United States "," February 10, 2024",Color: Black GrommetSize: M Fit Pant below 39'' （Length 43''),,"Overall this is a decent belt. It is a little wide so if you have smaller belt buckles it can take a bit to get the belt on. I like that while it has decor to it, the overall color is black so I am able to wear it for work.",
Elliot Z.,durable and fits nice,https://www.amazon.com/gp/customer-reviews/R1ZQFG4WPGSOWI/ref=cm_cr_getr_d_rvw_ttl?ie=UTF8&ASIN=B0CKB9RR1S,"5.0 "," the United States "," February 7, 2024",Color: Black GrommetSize: M Fit Pant below 39'' （Length 43''),,"The belt is comfortable to wear and its sturdy, its actually the only studded belt ive owned where the studs haven't came loose and stabbed me.",
kaylee,so cute,https://www.amazon.com/gp/customer-reviews/R36X25FW68EMCH/ref=cm_cr_getr_d_rvw_ttl?ie=UTF8&ASIN=B0CKB9RR1S,"5.0 "," the United States "," February 5, 2024",Color: SilverSize: S Fit Pant 30-35'' （Length 39''),Verified Purchase,these are so cute they are sturdy and are a perfect fit i love,
Jennifer Jones,Good Product,https://www.amazon.com/gp/customer-reviews/R327GRKECV5ED1/ref=cm_cr_getr_d_rvw_ttl?ie=UTF8&ASIN=B0CKB9RR1S,"4.0 "," the United States "," January 30, 2024",Color: Black GrommetSize: S Fit Pant below 35'' （Length 39''),,"This belt was a little larger than it was indicated on the listing, however it has really good quality and looks very attractive when worn.  This has become a regular staple in my child's wardrobe and she really likes the way that it looks on.",
Lissa,Black pyramid stud belt,https://www.amazon.com/gp/customer-reviews/R2SAX9O2EO77OH/ref=cm_cr_getr_d_rvw_ttl?ie=UTF8&ASIN=B0CKB9RR1S,"4.0 "," the United States "," January 11, 2024",Color: Black GrommetSize: S Fit Pant below 35'' （Length 39''),,"This belt arrives in a lovely box! It's a cool belt, however I ordered the small and it's pretty big still. I wear a size 4 women's pants and if I wear it at a proper fit, it's tightened down to the second to last grommet (it was worn semi-loose in the photos). A women's size 4 pants is 26 inches and this belt is listed as 30 so it is indeed big for small.",
Laura Hagen,LOVE IT!,https://www.amazon.com/gp/customer-reviews/RJZ248IJ1WGTM/ref=cm_cr_getr_d_rvw_ttl?ie=UTF8&ASIN=B0CKB9RR1S,"5.0 "," the United States "," January 8, 2024",Color: Black GrommetSize: S Fit Pant below 35'' （Length 39''),,"Way cuter than your sterotypical silver studs!  This is really cute and it's subtle, which I think fits better at my age.  Good quality, actually comes in a nice gift box.",
QueenDe,Love this iconic belt,https://www.amazon.com/gp/customer-reviews/R39NVJWHSOL0PB/ref=cm_cr_getr_d_rvw_ttl?ie=UTF8&ASIN=B0CKB9RR1S,"5.0 "," the United States "," January 8, 2024",Color: SilverSize: M Fit Pant 34-39'' （Length 43''),Verified Purchase,"This belt gives nostalgic vibes. I love it. I'm 5'8"" and 175 pounds I got a medium which fits but I would have gone up to a large for extra room.  Great quality I'd buy again.",
Erin,Super cute!!!,https://www.amazon.com/gp/customer-reviews/R396L9DIA6X3AA/ref=cm_cr_getr_d_rvw_ttl?ie=UTF8&ASIN=B0CKB9RR1S,"5.0 "," the United States "," January 7, 2024",Color: Black GrommetSize: M Fit Pant below 39'' （Length 43''),,I love this!! It fits great and is so cute on!! Matches my total aesthetic.,
H. S.,Takes me back to my hot topic days,https://www.amazon.com/gp/customer-reviews/R2V8P8B52LDAXY/ref=cm_cr_getr_d_rvw_ttl?ie=UTF8&ASIN=B0CKB9RR1S,"4.0 "," the United States "," January 5, 2024",Color: Black GrommetSize: L Fit Pant below 43'' （Length 47''),,"I'm trying to lose weight, kind of successfully. Some of my pants now require a belt again. I impulse-requested this because it's cute and not too crazy looking, while still being a little punky. It seems well-made and is holding up to repeated use after about a month, and came in a cute reusable little box. My only complaint is that the rivets don't go all the way up to the edge of where the buckle and holes are, leaving some of the front of the belt un-adorned. However, with a rivet gun or an upholstery stapler, you can get creative with the unoccupied space.",
Tim & Tammy,Very thick and heavy,https://www.amazon.com/gp/customer-reviews/R29DL4UILT35T8/ref=cm_cr_getr_d_rvw_ttl?ie=UTF8&ASIN=B0CKB9RR1S,"5.0 "," the United States "," January 4, 2024",Color: Black GrommetSize: L Fit Pant below 43'' （Length 47''),,"My wife didn't quite realize how large this was going to be, but she is keeping it as it is solid, heavy and well made and the studs seem solid.",
Robin Scott,My new favorite belt!,https://www.amazon.com/gp/customer-reviews/R13FEASWJCUS0C/ref=cm_cr_getr_d_rvw_ttl?ie=UTF8&ASIN=B0CKB9RR1S,"5.0 "," the United States "," January 3, 2024",Color: Black GrommetSize: M Fit Pant below 39'' （Length 43''),,"I've worn this every day since I received it. If you know the basic emo studded belt at every mall, this is a major upgrade! The holes have metal rings and the loop that holds the belt flat has three studs on it as well. It feels sturdy and the leather feels really good quality. I'd totally buy this belt again if this one wears out. 6 stars out of 5 for the upgraded emo belt Lol",
Amanda,Nicely made,https://www.amazon.com/gp/customer-reviews/R3IFIVB5TBVHNQ/ref=cm_cr_getr_d_rvw_ttl?ie=UTF8&ASIN=B0CKB9RR1S,"5.0 "," the United States "," January 2, 2024",Color: BulletSize: M Fit Pant 34-39'' （Length 43''),Verified Purchase,Exactly how the picture looks and sizing chart was accurate. Friend is only slightly bigger than me so I measured my waist then went one size up and it fits her perfectly.,
Johana,Love it,https://www.amazon.com/gp/customer-reviews/R3RHRYG0VD2BRP/ref=cm_cr_getr_d_rvw_ttl?ie=UTF8&ASIN=B0CKB9RR1S,"5.0 "," the United States "," December 31, 2023",,Verified Purchase,"I love it, the look so good!!",
Corianna6,Stylish synthetic leather belt for men,https://www.amazon.com/gp/customer-reviews/R2GUC9J0DCTA8N/ref=cm_cr_getr_d_rvw_ttl?ie=UTF8&ASIN=B0CKB9RR1S,"5.0 "," the United States "," December 31, 2023",Color: Black GrommetSize: M Fit Pant below 39'' （Length 43''),,"I got this stylish belt for my husband, who plays in a rock band! I love the riveted design. This belt is THICK and sturdy, so he'll be able to use it for a long time. I ordered a medium, which the description says is for 34""-39"" waists, and it is true to size. I added a photo of the length to give people an idea of the measurement. Overall, my husband was super happy to get this belt, so I would definitely recommend it!",
LeeC,Very cool belt!,https://www.amazon.com/gp/customer-reviews/RL2DE3OIS70RV/ref=cm_cr_getr_d_rvw_ttl?ie=UTF8&ASIN=B0CKB9RR1S,"5.0 "," the United States "," December 29, 2023",Color: Black GrommetSize: M Fit Pant below 39'' （Length 43''),,"I spent some time wondering if I was really cool enough for a “black studded punk rock belt” before I bought this, and I’m glad I decided to go for it!  It looks great!  It adds a little edge to an outfit, but it's not too flashy.  The ""studded"" part of it is nice and shiny, and the holes have metal around them so they also have a little extra style.It is also just a good, functional belt – strong, holds pants up effectively.  The fake leather doesn’t feel like it’s going to crack, but I’ll update this if it does.",
The Blue Thunder Bomb,Tough and tumble and ready to rumble,https://www.amazon.com/gp/customer-reviews/R25XPUYH6SBEOB/ref=cm_cr_getr_d_rvw_ttl?ie=UTF8&ASIN=B0CKB9RR1S,"5.0 "," the United States "," December 29, 2023",Color: Black GrommetSize: L Fit Pant below 43'' （Length 47''),,Very well made belt. Looks really cool. Sizing is excellent as well.,
Rayne Alexandria,Cute little belt!,https://www.amazon.com/gp/customer-reviews/R1U5EE7G6FJCZ/ref=cm_cr_getr_d_rvw_ttl?ie=UTF8&ASIN=B0CKB9RR1S,"4.0 "," the United States "," December 26, 2023",Color: Black GrommetSize: S Fit Pant below 35'' （Length 39''),,"This is a very well-made and seemingly durable belt. I've worn it a few times now and I'm happy that there hasn't been any ripping or tearing on the faux-leaher and/or of the seams holding it together, and most importantly, all of the pyramid studs were in tact. My only real complaint with the belt is that the studs abruptly stop halfway up the belt. So from the front, it would appear as if it's just a plain belt. It's still super cute, and I am so glad I was able to snag one of these while they were still available. It's comfortable, bends with my body and accentuates all of my outfits with ease. Love it!",
Jay :),so cute,https://www.amazon.com/gp/customer-reviews/RD3NMQ3ER58C0/ref=cm_cr_getr_d_rvw_ttl?ie=UTF8&ASIN=B0CKB9RR1S,"5.0 "," the United States "," December 23, 2023",,,they're good quality and fit perfectly with my outfits,
Loren,Throwback to my younger days,https://www.amazon.com/gp/customer-reviews/R8U18QWOTKLC8/ref=cm_cr_getr_d_rvw_ttl?ie=UTF8&ASIN=B0CKB9RR1S,"4.0 "," the United States "," December 22, 2023",Color: Black GrommetSize: M Fit Pant below 39'' （Length 43''),,"The belt feels well-made for the most part. I like the metal grommets around the buckling holes, because those holes eventually stretch and wear out on all my other belts. That's a nice touch. Additionally, I like that the studs are anchored in more than just two points each. They will hold up to long-term abuse for sure.  I like that it's all black, too. A little more subtle than silver studs on black (or any other combination).  If I have one complaint, I suppose the actual belt material feels just a *tad* on the cheaper side. It's not a huge complaint though, and for this price point I'm certainly not expecting real leather or anything.  Overall I'm definitely happy.",
Tiffany,Nice belt,https://www.amazon.com/gp/customer-reviews/RSTKEN4HW9F9D/ref=cm_cr_getr_d_rvw_ttl?ie=UTF8&ASIN=B0CKB9RR1S,"5.0 "," the United States "," December 16, 2023",Color: Black GrommetSize: M Fit Pant below 39'' （Length 43''),,This black studded belt is nice material and it fits great and looks stylish. I recommend it.,
Maison Lupin,Gorgeous and a great fit,https://www.amazon.com/gp/customer-reviews/R1UDC2SDQJPAOV/ref=cm_cr_getr_d_rvw_ttl?ie=UTF8&ASIN=B0CKB9RR1S,"5.0 "," the United States "," December 16, 2023",Color: Black GrommetSize: M Fit Pant below 39'' （Length 43''),,"I've never stopped wearing leather and spikes. Of course, I might get mocked as someone who never got past their emo phase. But who says it's a phase? This piece can be worn either visibly or lowkey, showing a distinctive edge. I dig it.",
Amaz-Mel,cute and is still decent after months of use,https://www.amazon.com/gp/customer-reviews/RL24NH6JKLTUZ/ref=cm_cr_getr_d_rvw_ttl?ie=UTF8&ASIN=B0CKB9RR1S,"4.0 "," the United States "," December 15, 2023",,,"i have been using this belt for months. two of the rings on the holes have fallen off, which upsets me a little bit. however, the studs on the belt have all stayed on. the belt has not cracked or started to peel or anything. it has been worn down a bit, as all belts do, but it still looks pretty decent other than the two missing rings.",
In My Opinion,Studded Black Belt with Style,https://www.amazon.com/gp/customer-reviews/RJU908NJTSHKY/ref=cm_cr_getr_d_rvw_ttl?ie=UTF8&ASIN=B0CKB9RR1S,"5.0 "," the United States "," December 15, 2023",Color: Black GrommetSize: M Fit Pant below 39'' （Length 43''),,"This is a great belt for that black outfit. The dark studs downplay its style yet remains committed to its unique rock, punk, goth theme. The studs are firmly embedded in the belt and contain a gloss sheen. The belt thickness feels sturdy and should last quite a while. If time exposes a different result, this review will capture it and keep you posted.",
Isabel,Good looking belt,https://www.amazon.com/gp/customer-reviews/R387T8T2TBGMJ2/ref=cm_cr_getr_d_rvw_ttl?ie=UTF8&ASIN=B0CKB9RR1S,"5.0 "," the United States "," December 13, 2023",Color: Black GrommetSize: S Fit Pant below 35'' （Length 39''),,"First of all this belt fits true to size, I like the design it makes any outfit look better. The quality is decent and it’s not heavy",
J. Byrne,Decent for the price,https://www.amazon.com/gp/customer-reviews/R3IXQG7IMVDUPN/ref=cm_cr_getr_d_rvw_ttl?ie=UTF8&ASIN=B0CKB9RR1S,"4.0 "," the United States "," December 13, 2023",Color: Black GrommetSize: L Fit Pant below 43'' （Length 47''),,"Decent belt. It’s not super high quality, but for the price it’s decent enough and adds a stylish flair to any outfit. True to size.",
H.Vazquez,Functional and Great Quality,https://www.amazon.com/gp/customer-reviews/R1FOJ5M7KOLKKT/ref=cm_cr_getr_d_rvw_ttl?ie=UTF8&ASIN=B0CKB9RR1S,"5.0 "," the United States "," December 12, 2023",Color: Black GrommetSize: S Fit Pant below 35'' （Length 39''),,Picture and description are true to actual product n arrival. Well made and looks great!,
H. Wang,"Add dressing stylish, not meant to be a functioning belt.",https://www.amazon.com/gp/customer-reviews/R23I1U05YYDSAN/ref=cm_cr_getr_d_rvw_ttl?ie=UTF8&ASIN=B0CKB9RR1S,"4.0 "," the United States "," November 25, 2023",,,"These leather belts are for enhancing dressing style. They are not meant to function like an actual belt, mainly because there is nothing to keep the size in place. The color is not aggressive, and the belt can go with many clothing styles.  All in all, both my daughters like them.",
Salem,fits good,https://www.amazon.com/gp/customer-reviews/R6ISQ5RZFYP8L/ref=cm_cr_getr_d_rvw_ttl?ie=UTF8&ASIN=B0CKB9RR1S,"5.0 "," the United States "," November 23, 2023",Color: BulletSize: M Fit Pant 34-39'' （Length 43''),Verified Purchase,"looks like pics, my high waist is 30in and it fits perfect.",
Becca McLemore,Just As Expected,https://www.amazon.com/gp/customer-reviews/R3242A71OWSXNC/ref=cm_cr_getr_d_rvw_ttl?ie=UTF8&ASIN=B0CKB9RR1S,"5.0 "," the United States "," October 23, 2023",,,Ordered for a 90s party.  I got many compliments on the belt.  It fit as expected and is good quality.,
Tiffany Thompson,Super cute,https://www.amazon.com/gp/customer-reviews/R2YDUOBHR5QPGM/ref=cm_cr_getr_d_rvw_ttl?ie=UTF8&ASIN=B0CKB9RR1S,"5.0 "," the United States "," October 18, 2023",,,"I loved this belt, it was comfortbale and fit perfectly. It was very durable and the bracelets it came with are so cute as well. They are all really good quality.",
summer,Good for the price,https://www.amazon.com/gp/customer-reviews/RSHQFZXZSFENM/ref=cm_cr_getr_d_rvw_ttl?ie=UTF8&ASIN=B0CKB9RR1S,"3.0 "," the United States "," October 16, 2023",Color: SilverSize: L Fit Pant 38-43'' （Length 47''),Verified Purchase,It's definitely cheaply made but it's not bad for the price so I'm not upset with it.,
Dreamst4r,Super cute,https://www.amazon.com/gp/customer-reviews/R3E5NCNWDRDKR3/ref=cm_cr_getr_d_rvw_ttl?ie=UTF8&ASIN=B0CKB9RR1S,"5.0 "," the United States "," October 8, 2023",Color: BulletSize: M Fit Pant 34-39'' （Length 43''),Verified Purchase,Well made and very stylish,
Luis salgado,Love it.,https://www.amazon.com/gp/customer-reviews/R2U17MCNENSK4O/ref=cm_cr_getr_d_rvw_ttl?ie=UTF8&ASIN=B0CKB9RR1S,"5.0 "," the United States "," October 8, 2023",Color: BulletSize: L Fit Pant 38-43'' （Length 47''),,Love this belt.,
NOR SYUHADA ALIA BINTI ABDUL AZIZ,Son loved,https://www.amazon.com/gp/customer-reviews/RYPE5E3NGA1NZ/ref=cm_cr_getr_d_rvw_ttl?ie=UTF8&ASIN=B0CKB9RR1S,"5.0 "," the United States "," October 8, 2023",Color: BulletSize: S Fit Pant 30-35'' （Length 39''),,My son loved it. And it lasted a long time. Great buy,
Jessica S.,Poor quality,https://www.amazon.com/gp/customer-reviews/R3194ZPUH7V9WS/ref=cm_cr_getr_d_rvw_ttl?ie=UTF8&ASIN=B0CKB9RR1S,"2.0 "," the United States "," October 3, 2023",Color: SilverSize: S Fit Pant 30-35'' （Length 39''),Verified Purchase,The rivet fell out in the first week and the belt is about to tear,
Chad P.,Cheap,https://www.amazon.com/gp/customer-reviews/R3U9M4QDYE0TVQ/ref=cm_cr_getr_d_rvw_ttl?ie=UTF8&ASIN=B0CKB9RR1S,"1.0 "," the United States "," October 3, 2023",Color: SilverSize: M Fit Pant 34-39'' （Length 43''),Verified Purchase,Studs stop about 8 inches from the buckle,
Sunny Garner,cute,https://www.amazon.com/gp/customer-reviews/R4I72VJRQTOQQ/ref=cm_cr_getr_d_rvw_ttl?ie=UTF8&ASIN=B0CKB9RR1S,"5.0 "," the United States "," September 30, 2023",Color: SilverSize: M Fit Pant 34-39'' （Length 43''),Verified Purchase,This belt is exactly what I wanted. Super cute Super cool. I love it,
Amazon Customer,Run very small. Said it fit up to 35” and belt ends wouldn’t even touch with a 34” waist.,https://www.amazon.com/gp/customer-reviews/R3BZ9C4J9RYRFK/ref=cm_cr_getr_d_rvw_ttl?ie=UTF8&ASIN=B0CKB9RR1S,"3.0 "," the United States "," September 25, 2023",Color: SilverSize: S Fit Pant 30-35'' （Length 39''),Verified Purchase,Poor sizing guide. Get a size bigger,
