评论用户,评论概述,评论链接,星级评分,评论地点,评论时间,类型,是否购买,评论详情,觉得该评论有帮助的人数
Mdewey,Too big,https://www.amazon.com/gp/customer-reviews/R3KRI23C4WQQOC/ref=cm_cr_getr_d_rvw_ttl?ie=UTF8&ASIN=B08TZJR7WR,"4.0 "," the United States "," December 15, 2024",Size: SmallColor: Black Floral,Verified Purchase,I bought two dresses from Pretty Garden and they are too big. I think an extra small would have fit me . I am 5’4” and 107 pounds. This dress made my hips look huge. Very big  in the chest area so would look much better on someone with a larger bust. This dress will be returned. The material is nice for Summer. It came very wrinkled so definitely would need a steam.,
Gigi,Pretty,https://www.amazon.com/gp/customer-reviews/R2QX8V0W62Z41J/ref=cm_cr_getr_d_rvw_ttl?ie=UTF8&ASIN=B08TZJR7WR,"5.0 "," the United States "," December 4, 2024",Size: MediumColor: Navy,Verified Purchase,"it was very pretty, but it wasn’t flattering as they described it in the description. material was kind of thin the length was good.",
Wendy A. P. Yeoman,Long dress,https://www.amazon.com/gp/customer-reviews/R3VHSUM87I55KC/ref=cm_cr_getr_d_rvw_ttl?ie=UTF8&ASIN=B08TZJR7WR,"5.0 "," the United States "," November 20, 2024",Size: X-LargeColor: Blue,,Good weight for hot southern summers. Pretty colors.,
Angela and Abby Balazs,Pretty,https://www.amazon.com/gp/customer-reviews/R1T6BEK68GX45Y/ref=cm_cr_getr_d_rvw_ttl?ie=UTF8&ASIN=B08TZJR7WR,"5.0 "," the United States "," November 20, 2024",Size: LargeColor: Blue,,"Comfortable, beautiful, receive compliments when worn. Have several in other patterns",
Jenn,BoHo,https://www.amazon.com/gp/customer-reviews/R1U81D0GWPACI7/ref=cm_cr_getr_d_rvw_ttl?ie=UTF8&ASIN=B08TZJR7WR,"5.0 "," the United States "," November 19, 2024",Size: MediumColor: Black Floral,Verified Purchase,Love BoHo,
LidiLavender,The Fabric Looks Cheap,https://www.amazon.com/gp/customer-reviews/R2OE37RF7TF79B/ref=cm_cr_getr_d_rvw_ttl?ie=UTF8&ASIN=B08TZJR7WR,"2.0 "," the United States "," October 26, 2024",Size: LargeColor: Red Floral,Verified Purchase,"Bought this and really disappointed with the quality of the product. For that price, I expect they would use good quality fabrics. The product looks cheap and I regret buying it. I wish I listened to one of the reviews here that told the buyers about the quality of the fabric. I ended up giving it away to Goodwill.",
Katy Orlando,Cheap Fabric for price,https://www.amazon.com/gp/customer-reviews/R3C2M6X30JI2HB/ref=cm_cr_getr_d_rvw_ttl?ie=UTF8&ASIN=B08TZJR7WR,"3.0 "," the United States "," October 24, 2024",Size: LargeColor: Blue,Verified Purchase,"I love the way it looked and felt but for a price of over 40$, I can't justify the material. It probably won't last long. For that price, I can go to a brand name outlet for a better quality and even pay less. It did look amazing but, too high price for the quality",
Diane,shapeless - gave it away,https://www.amazon.com/gp/customer-reviews/R18QFU3CFQ0HTF/ref=cm_cr_getr_d_rvw_ttl?ie=UTF8&ASIN=B08TZJR7WR,"2.0 "," the United States "," October 18, 2024",Size: MediumColor: Navy,Verified Purchase,"Looks cute in the photo, but it's poor quality. I hand-washed it and hung it to dry. It's quite shapeless and not flattering at all. I ended up selling it for nothing at a consignment shop. Don't waste your $$.",
Kathy Hamblin,Wasn't as pretty in person.,https://www.amazon.com/gp/customer-reviews/R2IASOSS5VXPI1/ref=cm_cr_getr_d_rvw_ttl?ie=UTF8&ASIN=B08TZJR7WR,"3.0 "," the United States "," October 17, 2024",Size: LargeColor: Black Floral,Verified Purchase,It's a little frumpy looking. Happy I didn't pay full price.,
MS Hayes,Love it,https://www.amazon.com/gp/customer-reviews/R2V5KTY2GA0QXN/ref=cm_cr_getr_d_rvw_ttl?ie=UTF8&ASIN=B08TZJR7WR,"5.0 "," the United States "," October 15, 2024",Size: LargeColor: Red Floral,Verified Purchase,Looks great and fits great,
Lindsey,Runs a little small,https://www.amazon.com/gp/customer-reviews/R1JV3FFFAXII6M/ref=cm_cr_getr_d_rvw_ttl?ie=UTF8&ASIN=B08TZJR7WR,"3.0 "," the United States "," October 14, 2024",Size: X-LargeColor: Dark Green Floral,Verified Purchase,"This would have been cute if it fit. It was a bit small in the bust and hips. The material felt like a decent quality and I think it would have been flattering if it fit well. I got the XL, so there wasn't a larger size to order as a replacement. I would have probably tried the next size up if it was available.",
Toesnsand,Cheap,https://www.amazon.com/gp/customer-reviews/R1E63R7W2XRNON/ref=cm_cr_getr_d_rvw_ttl?ie=UTF8&ASIN=B08TZJR7WR,"1.0 "," the United States "," October 9, 2024",Size: X-LargeColor: Navy Floral,Verified Purchase,Returned months ago,
Matthew McGee,Great dress,https://www.amazon.com/gp/customer-reviews/R1Z8UHX52V399P/ref=cm_cr_getr_d_rvw_ttl?ie=UTF8&ASIN=B08TZJR7WR,"5.0 "," the United States "," October 7, 2024",Size: LargeColor: White Floral,Verified Purchase,"I bought the white floral in large after already owning the sleeveless navy in XL. It runs true to size and their chart. I ordered up the first time thinking it would shrink but it didn’t. I have gotten more compliments in this dress the three times I’ve worn it than any other piece of clothing I’ve owned. It’s very comfortable, light, not see through, able to be thrown in the wash (I hang dry), and modest. I’m 5’8” and wear large shirts and a size 12 in pants if that helps anyone with sizing.",
Amazon Customer,Casual Boho dress,https://www.amazon.com/gp/customer-reviews/R272K3O5EXVEXO/ref=cm_cr_getr_d_rvw_ttl?ie=UTF8&ASIN=B08TZJR7WR,"2.0 "," the United States "," September 26, 2024",Size: X-LargeColor: Blue Yellow Floral,Verified Purchase,"This is a pretty light-weight dress with a lovely pattern. Unfortunately it did not fit me well. I am 5'3"" and this dress is too long waisted for me, and too long in general. I will be returning this. This dress will look better on someone taller.",
Annmarie,Cheap looking!!,https://www.amazon.com/gp/customer-reviews/R1JMO1TGENZ0JM/ref=cm_cr_getr_d_rvw_ttl?ie=UTF8&ASIN=B08TZJR7WR,"1.0 "," the United States "," September 22, 2024",Size: MediumColor: Blue Floral,Verified Purchase,I returned this dress and the manufacturer claimed they never received the return. Charged me full price for this garbage! Buyer beware!!,
Kindle CustomerStacE,Love it!,https://www.amazon.com/gp/customer-reviews/R1GLA85A3B6EWN/ref=cm_cr_getr_d_rvw_ttl?ie=UTF8&ASIN=B08TZJR7WR,"5.0 "," the United States "," September 19, 2024",Size: X-LargeColor: Wine Red Floral,Verified Purchase,I was a little skeptical in ordering clothes online- I’m the type of person that tries on before buying but I am so glad I took the chance with this dress!!  It is so light and airy but not see through and very comfortable to wear. The only thing is the sleeves are not as long as the picture shows but can easily be overlooked.  I am very happy with the dress it seems well made and I will definitely be purchasing more. Shipping was fast.,
MeMaw,Love the dress,https://www.amazon.com/gp/customer-reviews/R2WBEYPN1GPXBX/ref=cm_cr_getr_d_rvw_ttl?ie=UTF8&ASIN=B08TZJR7WR,"5.0 "," the United States "," September 16, 2024",Size: LargeColor: Navy Floral,Verified Purchase,It’s soft flowing comfortable and very flattering.  I love the length and I can’t wait to wear this beautiful dress.  The color was as pictured.  Very happy with the dress and will buy more.,
XYZ,fit well,https://www.amazon.com/gp/customer-reviews/R3NRKJSYEU225D/ref=cm_cr_getr_d_rvw_ttl?ie=UTF8&ASIN=B08TZJR7WR,"5.0 "," the United States "," September 14, 2024",Size: X-LargeColor: Blue,Verified Purchase,soft material,
Ayla,Poor quality,https://www.amazon.com/gp/customer-reviews/R2P1M6HPSSG9N2/ref=cm_cr_getr_d_rvw_ttl?ie=UTF8&ASIN=B08TZJR7WR,"1.0 "," the United States "," September 13, 2024",Size: MediumColor: Red Floral,Verified Purchase,"The quality of materials was very poor. The dress looked and felt cheap, like there was $5 of materials used in its construction. The cut around the neck was misaligned, the material was very thin. The print was washed out and the color faded and the hem had a multitude of loose threads.",
Jamie,Cheap material,https://www.amazon.com/gp/customer-reviews/RO9C33GB7DPO9/ref=cm_cr_getr_d_rvw_ttl?ie=UTF8&ASIN=B08TZJR7WR,"3.0 "," the United States "," September 5, 2024",Size: X-LargeColor: Black Floral,,Cheap material and didn't seem to fit true to size. Got a rip in it pretty quickly after it arrived.,
Amazon Customer,sent wrong size can i exchange it?,https://www.amazon.com/gp/customer-reviews/R3EW0XM97XSPK9/ref=cm_cr_getr_d_rvw_ttl?ie=UTF8&ASIN=B08TZJR7WR,"1.0 "," the United States "," August 23, 2024",Size: X-LargeColor: Orange Red Floral,Verified Purchase,I love the dress  received wrong size  just tryed on this am,
Jeannette,Dumpy looking,https://www.amazon.com/gp/customer-reviews/R34WJS8FBKDS3J/ref=cm_cr_getr_d_rvw_ttl?ie=UTF8&ASIN=B08TZJR7WR,"2.0 "," the United States "," August 16, 2024",Size: LargeColor: Blue,Verified Purchase,I returned the dress because it looked cheap and dumpy.,
Steele,Good material and pattern,https://www.amazon.com/gp/customer-reviews/R3GVL6YYIYNZ18/ref=cm_cr_getr_d_rvw_ttl?ie=UTF8&ASIN=B08TZJR7WR,"3.0 "," the United States "," August 15, 2024",Size: X-LargeColor: Blue,Verified Purchase,Runs SMALL.,
Dawn M Sherf,"Very flattering, boho style",https://www.amazon.com/gp/customer-reviews/R2L4P7PUKL5O9J/ref=cm_cr_getr_d_rvw_ttl?ie=UTF8&ASIN=B08TZJR7WR,"5.0 "," the United States "," August 9, 2024",Size: SmallColor: Black Floral,Verified Purchase,"The cut, fabric and style of this dress is very flattering and comfortable to wear! Got lots of compliments when I wore it. True to size",
Barbara Hamilton,Did not fit,https://www.amazon.com/gp/customer-reviews/R2WHN118AQ0HTT/ref=cm_cr_getr_d_rvw_ttl?ie=UTF8&ASIN=B08TZJR7WR,"4.0 "," the United States "," August 9, 2024",Size: LargeColor: White Floral,,Quality seemed to be there just did not fit,
Rich Gustin,Don’t like this dress,https://www.amazon.com/gp/customer-reviews/R2GS3ZEMDL044W/ref=cm_cr_getr_d_rvw_ttl?ie=UTF8&ASIN=B08TZJR7WR,"1.0 "," the United States "," August 8, 2024",Size: LargeColor: Blue Yellow Floral,Verified Purchase,The material is really thin and it’s short wasted. It just doesn’t look good on me.,
Crys,So pretty,https://www.amazon.com/gp/customer-reviews/R3SNDCTFWKTSWS/ref=cm_cr_getr_d_rvw_ttl?ie=UTF8&ASIN=B08TZJR7WR,"5.0 "," the United States "," August 8, 2024",Size: LargeColor: Blue Grey Floral,Verified Purchase,A little long but really pretty.,
Drew & Steph | @TravelwiththeTimmers,"Great lightweight, flowy dress!",https://www.amazon.com/gp/customer-reviews/R2OK1JDXVIGJ8E/ref=cm_cr_getr_d_rvw_ttl?ie=UTF8&ASIN=B08TZJR7WR,"5.0 "," the United States "," August 6, 2024",Size: SmallColor: Rose Red Floral,Verified Purchase,"I love how lightweight, comfortable, and easy to throw on this dress is!",4
Heather,These dresses are my FAVE!! I have 4!,https://www.amazon.com/gp/customer-reviews/ROS3QTTFZ8P07/ref=cm_cr_getr_d_rvw_ttl?ie=UTF8&ASIN=B08TZJR7WR,"5.0 "," the United States "," July 31, 2024",Size: X-LargeColor: Rose Red Floral,Verified Purchase,I loveeeee these dresses! I have it in 4 different styles. Fits true to size. The material is super light so I can wear it in this Texas summer heat or I can wear it in the winter with a jacket over it. It’s super comfortable and flattering especially if you’re a thicker woman like me. I wore these while I was pregnant with both my babies as well. Buy it!,3
Raia,Comfy,https://www.amazon.com/gp/customer-reviews/RYGND37M0YHQ0/ref=cm_cr_getr_d_rvw_ttl?ie=UTF8&ASIN=B08TZJR7WR,"5.0 "," the United States "," July 29, 2024",Size: X-LargeColor: Blue,Verified Purchase,It’s so comfy and lightweight! Super soft fabric. I seam ripped out the waistband elastic and use a safety pin to pin back the waist. I love it!,
Jess Kidman,Almost perfect,https://www.amazon.com/gp/customer-reviews/R3701O3YYGS8I2/ref=cm_cr_getr_d_rvw_ttl?ie=UTF8&ASIN=B08TZJR7WR,"4.0 "," the United States "," July 28, 2024",Size: SmallColor: Blue,Verified Purchase,"I was looking for a colorful, beachy dress and this fits the bill perfectly. It’s thin enough to be light and airy without being see through (the darker print at least). The elastic in the waistband is really tight. I’m 5’4 and 130 lbs. I have a small high waist or else I’d have to return the small for a medium. I’d order a size up if this is a concern for you. Otherwise, it’s a perfect dress. I’ve already got lots of compliments.",2
Kindle Customer,Pretty print,https://www.amazon.com/gp/customer-reviews/RGUIW9OLLXC3G/ref=cm_cr_getr_d_rvw_ttl?ie=UTF8&ASIN=B08TZJR7WR,"4.0 "," the United States "," July 27, 2024",Size: LargeColor: Blue,Verified Purchase,I’m happy with this dress!  I’m 5’4 1/2 and about 155lbs - the large fit me perfectly and is very comfortable.  The hem sits just above my ankle.  Nice colors.,
ALyM,Beautiful Dress,https://www.amazon.com/gp/customer-reviews/R3T566TRM9G94J/ref=cm_cr_getr_d_rvw_ttl?ie=UTF8&ASIN=B08TZJR7WR,"4.0 "," the United States "," July 27, 2024",Size: X-LargeColor: Red Floral,Verified Purchase,"I get so many compliments when I wear this. I actually just bought it in a different color. My only note is that it is a little tighter in the hips than the photos show. So for anyone with curvy hips like mine, it might be form fitting from the waist to mid-thigh. I don’t mind though! It’s a good length, and I’m 5ft. The top is very flattering and the material is light. I recently wore it in one of the hottest days in San Fran and it was comfortable the whole day.",3
Annabelle Smith,I give this dress 100% beautiful,https://www.amazon.com/gp/customer-reviews/R2YE6H5Q8QB82X/ref=cm_cr_getr_d_rvw_ttl?ie=UTF8&ASIN=B08TZJR7WR,"5.0 "," the United States "," July 26, 2024",Size: MediumColor: Blue,Verified Purchase,"I wore This dress to church with my daughter as in the picture, I had so many people asked me where I got it. It fit very comfortable had plenty of room for a size medium. The fabric is very nice, and the color mix is beautiful.",
BusyBusyMom,Perfect sizing,https://www.amazon.com/gp/customer-reviews/R1H5XQV2TZB5BR/ref=cm_cr_getr_d_rvw_ttl?ie=UTF8&ASIN=B08TZJR7WR,"5.0 "," the United States "," July 25, 2024",Size: X-LargeColor: Red Floral,Verified Purchase,I usually order up a size when I see made in China but reviews said true to size and they were correct. Nice fabric. Nice fit. I am really happy that I got these on prime day for $30. Worth it. I,
Courtney,Just ok,https://www.amazon.com/gp/customer-reviews/R9EKGED1EC6FH/ref=cm_cr_getr_d_rvw_ttl?ie=UTF8&ASIN=B08TZJR7WR,"3.0 "," the United States "," July 25, 2024",Size: LargeColor: Dark Green Floral,Verified Purchase,"Nice dress, but could be better. Looks like I got it off Amazon.",
darlyn phillips,V neck line,https://www.amazon.com/gp/customer-reviews/R27BGDBXFLI0E2/ref=cm_cr_getr_d_rvw_ttl?ie=UTF8&ASIN=B08TZJR7WR,"2.0 "," the United States "," July 23, 2024",Size: X-LargeColor: Black Floral,Verified Purchase,It’s a very high v neck. The cut is a bit weird.,
Ishu,Its comfy and loved the design,https://www.amazon.com/gp/customer-reviews/RD8YCH6G8P9LM/ref=cm_cr_getr_d_rvw_ttl?ie=UTF8&ASIN=B08TZJR7WR,"5.0 "," the United States "," July 23, 2024",Size: SmallColor: Green Yellow Floral,Verified Purchase,I bought various dresses recently during prime day but so far this is the best one in terms of quality and material. Its soft and comfy. I returned all of them except this one. Would love to buy another variation of this once the price is low ;),2
DMM,A Short-Waisted Girl’s Best Friend!,https://www.amazon.com/gp/customer-reviews/RG4HMZYVON16F/ref=cm_cr_getr_d_rvw_ttl?ie=UTF8&ASIN=B08TZJR7WR,"5.0 "," the United States "," July 21, 2024",Size: SmallColor: Dark Green Floral,Verified Purchase,"I’m 5’-1.5” tall, with very long legs and basically NO TORSO. This dress is a rare find for me - it does not fall off my shoulders and the V-neck does NOT hang down to my navel! Don’t know how it will work out for the rest of the population, but I’M HAPPY!",
Gale Spilski,Love it,https://www.amazon.com/gp/customer-reviews/R1E532QVJERSYY/ref=cm_cr_getr_d_rvw_ttl?ie=UTF8&ASIN=B08TZJR7WR,"5.0 "," the United States "," July 21, 2024",Size: X-LargeColor: Blue Floral,Verified Purchase,The feel of this fabric is so soft and comfortable.,
Amazon Customer,V comfy,https://www.amazon.com/gp/customer-reviews/RYSODKIXZZ667/ref=cm_cr_getr_d_rvw_ttl?ie=UTF8&ASIN=B08TZJR7WR,"5.0 "," the United States "," July 21, 2024",Size: LargeColor: Orange Red Floral,Verified Purchase,Nice material!  Decent price too!,
Nay Nay,Cute Dress!,https://www.amazon.com/gp/customer-reviews/R2PO3IIN3VJ2I9/ref=cm_cr_getr_d_rvw_ttl?ie=UTF8&ASIN=B08TZJR7WR,"4.0 "," the United States "," July 19, 2024",Size: X-LargeColor: Black,Verified Purchase,"I wanted this dress to fit.  It is really cute, long, and seems to be made well.  It doesn’t fit me in the bust area well and tends to pull in that area.  I will be sending it back, unfortunately.  I wish there was a size a tad larger, but there is not.",
Marilyn Shoemaker,Very pretty,https://www.amazon.com/gp/customer-reviews/R2QKLUW4FYHG2H/ref=cm_cr_getr_d_rvw_ttl?ie=UTF8&ASIN=B08TZJR7WR,"5.0 "," the United States "," July 18, 2024",Size: LargeColor: Blue Floral,Verified Purchase,Fit is great. Nice material. Highly recommend,
Pamela,Nice dress. Fits well. TTS,https://www.amazon.com/gp/customer-reviews/RNYFYADQ5BC9P/ref=cm_cr_getr_d_rvw_ttl?ie=UTF8&ASIN=B08TZJR7WR,"4.0 "," the United States "," July 15, 2024",Size: MediumColor: Orange Red Floral,Verified Purchase,I think I’ll enjoy wearing this dress. I’m 5’2” and like my dresses to come at my ankle or slightly above. Length is fine. The dress on the site looks like a light coral. It’s not! It is ORANGE! That’s not my favorite color but not awful. I will still wear it. It did wash and dry without any issues. Good purchase.,
Rita A,Cute and Well-Made,https://www.amazon.com/gp/customer-reviews/RPKPRMMDNSET8/ref=cm_cr_getr_d_rvw_ttl?ie=UTF8&ASIN=B08TZJR7WR,"5.0 "," the United States "," July 13, 2024",Size: MediumColor: Black Floral,Verified Purchase,"Perfect fit. Fabric is soft and not see-through. Easy, comfortable dress.",
Cara,Very thin material. Not worth the price,https://www.amazon.com/gp/customer-reviews/R1S6F632M2S5EN/ref=cm_cr_getr_d_rvw_ttl?ie=UTF8&ASIN=B08TZJR7WR,"3.0 "," the United States "," July 12, 2024",Size: SmallColor: Navy Yellow Floral,Verified Purchase,I decided to give this dress a try despite reviews about the thinness of the material. The fabric is very very thin and there were some loose threads on the hem. I do not think this dress is worth the price tag.,
Amazon Customer,I love it so much!,https://www.amazon.com/gp/customer-reviews/R1DN8DHFNHVT3X/ref=cm_cr_getr_d_rvw_ttl?ie=UTF8&ASIN=B08TZJR7WR,"5.0 "," the United States "," July 7, 2024",Size: X-LargeColor: Green Yellow Floral,Verified Purchase,I'm a standard XL across all sites and it fit perfectly.  Colors so pretty and the material is soft and nice quality for summer.  I'm ordering another color I loved it so much.  thank you!,
Andy Blalock,quality,https://www.amazon.com/gp/customer-reviews/RDC87BLWTAEMV/ref=cm_cr_getr_d_rvw_ttl?ie=UTF8&ASIN=B08TZJR7WR,"5.0 "," the United States "," July 6, 2024",Size: X-LargeColor: Black Pink Floral,Verified Purchase,wonderful dress,
Lynn sharp,Most compliments,https://www.amazon.com/gp/customer-reviews/R27MWZGG3RY5QO/ref=cm_cr_getr_d_rvw_ttl?ie=UTF8&ASIN=B08TZJR7WR,"5.0 "," the United States "," July 5, 2024",Size: X-LargeColor: Blue,Verified Purchase,"Flattering, receive a compliment every time I wear it! fits great, and so so comfortable.",
Amy,Great summer maxi dress,https://www.amazon.com/gp/customer-reviews/RAFJD8O5S6JWN/ref=cm_cr_getr_d_rvw_ttl?ie=UTF8&ASIN=B08TZJR7WR,"5.0 "," the United States "," July 4, 2024",Size: X-LargeColor: Rose Red Floral,Verified Purchase,"So comfortable, easy material to move around in. Wore it to a bridal shower & could not have loved it more 🩷",
Stephanie H.,Pretty dress,https://www.amazon.com/gp/customer-reviews/R39SAVW4TVCYK/ref=cm_cr_getr_d_rvw_ttl?ie=UTF8&ASIN=B08TZJR7WR,"5.0 "," the United States "," June 30, 2024",Size: MediumColor: White Floral,Verified Purchase,I like this dress!  Very pretty and true to size.,2
terri,Love this dress,https://www.amazon.com/gp/customer-reviews/R1HQ806M4XURIR/ref=cm_cr_getr_d_rvw_ttl?ie=UTF8&ASIN=B08TZJR7WR,"5.0 "," the United States "," June 23, 2024",Size: MediumColor: Blue,Verified Purchase,It's a soft light fabric that is not see through and comfortable a very dress!,
Suz M.,"Well made, love the fabric",https://www.amazon.com/gp/customer-reviews/R3BKWW3CJCJYRZ/ref=cm_cr_getr_d_rvw_ttl?ie=UTF8&ASIN=B08TZJR7WR,"5.0 "," the United States "," June 22, 2024",Size: LargeColor: Blue,Verified Purchase,Fit is perfect. I'm between large and medium....got L.,
marva carnahan,Comfortable dress,https://www.amazon.com/gp/customer-reviews/R2V4B9NADBO45W/ref=cm_cr_getr_d_rvw_ttl?ie=UTF8&ASIN=B08TZJR7WR,"5.0 "," the United States "," June 22, 2024",Size: SmallColor: Black Floral,Verified Purchase,The fabric was soft and flowing. The dress looked exactly like the photo. I bought it for my daughter for her birthday. She was pleased.,
Sheryl JENNY,Beautiful colors,https://www.amazon.com/gp/customer-reviews/RE0YFSPB235P8/ref=cm_cr_getr_d_rvw_ttl?ie=UTF8&ASIN=B08TZJR7WR,"5.0 "," the United States "," June 22, 2024",Size: X-LargeColor: White Floral,Verified Purchase,Gave this as a gift for my daughter in law for her birthday and she loved it but is a little big so going to exchange for a smaller size. She loves the material and feel of the dress,
Fio,Great material for summer,https://www.amazon.com/gp/customer-reviews/R2C34XJYFN0PPU/ref=cm_cr_getr_d_rvw_ttl?ie=UTF8&ASIN=B08TZJR7WR,"5.0 "," the United States "," June 20, 2024",Size: SmallColor: Green Yellow Floral,Verified Purchase,Im 5”7 and 185lbs. I ordered size small. It fits me great but im not sure after the first wash.,4
JAM,Beatiful Dress,https://www.amazon.com/gp/customer-reviews/R2EHFL4LQ4C44G/ref=cm_cr_getr_d_rvw_ttl?ie=UTF8&ASIN=B08TZJR7WR,"5.0 "," the United States "," June 20, 2024",Size: MediumColor: Black Floral,Verified Purchase,"I love the dress pattern, colors, material, and length. However, dress was tight across the bust line. I ordered a medium according to the size guide; had to return for a large size.",
Lori Price,Pretty,https://www.amazon.com/gp/customer-reviews/R39MUB5EKDY80I/ref=cm_cr_getr_d_rvw_ttl?ie=UTF8&ASIN=B08TZJR7WR,"5.0 "," the United States "," June 20, 2024",Size: X-LargeColor: Blue,Verified Purchase,I love this dress.  It’s very comfortable and packs very well!!,
Ips,Stylish look and comfy to wear,https://www.amazon.com/gp/customer-reviews/R2ZRQYMP9IPZ88/ref=cm_cr_getr_d_rvw_ttl?ie=UTF8&ASIN=B08TZJR7WR,"5.0 "," the United States "," June 20, 2024",Size: LargeColor: Black Floral,Verified Purchase,Stylish look and comfy to wear. Prints and fabrics are good too.,
Bridget,Beautiful and comfortable dress,https://www.amazon.com/gp/customer-reviews/R1CQASJ9IVQ35F/ref=cm_cr_getr_d_rvw_ttl?ie=UTF8&ASIN=B08TZJR7WR,"5.0 "," the United States "," June 19, 2024",Size: X-LargeColor: Orange Red Floral,Verified Purchase,"Love this dress, color is brighter than I expected but I’m happy with it. Very light and breathable fabric, soft and comfy to wear shopping or just around the house. I’m 5,4 and about 220, the XL is a perfect fit. Sits right at my ankles so it doesn’t drag all the time. Only part I’m bummed about is not having any pockets. I wish it wasn’t so much but I would buy another.",3
Rossanita,Very nice dress.,https://www.amazon.com/gp/customer-reviews/R26GAUJW271LS9/ref=cm_cr_getr_d_rvw_ttl?ie=UTF8&ASIN=B08TZJR7WR,"5.0 "," the United States "," June 18, 2024",Size: LargeColor: Black Floral,Verified Purchase,"I’m 152 pounds and it fits very nice. I love the quality it’s soft, I love color the style and especially really fits me The way I want. I’m very comfortable to go to church or to go out with my new dress.",
Lillie Johnson,Love,https://www.amazon.com/gp/customer-reviews/R11S3PFCRWRZ9X/ref=cm_cr_getr_d_rvw_ttl?ie=UTF8&ASIN=B08TZJR7WR,"5.0 "," the United States "," June 16, 2024",Size: LargeColor: Green Yellow Floral,Verified Purchase,Love the colors. Would love to see this outfit in petite size as I'm a shorty,
AB.,"Flowy, Breathable, Vivid",https://www.amazon.com/gp/customer-reviews/R2TYPK5LS0MM9T/ref=cm_cr_getr_d_rvw_ttl?ie=UTF8&ASIN=B08TZJR7WR,"5.0 "," the United States "," June 12, 2024",Size: LargeColor: Blue Yellow Floral,Verified Purchase,"Purchased as a gift and it was very flattering on her! Colors were vivid, length was perfect.",
Ed Ball,Looks pretty on,https://www.amazon.com/gp/customer-reviews/R9PVAUWOXB8DN/ref=cm_cr_getr_d_rvw_ttl?ie=UTF8&ASIN=B08TZJR7WR,"4.0 "," the United States "," June 12, 2024",Size: MediumColor: Navy,Verified Purchase,"The fabric is a bit thin, but it isn’t see through (at least in the darker color I purchased). The dress fits and flows well!!",2
Vernetta Hesson,Pretty little dress for summer,https://www.amazon.com/gp/customer-reviews/R125JJF0U3QOI7/ref=cm_cr_getr_d_rvw_ttl?ie=UTF8&ASIN=B08TZJR7WR,"5.0 "," the United States "," June 11, 2024",Size: MediumColor: Black Floral,Verified Purchase,True to size. Pretty fabric. Not too lightweight but perfect for warm summer days.,
Rachel Riordan,Returned,https://www.amazon.com/gp/customer-reviews/R1JP6OTUX5PQ56/ref=cm_cr_getr_d_rvw_ttl?ie=UTF8&ASIN=B08TZJR7WR,"2.0 "," the United States "," June 10, 2024",Size: LargeColor: Blue Floral,Verified Purchase,"I returned this item. I am 5’4 and the waistline hit me almost at my belly button. Unflattering and a little small. But the pattern is pretty, cheap material for the price.",
