评论用户,评论概述,评论链接,星级评分,评论地点,评论时间,类型,是否购买,评论详情,觉得该评论有帮助的人数
N. Lesperance,Love these pants,https://www.amazon.com/gp/customer-reviews/R2NXMJ7KM5NKVH/ref=cm_cr_getr_d_rvw_ttl?ie=UTF8&ASIN=B0BY8FJ6V8,"5.0 "," the United States "," January 9, 2025",Color: WhiteSize: Medium,Verified Purchase,"Perfect fit, nice thick material that’s not see through. Very comfortable pant that can be casual or dressed up. Great purchase.",
ktcolt,Loose?,https://www.amazon.com/gp/customer-reviews/R3LWRNRQOANHJS/ref=cm_cr_getr_d_rvw_ttl?ie=UTF8&ASIN=B0BY8FJ6V8,"3.0 "," the United States "," January 8, 2025",Color: Dark GraySize: X-Large,Verified Purchase,"This company normally fits TTS for me, however, these are very unforgiving.  It might be wise to size up in these.  They look great.  Feel great.  But sizewise I think sizing up is best.",
Susan L.,Inaccurate sizing,https://www.amazon.com/gp/customer-reviews/R3KZ046U6J8JKP/ref=cm_cr_getr_d_rvw_ttl?ie=UTF8&ASIN=B0BY8FJ6V8,"4.0 "," the United States "," January 6, 2025",Color: Army GreenSize: Medium,Verified Purchase,Item returned,
Amazon Customer,Poor quality,https://www.amazon.com/gp/customer-reviews/RD0XLLA9F8XQU/ref=cm_cr_getr_d_rvw_ttl?ie=UTF8&ASIN=B0BY8FJ6V8,"1.0 "," the United States "," January 5, 2025",Color: BeigeSize: Small,Verified Purchase,I loved the style of these pants and the fit. Unfortunately they are extremely see through and the fabric wrinkles so much after putting them on.,
Amazon Customer,Linen Pants Don't Wrinkle,https://www.amazon.com/gp/customer-reviews/R4BMJEVUNYXGX/ref=cm_cr_getr_d_rvw_ttl?ie=UTF8&ASIN=B0BY8FJ6V8,"5.0 "," the United States "," December 28, 2024",Color: KhakiSize: Small,Verified Purchase,"Great for travel. Non wrinkles,  Functional, Durable. Color is perfect",
pxiong,Cute but runs small,https://www.amazon.com/gp/customer-reviews/R8SDJWWOHZOQZ/ref=cm_cr_getr_d_rvw_ttl?ie=UTF8&ASIN=B0BY8FJ6V8,"3.0 "," the United States "," December 27, 2024",Color: Navy BlueSize: XX-Large,Verified Purchase,"Bought the biggest size they had, fit like they were a size or two smaller especially after washing.",
SStar,Great quality,https://www.amazon.com/gp/customer-reviews/R3LTZAB5NPKF8W/ref=cm_cr_getr_d_rvw_ttl?ie=UTF8&ASIN=B0BY8FJ6V8,"5.0 "," the United States "," December 23, 2024",Color: Lake BlueSize: Medium,Verified Purchase,The fabric is on the thicker side which I prefer. The color was spot on. They are very comfortable.,
Karen K.,Cute,https://www.amazon.com/gp/customer-reviews/R2WIEQYPOMALGF/ref=cm_cr_getr_d_rvw_ttl?ie=UTF8&ASIN=B0BY8FJ6V8,"4.0 "," the United States "," December 7, 2024",Color: BlackSize: Small,Verified Purchase,They are comfortable but do wrinkle easily.  I think they would be great for travel except for the wrinkles.,
Kim,Great but shrink!,https://www.amazon.com/gp/customer-reviews/R3J3DZ3MWSLIO3/ref=cm_cr_getr_d_rvw_ttl?ie=UTF8&ASIN=B0BY8FJ6V8,"4.0 "," the United States "," December 5, 2024",Color: BeigeSize: Medium,Verified Purchase,Great product I love these pants but they do shrink and I did size up! They are comfortable and flattering just be careful when washing/drying!!,
Emily Dahl,Really wanted to love these more.,https://www.amazon.com/gp/customer-reviews/R2ON5SF41RT45R/ref=cm_cr_getr_d_rvw_ttl?ie=UTF8&ASIN=B0BY8FJ6V8,"3.0 "," the United States "," December 5, 2024",Color: Army GreenSize: Medium,Verified Purchase,I love the color and thickness of the material. They are comfortable except the waistline is a bit snug. I feel like sizing up would have been too big for my height.,
HALEY,Perfect for summer days,https://www.amazon.com/gp/customer-reviews/R3RPROPNNU6SAG/ref=cm_cr_getr_d_rvw_ttl?ie=UTF8&ASIN=B0BY8FJ6V8,"5.0 "," the United States "," December 3, 2024",Color: Army GreenSize: Large,Verified Purchase,Super cute and fun flowy pants! True to size! I didn't realize they were capris until I put them on 🤦🏻‍♀️,
I decided to keep it!!,Rate them,https://www.amazon.com/gp/customer-reviews/R11BPV5X1KSROZ/ref=cm_cr_getr_d_rvw_ttl?ie=UTF8&ASIN=B0BY8FJ6V8,"5.0 "," the United States "," December 3, 2024",Color: BeigeSize: X-Large,Verified Purchase,I love them!!!very comfortable!!!,
Meagan Hendrix,Love!!!,https://www.amazon.com/gp/customer-reviews/R32ZS4CEPE6AV9/ref=cm_cr_getr_d_rvw_ttl?ie=UTF8&ASIN=B0BY8FJ6V8,"5.0 "," the United States "," December 2, 2024",Color: Dark GraySize: X-Large,Verified Purchase,"These are super comfy! I bought these to wear as a light airy pant for a cruise and they were perfect. I was a little worried at first packing them and having them get al wrinkled, but the wrinkles naturally relaxed out after about 15 min of wearing them! Definitely recommend! Super versatile and now one of my new fav pairs of pants!",
Char,Cutest Pants!!,https://www.amazon.com/gp/customer-reviews/R2MOW8GGZLTS8F/ref=cm_cr_getr_d_rvw_ttl?ie=UTF8&ASIN=B0BY8FJ6V8,"5.0 "," the United States "," December 1, 2024",Color: BeigeSize: Medium,Verified Purchase,"These pants are so great! I ordered them last minute for a trip to France. They are so cute on, very comfortable and great for travel! Length was what I wanted. I ordered a small . Perfect for lots of weather, anytime except for very cold winter weather. I ended up wearing them much more than I thought on my trip. Have worn with tank tops and sweaters.",
Jackie,Fabric quality really bad,https://www.amazon.com/gp/customer-reviews/R1IGOW4MXNG4Q3/ref=cm_cr_getr_d_rvw_ttl?ie=UTF8&ASIN=B0BY8FJ6V8,"1.0 "," the United States "," November 30, 2024",Color: KhakiSize: Large,Verified Purchase,pants shrunk with first wash a dry,
kgp004,Super cute!,https://www.amazon.com/gp/customer-reviews/R2XERGFIJF6KZW/ref=cm_cr_getr_d_rvw_ttl?ie=UTF8&ASIN=B0BY8FJ6V8,"4.0 "," the United States "," November 17, 2024",Color: WhiteSize: Medium,Verified Purchase,"These pants are so cute and they are easily dressed up or down. Somethings to watch out for would be sizing, it definitely runs small, another thing to look out for is the length, I’m 5’5 and It goes up a little past my ankles. Overall super cute and definitely recommend!",
Becca,Great value for the price and GREAT for short people!,https://www.amazon.com/gp/customer-reviews/R24MWA57ZQ3GJR/ref=cm_cr_getr_d_rvw_ttl?ie=UTF8&ASIN=B0BY8FJ6V8,"5.0 "," the United States "," November 14, 2024",Color: BeigeSize: Medium,Verified Purchase,"Bought these for a trip to St. Kitts and am really impressed with them! It is a light linen blend so you can feel the synthetic fibers, but it's also $35 so I'll take it! They're very lightweight and comfortable, they're high-waisted and fit my long torso really nicely. They hit just around the ankle for me at 5'3"". I almost never find pants that fit my odd proportions so well, so I'm really pleased with these!",
Jennifer,Two Month review,https://www.amazon.com/gp/customer-reviews/RH9L2PJDL8AV0/ref=cm_cr_getr_d_rvw_ttl?ie=UTF8&ASIN=B0BY8FJ6V8,"1.0 "," the United States "," November 13, 2024",Color: BlackSize: Large,Verified Purchase,"After just barely 8 weeks (and maybe 10 wears total?), these pants have a hole in the outside seam of the leg. I love the pants themselves, but they did not stand the test of time and unfortunately were not worth the cost.",
Chrissi,Super comfy,https://www.amazon.com/gp/customer-reviews/R12OAWNLWG86A4/ref=cm_cr_getr_d_rvw_ttl?ie=UTF8&ASIN=B0BY8FJ6V8,"5.0 "," the United States "," November 12, 2024",Color: PurpleSize: Large,Verified Purchase,Love these pants,
Brianna,Comfy yet stylish!,https://www.amazon.com/gp/customer-reviews/RM88ATUJY3SVE/ref=cm_cr_getr_d_rvw_ttl?ie=UTF8&ASIN=B0BY8FJ6V8,"5.0 "," the United States "," November 8, 2024",Color: BlackSize: Large,Verified Purchase,Love these pants. Very comfy and flattering along the waist. Not too see through. I ordered a Large and they fit perfectly.,
CWW,Too wide legged,https://www.amazon.com/gp/customer-reviews/RSEC5X0VHBWSY/ref=cm_cr_getr_d_rvw_ttl?ie=UTF8&ASIN=B0BY8FJ6V8,"3.0 "," the United States "," November 8, 2024",Color: KhakiSize: Small,Verified Purchase,Cute but leg too wide,
Alexandria Boucher,Cute linen pants,https://www.amazon.com/gp/customer-reviews/R5UXM8WXMQCOM/ref=cm_cr_getr_d_rvw_ttl?ie=UTF8&ASIN=B0BY8FJ6V8,"4.0 "," the United States "," November 1, 2024",Color: BeigeSize: Medium,Verified Purchase,Wore these all day on a winery tour and they were so comfy and breezy!,
Theresa G.,Looks nice.,https://www.amazon.com/gp/customer-reviews/R30PF3UEQT3MMM/ref=cm_cr_getr_d_rvw_ttl?ie=UTF8&ASIN=B0BY8FJ6V8,"1.0 "," the United States "," November 1, 2024",Color: Navy BlueSize: XX-Large,Verified Purchase,The fabric is very thin. Actually see thru. Comfy.,
Deborah H.,Runs smaller in sizing then stated.,https://www.amazon.com/gp/customer-reviews/R2ABYEE77H08KM/ref=cm_cr_getr_d_rvw_ttl?ie=UTF8&ASIN=B0BY8FJ6V8,"1.0 "," the United States "," October 30, 2024",Color: BlackSize: XX-Large,Verified Purchase,No give on fabric and go up a size as it runs smaller then stated on sizes. Also shrunk more after washing.,
Nicole,Well made linen pants,https://www.amazon.com/gp/customer-reviews/R2A78805E55J4H/ref=cm_cr_getr_d_rvw_ttl?ie=UTF8&ASIN=B0BY8FJ6V8,"3.0 "," the United States "," October 30, 2024",Color: BlackSize: X-Large,Verified Purchase,"These pants are very well made, just a little too see through for me. More for wearing over a swimsuit.",
Jackie Martinez,Comfort & quality,https://www.amazon.com/gp/customer-reviews/RRF1JIFHH8CQB/ref=cm_cr_getr_d_rvw_ttl?ie=UTF8&ASIN=B0BY8FJ6V8,"5.0 "," the United States "," October 29, 2024",Color: BlackSize: X-Large,Verified Purchase,I was very impressed with this brand the thick band around the waist didn't roll like other brands that I have bought from Amazon. The material was very good quality wash really well although I did not put in the dryer I am most likely will buy in different colors true to size,
rycon20,Shrank!,https://www.amazon.com/gp/customer-reviews/RCXP2AKZLTACG/ref=cm_cr_getr_d_rvw_ttl?ie=UTF8&ASIN=B0BY8FJ6V8,"1.0 "," the United States "," October 27, 2024",Color: PurpleSize: Medium,Verified Purchase,Pants shrank terribly after first wash,
Taylor,Love these,https://www.amazon.com/gp/customer-reviews/R2NVTR0TAAXJ4N/ref=cm_cr_getr_d_rvw_ttl?ie=UTF8&ASIN=B0BY8FJ6V8,"5.0 "," the United States "," October 26, 2024",Color: BeigeSize: Small,Verified Purchase,I love these pants. I have them in two colors. They are comfy and flattering. I wear them all summer long,
Janiedv,Very disappointed,https://www.amazon.com/gp/customer-reviews/R3I4GSCJVQ9T9X/ref=cm_cr_getr_d_rvw_ttl?ie=UTF8&ASIN=B0BY8FJ6V8,"1.0 "," the United States "," October 25, 2024",Color: Dark KhakiSize: Large,Verified Purchase,I ordered these pants for a cruise we were going on so I waited and washed them right before we were leaving and the color ran so I couldn’t even wear them and it was to late to return them. Super disappointing!,
Mom to the third power,Tight in waist,https://www.amazon.com/gp/customer-reviews/R2WAZZKU6KF3YU/ref=cm_cr_getr_d_rvw_ttl?ie=UTF8&ASIN=B0BY8FJ6V8,"2.0 "," the United States "," October 23, 2024",Color: Army GreenSize: Medium,Verified Purchase,"Very tight in waist. Seems like a good material. I ordered a medium. I have no thighs, butt or hips. I have a little mom belly and I’m usually a medium in these types of pants. If I order a large I would look frumpy and swimming in the pants.",
Vicki S,I love how comfortable these are,https://www.amazon.com/gp/customer-reviews/R17T8UJFTY1IT/ref=cm_cr_getr_d_rvw_ttl?ie=UTF8&ASIN=B0BY8FJ6V8,"5.0 "," the United States "," October 14, 2024",Color: Navy BlueSize: Large,Verified Purchase,I've purchased a few of this style and love them all. Vert comfortable and wash well if you follow the instructions.,
Janice Martinez,Stylish and comfortable,https://www.amazon.com/gp/customer-reviews/R5QJRKNY6LU9N/ref=cm_cr_getr_d_rvw_ttl?ie=UTF8&ASIN=B0BY8FJ6V8,"5.0 "," the United States "," October 14, 2024",Color: RustSize: Medium,Verified Purchase,The linen fabric is very nice. Lots of compliments and the fit is perfect,
Madison Hurst,Perfect work pants!,https://www.amazon.com/gp/customer-reviews/RDODEBED8RJNU/ref=cm_cr_getr_d_rvw_ttl?ie=UTF8&ASIN=B0BY8FJ6V8,"5.0 "," the United States "," October 14, 2024",,Verified Purchase,"These are so cute and comfy! Great for when you need to look professional, but don't want to try😅",
Araceli Vallejo,Shrink,https://www.amazon.com/gp/customer-reviews/R5SFUIB96RGRS/ref=cm_cr_getr_d_rvw_ttl?ie=UTF8&ASIN=B0BY8FJ6V8,"1.0 "," the United States "," October 12, 2024",,Verified Purchase,Beautiful pants unfortunately after wash I couldn’t Wear it because it shrink a lot.,
Jennifer Parker,SHRINKAGE,https://www.amazon.com/gp/customer-reviews/R3J6EHZRVQFMZ9/ref=cm_cr_getr_d_rvw_ttl?ie=UTF8&ASIN=B0BY8FJ6V8,"3.0 "," the United States "," October 10, 2024",Color: WhiteSize: Medium,Verified Purchase,"I flipping LOVED these pants, until I washed them!  Washed on gentle cold water, low heat for 10 min to get most of water out. Lined dried the remained. They shrunk TWO INCHES in the length.  I’m 5”5” & size MED fit just like length in pic, until I washed them.  Makes me so mad!! A large will be too big in waist but maybe I need to buy it and try to shrink it to a large.",
Julie Anne Cabanatan,I love it!,https://www.amazon.com/gp/customer-reviews/R3CQGYVTK3UCAC/ref=cm_cr_getr_d_rvw_ttl?ie=UTF8&ASIN=B0BY8FJ6V8,"5.0 "," the United States "," October 9, 2024",Color: Dark KhakiSize: X-Large,Verified Purchase,"I have a favorite pair of linen like pants from target that only come in seasonally. After a while the crotch/ inner thigh area got thinned out and some holes appeared from the rubbing. If you know, you know. Everywhere else if looked for similar pants we’re just way too long! I don’t want to have to hem them. These were the perfect length!!! I got compliments all day! Will most likely order every color now.",
Slythe Stoler,Fit great comfortable,https://www.amazon.com/gp/customer-reviews/R24MUTQB0IHEAZ/ref=cm_cr_getr_d_rvw_ttl?ie=UTF8&ASIN=B0BY8FJ6V8,"5.0 "," the United States "," October 7, 2024",Color: BlackSize: Small,Verified Purchase,"Really really comfortable, lightweight good quality. Exactly what I was hoping for.",
Jaime S.,Didn’t process refund,https://www.amazon.com/gp/customer-reviews/R14L5I688RH4DQ/ref=cm_cr_getr_d_rvw_ttl?ie=UTF8&ASIN=B0BY8FJ6V8,"1.0 "," the United States "," September 29, 2024",Color: BeigeSize: Medium,Verified Purchase,"I returned these because they were the itchiest fabric.  They said I didn’t return the same pants, which I did, and still charged me. Bad seller.",
Christina Par,Size difference,https://www.amazon.com/gp/customer-reviews/RB2AL1KEZNV49/ref=cm_cr_getr_d_rvw_ttl?ie=UTF8&ASIN=B0BY8FJ6V8,"2.0 "," the United States "," September 28, 2024",Color: KhakiSize: X-Large,Verified Purchase,They are nice pants but all the colors don’t fit the same even though they are all the same size,
Momma Nikki,Linen capris,https://www.amazon.com/gp/customer-reviews/RM0FU8WCCJ8JA/ref=cm_cr_getr_d_rvw_ttl?ie=UTF8&ASIN=B0BY8FJ6V8,"5.0 "," the United States "," September 26, 2024",Color: BlackSize: Large,Verified Purchase,These have great amount of stretch so much so that you can size down 1 size other then that I love these.,
#1divergentfan,Poor quality,https://www.amazon.com/gp/customer-reviews/RGXRCG1MIUHUH/ref=cm_cr_getr_d_rvw_ttl?ie=UTF8&ASIN=B0BY8FJ6V8,"2.0 "," the United States "," September 26, 2024",Color: BeigeSize: Medium,Verified Purchase,"While these pants look nice are are comfortable, the my split in the seam the first time worn. And of course, it’s after the return date.",
Jess,Love them,https://www.amazon.com/gp/customer-reviews/R126FSYEMPH9IZ/ref=cm_cr_getr_d_rvw_ttl?ie=UTF8&ASIN=B0BY8FJ6V8,"5.0 "," the United States "," September 23, 2024",Color: YellowSize: Small,Verified Purchase,"These do shrink up when you wash them, as other reviewers have mentioned. I just run the handheld steamer over them and all the length comes back and the wrinkles are gone. Very easy. Love them.",
katieb603,POCKETS!,https://www.amazon.com/gp/customer-reviews/R11KP7BZSF4TDL/ref=cm_cr_getr_d_rvw_ttl?ie=UTF8&ASIN=B0BY8FJ6V8,"5.0 "," the United States "," September 22, 2024",Color: BlackSize: XX-Large,Verified Purchase,"These have a nice texture fabric that looks like linen. I have yet to wash them so I am unsure how they will turn out. I love that they have pockets! The length hits me right above the ankle so it is a bit of a feminine look that could be done with heals, flats or boots. The drawstring is nice and long too. I may get another pair in a different color. The black is great.",
hellotheremombo,Shrunk in wash developed holes in months,https://www.amazon.com/gp/customer-reviews/R2R4EXBHAZ6WXL/ref=cm_cr_getr_d_rvw_ttl?ie=UTF8&ASIN=B0BY8FJ6V8,"2.0 "," the United States "," September 22, 2024",Color: BlackSize: XX-Large,Verified Purchase,Shrunk in wash then developed multiple holes at seems in months.,
Amanda,Will shrink and look very faded and old after washing,https://www.amazon.com/gp/customer-reviews/RGCNMIG4Z3MRU/ref=cm_cr_getr_d_rvw_ttl?ie=UTF8&ASIN=B0BY8FJ6V8,"1.0 "," the United States "," September 21, 2024",Color: Navy BlueSize: Medium,Verified Purchase,At first I loved these pants for summer but when I went to wash them for the first time on a delicate cycle and I hung them up to dry they shrunk tremendously and the color faded so much they look like old pjs. Very disappointing.,
Nicholas P Humphries,Fits great but shrinks sooooo much,https://www.amazon.com/gp/customer-reviews/R1213Z17TAZSG3/ref=cm_cr_getr_d_rvw_ttl?ie=UTF8&ASIN=B0BY8FJ6V8,"2.0 "," the United States "," September 21, 2024",Color: BlackSize: Large,Verified Purchase,"I sized up One size based on reviews and the pants fit great. However, the first time I washed them (In cold water and did not dry them) they shrunk to the point that I couldn’t wear them anymore.",
heath,Good and comfortable,https://www.amazon.com/gp/customer-reviews/RBZY4S2BWQ6AU/ref=cm_cr_getr_d_rvw_ttl?ie=UTF8&ASIN=B0BY8FJ6V8,"5.0 "," the United States "," September 17, 2024",Color: BeigeSize: Medium,Verified Purchase,"My wife got these for a trip, they wear and wash well and are very comfortable. The color is good and is not see through.",
Lauren Jackson,They shrunk several inches in length but love the fabric,https://www.amazon.com/gp/customer-reviews/R2Y504FLGCSM1V/ref=cm_cr_getr_d_rvw_ttl?ie=UTF8&ASIN=B0BY8FJ6V8,"3.0 "," the United States "," September 16, 2024",,Verified Purchase,"Only buy these if you want to wear capris - I am 5’7”, 145 pounds, typically a size 10, and bought a size large for reference. They’re adorable and comfortable in the waist and love the color and fabric is soft and breathable. I washed on cold water, dried on delicate setting and they shrunk 3-4 inches. They’re mid-calf now. I can’t wear in winter. Only with sandals in spring-fall.",
Annie Marcella,Not the same item,https://www.amazon.com/gp/customer-reviews/R2C0KKGV93N070/ref=cm_cr_getr_d_rvw_ttl?ie=UTF8&ASIN=B0BY8FJ6V8,"1.0 "," the United States "," September 15, 2024",Color: Army GreenSize: Medium,Verified Purchase,I had bought the linen color of these pants and was very happy with them. I ordered 2 more colors and the items that came were about 2 feet shorter than the ones I ordered the first time. So frustrating!,
Amazon Customer,"Right size, wrong color.  But anyway, well made garment, reasonable price.",https://www.amazon.com/gp/customer-reviews/R28Q1UT0RSIJQ0/ref=cm_cr_getr_d_rvw_ttl?ie=UTF8&ASIN=B0BY8FJ6V8,"4.0 "," the United States "," September 14, 2024",Color: Dark GraySize: X-Large,Verified Purchase,"I ordered Dark Grey, but received a dark brown-like (Khaki?  Rust?)  garment.  It looks & feels OK on me, and is well made, so I will keep it.  BUT---I still need to order the Dark Grey.",
Connie,Short girl approved!,https://www.amazon.com/gp/customer-reviews/RDNNHKMJX16GO/ref=cm_cr_getr_d_rvw_ttl?ie=UTF8&ASIN=B0BY8FJ6V8,"5.0 "," the United States "," September 12, 2024",Color: PurpleSize: Medium,Verified Purchase,"Love these! I’m 5’1 and usually wear a small/2, after reading reviews I sized up to a medium and they are perfect! They hit at the ankle and are just so comfortable! Will be ordering more colors!",
Deedee,Don’t order these,https://www.amazon.com/gp/customer-reviews/R24HDXY0SBR47D/ref=cm_cr_getr_d_rvw_ttl?ie=UTF8&ASIN=B0BY8FJ6V8,"1.0 "," the United States "," September 12, 2024",Color: YellowSize: Small,Verified Purchase,I wore these twice. Then hand washed in cold water and air dried. They shunk so much they can’t be worn anymore. Now my return window has closed and I’m stuck with pants that are too short.  I’m super unhappy and disappointed because I really did love these the two times I wore them.,
KayDeeVee,So soft and comfortable!,https://www.amazon.com/gp/customer-reviews/R2WINDBNWO138O/ref=cm_cr_getr_d_rvw_ttl?ie=UTF8&ASIN=B0BY8FJ6V8,"5.0 "," the United States "," September 11, 2024",Color: BlackSize: X-Large,Verified Purchase,"Cute, comfortable, flattering and amazingly cool on hot days.",
makari,So cute but shrank in wash,https://www.amazon.com/gp/customer-reviews/R2HY6N88SCGKCJ/ref=cm_cr_getr_d_rvw_ttl?ie=UTF8&ASIN=B0BY8FJ6V8,"2.0 "," the United States "," September 10, 2024",Color: Army GreenSize: Small,Verified Purchase,"These are adorable pants. I’m 5’4 and 130lbs. Typically I wear a US size 6. I ordered a small in the green and adored the look and fit. However, after following the washing instructions (cold general cycle and line dry) they shrank a good 6 inches in length. I’m so disappointed because they really are so cute.",
D M A,Adorable,https://www.amazon.com/gp/customer-reviews/R1ADT9YCCVFTNP/ref=cm_cr_getr_d_rvw_ttl?ie=UTF8&ASIN=B0BY8FJ6V8,"5.0 "," the United States "," September 10, 2024",,Verified Purchase,They're cute and comfortable!,
Melissa Chacon,"Love, love, love!!",https://www.amazon.com/gp/customer-reviews/R3PCUTMVML6GAT/ref=cm_cr_getr_d_rvw_ttl?ie=UTF8&ASIN=B0BY8FJ6V8,"5.0 "," the United States "," September 10, 2024",Color: BeigeSize: Large,Verified Purchase,"I will be honest that I was losing hope in clothes from Amazon. But there is an influencer that I follow on social that swore by these and she is curvier, so I decided to order these. Now, I want them in every color! They are confortable, breezy but not too thin, not see through! I will say, after reading the reviews I am glad I sized up. I’m normally a medium, but got the large. If you’re curvier in your hips or have a belly, I would say size up. These are definitely worth the purchase! And I’ll be buying many more!",
Peggy,Casual but Classy!!,https://www.amazon.com/gp/customer-reviews/R248KC8MS7PW9M/ref=cm_cr_getr_d_rvw_ttl?ie=UTF8&ASIN=B0BY8FJ6V8,"5.0 "," the United States "," September 9, 2024",Color: GraySize: X-Large,Verified Purchase,"The pants fit loosely but have a nice flow. Really like the material, cotton with a small amount of texture. Always get a compliment when I wear which is how you know you chose correctly!",
Jes,Comfortable and Flattering,https://www.amazon.com/gp/customer-reviews/R2L40PH4JYTHOY/ref=cm_cr_getr_d_rvw_ttl?ie=UTF8&ASIN=B0BY8FJ6V8,"5.0 "," the United States "," September 8, 2024",Color: BeigeSize: Small,Verified Purchase,These are great linen pants that are comfortable and stylish to wear. I purchased the beige color in a small and they are thick enough not to be see-through. It’s a great pant to wear for summer.,
Rachel Gault,Great for travel or regular wear,https://www.amazon.com/gp/customer-reviews/RK5FH5NX5S1ZV/ref=cm_cr_getr_d_rvw_ttl?ie=UTF8&ASIN=B0BY8FJ6V8,"5.0 "," the United States "," September 6, 2024",Color: Army GreenSize: Small,Verified Purchase,Bought these for a trip and they were perfect for the plane and the milder climates. Washed a few times and have air dried as some reviews mentioned shrinking. I am 5’3” and they were still cropped enough. Very happy with this purchase!,
Sara Greenfield,Unhappy,https://www.amazon.com/gp/customer-reviews/R368GLI4MUAM4W/ref=cm_cr_getr_d_rvw_ttl?ie=UTF8&ASIN=B0BY8FJ6V8,"1.0 "," the United States "," September 6, 2024",Color: KhakiSize: Medium,Verified Purchase,"Loved these when I first put them on, such a cute high waist, very flattering. I washed them in cold, air dry and they shrunk 4-5 inches in length. What were once pants, are now to my knees. So unhappy. I didn’t buy these to only be able to wear once. Do not recommend at all.",
Alynn G,Comfortable and matches so many things!,https://www.amazon.com/gp/customer-reviews/R1T6P110PJ12X9/ref=cm_cr_getr_d_rvw_ttl?ie=UTF8&ASIN=B0BY8FJ6V8,"5.0 "," the United States "," September 5, 2024",Color: Army GreenSize: Medium,Verified Purchase,I wear these to work all the time! They are both comfy and chic. The olive green matches so many colors too.,
Amalie M. Marte,Lovely pants,https://www.amazon.com/gp/customer-reviews/R7BZZ3EKKIGBY/ref=cm_cr_getr_d_rvw_ttl?ie=UTF8&ASIN=B0BY8FJ6V8,"5.0 "," the United States "," September 1, 2024",Color: Navy BlueSize: XX-Large,Verified Purchase,"Really nice pants. Substantial fabric without being too thick. I wear a size 16 in most pants, 5’5” 190 lbs. I purchased a size XXL and they are perfect.",2
