标题,详情
GRACE KARIN Women's 2025 Summer Beach Dress Floral V Neck Tie Front Spaghetti Strap Flowy Long Dress Boho Maxi Dress,"Material: The Summer Floral Dress is made of 95% polyester and 2% Viscose. Soft and comfy fabric that is flowy, lightweight, and breathable to wear all day long. A must-have dress in your summer wardrobe."
GRACE KARIN Women's 2025 Summer Beach Dress Floral V Neck Tie Front Spaghetti Strap Flowy Long Dress Boho Maxi Dress,Features: Summer Maxi Dresses/Beach Party Dresses/Adjustable Spaghetti Strap Dresses/Ruffle Hem Dresses/Women's Sun Dress/V Neck Dresses/Floral Print Boho Dresses/Sleeveless/A-Line Swing Dresses/Casual Flowy Elegant Style
GRACE KARIN Women's 2025 Summer Beach Dress Floral V Neck Tie Front Spaghetti Strap Flowy Long Dress Boho Maxi Dress,"Chic Design: The Casual Summer Dress has a sexy tie front design; it adjusts the tie to make it as tight as you need, and a sexy midriff cutout has been coupled perfectly to show your flattering curves. The ruffle hem and floral print add more playfulness to the long dress."
GRACE KARIN Women's 2025 Summer Beach Dress Floral V Neck Tie Front Spaghetti Strap Flowy Long Dress Boho Maxi Dress,"Occasions: The Flowy Beach Dress styles yours with earrings, a necklace, lace-up sandals, heels, a hat, and sunglasses. Perfect For Beach, Vacation, Party, Summer, Wedding, Casual, Holiday, Evening, Prom, Night Out, Dating, Birthday, etc."
GRACE KARIN Women's 2025 Summer Beach Dress Floral V Neck Tie Front Spaghetti Strap Flowy Long Dress Boho Maxi Dress,Garment Care: Hand/Machine Washable with Cold Water; Hang or Line to Dry. The generic Amazon size chart is not our size. Please check the GRACE KARIN size chart in the photo gallery before you order.
GRACE KARIN Women's 2025 Summer Beach Dress Floral V Neck Tie Front Spaghetti Strap Flowy Long Dress Boho Maxi Dress,
