Stacy,Good scrub pants,https://www.amazon.com/gp/customer-reviews/R24BU2VDTOLBL2/ref=cm_cr_getr_d_rvw_ttl?ie=UTF8&ASIN=B07WTVFYTC,"5.0 "," the United States "," March 16, 2023",,Verified Purchase,These are good scrub pants. I would size down when purchasing. I bought a medium and could wear a small in these. The length is good as well.,
Jenn,Terrible,https://www.amazon.com/gp/customer-reviews/R2XUZ9Q15DX0BC/ref=cm_cr_getr_d_rvw_ttl?ie=UTF8&ASIN=B07WTVFYTC,"1.0 "," the United States "," March 14, 2023",,Verified Purchase,"These have a very low rise fit and other than the waistband there is zero stretch, also slightly see-thru. Will be returning.",
Auntie TT,Nursing Classes,https://www.amazon.com/gp/customer-reviews/R3SF487YZAW7/ref=cm_cr_getr_d_rvw_ttl?ie=UTF8&ASIN=B07WTVFYTC,"5.0 "," the United States "," March 8, 2023",Size: Medium TallColor: Caribbean Blue,Verified Purchase,My daughter usually doesn't care much for Cherokee scrubs but she wanted a color that was almost an exact match to her scrub sets that she purchased through the college but not as expensive.  She was very impressed with the way they moved with her and that they were not too hard and scratchy to her skin. She loves them.,
Amazon Customer,Great length,https://www.amazon.com/gp/customer-reviews/R3T6IOOX1CDM86/ref=cm_cr_getr_d_rvw_ttl?ie=UTF8&ASIN=B07WTVFYTC,"5.0 "," the United States "," March 7, 2023",Size: XX-Large Plus TallColor: Black,Verified Purchase,Roomy comfy. 2x long. I’m 6ft. Still long after drying!,
Julie Felix,No waist adjustment,https://www.amazon.com/gp/customer-reviews/R2V013ZCCF5812/ref=cm_cr_getr_d_rvw_ttl?ie=UTF8&ASIN=B07WTVFYTC,"2.0 "," the United States "," February 27, 2023",Size: Large PetiteColor: Black,Verified Purchase,Elastic waistband is thin no way to adjust waist. Quality not good.,
Fastfanea,Biggest Gap Ever,https://www.amazon.com/gp/customer-reviews/R2KO3BLJQ7ZC4K/ref=cm_cr_getr_d_rvw_ttl?ie=UTF8&ASIN=B07WTVFYTC,"2.0 "," the United States "," February 14, 2023",Size: XX-Large Plus PetiteColor: Black,,"The hip part of these parts fit great. The length is reasonable and roomy. When it comes to my waist, I have no privacy. It sag off my waste like an over sized hulahoop. Even if I had suspenders, all eyes can see do inside my clothes. I have to alter and maneuver it for work this week. I can't return them.",
chloe mootz,My fav scrubs!,https://www.amazon.com/gp/customer-reviews/R1E10FOPR4YE7V/ref=cm_cr_getr_d_rvw_ttl?ie=UTF8&ASIN=B07WTVFYTC,"5.0 "," the United States "," February 3, 2023",,Verified Purchase,It fits perfectly! I do a lot of moving at work and it seems to always stay in place.,
Tonia,To big and no draw string.,https://www.amazon.com/gp/customer-reviews/R2LUGJ5HINPG2W/ref=cm_cr_getr_d_rvw_ttl?ie=UTF8&ASIN=B07WTVFYTC,"1.0 "," the United States "," January 31, 2023",Size: SmallColor: Black,,"I'm a size small and sometimes a medium. I have a few pounds around the belly. Size small is way to big. They don't have a drawstring either. If you put anything in The pockets, they will fall off.",
Amazon Customer,Love them!,https://www.amazon.com/gp/customer-reviews/R1RQ8CO23U4QNO/ref=cm_cr_getr_d_rvw_ttl?ie=UTF8&ASIN=B07WTVFYTC,"5.0 "," the United States "," January 29, 2023",Size: MediumColor: Caribbean Blue,Verified Purchase,This is my second pair of this style and brand. I like these pants in general because they fit well on me and fit my lifestyle even though I am not a nurse. I get up before dawn to go to a job that provides a different uniform. The pockets are a big help. I like the no string waistband for a sleeker look under my t-shirt or whatever. They are flattering and comfortable—not too tight or too loose. The colors last with washing. I also wear them for hiking for the same reasons.,3
Merissa,yikes,https://www.amazon.com/gp/customer-reviews/R39EXFUHEE7W3U/ref=cm_cr_getr_d_rvw_ttl?ie=UTF8&ASIN=B07WTVFYTC,"3.0 "," the United States "," January 23, 2023",,,honestly they might get softer with washing but first impressions were just not it. if you're 5'9+ the talls are going to be TALL they drag on the floor and i would recommend sizing down. my other scrub pants are a medium but these mediums fit more like a large. the waist band has stretch but the legs do not.,
kathy ortega,Size,https://www.amazon.com/gp/customer-reviews/R24XU1BC9LVKNH/ref=cm_cr_getr_d_rvw_ttl?ie=UTF8&ASIN=B07WTVFYTC,"1.0 "," the United States "," January 21, 2023",Size: X-LargeColor: Black,Verified Purchase,Too small,
katherine snider,Size runs big,https://www.amazon.com/gp/customer-reviews/R3NJ5IDRL8KIKH/ref=cm_cr_getr_d_rvw_ttl?ie=UTF8&ASIN=B07WTVFYTC,"1.0 "," the United States "," January 8, 2023",Size: MediumColor: Black,Verified Purchase,Tryed to call no phone number these are way to big,
JoAnn Harris,Waist very loose with no way to adjust,https://www.amazon.com/gp/customer-reviews/R31QHZSA1XJKFS/ref=cm_cr_getr_d_rvw_ttl?ie=UTF8&ASIN=B07WTVFYTC,"3.0 "," the United States "," January 7, 2023",Size: X-Large TallColor: Navy,Verified Purchase,Waist very loose with no way to adjust. I ordered a tall length the length is very good I like the cut of the pants but I’m gonna have to send them back because the waist is loose it’s falling down and there’s no way to adjust them or wear a belt with this,
Heather,Disappointed,https://www.amazon.com/gp/customer-reviews/RRTS7FBTQL4KA/ref=cm_cr_getr_d_rvw_ttl?ie=UTF8&ASIN=B07WTVFYTC,"3.0 "," the United States "," January 6, 2023",Size: X-LargeColor: Black,Verified Purchase,"It was not the quality I expected from Cherokee. The waistband is just a thin piece of elastic covered by a non-elastic wide band. The sizing was off as well, too large.",
M. Fitzgerald,Used the size chart but pants are way too big.,https://www.amazon.com/gp/customer-reviews/R3B9XPGBMMS8HV/ref=cm_cr_getr_d_rvw_ttl?ie=UTF8&ASIN=B07WTVFYTC,"1.0 "," the United States "," January 3, 2023",Size: LargeColor: Pewter,,Used the size chart but pants are way too big.,
connie,These run big,https://www.amazon.com/gp/customer-reviews/R68TZ5TTACRCT/ref=cm_cr_getr_d_rvw_ttl?ie=UTF8&ASIN=B07WTVFYTC,"2.0 "," the United States "," December 31, 2022",Size: Medium PetiteColor: Black,Verified Purchase,Returned to big. Would not stay up on me,
dfk,Runs quite large,https://www.amazon.com/gp/customer-reviews/R3SDHJ802MRN2U/ref=cm_cr_getr_d_rvw_ttl?ie=UTF8&ASIN=B07WTVFYTC,"3.0 "," the United States "," December 26, 2022",Size: X-Large PetiteColor: Black,Verified Purchase,I wanted to like these - but - they felt more like pajamas then most scrubs. I purchased my usual size and struggled all day to keep them up!,
Kindle Customer,Definitely no,https://www.amazon.com/gp/customer-reviews/R36NLOJFFGAR7Q/ref=cm_cr_getr_d_rvw_ttl?ie=UTF8&ASIN=B07WTVFYTC,"3.0 "," the United States "," December 17, 2022",,Verified Purchase,Nothing,2
Skyla,Stiff material,https://www.amazon.com/gp/customer-reviews/R2BIQ2MKPAFEPM/ref=cm_cr_getr_d_rvw_ttl?ie=UTF8&ASIN=B07WTVFYTC,"2.0 "," the United States "," December 13, 2022",,Verified Purchase,Loved the fact that these pants had all these pockets. Once I opened them I noticed the material. Tried them on and they did not feel comfortable. I even went up a size just to make sure I’d be comfortable but that didn’t help the fact that I still couldn’t move in them because the material wasn’t to my liking.,
lauren valerio,sizing incorrect,https://www.amazon.com/gp/customer-reviews/R2UBK2I1WYW376/ref=cm_cr_getr_d_rvw_ttl?ie=UTF8&ASIN=B07WTVFYTC,"1.0 "," the United States "," December 13, 2022",Size: Large PetiteColor: Black,Verified Purchase,"ordered large petite fit bigger than an xl also not petite at all, dragged all over the floor",
PérezD,Corre grande,https://www.amazon.com/gp/customer-reviews/R2MAE48UCMQKL8/ref=cm_cr_getr_d_rvw_ttl?ie=UTF8&ASIN=B07WTVFYTC,"3.0 "," the United States "," December 10, 2022",Size: Medium PetiteColor: Black,Verified Purchase,En general me parece un buen producto en relación al precio. Pero si definitivamente corre grande.,
MsAP,Spongebob Fit,https://www.amazon.com/gp/customer-reviews/R385OG2C8HS7LG/ref=cm_cr_getr_d_rvw_ttl?ie=UTF8&ASIN=B07WTVFYTC,"1.0 "," the United States "," December 8, 2022",,Verified Purchase,"The medium was too big and the small was too tight. I normally wear a medium. The waist band is extra stretchy, but the area for your hips is not properly sized. The pants seemed to be a good fit for someone who is very small at the bottom, but wide at the waist and upper body like Spongebob.",
Nikki Sandy,The medium size is unbelievably big.. wayyy to big.,https://www.amazon.com/gp/customer-reviews/R15KT4OXYU0ZMQ/ref=cm_cr_getr_d_rvw_ttl?ie=UTF8&ASIN=B07WTVFYTC,"1.0 "," the United States "," December 7, 2022",,Verified Purchase,"I got a med, which is my usual size, but I am swimming in these pants. I wore them once and all day long had to keep pulling them up, so big the literally just fall down every step I take. The are also super long, so I was walking on the pants.  Terrible.  I don't recommend this style, get the drawstring pants in a small if you are a small girl, they fit much better.  Love the top but these pants are ridiculous 🙄",
Casey,WAYYY too big,https://www.amazon.com/gp/customer-reviews/R2AN44PFYRGDTU/ref=cm_cr_getr_d_rvw_ttl?ie=UTF8&ASIN=B07WTVFYTC,"1.0 "," the United States "," December 3, 2022",Size: X-LargeColor: Black,Verified Purchase,These were HUGE. Like laughably big. They were very stiff and unflattering. Would not recommend at all.,
Kariska,Sizing doesn't make sense,https://www.amazon.com/gp/customer-reviews/R218713SQTY5R7/ref=cm_cr_getr_d_rvw_ttl?ie=UTF8&ASIN=B07WTVFYTC,"1.0 "," the United States "," November 24, 2022",,Verified Purchase,"I bought these pants in size Large, Medium, Small, and Small Petite (I'm 5'2''). Large and Medium were both falling off of me. Small hardly made it past top of my thighs. So upset because I need new pants for work and have had no luck. ALL RETURNED",
elemiller,comfortable,https://www.amazon.com/gp/customer-reviews/R2RDVMR0IOLHPO/ref=cm_cr_getr_d_rvw_ttl?ie=UTF8&ASIN=B07WTVFYTC,"5.0 "," the United States "," November 21, 2022",Size: MediumColor: Black,Verified Purchase,"these scrubs do seem to run large. After wearing them one day, I had to take them in as the very comfortable knit waist would slide down as the day progressed. I like the pockets very much, but would probably buy a small instead of a medium next time. I bought the average length and did have to shorten them (I am 5' 4"")",
Terry Green,I don't sag,https://www.amazon.com/gp/customer-reviews/RWDKDBSZJ81SD/ref=cm_cr_getr_d_rvw_ttl?ie=UTF8&ASIN=B07WTVFYTC,"1.0 "," the United States "," November 16, 2022",Size: X-LargeColor: Black,Verified Purchase,These pants were three time the size that I wear 🤣,
MamaNitaj,Way too large,https://www.amazon.com/gp/customer-reviews/R37U8ITXDRJ4T6/ref=cm_cr_getr_d_rvw_ttl?ie=UTF8&ASIN=B07WTVFYTC,"2.0 "," the United States "," November 9, 2022",Size: X-Large PetiteColor: Black,Verified Purchase,"Fabric is good and will probably wash well, but fit is entirely too large.  I’m a big gal & these are too big for me.  Consider ordering one size smaller than your usual.",
Grizzlybear,irregular fit,https://www.amazon.com/gp/customer-reviews/RAR1VOM5X26L6/ref=cm_cr_getr_d_rvw_ttl?ie=UTF8&ASIN=B07WTVFYTC,"1.0 "," the United States "," October 7, 2022",Size: X-LargeColor: Ciel,,too small on top and too small on legs,
Florence Nightingale,returned,https://www.amazon.com/gp/customer-reviews/R229L93H73YZR3/ref=cm_cr_getr_d_rvw_ttl?ie=UTF8&ASIN=B07WTVFYTC,"2.0 "," the United States "," September 27, 2022",Size: Small PetiteColor: Wine,Verified Purchase,"I had to return these pants, way too big and long for a small petite. overtime the elastic waist will be loose.",
A Anderson,Too long,https://www.amazon.com/gp/customer-reviews/R1M132SLPLM5TF/ref=cm_cr_getr_d_rvw_ttl?ie=UTF8&ASIN=B07WTVFYTC,"3.0 "," the United States "," September 9, 2022",Size: X-LargeColor: Black,Verified Purchase,Cherokee scrubs are too random when it comes to size and length. I love the look of the brand and I have several to mix and match scrubs more easily. I have some that are large and fit great some that are XL and fit great. I have some that I ordered in Tall and they’re perfect length and some Talls that are wayyyy too long. I just wish there was more consistency,
Lusine,Excellent quality,https://www.amazon.com/gp/customer-reviews/R1UEQKCDVUWB6P/ref=cm_cr_getr_d_rvw_ttl?ie=UTF8&ASIN=B07WTVFYTC,"5.0 "," the United States "," August 20, 2022",Size: MediumColor: Teal Blue,Verified Purchase,The quality is very good but with the size I was mistaken.I had to interrupt,
Louver Luis Morán peñafiel,Bonito,https://www.amazon.com/gp/customer-reviews/R2WYGK3MFG15WT/ref=cm_cr_getr_d_rvw_ttl?ie=UTF8&ASIN=B07WTVFYTC,"4.0 "," the United States "," August 7, 2022",,Verified Purchase,Bonito,
Ashleigh,Cute but not my favorite,https://www.amazon.com/gp/customer-reviews/R2O5GKX4LON9FR/ref=cm_cr_getr_d_rvw_ttl?ie=UTF8&ASIN=B07WTVFYTC,"4.0 "," the United States "," August 3, 2022",Size: X-LargeColor: Navy,Verified Purchase,"Cute and comfortable, but not my favorite. Functionality and stretch is good. Healing Hands scrubs have become my new favorite.",
