标题,详情
InCashmere 100% Pure Cashmere Women Poncho Sweater - Lightweight Warm Knitted Shawl Wrap - All Year Round Dress Topper Gift,"Pure Cashmere Comfort: made of 100% light, airy cashmere and it is perfect for adding a little warmth, whether over a casual outfit or formal. The luxurious feel of cashmere against the skin makes every wear a truely exceptional experience."
InCashmere 100% Pure Cashmere Women Poncho Sweater - Lightweight Warm Knitted Shawl Wrap - All Year Round Dress Topper Gift,"Lightweight and soft: it strikes the perfect balance between warmth and breath ability, making it an idea layering piece for all season. Layering it over a blouse on a chilly evening or on the plane, the cashmere insulate properties keep you comfortable warm without adding bulk."
InCashmere 100% Pure Cashmere Women Poncho Sweater - Lightweight Warm Knitted Shawl Wrap - All Year Round Dress Topper Gift,"Versatile style: you can wear it as a poncho, adjust it to look more like a wrap, or drape it down front like a scarf. The neck opening is just the right size to allow for it to be nicely draped across the collarbone."
InCashmere 100% Pure Cashmere Women Poncho Sweater - Lightweight Warm Knitted Shawl Wrap - All Year Round Dress Topper Gift,"All season long product: it is heavy enough to use in a chilly office, or to have on a spring, fall, even summer in some places evening to knock off the chill when the sun goes down. It is light, packs small in a carry on baggage."
InCashmere 100% Pure Cashmere Women Poncho Sweater - Lightweight Warm Knitted Shawl Wrap - All Year Round Dress Topper Gift,"The Gift of Unique Luxury: Surprise your loved ones with a unique and thoughtful gift for Birthdays, Anniversaries, Thanksgiving, Christmas. Cashmere poncho comes with a complimentary gift box, no need for additional wrapping."
InCashmere 100% Pure Cashmere Women Poncho Sweater - Lightweight Warm Knitted Shawl Wrap - All Year Round Dress Topper Gift,
