评论用户,评论概述,评论链接,星级评分,评论地点,评论时间,类型,是否购买,评论详情,觉得该评论有帮助的人数
Benedicto DeJesus,Comfortable sporty,https://www.amazon.com/gp/customer-reviews/R1T1Y3GRR51OTQ/ref=cm_cr_getr_d_rvw_ttl?ie=UTF8&ASIN=B0D3B89NRZ,"5.0 "," the United States "," May 8, 2024",,Verified Purchase,Great love it,
Yolanda,Incorrect Material Listing,https://www.amazon.com/gp/customer-reviews/R3B81WVWDPJ4AJ/ref=cm_cr_getr_d_rvw_ttl?ie=UTF8&ASIN=B0D3B89NRZ,"2.0 "," the United States "," February 2, 2024",Size: LargeColor: Purple,Verified Purchase,In the description this jacket is listed as 65% cotton 35% polyester. However this jacket is 65% polyester/35% cotton. It also has a sponge like feel to it.,
Wylissa graham,I made my daughter senior jacket,https://www.amazon.com/gp/customer-reviews/REN2FA79R1T7N/ref=cm_cr_getr_d_rvw_ttl?ie=UTF8&ASIN=B0D3B89NRZ,"5.0 "," the United States "," October 21, 2023",Size: LargeColor: Blue,Verified Purchase,Will buy again!,
Sam Dasch,"Quality jacket, looks fly",https://www.amazon.com/gp/customer-reviews/RT6R7IPQVUF79/ref=cm_cr_getr_d_rvw_ttl?ie=UTF8&ASIN=B0D3B89NRZ,"5.0 "," the United States "," October 9, 2023",Size: MediumColor: Purple,Verified Purchase,"Was in the market for an autumn New England style. Love the pockets! My hand feels chilly! Oh sweet my jacket has pockets! Only had for a short while so far, but very pleased with the purchase.",
Kimberly,Not bad but runs very small,https://www.amazon.com/gp/customer-reviews/R2JXY9AAWJ91PS/ref=cm_cr_getr_d_rvw_ttl?ie=UTF8&ASIN=B0D3B89NRZ,"4.0 "," the United States "," June 11, 2023",Size: X-LargeColor: Green,Verified Purchase,Surprisingly it's a nice jacket. Fleece. SMALL. Order up.,2
