评论用户,评论概述,评论链接,星级评分,评论地点,评论时间,类型,是否购买,评论详情,觉得该评论有帮助的人数
Coverplex,Soft,https://www.amazon.com/gp/customer-reviews/R103MLQMBEALTR/ref=cm_cr_getr_d_rvw_ttl?ie=UTF8&ASIN=B07PD7RRP9,"5.0 "," the United States "," October 28, 2024",,Verified Purchase,Great shirt,
tarni m bell,"Comments, Smiles, Compliments and Laughter",https://www.amazon.com/gp/customer-reviews/R3O98NQ73R0SM1/ref=cm_cr_getr_d_rvw_ttl?ie=UTF8&ASIN=B07PD7RRP9,"5.0 "," the United States "," November 8, 2023",,Verified Purchase,Excellent and elevated gift (for self or another). A Classic since Animal House! Humor abounds- as does comfort. Size was perfectly roomy. Tons of compliments! and inquiries about where I got it!,
Rich D,Fun,https://www.amazon.com/gp/customer-reviews/R152MZOJX0O7CZ/ref=cm_cr_getr_d_rvw_ttl?ie=UTF8&ASIN=B07PD7RRP9,"5.0 "," the United States "," January 5, 2023",,Verified Purchase,Fun gift for my son,
Victor,Love it,https://www.amazon.com/gp/customer-reviews/R1M05XR5TYXUZU/ref=cm_cr_getr_d_rvw_ttl?ie=UTF8&ASIN=B07PD7RRP9,"5.0 "," the United States "," January 1, 2023",,Verified Purchase,I had to have this and the shirt didn’t disappoint. Very soft and comfy,
Kegz,Font way too big,https://www.amazon.com/gp/customer-reviews/RT8AIOX4CT2T1/ref=cm_cr_getr_d_rvw_ttl?ie=UTF8&ASIN=B07PD7RRP9,"3.0 "," the United States "," November 9, 2022",,Verified Purchase,Font is way too big which doesn’t really come through in pictures. But comfy shirt nonetheless,
Chef,Very faded.,https://www.amazon.com/gp/customer-reviews/R32J4NL20A24JL/ref=cm_cr_getr_d_rvw_ttl?ie=UTF8&ASIN=B07PD7RRP9,"1.0 "," the United States "," October 18, 2022",,Verified Purchase,Not just pre washed but so faded it was hard to see.,
Steven Surovik,Good shirt,https://www.amazon.com/gp/customer-reviews/RQKF5P6MHJLDS/ref=cm_cr_getr_d_rvw_ttl?ie=UTF8&ASIN=B07PD7RRP9,"5.0 "," the United States "," September 7, 2022",,Verified Purchase,Comfortable and good fit,
dyc3,Older Adult College-ware!,https://www.amazon.com/gp/customer-reviews/RX9LVVF5TUCQB/ref=cm_cr_getr_d_rvw_ttl?ie=UTF8&ASIN=B07PD7RRP9,"5.0 "," the United States "," August 18, 2021",,Verified Purchase,"Going back to college at age 52 to local community college.  Got this for my days on campus…makes me feel “in”, even though I’m usually the oldest in my classes! Cute tshirt. Not super soft or slimming-so just expect a regular old cotton tshirt.",
W. Burkholder,Quick to fade,https://www.amazon.com/gp/customer-reviews/R2TZYHJNSJ0PPJ/ref=cm_cr_getr_d_rvw_ttl?ie=UTF8&ASIN=B07PD7RRP9,"3.0 "," the United States "," July 27, 2021",,Verified Purchase,Lettering has just about gone away after 6 or 7 months.,2
JobInterviewInsider,Hilarious,https://www.amazon.com/gp/customer-reviews/R1HOVT21LQHZ3Q/ref=cm_cr_getr_d_rvw_ttl?ie=UTF8&ASIN=B07PD7RRP9,"5.0 "," the United States "," June 2, 2021",,Verified Purchase,"We are big Animal House fans.  This is soooo subtle...most people don't get it, only Animal House fans",
Ali,Nice shirt,https://www.amazon.com/gp/customer-reviews/R3R4B2IX9R2HV4/ref=cm_cr_getr_d_rvw_ttl?ie=UTF8&ASIN=B07PD7RRP9,"4.0 "," the United States "," March 25, 2021",,Verified Purchase,This is a great shirt I bought for my son the only problem was it was a little short.,
Todd Shaffer,Ok,https://www.amazon.com/gp/customer-reviews/R27DEGYLOYQAOC/ref=cm_cr_getr_d_rvw_ttl?ie=UTF8&ASIN=B07PD7RRP9,"3.0 "," the United States "," November 5, 2020",,Verified Purchase,I’m bigger so I look for shirts I can stretch a little.  This one did not but a good T-shirt if weari g around the house or under something.  Ripped in the collar when I tried to stretch it.,
MickeyMouth,Lettering is too big.,https://www.amazon.com/gp/customer-reviews/RW6NP01JY1Q3G/ref=cm_cr_getr_d_rvw_ttl?ie=UTF8&ASIN=B07PD7RRP9,"3.0 "," the United States "," April 29, 2020",,Verified Purchase,The beginning C and the ending E are under my arms. Looks funky.,
judeann,Order one size bigger.,https://www.amazon.com/gp/customer-reviews/R2Q4PRII0NL4A0/ref=cm_cr_getr_d_rvw_ttl?ie=UTF8&ASIN=B07PD7RRP9,"3.0 "," the United States "," March 15, 2020",,Verified Purchase,Not very big for xxxl.,
Patrick H Brick,"Great Quality Fabric, Cool Color",https://www.amazon.com/gp/customer-reviews/R3302YY3R5XFN8/ref=cm_cr_getr_d_rvw_ttl?ie=UTF8&ASIN=B07PD7RRP9,"5.0 "," the United States "," December 8, 2019",,Verified Purchase,"This T-Shirt is simply the greatest Homage to the late great John Belushi in ""Animal House.""  Fans of that movie should remember that he wore a T-shirt that simply said ""COLLEGE.""  So when I saw the same type of shirt on Amazon, knew I had to get it, and got it.  Have worn it only a couple times, but each time, people recognized the connection to Belushi, and said, Way to Go, Cool Belushi Animal House shirt!",2
Valentina13,Flattering,https://www.amazon.com/gp/customer-reviews/R3IJ3QVQGZY1VY/ref=cm_cr_getr_d_rvw_ttl?ie=UTF8&ASIN=B07PD7RRP9,"5.0 "," the United States "," July 19, 2019",,Verified Purchase,Daughter loves it,
Joy,Great shirt.,https://www.amazon.com/gp/customer-reviews/R13ZA23UDZD1NB/ref=cm_cr_getr_d_rvw_ttl?ie=UTF8&ASIN=B07PD7RRP9,"5.0 "," the United States "," July 4, 2019",,Verified Purchase,"Very high quality.  Feminine fit, but not tight.",
Robert Hedrick,"Nice shirt, bad ""handling""",https://www.amazon.com/gp/customer-reviews/R22Q0WJWQQGC0B/ref=cm_cr_getr_d_rvw_ttl?ie=UTF8&ASIN=B07PD7RRP9,"2.0 "," the United States "," April 11, 2019",,Verified Purchase,"The shirt is fine, for the most part. However, at some point prior to packaging the shirt, someone got ink hand-prints on the back of the shirt. I do not feel like going through the hassle of packaging and returning the shirt, so I am going to wash it, and hope for the best. Ultimately, it is just very disappointing.",
