评论用户,评论概述,评论链接,星级评分,评论地点,评论时间,类型,是否购买,评论详情,觉得该评论有帮助的人数
Amylynne526,"Great pants, but too long!",https://www.amazon.com/gp/customer-reviews/R1PP1P5DIGRAIW/ref=cm_cr_getr_d_rvw_ttl?ie=UTF8&ASIN=B0CW96LPQ3,"4.0 "," the United States "," January 20, 2025",Color: BlackSize: Large,,"These pants are SO CUTE. They fit perfectly, are SO comfortable, and the material is soft but sturdy. It’s like getting to wear pajama pants to work. My only complaint is they are wayyy too long for my 5’1” self. Even with heels I have to take a few inches off. So if you’re maybe 5’5” or taller, they’ll be perfect. But for my short girlies… prepare to have them hemmed. Still worth it, but it was enough to take a star off.",
Cliente Amazon,Great tummy control,https://www.amazon.com/gp/customer-reviews/RFO28F2VJM7WI/ref=cm_cr_getr_d_rvw_ttl?ie=UTF8&ASIN=B0CW96LPQ3,"5.0 "," the United States "," January 18, 2025",Color: Light KhakiSize: Medium,Verified Purchase,Best tummy control ever and super soft fabric!,
Robin Strahl,High quality,https://www.amazon.com/gp/customer-reviews/R2KDJKEIIPFVDJ/ref=cm_cr_getr_d_rvw_ttl?ie=UTF8&ASIN=B0CW96LPQ3,"5.0 "," the United States "," January 17, 2025",Color: Mocha BrownSize: Small,Verified Purchase,These pants are worth their weight in gold! Super soft and stretchy.  Elevates your look at work!,
Irina Boudreau,Too short,https://www.amazon.com/gp/customer-reviews/RL70AL6YHQPIO/ref=cm_cr_getr_d_rvw_ttl?ie=UTF8&ASIN=B0CW96LPQ3,"4.0 "," the United States "," January 4, 2025",Color: Mocha BrownSize: Medium,Verified Purchase,I liked the fabric and style but the length is too short. It m 5’8” and the pants sit above my foot.  Can’t wear them with hills. It’ll look odd even with flats.,
RaChell,So cute & comfortable,https://www.amazon.com/gp/customer-reviews/RTG88HRXEZ22L/ref=cm_cr_getr_d_rvw_ttl?ie=UTF8&ASIN=B0CW96LPQ3,"5.0 "," the United States "," January 4, 2025",Color: BrownSize: Small,Verified Purchase,These are the cutest pants. They are very comfortable and true to size. I have worn them several times and they seem to be very durable. I get a lot of compliments. I have order in several colors. You can wear them in summer and winter.,
Emily,A little short,https://www.amazon.com/gp/customer-reviews/RGW1HZEN0EFX2/ref=cm_cr_getr_d_rvw_ttl?ie=UTF8&ASIN=B0CW96LPQ3,"4.0 "," the United States "," December 30, 2024",Color: Light GreySize: Large,Verified Purchase,I’m 5’9 and these were a little too short for me but overall good quality.,
Michelle Bertorini,Great value and good quality,https://www.amazon.com/gp/customer-reviews/R1EKJHJQ6D4SC4/ref=cm_cr_getr_d_rvw_ttl?ie=UTF8&ASIN=B0CW96LPQ3,"5.0 "," the United States "," December 27, 2024",Color: BlackSize: Small,Verified Purchase,"I’ve totally fallen in love with these work pants! The fit is amazing! I'm 5'2“ 130 lbs and I wear a small in these. I usually stick to heels, so I’m not quite sure how the length would work with flats. I did notice that my gray pair feels a bit tighter compared to my black pair, even though they’re both the same size. But overall, they’re pretty true to size! I carry a little more weight in my thighs and lower body, and these pants fit me really well!",
Nicole Williams,Cute,https://www.amazon.com/gp/customer-reviews/R38GOQP11J767Q/ref=cm_cr_getr_d_rvw_ttl?ie=UTF8&ASIN=B0CW96LPQ3,"5.0 "," the United States "," December 27, 2024",Color: BrownSize: Large,Verified Purchase,"These pants are really cute, love how they fit.",
Erin Elizabeth,Worth the money!,https://www.amazon.com/gp/customer-reviews/R25AC30Q4MN8Z1/ref=cm_cr_getr_d_rvw_ttl?ie=UTF8&ASIN=B0CW96LPQ3,"5.0 "," the United States "," December 21, 2024",Color: BlackSize: X-Large,Verified Purchase,"I'm not one to leave reviews, especially when it comes to clothes from Amazon. These pants were perfect! They are definitely true to size but extremely comfortable and some room for movement! If you are debating on buying these, do it!!",
Heather Black,Great quality pants,https://www.amazon.com/gp/customer-reviews/R1LRNCSWSP4QIV/ref=cm_cr_getr_d_rvw_ttl?ie=UTF8&ASIN=B0CW96LPQ3,"5.0 "," the United States "," December 19, 2024",Color: BrownSize: Medium,Verified Purchase,These pants are great quality. They are a thick material and are very comfortable. Have a little difficulty keeping the belt tied but no complaints other than that,
Donna Vosberg,Not described very accurately,https://www.amazon.com/gp/customer-reviews/R3JWSZ2WJWA80P/ref=cm_cr_getr_d_rvw_ttl?ie=UTF8&ASIN=B0CW96LPQ3,"1.0 "," the United States "," December 18, 2024",Color: Charcoal GreySize: Large,Verified Purchase,Material very flimsy.  Style very different than expected,
Jane A,Pants,https://www.amazon.com/gp/customer-reviews/R1EDZS8KW54G3I/ref=cm_cr_getr_d_rvw_ttl?ie=UTF8&ASIN=B0CW96LPQ3,"3.0 "," the United States "," December 17, 2024",Color: BlackSize: Small,Verified Purchase,Didn't fit good for me way too big,
Amazon Customer,Pants,https://www.amazon.com/gp/customer-reviews/R1XGKRUQE0FYPK/ref=cm_cr_getr_d_rvw_ttl?ie=UTF8&ASIN=B0CW96LPQ3,"5.0 "," the United States "," December 15, 2024",Color: Off-whiteSize: Medium,Verified Purchase,Love them,
Bri Vaughan,Comfortable & beautiful,https://www.amazon.com/gp/customer-reviews/R3TW7YP13HALXE/ref=cm_cr_getr_d_rvw_ttl?ie=UTF8&ASIN=B0CW96LPQ3,"5.0 "," the United States "," December 9, 2024",Color: RedSize: Large,Verified Purchase,"These took quite some time to arrive, so order with plenty of time if you need them for an event. However, they were SO comfortable & I received many compliments. The pockets were great as most pants like these don’t have pockets. They’re also flattering and not thin. They are a great float meets durable fabric.",9
Heather,Long,https://www.amazon.com/gp/customer-reviews/R3FTITK71TH77Z/ref=cm_cr_getr_d_rvw_ttl?ie=UTF8&ASIN=B0CW96LPQ3,"4.0 "," the United States "," December 1, 2024",Color: Mocha BrownSize: Small,Verified Purchase,Quality is good but length was extremely to long,
Crystal and Chuck  Emory,Perfect fit,https://www.amazon.com/gp/customer-reviews/R1BLG8PDRLRI0F/ref=cm_cr_getr_d_rvw_ttl?ie=UTF8&ASIN=B0CW96LPQ3,"5.0 "," the United States "," November 25, 2024",Color: RedSize: Medium,Verified Purchase,I love these pants. Very comfortable and great fit. I’m 5’9 and weigh 140 pounds and the medium is a great size. Great for Christmas season.,
Amazon Customer,Too short,https://www.amazon.com/gp/customer-reviews/R3O0XUOOCV2Z8Q/ref=cm_cr_getr_d_rvw_ttl?ie=UTF8&ASIN=B0CW96LPQ3,"5.0 "," the United States "," November 22, 2024",Color: Light KhakiSize: Large,Verified Purchase,Beautiful but too short to wear with heels.,
Amazon Customer,Awesome,https://www.amazon.com/gp/customer-reviews/ROPZP75A59Z3U/ref=cm_cr_getr_d_rvw_ttl?ie=UTF8&ASIN=B0CW96LPQ3,"5.0 "," the United States "," November 19, 2024",Color: Navy BlueSize: Large,Verified Purchase,"These may be the best pants I’ve ever purchased. Soft, flattering, lay great, not to thin as some have said, I was impressed by the weight. I’m 5’4” 155# the fit perfect! Will be buying another pair.",2
Erin,Love these pants!,https://www.amazon.com/gp/customer-reviews/R13C53PZOESS4A/ref=cm_cr_getr_d_rvw_ttl?ie=UTF8&ASIN=B0CW96LPQ3,"5.0 "," the United States "," November 18, 2024",Color: BrownSize: Medium,Verified Purchase,Absolutely love these pants. Fit perfect and so comfortable,
Kris,If your short these are for you,https://www.amazon.com/gp/customer-reviews/RN7OEOWW09WIN/ref=cm_cr_getr_d_rvw_ttl?ie=UTF8&ASIN=B0CW96LPQ3,"2.0 "," the United States "," November 15, 2024",Color: BlackSize: X-Large,Verified Purchase,I am not sure how short they intended me to be but Im 5'7 and these are high flood. They do also didn't fit which is my normal size.,
Alyssa,Comfy but cute!,https://www.amazon.com/gp/customer-reviews/RUEZAPQPKCPNA/ref=cm_cr_getr_d_rvw_ttl?ie=UTF8&ASIN=B0CW96LPQ3,"5.0 "," the United States "," November 14, 2024",Color: BlackSize: Medium,Verified Purchase,These are one of the most comfy dress pants I have owned. They are true to size and the quality for the price is great! I have received many compliments.,
Hillary,Cute but not for very small frames,https://www.amazon.com/gp/customer-reviews/RZPQ4B9UZEN2I/ref=cm_cr_getr_d_rvw_ttl?ie=UTF8&ASIN=B0CW96LPQ3,"4.0 "," the United States "," November 11, 2024",Color: Mocha BrownSize: Small,Verified Purchase,"I love the color and the style, but I ordered small and I was swimming in them. I am 105 lbs and the waist was very large. Wish they had worked for me!",
质量特别差、面料特别差、千万不要买,不要买 做工和面料特别差,https://www.amazon.com/gp/customer-reviews/RIG6XCQWVMMGX/ref=cm_cr_getr_d_rvw_ttl?ie=UTF8&ASIN=B0CW96LPQ3,"1.0 "," the United States "," November 8, 2024",Color: BlackSize: Small,Verified Purchase,,
jessica,Favorecedor!,https://www.amazon.com/gp/customer-reviews/R1HDXJF0112WZ3/ref=cm_cr_getr_d_rvw_ttl?ie=UTF8&ASIN=B0CW96LPQ3,"5.0 "," the United States "," November 6, 2024",Color: BlackSize: Medium,Verified Purchase,Costo vs beneficio me encantó y no necesita ningún arreglo,
Shooting  Mom,Good,https://www.amazon.com/gp/customer-reviews/R3DHYKHUBIH7IH/ref=cm_cr_getr_d_rvw_ttl?ie=UTF8&ASIN=B0CW96LPQ3,"5.0 "," the United States "," November 6, 2024",Color: Light KhakiSize: X-Large,Verified Purchase,Very comfortable and fits my odd shaped body well (you know....the woman's shape),
Marie’s teview,Fabric feels great.,https://www.amazon.com/gp/customer-reviews/R2758L7URIY3GP/ref=cm_cr_getr_d_rvw_ttl?ie=UTF8&ASIN=B0CW96LPQ3,"5.0 "," the United States "," November 6, 2024",Color: Charcoal GreySize: Large,Verified Purchase,"Everyone comments on these slacks. Perfect fabric,comfortable fit and looks great on.",
Sandra Luman,Too long,https://www.amazon.com/gp/customer-reviews/R30RZTUIQDAPJQ/ref=cm_cr_getr_d_rvw_ttl?ie=UTF8&ASIN=B0CW96LPQ3,"3.0 "," the United States "," November 5, 2024",Color: Walnut BrownSize: Medium,Verified Purchase,"They were way too long and too much to hem and still look right.  I am 5'4"". Really loved the color and material.",
Odalys C,Gray pants,https://www.amazon.com/gp/customer-reviews/R11ORIH97VH5RU/ref=cm_cr_getr_d_rvw_ttl?ie=UTF8&ASIN=B0CW96LPQ3,"4.0 "," the United States "," November 4, 2024",Color: Charcoal GreySize: Medium,Verified Purchase,"Texture, color and fit very nice I really like them",
Sarah Seifert,Perfect work pants,https://www.amazon.com/gp/customer-reviews/R3RU7PAMDYAC6I/ref=cm_cr_getr_d_rvw_ttl?ie=UTF8&ASIN=B0CW96LPQ3,"5.0 "," the United States "," November 3, 2024",,Verified Purchase,"These are the perfect work pants. They coordinate well with a lot of tops, they look cute with or without the included belt, and they are sooooooo comfortable. They feel like pajama pants but look super professional.",
Shantell,Broken Zipper,https://www.amazon.com/gp/customer-reviews/R31MI74RA54ZJZ/ref=cm_cr_getr_d_rvw_ttl?ie=UTF8&ASIN=B0CW96LPQ3,"1.0 "," the United States "," November 3, 2024",Color: Charcoal GreySize: Large,Verified Purchase,"They were very cute. The material wasn’t what I expected. I put them on and the zipper broke was broken, so want able to were them. The zipper was backwards. So must had a defective zipper.",
Robert Schubert,Perfect,https://www.amazon.com/gp/customer-reviews/R773M6NXX7J0G/ref=cm_cr_getr_d_rvw_ttl?ie=UTF8&ASIN=B0CW96LPQ3,"5.0 "," the United States "," October 31, 2024",Color: BrownSize: Medium,Verified Purchase,So comfortable I get so many compliments,
Girl Jamaica,Great fit,https://www.amazon.com/gp/customer-reviews/R17GQCBI4EQEY/ref=cm_cr_getr_d_rvw_ttl?ie=UTF8&ASIN=B0CW96LPQ3,"4.0 "," the United States "," October 29, 2024",Color: Navy BlueSize: Small,Verified Purchase,A must buy. Purchased a small in black and navy blue. 168lbs 5’4”,
N,Great quality,https://www.amazon.com/gp/customer-reviews/R3MUDJ5BGDGGD7/ref=cm_cr_getr_d_rvw_ttl?ie=UTF8&ASIN=B0CW96LPQ3,"3.0 "," the United States "," October 28, 2024",Color: Mocha BrownSize: Large,Verified Purchase,I typically don’t need to buy longs but these pants were just a little too short. Great material and super cute,
"Cynthia, Blairsville GA",Wrinkles free,https://www.amazon.com/gp/customer-reviews/R3MDE9VK3W75GG/ref=cm_cr_getr_d_rvw_ttl?ie=UTF8&ASIN=B0CW96LPQ3,"5.0 "," the United States "," October 28, 2024",Color: Sage GreenSize: Small,Verified Purchase,"Love the detachable belt, great fit. Flowing material, light weight. Pockets are deep and the color is as seen in website.",
Chesterp,LOVE THESE,https://www.amazon.com/gp/customer-reviews/R31Y89ODTLCDCW/ref=cm_cr_getr_d_rvw_ttl?ie=UTF8&ASIN=B0CW96LPQ3,"5.0 "," the United States "," October 27, 2024",Color: BlackSize: Medium,Verified Purchase,"These pants are quite amazing. I have them in black, coffee, and dusty blue. They fit perfectly, lightweight material, very flattering, and quality is great. Colors are also super cute. Perfect for an interview outfit, office/work pant, or if you need a semi-formal pant for an event.",5
Amazon Customer,"Cutest, comfortable pants!",https://www.amazon.com/gp/customer-reviews/R3IL1JM3YYLXCZ/ref=cm_cr_getr_d_rvw_ttl?ie=UTF8&ASIN=B0CW96LPQ3,"5.0 "," the United States "," October 24, 2024",Color: BrownSize: Small,Verified Purchase,These pants are so cute! I weight 130 pounds and 5”3. I ordered a size small and they fit perfectly. Only complaint would be the color. They are definitely orange and not a shade of brown.,10
Lisa B,Pants,https://www.amazon.com/gp/customer-reviews/RDPLIWYGI8DQN/ref=cm_cr_getr_d_rvw_ttl?ie=UTF8&ASIN=B0CW96LPQ3,"5.0 "," the United States "," October 24, 2024",Color: CoffeeSize: Medium,Verified Purchase,"I am 5’11 and I ordered a medium. They are so comfortable and cute. I wear them to work and it looks fabulous. Or out to dinner. I’ve never been a fan of the big leg openings at the bottom, but I love these",
Kindle Customer,Great Pants,https://www.amazon.com/gp/customer-reviews/R118LWKC0PFXHJ/ref=cm_cr_getr_d_rvw_ttl?ie=UTF8&ASIN=B0CW96LPQ3,"5.0 "," the United States "," October 22, 2024",Color: Mocha BrownSize: Medium,Verified Purchase,I love these Pants I purchased them for a recent trip I took and where so versatile. Great quality for the money you pay. True to size,
CS,A Little Long For Petitte Girls.,https://www.amazon.com/gp/customer-reviews/RP1J1KGOCK1V1/ref=cm_cr_getr_d_rvw_ttl?ie=UTF8&ASIN=B0CW96LPQ3,"4.0 "," the United States "," October 21, 2024",Color: Walnut BrownSize: Small,Verified Purchase,Great quality!  It does not Get Five Stars only because the length is not The Best For Short Girls!,
EnavH,LOVE THIS!,https://www.amazon.com/gp/customer-reviews/R12TJ80R7X8O8Z/ref=cm_cr_getr_d_rvw_ttl?ie=UTF8&ASIN=B0CW96LPQ3,"5.0 "," the United States "," October 21, 2024",Color: Mocha BrownSize: Medium,Verified Purchase,"The fabric is smooth and heavy so the pants are falling nicely along the body and doesn't make my skin itch. Top quality, ordered more colors!",
N. Fisher,"Nice slacks, thin material",https://www.amazon.com/gp/customer-reviews/RENZU7G9JSSI3/ref=cm_cr_getr_d_rvw_ttl?ie=UTF8&ASIN=B0CW96LPQ3,"4.0 "," the United States "," October 20, 2024",Color: Light KhakiSize: Large,Verified Purchase,"I like these pants. The style is cute, the size is correct, the length is good. My only gripe is the material is a little thin so it makes me feel like I need shape wear for lumps and bumps. It could also just be the color but I’ll keep them and see if ever there’s a chance to wear them.",5
Christina Gibson,Legs too wide for me,https://www.amazon.com/gp/customer-reviews/R1UG8ZNIFBZSYI/ref=cm_cr_getr_d_rvw_ttl?ie=UTF8&ASIN=B0CW96LPQ3,"1.0 "," the United States "," October 14, 2024",Color: Mocha BrownSize: Large,Verified Purchase,"These are super cute and soft. However, I’m not a fan of the super wide leg pants. I ended up returning them.",
Dayze,10/10,https://www.amazon.com/gp/customer-reviews/R36OH66OH37HDY/ref=cm_cr_getr_d_rvw_ttl?ie=UTF8&ASIN=B0CW96LPQ3,"5.0 "," the United States "," October 11, 2024",Color: BrownSize: X-Large,Verified Purchase,Omg I would literally buy every color !! They are so comfortable and very pretty . I would have went up a size though,
Tony S,Amazing,https://www.amazon.com/gp/customer-reviews/RP387WQ07AUKF/ref=cm_cr_getr_d_rvw_ttl?ie=UTF8&ASIN=B0CW96LPQ3,"5.0 "," the United States "," October 9, 2024",Color: Mocha BrownSize: Large,Verified Purchase,"I am 5.7, 185lb and got large. They fit great. Little loose on hips and perfect length for me. Easy to steam and maintain crease free. I got many compliments at work. Will get another color.",
Stuebz,Cute But Huge,https://www.amazon.com/gp/customer-reviews/R38ROUN553GHTJ/ref=cm_cr_getr_d_rvw_ttl?ie=UTF8&ASIN=B0CW96LPQ3,"4.0 "," the United States "," October 4, 2024",Color: Mocha BrownSize: Small,Verified Purchase,"I love the quality and feel of these pants, but even for trouser pants they're huge. It just looks ridiculously baggy, I look like I'm wearing clown pants. I'm 5'5"" and 130 lbs, lean/athletic, and I bought a Small. If there was an XS available I would get that, but unfortunately S is the smallest.",
Harley,Too small,https://www.amazon.com/gp/customer-reviews/R3RPNTCGIJJGL6/ref=cm_cr_getr_d_rvw_ttl?ie=UTF8&ASIN=B0CW96LPQ3,"2.0 "," the United States "," October 4, 2024",Color: BlackSize: X-Large,Verified Purchase,This is way too small,
Amanda,Quality ok,https://www.amazon.com/gp/customer-reviews/R3OF76CV5MBDT0/ref=cm_cr_getr_d_rvw_ttl?ie=UTF8&ASIN=B0CW96LPQ3,"3.0 "," the United States "," October 2, 2024",Color: Mocha BrownSize: Small,Verified Purchase,I have some great pieces from the Lillusory brand and so had high expectations on these trousers.  When I tried them on I didn't care for the fit or the fabric quality for the price so I ended up returning them.,
Shannan Robillard,Nothing but sophistication and style,https://www.amazon.com/gp/customer-reviews/R3AVIH29W7APIQ/ref=cm_cr_getr_d_rvw_ttl?ie=UTF8&ASIN=B0CW96LPQ3,"5.0 "," the United States "," October 1, 2024",Color: Off-whiteSize: Large,Verified Purchase,I get soo many compliments when I wear these pants. I match them with a black top and black flats and always get great compliments. They are comfortable and the casual with a level of sophistication that soo worth the value! I bought a large and they are true to size. Love these and need more colors.,
Tracy Graeber,Perfect Black Dress Pant,https://www.amazon.com/gp/customer-reviews/R3R7NYRV7SX5QJ/ref=cm_cr_getr_d_rvw_ttl?ie=UTF8&ASIN=B0CW96LPQ3,"5.0 "," the United States "," October 1, 2024",Color: BlackSize: Small,Verified Purchase,"Look no further.. these paperbag pants are ANAZING! They are so comfortable , can be worn with a variety of top & shoes & the belt can also be styled several ways. These are a great addition to any wardrobe. Can be dressed up or down!! Don’t pass on these! Size is spot on!",2
Jackie,Gorgeous but beware of quality control issue,https://www.amazon.com/gp/customer-reviews/R8THQEH08VGAZ/ref=cm_cr_getr_d_rvw_ttl?ie=UTF8&ASIN=B0CW96LPQ3,"5.0 "," the United States "," September 28, 2024",Color: Off-whiteSize: Medium,Verified Purchase,"I ordered the white pair. They fit like a dream, so flattering & comfortable, received compliments all day at work. I ordered same size in black & they were way too short! Had to return. So bummed.",11
MarlonMedia,Love them.,https://www.amazon.com/gp/customer-reviews/R3OAPXYGA05F0M/ref=cm_cr_getr_d_rvw_ttl?ie=UTF8&ASIN=B0CW96LPQ3,"5.0 "," the United States "," September 28, 2024",Color: Mocha BrownSize: Small,Verified Purchase,Good quality and cute! They don’t fit me perfectly because I wear a size zero. But it’s manageable with the belt!,
CJD,Pilled after 1 wear,https://www.amazon.com/gp/customer-reviews/R3KRKDPRZEG9CW/ref=cm_cr_getr_d_rvw_ttl?ie=UTF8&ASIN=B0CW96LPQ3,"1.0 "," the United States "," September 28, 2024",Color: Light KhakiSize: Large,Verified Purchase,Looked very nice but noticed they pilled after 1 wear. This was on my back area where my purse might have been hanging. That’s all I can think.,7
Renée,Actually Nice,https://www.amazon.com/gp/customer-reviews/R2OYO17P3GWMZG/ref=cm_cr_getr_d_rvw_ttl?ie=UTF8&ASIN=B0CW96LPQ3,"5.0 "," the United States "," September 21, 2024",Color: BlackSize: Small,Verified Purchase,"Sometimes ya never know what you're gonna get, but these pants are actually very nice for warm days or cool evenings. Because the material being lightweight polyester, which I call rayon, they're gonna be wrinkly when you get them and you will have to steam them after washing. I did wash them in warm water and put them in a warm dryer, took them out while they were damp, but no matter how you wash them, steam them. They have a zipper, button and belt. Other than that, I'm 5' 1"" 136 lbs, bought a small and they fit very nice with the length long enough to wear a short heel without them dragging on the ground. They hide the belly bulge so you can wear a top tucked in. They're very flattering pants. I'm wearing them with a tuxedo shirt and bow tie.",3
Wanda C.,They were to small in the waist,https://www.amazon.com/gp/customer-reviews/RBGB7YFZ76TPE/ref=cm_cr_getr_d_rvw_ttl?ie=UTF8&ASIN=B0CW96LPQ3,"3.0 "," the United States "," September 13, 2024",Color: RedSize: X-Large,Verified Purchase,"Why would you put  my refund into a amazon account,I didn't pay with no amazon account",
amber earl,Cute and comfortable,https://www.amazon.com/gp/customer-reviews/R3L9RPQEVLM0Y1/ref=cm_cr_getr_d_rvw_ttl?ie=UTF8&ASIN=B0CW96LPQ3,"5.0 "," the United States "," September 12, 2024",Color: Mocha BrownSize: Small,Verified Purchase,These are fantastic for work. They look great and are super comfortable,
shopaholic,Super comfortable,https://www.amazon.com/gp/customer-reviews/R1YADX23VR5Q8P/ref=cm_cr_getr_d_rvw_ttl?ie=UTF8&ASIN=B0CW96LPQ3,"5.0 "," the United States "," September 7, 2024",Color: Hot PinkSize: Large,Verified Purchase,I love these pants. I’m 5’8” 170pounds and the large fit perfect. The material is a little heavier than I expected but the fit and length is perfect,
Kristopher,Great fit,https://www.amazon.com/gp/customer-reviews/R3EYJTQ4IDKS3O/ref=cm_cr_getr_d_rvw_ttl?ie=UTF8&ASIN=B0CW96LPQ3,"5.0 "," the United States "," September 6, 2024",Color: Mocha BrownSize: Small,Verified Purchase,Love how flattering it is,
Savvy Shopper,Lovely,https://www.amazon.com/gp/customer-reviews/R122Y9J8BT9FSF/ref=cm_cr_getr_d_rvw_ttl?ie=UTF8&ASIN=B0CW96LPQ3,"5.0 "," the United States "," September 1, 2024",Color: Light KhakiSize: Medium,,Perfect pair of work pants.  The style and fit of these casual pants gives it a 5-star review.  Quality material and comfortable.  I like the front tie which gives it a finished look when I tuck in my dress shirt.  Don't need a belt with this feature.  Loose fitting helps keep you cool when going outside the hot sun at lunch.  Overall I like wearing this to work or just out and about.,
J.M,Perfect,https://www.amazon.com/gp/customer-reviews/R1XK5JDZH7MOD8/ref=cm_cr_getr_d_rvw_ttl?ie=UTF8&ASIN=B0CW96LPQ3,"5.0 "," the United States "," September 1, 2024",Color: Navy BlueSize: Medium,Verified Purchase,Perfect to dress up or be casual.,
Burrells,Work attire perfected,https://www.amazon.com/gp/customer-reviews/R3QB7CJHCMO9UV/ref=cm_cr_getr_d_rvw_ttl?ie=UTF8&ASIN=B0CW96LPQ3,"5.0 "," the United States "," August 31, 2024",Color: Light KhakiSize: Small,Verified Purchase,"Love the fit and material. Bought for work, business attire and have found myself wearing these all the time due to comfort and fit. The fullness of the pant is trendy and paired with a form fitted top it trims down the appearance of my waistline. I have had so many compliments on these. I am 5’5 and 120lbs and got a small. I feel they are true to size",
Baksad30,Love them!,https://www.amazon.com/gp/customer-reviews/R37KB55B0MKGDI/ref=cm_cr_getr_d_rvw_ttl?ie=UTF8&ASIN=B0CW96LPQ3,"5.0 "," the United States "," August 29, 2024",Color: BlackSize: X-Large,Verified Purchase,"Initially, when I felt these pants, I wasn't sure if I would keep them or not. They kinda remind me of a thin canvas type material. However, I absolutely LOVE them!! They feel so amazing on and are super flattering to a curvy girl! (For reference, I'm 5'3"" and 190 pounds. I bought an XL) I love them so much, I ordered 2 more pairs and will probably end up owning one in each color!!",
Sandra Fellman,Good,https://www.amazon.com/gp/customer-reviews/RJYD54LLJ9G0K/ref=cm_cr_getr_d_rvw_ttl?ie=UTF8&ASIN=B0CW96LPQ3,"4.0 "," the United States "," August 28, 2024",Color: CoffeeSize: Large,Verified Purchase,Very wide legs,
Kate,Just not for me,https://www.amazon.com/gp/customer-reviews/R2HA43O1J0F1ON/ref=cm_cr_getr_d_rvw_ttl?ie=UTF8&ASIN=B0CW96LPQ3,"3.0 "," the United States "," August 28, 2024",Color: Light KhakiSize: Large,Verified Purchase,"These look so good on some people - but I don’t think I have the right body shape. I am pear shaped with big hips and thighs and these pants just didn’t do much for me. They also made my butt look very long and flat so I ended up returning. The material was a very nice, thin, breathable fabric which would be great in summer. The belt and pleats at the top were ehh - again likely just didn’t fit my body shape well.",
DL,Great business casual pants,https://www.amazon.com/gp/customer-reviews/R1HQMP8FFY60T4/ref=cm_cr_getr_d_rvw_ttl?ie=UTF8&ASIN=B0CW96LPQ3,"5.0 "," the United States "," August 24, 2024",Color: Mocha BrownSize: X-Large,Verified Purchase,"I got these pants for a work event and the material, flexibility of the elastic, and the cute tie on the front makes it look very elegant.",
