Erica Labean,Does NOT look like the picture,https://www.amazon.com/gp/customer-reviews/R3U1D8NP3LBS2X/ref=cm_cr_getr_d_rvw_ttl?ie=UTF8&ASIN=B0CW96LPQ3,"1.0 "," the United States "," August 18, 2024",Color: BlackSize: Medium,Verified Purchase,"This product is cheap, the material almost looks like a trash bag material and fits extremely baggy. The fabric is awful and would not look like a classy piece to have for work",
Amazon Customer,Love them,https://www.amazon.com/gp/customer-reviews/R2SPTQROA5T75J/ref=cm_cr_getr_d_rvw_ttl?ie=UTF8&ASIN=B0CW96LPQ3,"5.0 "," the United States "," August 17, 2024",Color: Light KhakiSize: Small,Verified Purchase,Great fit and comfy,
Heather,Not true to size,https://www.amazon.com/gp/customer-reviews/R29UT1G5740MCF/ref=cm_cr_getr_d_rvw_ttl?ie=UTF8&ASIN=B0CW96LPQ3,"2.0 "," the United States "," August 16, 2024",Color: Dusty BlueSize: Medium,Verified Purchase,I normally wear a medium and would have needed a large in these pants.,
Kendra Miller Johnson,Way too small,https://www.amazon.com/gp/customer-reviews/R16WJJ0BIKNT1G/ref=cm_cr_getr_d_rvw_ttl?ie=UTF8&ASIN=B0CW96LPQ3,"2.0 "," the United States "," August 16, 2024",Color: Dusty BlueSize: Large,Verified Purchase,"I bought large and though sometimes I size up to XL for a looser fit, these didn’t come close to being the right size. The large size was so tight in the waist, I doubt I’ll try to size up.  The quality seemed really great and I love the style. Super disappointed.",
Miss K,"Wrong Size, fits more like hip huggers",https://www.amazon.com/gp/customer-reviews/R1FRBIL7VB75YF/ref=cm_cr_getr_d_rvw_ttl?ie=UTF8&ASIN=B0CW96LPQ3,"3.0 "," the United States "," August 7, 2024",Color: BlackSize: Large,Verified Purchase,"Sent a Large. Needed the XL. These pants are not long enough in the crotch. They sit on the hips below the belly button. When pulled up to wear they are advertised, it gives extreme wedge. Gave a 3 at least because they are a good material. Will be returning.",
Shena C.,Fits great!,https://www.amazon.com/gp/customer-reviews/RTPY7ZWOV4PPR/ref=cm_cr_getr_d_rvw_ttl?ie=UTF8&ASIN=B0CW96LPQ3,"5.0 "," the United States "," August 7, 2024",Color: Light KhakiSize: Small,Verified Purchase,Beautiful and as pictured. Flowy and fit me well.,
K. Oleander,Sizing is off!,https://www.amazon.com/gp/customer-reviews/R2TH853YBJPXR1/ref=cm_cr_getr_d_rvw_ttl?ie=UTF8&ASIN=B0CW96LPQ3,"2.0 "," the United States "," August 5, 2024",Color: Mocha BrownSize: X-Large,Verified Purchase,"I have to admit I am a little jealous of all the reviews stating these are too long, fit great and need to size down--That is not my experience! I am 5-11 (yes, I knew they were going to be too short, but two previous pairs of pants from this brand are just long enough for flats). I wonder if the mocha brown color might have a different sizing than other colors because, there is no way the XL is true to size! It was at least two sizes too small in the waist and hips, especially for having elastic! The measurement for waist size must have been taken with the elastic stretched to maximum. Or maybe mine is mislabeled? Even the length is shorter than it is supposed to be. I might try again and see what happens in another color and the same color.",4
Matt M.,Wasn't Impressed and retuned,https://www.amazon.com/gp/customer-reviews/R3JAQ49XTHSPR1/ref=cm_cr_getr_d_rvw_ttl?ie=UTF8&ASIN=B0CW96LPQ3,"3.0 "," the United States "," August 4, 2024",Color: Off-whiteSize: Small,Verified Purchase,"I wasn't super impressed with these as they were see through! I wanted to like them as they fit well and looked so cute, but I wouldn't be able to wear them to work which is a bummer.",
Janie Slayden,"I liked the color of the slacks but was too long, will return. please send a return label",https://www.amazon.com/gp/customer-reviews/R1HE3FDAP6DY6Q/ref=cm_cr_getr_d_rvw_ttl?ie=UTF8&ASIN=B0CW96LPQ3,"3.0 "," the United States "," July 30, 2024",Color: BrownSize: Medium,Verified Purchase,Pants too long and elastic in back was very tight.,
Patrice M.,Stylish,https://www.amazon.com/gp/customer-reviews/R2W3GALEZ6OI8M/ref=cm_cr_getr_d_rvw_ttl?ie=UTF8&ASIN=B0CW96LPQ3,"4.0 "," the United States "," July 28, 2024",Color: BlackSize: X-Large,Verified Purchase,Stylish business casual pants. Fits true to size.,
Katelyn Johnson,Nice dress pants,https://www.amazon.com/gp/customer-reviews/R19EPQBW23RHCX/ref=cm_cr_getr_d_rvw_ttl?ie=UTF8&ASIN=B0CW96LPQ3,"5.0 "," the United States "," July 26, 2024",Color: Off-whiteSize: Medium,Verified Purchase,These pants are heavy but very cute with a black tank top - I bought them in white.,
Courtney Richards | Finds For Families,Runs very long - not great fabric.,https://www.amazon.com/gp/customer-reviews/R3PRCQIRA4OMOL/ref=cm_cr_getr_d_rvw_ttl?ie=UTF8&ASIN=B0CW96LPQ3,"2.0 "," the United States "," July 23, 2024",Color: Navy BlueSize: X-Large,Verified Purchase,Unfortunately these did not work out for me. The sizing is a little weird. They fit my waist but were so long I could never have worn a heel high enough to fit them. I was also not thrilled with the fake feeling fabric. The style overall is cute for work but just not for me.,
kat1585,Comfortable Fit,https://www.amazon.com/gp/customer-reviews/RMYTYMFQ1WFI4/ref=cm_cr_getr_d_rvw_ttl?ie=UTF8&ASIN=B0CW96LPQ3,"5.0 "," the United States "," July 22, 2024",Color: BlackSize: Large,Verified Purchase,"These are my new favorite work pants, love how they look and feel. They are so comfortable and light for summer wear.",
Cecilia,Size is true,https://www.amazon.com/gp/customer-reviews/R3F489JZMWILGS/ref=cm_cr_getr_d_rvw_ttl?ie=UTF8&ASIN=B0CW96LPQ3,"5.0 "," the United States "," July 19, 2024",Color: Mocha BrownSize: X-Large,Verified Purchase,Nic pants for office wear.  Would buy again.,
Kendall Corcoran,LOVE,https://www.amazon.com/gp/customer-reviews/R27A2DBCBAIWEN/ref=cm_cr_getr_d_rvw_ttl?ie=UTF8&ASIN=B0CW96LPQ3,"5.0 "," the United States "," July 18, 2024",Color: Light KhakiSize: Large,Verified Purchase,"I’m a teacher and got these to wear in the classroom. They are SO SOFT! I got a large and they fit great, super comfy. Can’t wait to wear these!",
Patricia Ormsby-Haase,Pink Pant,https://www.amazon.com/gp/customer-reviews/R1703DBGVVILS5/ref=cm_cr_getr_d_rvw_ttl?ie=UTF8&ASIN=B0CW96LPQ3,"5.0 "," the United States "," July 17, 2024",Color: Hot PinkSize: Medium,Verified Purchase,I love the quality of the material. The shade of the pink is also exactly what I saw online. It fits perfectly. I have absolutely no regrets buying it. I will be getting a few more colors when I have the money. Love the style.,
Amazon Customer,Buen material!,https://www.amazon.com/gp/customer-reviews/R1S1P7ANVWQ7LP/ref=cm_cr_getr_d_rvw_ttl?ie=UTF8&ASIN=B0CW96LPQ3,"4.0 "," the United States "," July 15, 2024",Color: Light KhakiSize: Medium,Verified Purchase,"Me quedó muy bien, Soy Medium. El único problema es que me quedó largo de pierna, tengo que cortar y cojerle ruedo.",
Brittany Hedgepeth,Just as expected.,https://www.amazon.com/gp/customer-reviews/R1J639PWA2TS68/ref=cm_cr_getr_d_rvw_ttl?ie=UTF8&ASIN=B0CW96LPQ3,"5.0 "," the United States "," July 14, 2024",Color: BrownSize: Medium,Verified Purchase,These are the best casual pants for work.,
Sara Hair,Love!!,https://www.amazon.com/gp/customer-reviews/R3KG15WHFW5UOB/ref=cm_cr_getr_d_rvw_ttl?ie=UTF8&ASIN=B0CW96LPQ3,"5.0 "," the United States "," July 13, 2024",Color: BlackSize: Large,Verified Purchase,So comfy and perfect for a business casual outfit. You may need to size down depending on your body type though! I am a large in most pants/leggings/shorts etc but these pants were a bit too big on me in the large size. Still so comfy and so cute so I made it work because I didn’t have time to return and get a smaller size :),
Mr. Flaps,Too long for shorter people,https://www.amazon.com/gp/customer-reviews/RRNO06C0YU4FA/ref=cm_cr_getr_d_rvw_ttl?ie=UTF8&ASIN=B0CW96LPQ3,"2.0 "," the United States "," July 12, 2024",Color: BlackSize: Medium,Verified Purchase,I am 5'1 and these pants were way too long. The material is nice even thought the pants are not lined. I wish they had an option for shorter people.,
Karissa,I see London…I see France,https://www.amazon.com/gp/customer-reviews/R102X5A5WR9W7Z/ref=cm_cr_getr_d_rvw_ttl?ie=UTF8&ASIN=B0CW96LPQ3,"3.0 "," the United States "," July 9, 2024",Color: Off-whiteSize: Small,Verified Purchase,"I loved the style, fit, color, and comfort of these pants. However, the white color is see through, so I had to return them.",
Jessica,Perfect for us shorter people.,https://www.amazon.com/gp/customer-reviews/R2V6KJQ92UPNMT/ref=cm_cr_getr_d_rvw_ttl?ie=UTF8&ASIN=B0CW96LPQ3,"3.0 "," the United States "," July 7, 2024",Color: Light KhakiSize: Medium,Verified Purchase,"Finally a pair of pants that I don’t have to have altered because they are to long. I am 5’1 and they come right to my heel without any type of heels on. They are super comfy, I love the concealed pocket on the side of the pants, they are light weight which is perfect for summer. They can be dressed up or dressed down. They are not see thru- I purchased in beige color. I will definitely order more in the future. I ordered a medium which fits but, I could have ordered a large to give myself a little more room.",8
D K.,Cuts into hips,https://www.amazon.com/gp/customer-reviews/RPDGDB4WFS8MU/ref=cm_cr_getr_d_rvw_ttl?ie=UTF8&ASIN=B0CW96LPQ3,"3.0 "," the United States "," July 6, 2024",Color: Hot PinkSize: Small,Verified Purchase,Quality and color of these are wonderful. Good length for feels or flats. Top of the pant does not have much elasticity and cuts into hip.,
Angela Davis,Get these,https://www.amazon.com/gp/customer-reviews/R4GS1U93DHAE9/ref=cm_cr_getr_d_rvw_ttl?ie=UTF8&ASIN=B0CW96LPQ3,"5.0 "," the United States "," July 6, 2024",Color: Walnut BrownSize: Small,Verified Purchase,"I live in warm weather, so the fabric is great. It doesn’t wrinkle through the day. Washed just fine. They are beautiful on. I am 5’2”, 130 and I got a size small. Perfect length and waist.",
Jorden Rasmussen,Buy them!,https://www.amazon.com/gp/customer-reviews/R1G0YV5P6X502J/ref=cm_cr_getr_d_rvw_ttl?ie=UTF8&ASIN=B0CW96LPQ3,"5.0 "," the United States "," July 3, 2024",Color: BlackSize: Small,Verified Purchase,"These pants are amazing. They have the button in the front, but also a piece of elastic band in the back. Super comfortable, don't cut in, and look nice with the bow detail. For reference, I'm 5'1"" and 120lbs and the small fits perfectly",
Sully2222,Size down!,https://www.amazon.com/gp/customer-reviews/R3R4V8NSASA59L/ref=cm_cr_getr_d_rvw_ttl?ie=UTF8&ASIN=B0CW96LPQ3,"4.0 "," the United States "," July 3, 2024",Color: Walnut BrownSize: Large,Verified Purchase,I ordered a large based off the sizing chart and reviews I read and these are really big and very unflattering in the booty area. I usually wear an 8-10 and am definitely hippy but have a flat stomach. Waist is about 30. Will try a medium and see if they’re more flattering. Wrinkle easy but fabric feels nice and breathable for the office.,5
Sara E. Skees,Very pretty,https://www.amazon.com/gp/customer-reviews/R1SGIA6ID73QV9/ref=cm_cr_getr_d_rvw_ttl?ie=UTF8&ASIN=B0CW96LPQ3,"4.0 "," the United States "," July 2, 2024",Color: Navy BlueSize: X-Large,Verified Purchase,Wish the waist gave a little more,
Anjelica Molina,Comfortable,https://www.amazon.com/gp/customer-reviews/R3F311E7DRLW3C/ref=cm_cr_getr_d_rvw_ttl?ie=UTF8&ASIN=B0CW96LPQ3,"4.0 "," the United States "," July 1, 2024",Color: Charcoal GreySize: Small,Verified Purchase,Unfortunately my build isn’t the most flattering but for those more petite gals these dress slacks fit comfortably not too baggy. Im on the shorter side and wore 4 inch wedges so the pants wouldn’t drag. Most favorite part was the pockets. The fabrics wrinkles a tad. The color was exactly what I was looking for. The fabric wasn’t too heavy and was very breathable.,9
Stephanie,Great value for the price,https://www.amazon.com/gp/customer-reviews/R29VMOZ86LA6PU/ref=cm_cr_getr_d_rvw_ttl?ie=UTF8&ASIN=B0CW96LPQ3,"5.0 "," the United States "," June 27, 2024",Color: BlackSize: Medium,Verified Purchase,"I was a little skeptical, as I'm over 5'9"" and finding something 'high waisted' thats the right fit is occasionally a difficult journey. Needed new pants for a last minute trip with work, and took a shot in the dark with these. Super comfortable and very flattering, got multiple compliments. Will be buying more, as they are pretty much my new favorite work pant.",2
Ms. Shopsalot,From Day to Night!,https://www.amazon.com/gp/customer-reviews/RP25BEW6SHN5V/ref=cm_cr_getr_d_rvw_ttl?ie=UTF8&ASIN=B0CW96LPQ3,"5.0 "," the United States "," June 27, 2024",Color: Charcoal GreySize: Medium,,"These pants are soooo comfortable! They are lightweight, but I only gave four stars because they have some sturdiness/weight to them in a good way. They are not see-through or flimsy. They are well stitched and have a cute sash tie in the front of them (or side or back if you choose) so you can tuck in a shirt/bodysuit/blouse or wear with a cropped top that sits just at the waist-line and still be suitable for work! I actually got these after ordering another pair just like them in a khaki/olive green. They are nice enough to wear to work all day and then out for the evening. Also easily made more casual with tennis shoes/sandals and a tank top or t-shirt. Easy to wash in cold water and hang dry or tumble dry on gentle. If you iron them, do so inside out and on low to avoid marking material.",
Angorelli,Great black pants,https://www.amazon.com/gp/customer-reviews/R1ULDBVBJBHWFH/ref=cm_cr_getr_d_rvw_ttl?ie=UTF8&ASIN=B0CW96LPQ3,"5.0 "," the United States "," June 27, 2024",Color: BlackSize: X-Large,Verified Purchase,"These black pants are very comfortable, and I love that the bow kind of conceals My tummy. I think they’re very versatile. I wore this outfit to work, but I also think this summer I compare it with a tank top for more casual look.",2
Amazon Customer,Stylish,https://www.amazon.com/gp/customer-reviews/R2NGH13YNSFDZK/ref=cm_cr_getr_d_rvw_ttl?ie=UTF8&ASIN=B0CW96LPQ3,"5.0 "," the United States "," June 24, 2024",Color: Off-whiteSize: Large,Verified Purchase,Stylish and good fit,
EK,Absolutely amazing,https://www.amazon.com/gp/customer-reviews/R1R3CRDIP64BOZ/ref=cm_cr_getr_d_rvw_ttl?ie=UTF8&ASIN=B0CW96LPQ3,"5.0 "," the United States "," June 23, 2024",Color: Light KhakiSize: Large,Verified Purchase,I purchased one pair and 3 days later ordered another one in different color. I was pleasantly surprised with look and feel. This material is lightweight and quality is amazing.,
Abbey,Very Long,https://www.amazon.com/gp/customer-reviews/R16Y0YTJ7EPUBO/ref=cm_cr_getr_d_rvw_ttl?ie=UTF8&ASIN=B0CW96LPQ3,"3.0 "," the United States "," June 20, 2024",Color: Mocha BrownSize: X-Large,,"These are for giants.  Kidding, but I'm 5'4"" and I would have to cut off a foot to make these work.  If you have a kangaroo pouch it's a little much but that's okay I'm used to it.",
Rachael Robinson,Run very small,https://www.amazon.com/gp/customer-reviews/R3QLJGV90TOAKB/ref=cm_cr_getr_d_rvw_ttl?ie=UTF8&ASIN=B0CW96LPQ3,"3.0 "," the United States "," June 16, 2024",Color: Mocha BrownSize: X-Large,Verified Purchase,"Although these look ""relaxed"" fit, they are cut trim through the hips & thighs. If you have any shape go up at least 2 sizes.",3
NCGal83,Not for petite ladies,https://www.amazon.com/gp/customer-reviews/R3K9V4XCM2JPX2/ref=cm_cr_getr_d_rvw_ttl?ie=UTF8&ASIN=B0CW96LPQ3,"4.0 "," the United States "," June 15, 2024",Color: Mocha BrownSize: Large,,These pants aren’t bad overall. The color is great. The fit is great. They look good on. They just drag on the floor because I’m short. I don’t wear them often because of how long they are and I haven’t taken them to get hemmed. They are comfortable and it reminds me of wearing pajamas but looks professional. If you aren’t short I would recommend these pants.,
