评论用户,评论概述,评论链接,星级评分,评论地点,评论时间,类型,是否购买,评论详情,觉得该评论有帮助的人数
Diane,Not flattering for me,https://www.amazon.com/gp/customer-reviews/R2G29MFMTYVDZE/ref=cm_cr_getr_d_rvw_ttl?ie=UTF8&ASIN=B0CFZW6BNZ,"3.0 "," the United States "," January 18, 2025",Size: LargeColor: Dark Green,Verified Purchase,"Pretty dress, beautiful green. Velvet makes it a bit heavy. I wanted to love it, but the dress was not flattering for my body type.",
S. Evans,Not as pictured,https://www.amazon.com/gp/customer-reviews/R13KK017T8G6M5/ref=cm_cr_getr_d_rvw_ttl?ie=UTF8&ASIN=B0CFZW6BNZ,"1.0 "," the United States "," January 14, 2025",Size: XX-LargeColor: Dark Red,,"It said this was a dark red dress, and every picture shows that it is, but what I received is bright red and looks incredibly cheap. It looks like a cheap stuffed animal that you would win at a carnival and not at all like an elegant dress. I’m not sure how other people got something that looks like the picture, but this is garbage. The color looks like a cheap Santa costume.",
Lisa Plevin,perfect for winter wedding,https://www.amazon.com/gp/customer-reviews/R2UT9UR5NXEJVL/ref=cm_cr_getr_d_rvw_ttl?ie=UTF8&ASIN=B0CFZW6BNZ,"5.0 "," the United States "," January 9, 2025",Size: X-LargeColor: Dark Red,Verified Purchase,"needed a dress suitable for a winter wedding.  this dress fit well, was comfortable, decent quality and actually looked brand new after a wash on the delicate cycle.",
Christina Arguello,Very flattering,https://www.amazon.com/gp/customer-reviews/R2Q6ASMGNEIPPR/ref=cm_cr_getr_d_rvw_ttl?ie=UTF8&ASIN=B0CFZW6BNZ,"5.0 "," the United States "," January 5, 2025",,Verified Purchase,"I’m 5’3 and curvy. This fits so flattering, love the velvet navy color and material. I’ll be wearing it without the belt. Since I’m so short, the size large is hitting below my knee, but still good for a winter cruise",
Amazon Customer,Covered in someone else's hair - disgusting!,https://www.amazon.com/gp/customer-reviews/R1EPGV7BNP4ODH/ref=cm_cr_getr_d_rvw_ttl?ie=UTF8&ASIN=B0CFZW6BNZ,"1.0 "," the United States "," December 31, 2024",Size: LargeColor: Dark Green,Verified Purchase,"The dress itself looked nice, but the dress and attachable belt were COVERED in someone else's short, blonde hair. It literally looked like someone trimmed their hair and threw the dress on top of the cuttings. So gross.",
Kiwigirl,Nice soft fabric and attractive styling,https://www.amazon.com/gp/customer-reviews/R23YHGW2Z3TWXR/ref=cm_cr_getr_d_rvw_ttl?ie=UTF8&ASIN=B0CFZW6BNZ,"5.0 "," the United States "," December 31, 2024",Size: SmallColor: Burgundy,Verified Purchase,I bought this for a Christmas party. I got a size small and it seemed like it was going to fit too small but once zipped it fit fine and it was very attractive. Dressy yet comfortable. The color was beautiful. I highly recommend it.,
Mary,Really pretty color but it ran large,https://www.amazon.com/gp/customer-reviews/RV4CSI2KKTR5Y/ref=cm_cr_getr_d_rvw_ttl?ie=UTF8&ASIN=B0CFZW6BNZ,"3.0 "," the United States "," December 30, 2024",Size: SmallColor: Turquoise,Verified Purchase,"I loved the color of the dress, but it was way too big. I ordered a small but it fit more like a medium.  I also think I received a used dress because it smelled like body odor. If it was new and clean I probably would’ve gotten it tailored so I could wear it, but I was so turned off by the smell that I had to return it.",
Kari,Flattering and comfortable,https://www.amazon.com/gp/customer-reviews/R1HALNCAS0Y1KY/ref=cm_cr_getr_d_rvw_ttl?ie=UTF8&ASIN=B0CFZW6BNZ,"5.0 "," the United States "," December 29, 2024",Size: LargeColor: Burgundy,Verified Purchase,"The fabric is very soft and comfortable, with just a bit of stretch so it’s easy to move in. The color is very rich.",
karyn,Dress,https://www.amazon.com/gp/customer-reviews/R1QR8O4O5VYP3A/ref=cm_cr_getr_d_rvw_ttl?ie=UTF8&ASIN=B0CFZW6BNZ,"5.0 "," the United States "," December 28, 2024",Size: LargeColor: Dark Green,Verified Purchase,"I wore this dress for our Christmas pictures, it’s light and well made, soft.",
Stokes Family,Perfect winter dress,https://www.amazon.com/gp/customer-reviews/R7DHZQ4ULMDX3/ref=cm_cr_getr_d_rvw_ttl?ie=UTF8&ASIN=B0CFZW6BNZ,"5.0 "," the United States "," December 26, 2024",Size: SmallColor: Black,Verified Purchase,This fit true to size and perfect for a December wedding,
Ana S.,Perfect Dress!!!,https://www.amazon.com/gp/customer-reviews/R15C42HFGRV5CO/ref=cm_cr_getr_d_rvw_ttl?ie=UTF8&ASIN=B0CFZW6BNZ,"5.0 "," the United States "," December 26, 2024",Size: LargeColor: Dark Green,Verified Purchase,Loved the dress! The color was beautiful! I’m 5ft 160 lbs and ordered a large! I wore heels and it feel well!,
C. Ford,Beautiful,https://www.amazon.com/gp/customer-reviews/R19B4GP4IEBKX0/ref=cm_cr_getr_d_rvw_ttl?ie=UTF8&ASIN=B0CFZW6BNZ,"5.0 "," the United States "," December 22, 2024",Size: X-LargeColor: Turquoise,Verified Purchase,"This dress was all about the rich color. Easy to wear, very stretchy and forgiving. Facing in front top however left a line on chest but it didn't seem as noticeable in person. No special undies or smoothers worn in these photos. True to size",
Ohsnaps,Perfect dress for the holidays!,https://www.amazon.com/gp/customer-reviews/RLFFDP1Z0HACY/ref=cm_cr_getr_d_rvw_ttl?ie=UTF8&ASIN=B0CFZW6BNZ,"5.0 "," the United States "," December 17, 2024",Size: MediumColor: Burgundy,Verified Purchase,"Prefect color for our holiday cards, the color was exactly as the photos on the listing. The fit was also true to size, I had to size up 2 sizes because of my chest, and it fit perfectly. I just cinched in the waist with the included velvet rope/belt. Also surprised by the fabric quality, thicker velvet and not cheap feeling at all",2
Amazon customer,Not the best material.  Thin feeling,https://www.amazon.com/gp/customer-reviews/R2Q6O8L782G36S/ref=cm_cr_getr_d_rvw_ttl?ie=UTF8&ASIN=B0CFZW6BNZ,"2.0 "," the United States "," December 16, 2024",Size: MediumColor: Dark Red,Verified Purchase,"Not the dress for me, material was not flattering and felt thin.  Color was nice tho.",
Kindle Customer,Loved the hue!,https://www.amazon.com/gp/customer-reviews/R32G8V808GR148/ref=cm_cr_getr_d_rvw_ttl?ie=UTF8&ASIN=B0CFZW6BNZ,"5.0 "," the United States "," December 12, 2024",Size: XX-LargeColor: Dark Red,Verified Purchase,"This was a great value for the money! Soft, stretchy material and a great color for our Christmas  pictures.",
AAs,Not flattering & no bow,https://www.amazon.com/gp/customer-reviews/R1P0KJLBFV181O/ref=cm_cr_getr_d_rvw_ttl?ie=UTF8&ASIN=B0CFZW6BNZ,"3.0 "," the United States "," December 9, 2024",Size: SmallColor: Turquoise,Verified Purchase,"The cute at the chest is odd and was not symmetrical. Additionally, the dress did not have the bow featured in the product image. Color was beautiful but not worth the price tag.",
EmeaTon,"Beautiful dress, didn't fit right",https://www.amazon.com/gp/customer-reviews/R2FR1RNADEAVIP/ref=cm_cr_getr_d_rvw_ttl?ie=UTF8&ASIN=B0CFZW6BNZ,"4.0 "," the United States "," December 5, 2024",Size: XX-LargeColor: Burgundy,Verified Purchase,The color was just as in the website picture.  Good quality for the price. Usually A-line dresses fit me really well.  Unfortunately the fabric gave more of a bodycon fit and stuck to my backside curves (I was trying to avoid that). I think if the fabric was heavier it might have hung better on me. But beautiful rich Burgundy color.,
Kindle Customer,Much better than expected.,https://www.amazon.com/gp/customer-reviews/RRVZLLP4EAVIH/ref=cm_cr_getr_d_rvw_ttl?ie=UTF8&ASIN=B0CFZW6BNZ,"5.0 "," the United States "," December 3, 2024",Size: XX-LargeColor: Burgundy,Verified Purchase,"The size and fit are excellent! The velvet is quite stretchy so the bodice flatters while the full skirt flows beautifully.  I paired the dress with a gold and burgundy pashmina and got so many compliments.  The only con was that I wasn't really sure what to do with the bow/belt. I am plus size so this might not be an issue for a more slender build. It is sewn on and for my size it isn't long enough to be a belt, but it's a bit long and narrow to tie to the side. It wasn't bad enough to mitigate my delight, but I would've liked it to be a little longer and thicker.",
Melissa McCrosky,Perfect holiday dress,https://www.amazon.com/gp/customer-reviews/RYTN8G6TKUORJ/ref=cm_cr_getr_d_rvw_ttl?ie=UTF8&ASIN=B0CFZW6BNZ,"5.0 "," the United States "," November 28, 2024",Size: SmallColor: Burgundy,Verified Purchase,Fit beautifully! Very forgiving. Great purchase!!,
Leigh W,Fantastic dress for curves.,https://www.amazon.com/gp/customer-reviews/RZC9V30H0FFAM/ref=cm_cr_getr_d_rvw_ttl?ie=UTF8&ASIN=B0CFZW6BNZ,"5.0 "," the United States "," November 24, 2024",Size: XX-LargeColor: Burgundy,Verified Purchase,Bought this dress did a late Nov. wedding. It was perfect. Comfortable and lots of stretch. Waist really accentuates my figure. This will also be a great dress for holiday parties. I received a lot of complements. I’m 5’10 and 260lbs wearing a 2XL,9
Jeannette Shields,Velvet dress,https://www.amazon.com/gp/customer-reviews/R1XSJT6L2WD484/ref=cm_cr_getr_d_rvw_ttl?ie=UTF8&ASIN=B0CFZW6BNZ,"5.0 "," the United States "," November 17, 2024",Size: MediumColor: Dark Red,Verified Purchase,"Beautiful dress. Great fit and length. I’m looking forward to wearing this to my niece’s wedding next month, but I can also wear it “anywhere “ after that. I appreciate the great quality in all of the clothes I buy from Amazon; not one has been wrinkled or dirty or missing buttons, etc. Thank you to the packing department, they do a very nice job!",
Chontay Pershing,A line figure,https://www.amazon.com/gp/customer-reviews/R2QK677LVZ8CXM/ref=cm_cr_getr_d_rvw_ttl?ie=UTF8&ASIN=B0CFZW6BNZ,"5.0 "," the United States "," November 11, 2024",Size: XX-LargeColor: Dark Green,Verified Purchase,"Velvet and soft. Great quality! It fit like a glove and helped provide the hour glass figure. The neckline was a little low cut if you're voluptuous, but not horrible unless you take a selfie. Overall the dress helped boost my confidence and allowed me to feel sexy.",7
Amazon Customer,Perfect holiday dress.,https://www.amazon.com/gp/customer-reviews/R2KNGKQMFUQIAM/ref=cm_cr_getr_d_rvw_ttl?ie=UTF8&ASIN=B0CFZW6BNZ,"5.0 "," the United States "," November 10, 2024",Size: LargeColor: Dark Green,Verified Purchase,Accurate sizing. Thick fabric and nice quality for the price. Perfect for our holiday photos.,
Shebook,Returned it!,https://www.amazon.com/gp/customer-reviews/RDQUP1EZHQ81X/ref=cm_cr_getr_d_rvw_ttl?ie=UTF8&ASIN=B0CFZW6BNZ,"2.0 "," the United States "," October 30, 2024",,Verified Purchase,The velvet is very thin and the lining on the V neck wouldn't stay tucked under just while trying on.  I bought two different dresses in dark blue and thought I would like this one better but because of the thin fabric and awkward lining - I returned this one!,4
Ksenia,Great quality. Runs big.,https://www.amazon.com/gp/customer-reviews/R2V3BZUIFUSIV9/ref=cm_cr_getr_d_rvw_ttl?ie=UTF8&ASIN=B0CFZW6BNZ,"5.0 "," the United States "," October 27, 2024",Size: MediumColor: Black,Verified Purchase,"This dress is lovely. The quality of the fabric and seams exceeded my expectations. It flows nicely, smooting the figure and highlighting the curves in the best way.  Now, the sizing is definitely off to the larger side. I am 5'4"", 130lbs, and I got size M (both recommended to me by Amazon by the numbers on sizing sheet). The dress is way too big for me in the shoulders, bust, waist, and hips - so technically, everywhere :) I am going to try and reorder it in S and see what happens there.",14
Kristen M,Great dress!,https://www.amazon.com/gp/customer-reviews/R1855N9IG1PR8A/ref=cm_cr_getr_d_rvw_ttl?ie=UTF8&ASIN=B0CFZW6BNZ,"5.0 "," the United States "," October 23, 2024",Size: XX-LargeColor: Turquoise,Verified Purchase,Love this dress and got a ton of compliments.  Fit true to size and just how I wanted it.  Only downside is dry clean only - but this one is worth it.  The teal color was gorgeous.,3
Giggles,Green is too bright,https://www.amazon.com/gp/customer-reviews/R2M6VJF0CT9EOJ/ref=cm_cr_getr_d_rvw_ttl?ie=UTF8&ASIN=B0CFZW6BNZ,"2.0 "," the United States "," October 20, 2024",Size: XX-LargeColor: Dark Green,Verified Purchase,Looked much more like a forest green in the photo but it was too bright. Looked ok but decided not to wear. I should have returned it.,
Brenchris,I love it.,https://www.amazon.com/gp/customer-reviews/R92E0M9J4QKUG/ref=cm_cr_getr_d_rvw_ttl?ie=UTF8&ASIN=B0CFZW6BNZ,"5.0 "," the United States "," October 5, 2024",Size: LargeColor: Dark Red,Verified Purchase,THe dress was exactly as I expected. I will be wearing it for my birthday celebration.,
Kim Crampton,Great quality!,https://www.amazon.com/gp/customer-reviews/R277I9SWZGBMRY/ref=cm_cr_getr_d_rvw_ttl?ie=UTF8&ASIN=B0CFZW6BNZ,"5.0 "," the United States "," September 22, 2024",Size: X-LargeColor: Grape,Verified Purchase,"The material is solid, yet lightweight. It's incredibly flattering,  very comfortable, and worth every penny.  I'm glad I sized down to an XL, because it is a little stretchier than I anticipated and I love it.",2
Kelly Kennedy,I love this,https://www.amazon.com/gp/customer-reviews/R124QFXI0FS2L3/ref=cm_cr_getr_d_rvw_ttl?ie=UTF8&ASIN=B0CFZW6BNZ,"5.0 "," the United States "," June 17, 2024",Size: SmallColor: Navy,Verified Purchase,Made way better than I thought it would be. Wore to a 1920s style wedding in the cold . It was perfect,
Linda Kozel,Nice good quality,https://www.amazon.com/gp/customer-reviews/R2WRIFP1CWVA7L/ref=cm_cr_getr_d_rvw_ttl?ie=UTF8&ASIN=B0CFZW6BNZ,"5.0 "," the United States "," April 29, 2024",Size: SmallColor: Burgundy,Verified Purchase,Very nice,
Cassidy,Comfortable,https://www.amazon.com/gp/customer-reviews/R1X1L67R7A6QS0/ref=cm_cr_getr_d_rvw_ttl?ie=UTF8&ASIN=B0CFZW6BNZ,"5.0 "," the United States "," April 7, 2024",Size: 3X-LargeColor: Burgundy,,Nothing beats being comfortable and beautiful and this dress does just that! It was a tad bit longer on be because I am short but it still looked amazing,
Amazon Customer,Perfect!,https://www.amazon.com/gp/customer-reviews/R56Y916ZNEJE/ref=cm_cr_getr_d_rvw_ttl?ie=UTF8&ASIN=B0CFZW6BNZ,"5.0 "," the United States "," March 8, 2024",Size: X-LargeColor: Burgundy,Verified Purchase,"I wasn't sure how I would like a velvet dress, but this is a stunner!  I am on the heavier side, have a decent size tummy and am busty, and this dress concealed the parts that needed to be hidden and accentuated the better parts.  It is very elegant.  It hits just past the knee, which in my opinion makes it more elegant.",5
Josh Seth,Doesn't fit,https://www.amazon.com/gp/customer-reviews/R1189GF1UI0S4U/ref=cm_cr_getr_d_rvw_ttl?ie=UTF8&ASIN=B0CFZW6BNZ,"2.0 "," the United States "," February 23, 2024",Size: MediumColor: Grape,Verified Purchase,"I get it... I don't have the most form-fitting shape, but I was really hoping this would help!",
Dianne Linsley,Thank you,https://www.amazon.com/gp/customer-reviews/R3IPMAOWCYQ0I/ref=cm_cr_getr_d_rvw_ttl?ie=UTF8&ASIN=B0CFZW6BNZ,"5.0 "," the United States "," February 16, 2024",Size: X-LargeColor: Turquoise,Verified Purchase,Wedding,
Jessica Bartos,Perfect festive dress,https://www.amazon.com/gp/customer-reviews/R1O1EVA15DC6NI/ref=cm_cr_getr_d_rvw_ttl?ie=UTF8&ASIN=B0CFZW6BNZ,"5.0 "," the United States "," February 2, 2024",Size: LargeColor: Dark Red,Verified Purchase,"I bought this dress for a Valentines photo shoot and it was perfect! Thin enough not to overheat, but still a good quality material that you can’t see through! Fully lined. I added a cami because it was too low cut for me but this would be perfect for any occasion. Fits true to size",
jude,Festive & fabulous,https://www.amazon.com/gp/customer-reviews/R37KGRB0PJN3P0/ref=cm_cr_getr_d_rvw_ttl?ie=UTF8&ASIN=B0CFZW6BNZ,"5.0 "," the United States "," January 28, 2024",Size: LargeColor: Dark Red,Verified Purchase,This was an amazing dress that got lots of compliments this Christmas season.,
kk,Absolutely Gorgeous!,https://www.amazon.com/gp/customer-reviews/R2D0BVQV9HL0PM/ref=cm_cr_getr_d_rvw_ttl?ie=UTF8&ASIN=B0CFZW6BNZ,"5.0 "," the United States "," January 16, 2024",Size: LargeColor: Dark Green,Verified Purchase,It's perfect in every way.  Exactly what I needed for a winter wedding.,
Geraldine E Green,Comfy,https://www.amazon.com/gp/customer-reviews/R36OQOQU9WN9HS/ref=cm_cr_getr_d_rvw_ttl?ie=UTF8&ASIN=B0CFZW6BNZ,"5.0 "," the United States "," January 15, 2024",Size: X-LargeColor: Grape,Verified Purchase,Easy to wear and dressy,
Amazon Customer,Perfect Fit,https://www.amazon.com/gp/customer-reviews/R1KUGP0BSL6FN9/ref=cm_cr_getr_d_rvw_ttl?ie=UTF8&ASIN=B0CFZW6BNZ,"5.0 "," the United States "," January 15, 2024",Size: XX-LargeColor: Grape,Verified Purchase,"This dress is beautiful, feels great and fits perfect.  I plan to order in the non-velvet option.",
sparky134,great winter dress.,https://www.amazon.com/gp/customer-reviews/R2HZ24OLT95WWN/ref=cm_cr_getr_d_rvw_ttl?ie=UTF8&ASIN=B0CFZW6BNZ,"5.0 "," the United States "," January 8, 2024",Size: 3X-LargeColor: Dark Green,Verified Purchase,This is a great winter dress for the holidays or winter wedding. I loved the color and feel of this dress. it was comfortable and liked the sleeve length too. Sadly I sent it back as I found a better dress for the occasion I was shopping for.,
Jessica,Holiday party dress!!!,https://www.amazon.com/gp/customer-reviews/R10MW9UIK1Y1AF/ref=cm_cr_getr_d_rvw_ttl?ie=UTF8&ASIN=B0CFZW6BNZ,"5.0 "," the United States "," January 7, 2024",Size: LargeColor: Black,Verified Purchase,"Bought this for 2 holiday parties and it was perfect! It hung nicely, didn’t wrinkle, has some stretch, and covered my muffin top. It’s a simple black dress that can be dressed up or down but being velvet is perfect for the holidays!",
JDHatman,Extremely soft,https://www.amazon.com/gp/customer-reviews/R1BFWSM4O3FDSC/ref=cm_cr_getr_d_rvw_ttl?ie=UTF8&ASIN=B0CFZW6BNZ,"5.0 "," the United States "," January 4, 2024",Size: MediumColor: Turquoise,,"Very soft, very comfortable, a bit on the short side. You have to tie the sash just right for it to look like it belongs.",
N.,Twirls beautifully,https://www.amazon.com/gp/customer-reviews/RGLR1NOIYUYGS/ref=cm_cr_getr_d_rvw_ttl?ie=UTF8&ASIN=B0CFZW6BNZ,"5.0 "," the United States "," January 2, 2024",Size: LargeColor: Dark Green,,"This dress is great! It looks fancy enough to be worn to a formal event, it's comfortable to be in for hours, and it's easy to put on. The velvet is very nice to touch, and it adds a bit of class to it. When dancing, the dress also swirls around your legs in a fashion that reminds me of those old dancing movies. Honestly, this is a dress that will make you feel beautiful.",
Mulkerns ❤️,Beautiful,https://www.amazon.com/gp/customer-reviews/R38PL13PB598XS/ref=cm_cr_getr_d_rvw_ttl?ie=UTF8&ASIN=B0CFZW6BNZ,"4.0 "," the United States "," December 28, 2023",Size: XX-LargeColor: Black,,I needed a dress to wear to my dad's funeral. This was beautiful easy to take care of simple and it's a great little black dress that you need for any kind of occasion. True to size washes well. Received many compliments on it!,5
Tiffinie A.,Soft and comfortable,https://www.amazon.com/gp/customer-reviews/R22E91JHNCNCN4/ref=cm_cr_getr_d_rvw_ttl?ie=UTF8&ASIN=B0CFZW6BNZ,"5.0 "," the United States "," December 23, 2023",Size: X-LargeColor: Dark Green,Verified Purchase,"This dress was well made, comfortable and had lots of give without being baggy or too tight. I bought the xl, since I have broad shoulders and often the sleeves won’t fit on a large. I wear a 12 in most cases and this was perfect. Pictures with the family turned out beautifully!",
steffeha,Beautiful velvet dress,https://www.amazon.com/gp/customer-reviews/R2SRONCJGPYWT8/ref=cm_cr_getr_d_rvw_ttl?ie=UTF8&ASIN=B0CFZW6BNZ,"5.0 "," the United States "," December 20, 2023",Size: LargeColor: Dark Green,,"Great dress for the holidays.  Comfortable and wrinkles fell out easily after hanging up out of package.  I like the mix of style and a bit more conservative, will work to wear to church.",12
Jane,Gorgeous Dress!,https://www.amazon.com/gp/customer-reviews/R18FHZWYST8DSB/ref=cm_cr_getr_d_rvw_ttl?ie=UTF8&ASIN=B0CFZW6BNZ,"5.0 "," the United States "," December 19, 2023",Size: MediumColor: Burgundy,Verified Purchase,Beautiful dress!  The fabric is rich in color and nice weight.  Fits true to size.,
LAJ,"Beautiful color, perfect for winter wedding",https://www.amazon.com/gp/customer-reviews/R36FU7D4AV722/ref=cm_cr_getr_d_rvw_ttl?ie=UTF8&ASIN=B0CFZW6BNZ,"5.0 "," the United States "," December 17, 2023",Size: MediumColor: Burgundy,Verified Purchase,"Size is spot on, color is gorgeous. Bought this for a Christmas wedding. Cannot wait to wear it.",
areyoulily68,Pay attention to the sizing chart!,https://www.amazon.com/gp/customer-reviews/R1ZZESB39VHSON/ref=cm_cr_getr_d_rvw_ttl?ie=UTF8&ASIN=B0CFZW6BNZ,"5.0 "," the United States "," December 6, 2023",Size: XX-LargeColor: Navy,Verified Purchase,"This dress was exactly what I was looking for! Make sure you pay attention to the waist sizing, that’s the most important part of the measurements. Classy length and perfect for a winter evening out!",
GSP,nice velvet but returned due to sizeing being off,https://www.amazon.com/gp/customer-reviews/RTPNVZUX6BG1J/ref=cm_cr_getr_d_rvw_ttl?ie=UTF8&ASIN=B0CFZW6BNZ,"3.0 "," the United States "," November 22, 2023",Size: SmallColor: Black,Verified Purchase,"I ordered two of these dresses.. the violet in S and the Black in S, both ran large the Violet was damaged in the front of the dress. wanted to love thm since it was soft and stretchy, Returned both due to sizing",7
R.F.,"Flattering fit, comfortable and well made",https://www.amazon.com/gp/customer-reviews/RQG4XZ39JN2SD/ref=cm_cr_getr_d_rvw_ttl?ie=UTF8&ASIN=B0CFZW6BNZ,"5.0 "," the United States "," November 10, 2023",Size: MediumColor: Turquoise,Verified Purchase,I plan to wear this dress for dressy holiday events. The color and fit are very nice,2
Ellen,"Not ""fast fashion""",https://www.amazon.com/gp/customer-reviews/RWBN7P6K4I8J5/ref=cm_cr_getr_d_rvw_ttl?ie=UTF8&ASIN=B0CFZW6BNZ,"3.0 "," the United States "," October 30, 2023",Size: X-LargeColor: Black,,"Always on the lookout for simple yet versatile black dresses, I was hopeful that this would be useful for me. While not the most stylish of dresses, it could be useful for those of us who aren't looking for ""fast fashion."" I was surprised by how heavy the dress actually is, but of course with velvet and the satiny liner, that actually shouldn't be surprising. I appreciate the 3/4 sleeve; full-length sleeves are so often difficult to fit into a coat. I also like that belt is not attached, so the dress can be worn with or without. Unable to reach the zipper in the back, I did have to ask a family member for help zipping it, which led to the question ""Are you dressing like a pilgrim for something?"" So be aware that you, too, may be looking like a pilgrim in this! (I work in a school, so it's actually not unheard of for me to dress like a pilgrim...but, still....!)",4
Michele M,Very classic style,https://www.amazon.com/gp/customer-reviews/R3B1PLN3FK9HPY/ref=cm_cr_getr_d_rvw_ttl?ie=UTF8&ASIN=B0CFZW6BNZ,"5.0 "," the United States "," October 25, 2023",Size: MediumColor: Dark Green,,Really pretty dress.  Classic emerald green.  Very flattering fit and came with a matching belt.  Three quarter sleeves (although it says long sleeves they are not)  and it comes down past my knees so this is good for fall or winter.  Planning on wearing it to a Christmas concert.  Very comfortable and stylish.  I would recommend it.,4
Patrick S.,It was a hit!,https://www.amazon.com/gp/customer-reviews/R1ETBVP8043K6O/ref=cm_cr_getr_d_rvw_ttl?ie=UTF8&ASIN=B0CFZW6BNZ,"5.0 "," the United States "," October 20, 2023",Size: MediumColor: Turquoise,,"This is exactly my wife's style and while I knew I had to pick one the hardest part was knowing which of the great colors to pick.  One of the standout features of this dress is its luxurious velvet fabric. It's soft on the skin while looking very classic and elegant. The v-neckline is tastefully revealing, striking that perfect balance between modesty and allure.  The dress's fit is true to its description – an exceptional feat in the world of online shopping. It offers a fitting silhouette that's flattering to different body types. The bow belt is also fashionable and functional. While it looks stunning in its original form, the fact that it can be modified for various fashion statements adds a touch of versatility to an already versatile dress. Whether you're aiming for a classic, vintage look, or seeking to infuse a dash of contemporary flair, the bow belt allows for that personal touch.  Perfect for formal events, cocktail parties, weddings, or church functions. In a world where fast fashion often compromises on quality, the Velvet Vintage Tea Dress was a hit, and brownie points were awarded. Highly recommended!",2
SouthernMommma,Greeeeen Vevlvetttt,https://www.amazon.com/gp/customer-reviews/R1I5XJMWNGCPAF/ref=cm_cr_getr_d_rvw_ttl?ie=UTF8&ASIN=B0CFZW6BNZ,"4.0 "," the United States "," October 18, 2023",Size: XX-LargeColor: Dark Green,,"Okay okay. But in all honestly this green velvet is absolutely gorgeous!!!! The color is very true to the picture and it is perfect for the Christmas holidays.  It is very flattering, however my only complaint is I normally wear a XL/14 but bought up for length. The XXL was snug. More snug then it should of been so I recommend sizing up. There is also no loops for the belt. So if you don’t have a waist, sorry your belt won’t stay up much.  Otherwise it is gorgeous, thick fabric, made well and super comfortable.",12
