Travis Becker,Great casual dress shirt!  Ordering more colors!,https://www.amazon.com/gp/customer-reviews/R25XO8K99B935P/ref=cm_cr_getr_d_rvw_ttl?ie=UTF8&ASIN=B0DDXV6G1C,"5.0 "," the United States "," November 12, 2024",Color: BlackSize: Large,Verified Purchase,"Wow!  Cant say enough good things about this shirt.  Soft, stretchy, stiff collar, perfect fit for US.I am 5'9"", 200lbs, 34"" waist athletic build.  I originally bought XL do to recommendation but was swimming in an XL.  I like my shirts a little fitted so dropped down to a L and it fits great!  for dress shirts I am normally 17 34/35 for reference (slim fit).  My arms are 19"" so I usually have problems with Asia sizes.  But this shirt fits great.  Meant to be un-tucked so its not too long, but you can also tuck this shirt in.  I will be wearing this shirt for parties or dinner with the lady.",15
RU,These Are Dumpster Fire. Stop Making Coofandy Happen.,https://www.amazon.com/gp/customer-reviews/RCOPMSC8JHH9F/ref=cm_cr_getr_d_rvw_ttl?ie=UTF8&ASIN=B0DDXV6G1C,"1.0 "," the United States "," November 10, 2024",Color: Navy BlueSize: Medium,,"Let's start with the basics:  The fabric and material is attempting to hit some of the more premium brands that you'd be paying in excess of $100 to drape over your muscular form. (This is a muscle-fit shirt, so this is a reasonable assumption.)  That's fine, except the packaging is extremely flat which means that in many cases, including my case, the shirt shows up with a deep crease in the collar that is weaker than my lactose intolerant stomach after putting the damage on a pint of Ben & Jerry's. No amount of steaming will fully remove said crease, and the collar itself will likely look ""okay"" as long as it's by itself.  Want to put it under a light sweater? Be prepared to show how not-as-awesome that this shirt is when trying to layer it. Put it under a sports coat? Unless it's the same trash-fast-fashion as the shirt, you're not going to fool anyone and you're going to look out-classed in public.  Finally, muscle sleeves? No, not hardly. I'm a Medium at 5'9, 155 and this thing bloused more than Theo Huxtable's knockoff Gartrelle shirt. (Google it; worth the laugh)  Not only is this not a muscle shirt, Thor, it's also got 2 different-sized sleeve openings at the wrist, which is hilarious. Sure, maybe that was mine, however, quality control on this stuff is through the basement.  Not a good shirt. Not at any price point. Instead of getting 3 of these, slow-roll yourself into something of higher quality. You'll be grateful in the long run.",
Alex Artiaga,Incredible,https://www.amazon.com/gp/customer-reviews/R3QT67EY963AA1/ref=cm_cr_getr_d_rvw_ttl?ie=UTF8&ASIN=B0DDXV6G1C,"4.0 "," the United States "," November 8, 2024",Color: Denim BlueSize: Large,Verified Purchase,"I am 5’8 , 189 the Large fits great for me if your a little on the stocky side and same height and weight use Xl.. just saying otherwise these are fantastic shirts",
Alvin Watson,Shirt,https://www.amazon.com/gp/customer-reviews/R2C5C7GQZUWLBK/ref=cm_cr_getr_d_rvw_ttl?ie=UTF8&ASIN=B0DDXV6G1C,"3.0 "," the United States "," November 7, 2024",Color: Olive GreenSize: Large,Verified Purchase,These are ok but the material is not as good as the short sleeve ones.,
D.H.L.,excellent quality no-tuck shirt. perfect for travel.,https://www.amazon.com/gp/customer-reviews/R2JXUWWZRG12GM/ref=cm_cr_getr_d_rvw_ttl?ie=UTF8&ASIN=B0DDXV6G1C,"5.0 "," the United States "," November 6, 2024",Color: Deep BlueSize: XX-Large,Verified Purchase,nothing to not like.Have bought many of these shirts in recent months.,
Myron Abernathy,Not just a muscle shirt!,https://www.amazon.com/gp/customer-reviews/R3M6QO7GEB2H0U/ref=cm_cr_getr_d_rvw_ttl?ie=UTF8&ASIN=B0DDXV6G1C,"5.0 "," the United States "," November 5, 2024",Color: Light KhakiSize: X-Large,Verified Purchase,"Silky smooth, flexible and fits your body very well.  This is a great product.  Take care of it.  the fabric is thin but it is really a nice shirt for a slender man.",
M. Miller,"Good quality fabrics, need better construction",https://www.amazon.com/gp/customer-reviews/R3DO4M0KIJ12PS/ref=cm_cr_getr_d_rvw_ttl?ie=UTF8&ASIN=B0DDXV6G1C,"3.0 "," the United States "," November 3, 2024",Color: Olive GreenSize: X-Large,Verified Purchase,"This shirt feels great, fits well, and is breathable. The button holes are a bit large and the button will often just open randomly.",
Brian Pasqua,Very nice shirt.,https://www.amazon.com/gp/customer-reviews/R1U2UWC3UTLAD8/ref=cm_cr_getr_d_rvw_ttl?ie=UTF8&ASIN=B0DDXV6G1C,"5.0 "," the United States "," November 3, 2024",Color: Denim BlueSize: XX-Large,Verified Purchase,"Very comfortable dress shirt. Highly recommend, especially for the good value.",
David,fits great,https://www.amazon.com/gp/customer-reviews/R3BHB0EHK8TIDC/ref=cm_cr_getr_d_rvw_ttl?ie=UTF8&ASIN=B0DDXV6G1C,"5.0 "," the United States "," October 29, 2024",Color: Light KhakiSize: X-Large,Verified Purchase,fits perfect,
Brian Petratuona,NICE,https://www.amazon.com/gp/customer-reviews/R7ZVWJMW9XAAU/ref=cm_cr_getr_d_rvw_ttl?ie=UTF8&ASIN=B0DDXV6G1C,"5.0 "," the United States "," October 28, 2024",Color: BlackSize: X-Large,Verified Purchase,WORKED OUT GREAT,
Tommy Randle,Shirt,https://www.amazon.com/gp/customer-reviews/R384D51CFZXCPB/ref=cm_cr_getr_d_rvw_ttl?ie=UTF8&ASIN=B0DDXV6G1C,"5.0 "," the United States "," October 26, 2024",Color: Army GreenSize: Large,Verified Purchase,The shirt is a nice color and it fits absolutely perfect,
Trisha Herring,Nice fit & soft material,https://www.amazon.com/gp/customer-reviews/R3NXBS9H6L66LJ/ref=cm_cr_getr_d_rvw_ttl?ie=UTF8&ASIN=B0DDXV6G1C,"5.0 "," the United States "," October 26, 2024",Color: RedSize: Large,Verified Purchase,Perfect fit & comfortable & completed my gangster look!,
Tito,Great shirt,https://www.amazon.com/gp/customer-reviews/R59O634GZ5WSG/ref=cm_cr_getr_d_rvw_ttl?ie=UTF8&ASIN=B0DDXV6G1C,"5.0 "," the United States "," October 25, 2024",Color: Deep BlueSize: Large,Verified Purchase,"Feels great, excellent fit.",
Joseph,It’s ok,https://www.amazon.com/gp/customer-reviews/R13JKOE1DA319A/ref=cm_cr_getr_d_rvw_ttl?ie=UTF8&ASIN=B0DDXV6G1C,"2.0 "," the United States "," October 21, 2024",Color: RedSize: Large,Verified Purchase,Bright red and too silky for me. Just didn’t fit right for myself,
Flips,Not a good fit,https://www.amazon.com/gp/customer-reviews/RERRFX9K48LMB/ref=cm_cr_getr_d_rvw_ttl?ie=UTF8&ASIN=B0DDXV6G1C,"2.0 "," the United States "," October 20, 2024",Color: Navy BlueSize: X-Large,Verified Purchase,This shirt did not fit as advertised…didn’t look good,
Customer,Great Buy!,https://www.amazon.com/gp/customer-reviews/R2QNR2D0J790DF/ref=cm_cr_getr_d_rvw_ttl?ie=UTF8&ASIN=B0DDXV6G1C,"5.0 "," the United States "," October 19, 2024",Color: Navy BlueSize: X-Large,Verified Purchase,I Normally hate doing these but this shirt warrants a little praise…. Great price! Comfortable fit and accurate for size and looks really good when I put it on. I may get a few more in different colors. Great Product!,
Meg,Stretchy,https://www.amazon.com/gp/customer-reviews/R1CHLL5UGMPMGS/ref=cm_cr_getr_d_rvw_ttl?ie=UTF8&ASIN=B0DDXV6G1C,"5.0 "," the United States "," October 18, 2024",Color: Dark BlueSize: Medium,Verified Purchase,Supper soft and comfortable,
John Platt,Cooling but short,https://www.amazon.com/gp/customer-reviews/R17ENC93O7E1KK/ref=cm_cr_getr_d_rvw_ttl?ie=UTF8&ASIN=B0DDXV6G1C,"4.0 "," the United States "," October 15, 2024",Color: BlackSize: XX-Large,Verified Purchase,Purchased 2X which was true to size but it is a little short. Wish there was an extra 3 inches for comfort.  This should keep my husband cool while dancing the night away.,
Amazon Customer,Black dress,https://www.amazon.com/gp/customer-reviews/R1183VUANV6SAD/ref=cm_cr_getr_d_rvw_ttl?ie=UTF8&ASIN=B0DDXV6G1C,"5.0 "," the United States "," October 13, 2024",Color: BlackSize: Medium,Verified Purchase,Great shirt does not wrinkle,
Nick,Awesome Cool Shirt,https://www.amazon.com/gp/customer-reviews/R1Y3ZGQHYGP7RJ/ref=cm_cr_getr_d_rvw_ttl?ie=UTF8&ASIN=B0DDXV6G1C,"5.0 "," the United States "," October 8, 2024",Color: WhiteSize: X-Large,Verified Purchase,"These shirts fit true to size and are light weight and stretch.  The XL fits perfect for 5’11 260, 50” chest and 18” arms.  I also pull the material forward to stretch when unbuttoned to make it looser on my gut.  I wear with a tshirt under and it is still  great in hot humid weather.",2
Carlos Márquez,Lindo,https://www.amazon.com/gp/customer-reviews/R183TYEF7UJRBZ/ref=cm_cr_getr_d_rvw_ttl?ie=UTF8&ASIN=B0DDXV6G1C,"5.0 "," the United States "," October 8, 2024",Color: Dark BlueSize: Large,Verified Purchase,Muy bueno el material,
Amazon Customer,As Advertised,https://www.amazon.com/gp/customer-reviews/R1AATRUBWL0Y8/ref=cm_cr_getr_d_rvw_ttl?ie=UTF8&ASIN=B0DDXV6G1C,"5.0 "," the United States "," October 6, 2024",Color: Deep BlueSize: Medium,Verified Purchase,"Great sheek fit. Looks nice, great reasonable price.",
Manfred Rea,I really like this shirt.,https://www.amazon.com/gp/customer-reviews/R1Z25AFY1LBXCR/ref=cm_cr_getr_d_rvw_ttl?ie=UTF8&ASIN=B0DDXV6G1C,"5.0 "," the United States "," October 5, 2024",Color: RedSize: Medium,Verified Purchase,"I love the beautiful, bright red color, and it doesn’t wrinkle. It’s supposed to be a muscle shirt,  but I don’t have a lot of muscle. I wear it anyway it’s one of my favorite shirts.",
micki buchmiller,So comfortable,https://www.amazon.com/gp/customer-reviews/R3B29QF9OPRNXC/ref=cm_cr_getr_d_rvw_ttl?ie=UTF8&ASIN=B0DDXV6G1C,"5.0 "," the United States "," October 5, 2024",Color: BlackSize: XX-Large,Verified Purchase,This shirt is exactly how it’s described. Soft comfortable. It fit perfectly. Highly recommended.,
Edmund Luggen,White shirt is see through,https://www.amazon.com/gp/customer-reviews/R1VC45WRMXE4EL/ref=cm_cr_getr_d_rvw_ttl?ie=UTF8&ASIN=B0DDXV6G1C,"3.0 "," the United States "," October 4, 2024",Color: WhiteSize: Medium,Verified Purchase,"fits great, feels great, will try a different color - the white dress shirt is SEE THROUGH.  You will show off your nips and chest hair wearing it",2
tiki,Super cool,https://www.amazon.com/gp/customer-reviews/RCS7EFBHJFW33/ref=cm_cr_getr_d_rvw_ttl?ie=UTF8&ASIN=B0DDXV6G1C,"5.0 "," the United States "," October 1, 2024",Color: BlackSize: Small,Verified Purchase,Very comfortable material and looks very modern.,
Ramses Fils-Aime,Cheap,https://www.amazon.com/gp/customer-reviews/R2ZQLUVCGJEZIZ/ref=cm_cr_getr_d_rvw_ttl?ie=UTF8&ASIN=B0DDXV6G1C,"1.0 "," the United States "," September 30, 2024",Color: Deep BlueSize: X-Large,Verified Purchase,"It’s a one time wear, the buttons were all loose. And after one were it started falling apart",
Jeff J Poirier,Great fit Great texture,https://www.amazon.com/gp/customer-reviews/R1HVKMR8AGFQG6/ref=cm_cr_getr_d_rvw_ttl?ie=UTF8&ASIN=B0DDXV6G1C,"5.0 "," the United States "," September 26, 2024",Color: Navy BlueSize: Large,Verified Purchase,Feels like a good glove,
Byron,Fiel a la medida,https://www.amazon.com/gp/customer-reviews/R1I66YE9B522P2/ref=cm_cr_getr_d_rvw_ttl?ie=UTF8&ASIN=B0DDXV6G1C,"5.0 "," the United States "," September 23, 2024",Color: BlackSize: Large,Verified Purchase,"Me gustó mucho, muy buena calidad 👌 fiel a la medida",
