评论用户,评论概述,评论链接,星级评分,评论地点,评论时间,类型,是否购买,评论详情,觉得该评论有帮助的人数
Russell,Too Tight; Too Short,https://www.amazon.com/gp/customer-reviews/R1RVW5S5CJHS4H/ref=cm_cr_getr_d_rvw_ttl?ie=UTF8&ASIN=B0DDXV6G1C,"1.0 "," the United States "," February 4, 2025",Color: BlackSize: XX-Large,,I usually wear a 3X and this 3X is tight !  They essentially provide you with almost zero material to tuck in your pants.,
Julio Laborin,For guys who workout!,https://www.amazon.com/gp/customer-reviews/R2YYY6W3QYDQZ7/ref=cm_cr_getr_d_rvw_ttl?ie=UTF8&ASIN=B0DDXV6G1C,"5.0 "," the United States "," February 4, 2025",Color: Dark BlueSize: Large,Verified Purchase,Great fit!,
Rob2.0,Great for muscular body types.,https://www.amazon.com/gp/customer-reviews/R1RLYVXP8W0GDK/ref=cm_cr_getr_d_rvw_ttl?ie=UTF8&ASIN=B0DDXV6G1C,"5.0 "," the United States "," February 3, 2025",Color: Light GreySize: Small,Verified Purchase,"I used the size chart and got medium based on it. I do usually buy medium. I'm 5'8"" 160 pounds and no belly fat. 42 chest 30 waist so medium was what I got. I went back and bought 9 colors in total after I bought the first one. Wash in clod water, remove immediately and hang to day. I haven't had to iron them and would not even attempt to because of the fabric. All the wrinkles fall out with air drying, no need to iron. The fit is perfect. I love these shirts.",
Great,Shirt,https://www.amazon.com/gp/customer-reviews/R1CVE9C1GVSN3Z/ref=cm_cr_getr_d_rvw_ttl?ie=UTF8&ASIN=B0DDXV6G1C,"5.0 "," the United States "," February 3, 2025",Color: Dark GreySize: Large,Verified Purchase,Great,
Amazon Customer,The perfect shirt,https://www.amazon.com/gp/customer-reviews/R1RWHKS59HV6BZ/ref=cm_cr_getr_d_rvw_ttl?ie=UTF8&ASIN=B0DDXV6G1C,"5.0 "," the United States "," February 2, 2025",Color: Deep BlueSize: X-Large,,Love these shirts. Feels and fits nicely,
kelly bailey,Sharp shirt,https://www.amazon.com/gp/customer-reviews/R2DTLTJ9OCFQIL/ref=cm_cr_getr_d_rvw_ttl?ie=UTF8&ASIN=B0DDXV6G1C,"5.0 "," the United States "," February 2, 2025",Color: BlackSize: X-Large,Verified Purchase,"It took a minute to get here, but worth the wait.  I have a muscular frame  and I this shirt extenuates my shape.  Most shirts make me feel like a square.  I steamed it once it arrived and it looks amazing. I would strongly suggest this shirt if you have muscular frame.  I ordered a black one and just ordered a green one.  Nice shirt.",
Richard L.,Confort and fit,https://www.amazon.com/gp/customer-reviews/RC1T78W8HGV6T/ref=cm_cr_getr_d_rvw_ttl?ie=UTF8&ASIN=B0DDXV6G1C,"5.0 "," the United States "," February 1, 2025",Color: BlackSize: Large,Verified Purchase,"I absolutely love the shirt, confort and perfect fit for me.  As I am a 67 old at 5' 10"", 180, I find I have a problem whit shirts being too tight in the chest ;-) at a medium.  I bought large and found a nice fit in the chest and great taper everywhere else.This shirt was a perfect fit for me.  In fact, I liked it so much, I bought 3 more.  Great quality!",
Jeremy Bergstrom,Amazing shirts,https://www.amazon.com/gp/customer-reviews/R3I9E746DNE1DS/ref=cm_cr_getr_d_rvw_ttl?ie=UTF8&ASIN=B0DDXV6G1C,"5.0 "," the United States "," February 1, 2025",Color: Dark BlueSize: Medium,Verified Purchase,These shirts are amazing. Super comfy and stretch fitting.,
yak217,Comfy dress shirt!,https://www.amazon.com/gp/customer-reviews/R15RUXM7OVT3Y6/ref=cm_cr_getr_d_rvw_ttl?ie=UTF8&ASIN=B0DDXV6G1C,"5.0 "," the United States "," January 30, 2025",Color: GreenSize: Medium,,This shirt is super soft & a stretchy! My teenage son loves it. The color was as shown & the sizing is true to size.,
Omar Jose Acosta,Qué le diga talla adecuada,https://www.amazon.com/gp/customer-reviews/R3I8RVM8WUT6BA/ref=cm_cr_getr_d_rvw_ttl?ie=UTF8&ASIN=B0DDXV6G1C,"5.0 "," the United States "," January 30, 2025",Color: WhiteSize: Large,Verified Purchase,Que está muy bueno,
sean n,Poor quality,https://www.amazon.com/gp/customer-reviews/R3S1CRCP6HS9RX/ref=cm_cr_getr_d_rvw_ttl?ie=UTF8&ASIN=B0DDXV6G1C,"1.0 "," the United States "," January 30, 2025",Color: Denim BlueSize: Large,Verified Purchase,"Shirt worn once, from collar to sleeve across entire shoulder stitching came out. Not good quality",
No Name,Nice shirt.,https://www.amazon.com/gp/customer-reviews/R1GB6IHW5TR8MD/ref=cm_cr_getr_d_rvw_ttl?ie=UTF8&ASIN=B0DDXV6G1C,"5.0 "," the United States "," January 29, 2025",Color: Olive GreenSize: Small,Verified Purchase,Great shirt. Perfect fit.,
Preston P,Damaged and used,https://www.amazon.com/gp/customer-reviews/R12E6BVHEE573U/ref=cm_cr_getr_d_rvw_ttl?ie=UTF8&ASIN=B0DDXV6G1C,"1.0 "," the United States "," January 28, 2025",Color: Olive GreenSize: X-Large,Verified Purchase,Shirt was used! Came with stains and reap of cologne. Throw it away so it wouldn't be resold.,
Rolando Balcarcel,Perfect fit,https://www.amazon.com/gp/customer-reviews/R3IZKJK86QY0HC/ref=cm_cr_getr_d_rvw_ttl?ie=UTF8&ASIN=B0DDXV6G1C,"5.0 "," the United States "," January 28, 2025",Color: Dark BlueSize: Large,Verified Purchase,Love this shirt.  Great fit and appearance.,
bryce vickers,Super comfy,https://www.amazon.com/gp/customer-reviews/R3QUR28A1735XY/ref=cm_cr_getr_d_rvw_ttl?ie=UTF8&ASIN=B0DDXV6G1C,"5.0 "," the United States "," January 27, 2025",Color: WhiteSize: Medium,Verified Purchase,Super comfortable and fit exactly as I had hoped! Great for wearing underneath a sweater!,
Jerome R. Sharpe,NOT a button down shirt,https://www.amazon.com/gp/customer-reviews/R1P9LZ2E1R6C2B/ref=cm_cr_getr_d_rvw_ttl?ie=UTF8&ASIN=B0DDXV6G1C,"1.0 "," the United States "," January 26, 2025",Color: WhiteSize: Large,,"These guys apparently don;t know the meaning of a button down shirt. As clearly seen in the pix, these are NOT button down.",
DgTr,Great look and feel,https://www.amazon.com/gp/customer-reviews/R2VUYH4BRT18GM/ref=cm_cr_getr_d_rvw_ttl?ie=UTF8&ASIN=B0DDXV6G1C,"5.0 "," the United States "," January 26, 2025",Color: BlackSize: Large,Verified Purchase,Use the size charge for this shirt it works,
Big boy,nice,https://www.amazon.com/gp/customer-reviews/R3LL53YZRQZGV2/ref=cm_cr_getr_d_rvw_ttl?ie=UTF8&ASIN=B0DDXV6G1C,"5.0 "," the United States "," January 25, 2025",Color: Army GreenSize: Medium,Verified Purchase,fits great....,
Stephanie C.,Sizing off,https://www.amazon.com/gp/customer-reviews/R3P7SSALTAD6K8/ref=cm_cr_getr_d_rvw_ttl?ie=UTF8&ASIN=B0DDXV6G1C,"3.0 "," the United States "," January 25, 2025",Color: Denim BlueSize: Small,Verified Purchase,"Not a bad shirt, I don’t think, but it runs quite large. The small is more of a medium-and-a-half. When I can wear a size small in every brand but this one, I think my assessment of the sizing is fairly accurate.",
Farmer88,Fast delivery.,https://www.amazon.com/gp/customer-reviews/R233NQQBHLKTP1/ref=cm_cr_getr_d_rvw_ttl?ie=UTF8&ASIN=B0DDXV6G1C,"5.0 "," the United States "," January 24, 2025",Color: WhiteSize: Large,Verified Purchase,The tailored fit!!,
Donald,Great Feel and Look,https://www.amazon.com/gp/customer-reviews/R3SBBDCG1HBM6M/ref=cm_cr_getr_d_rvw_ttl?ie=UTF8&ASIN=B0DDXV6G1C,"5.0 "," the United States "," January 22, 2025",Color: Dark GreySize: Large,Verified Purchase,"While I'm a few gym visits short of the model, the shirt looks great, is extremely comfortable, and well made.  I bought 5.",
Ivis  Sampayo,Great shirt,https://www.amazon.com/gp/customer-reviews/R3DARJ8IAVRGC9/ref=cm_cr_getr_d_rvw_ttl?ie=UTF8&ASIN=B0DDXV6G1C,"5.0 "," the United States "," January 22, 2025",Color: WhiteSize: X-Large,Verified Purchase,Nice quality and shirt fits my son perfectly,
Jason Reavis,Beautiful material,https://www.amazon.com/gp/customer-reviews/ROUTTYC3Q6K7V/ref=cm_cr_getr_d_rvw_ttl?ie=UTF8&ASIN=B0DDXV6G1C,"5.0 "," the United States "," January 22, 2025",Color: BlackSize: Large,Verified Purchase,"I absolutely love this shirt. The material is soft and silky, my girlfriend can’t keep her hands off of me when I wear it.  It feels great to touch.  I will definitely buy more of these.",
William Gillett,Moveabiliy,https://www.amazon.com/gp/customer-reviews/R2U1DX4K8HLQC3/ref=cm_cr_getr_d_rvw_ttl?ie=UTF8&ASIN=B0DDXV6G1C,"4.0 "," the United States "," January 22, 2025",Color: WhiteSize: Large,Verified Purchase,Shirt is amazing for comfort and how unrestricted movement is.  I've been weating suits for 20yrs. Most comfortable shirt I've worn.  Durability is yet to be determined. Size fits correct. Always wear a large dress shirt. Im 6ft 195 and large is right. Doesn't appear to be shrinkage but I wouldn't dry it to find out.,
Will,Great shirt,https://www.amazon.com/gp/customer-reviews/R3CCCH16XXI6TQ/ref=cm_cr_getr_d_rvw_ttl?ie=UTF8&ASIN=B0DDXV6G1C,"5.0 "," the United States "," January 22, 2025",Color: Light GreySize: XX-Large,Verified Purchase,Shirt looks and stretches as advertised. They run a little big so go down a size. You won't be disappointed.,
Cathy L.,Beautiful Fitted Shirt,https://www.amazon.com/gp/customer-reviews/R1WTJ99GYFDUGU/ref=cm_cr_getr_d_rvw_ttl?ie=UTF8&ASIN=B0DDXV6G1C,"5.0 "," the United States "," January 21, 2025",Color: WhiteSize: Large,Verified Purchase,"If you have the fit triangular shape most men want, this shirt is for you. It stretches to fit your muscles in the best possible way. My weight lifting son loves them and plans to buy them in more colors. The color selection is broad. The material is so soft.",
unhappy,Fits perfectly,https://www.amazon.com/gp/customer-reviews/R2KB8ZHP0NB0WE/ref=cm_cr_getr_d_rvw_ttl?ie=UTF8&ASIN=B0DDXV6G1C,"5.0 "," the United States "," January 20, 2025",Color: WhiteSize: Large,Verified Purchase,Very happy with this shirt. Purchased a total of 3.,
Vera,Coofandy quality has taken a nose dive.,https://www.amazon.com/gp/customer-reviews/R3GQAMZGS3OSAK/ref=cm_cr_getr_d_rvw_ttl?ie=UTF8&ASIN=B0DDXV6G1C,"2.0 "," the United States "," January 15, 2025",Color: WhiteSize: Large,Verified Purchase,"My husband has used coofandy shirts to wear for dress casual for years. Always a go to when looking for a decently priced dress shirt in a pinch. He likes the cut of the shirts and the stretch the fabric offers, however this is the second shirt we have ordered from the coofandy line recently that as been really terrible. This shirt is so sheer and thin it's practically see through. You can see every bit of the undershirt. We don't have time to return this time and since he will be wearing a sweater over this shirt it will do. Upside is that it's so thin he shouldn't overheat wearing the sweater over it. Maybe it's time to move on and find another brand, too bad. Buyer beware.",
D L P  J R,Size Down one size to get an actual pump/muscle stretch,https://www.amazon.com/gp/customer-reviews/R35CK0PKD0M8CR/ref=cm_cr_getr_d_rvw_ttl?ie=UTF8&ASIN=B0DDXV6G1C,"5.0 "," the United States "," January 14, 2025",Color: WhiteSize: Medium,,"Unlike an alternate brand that advertises an almost idential looking and described item - THIS ONE REALLY IS A MUSCLE STRETCH SHIRT. (LIKE 35-45% STRETCH, While the other brand is only 5-10% Max). Another thing to know is that this shirt is not going to shrink in the wash much at all. Maybe hot water, and max drying (or repeat) will force it to shrink some. It is very wrinkle resistant, and looks good, but to look like the ads pics - you are gonna have to really stack some plate to get that kind of fit, and buy a smaller size than normal. My guess is that the model has possibly 2 sizes smaller and a good pump.  But as stated - THIS is the one to buy for the fit advertised. NOT that other one that has very little stretch.",
Kendall Blevins,We went to Jamaica,https://www.amazon.com/gp/customer-reviews/R1K20RTWOLECON/ref=cm_cr_getr_d_rvw_ttl?ie=UTF8&ASIN=B0DDXV6G1C,"5.0 "," the United States "," January 13, 2025",Color: Army GreenSize: Large,Verified Purchase,The shirt felt amazing. Very good quality.,4
robert lans,time,https://www.amazon.com/gp/customer-reviews/R1CISHDN6N87V8/ref=cm_cr_getr_d_rvw_ttl?ie=UTF8&ASIN=B0DDXV6G1C,"4.0 "," the United States "," January 11, 2025",Color: Army GreenSize: Small,Verified Purchase,could not be used with a tie and sizing restricted that,
Luis Lopez,Nice,https://www.amazon.com/gp/customer-reviews/R2CP41FYBAEAPF/ref=cm_cr_getr_d_rvw_ttl?ie=UTF8&ASIN=B0DDXV6G1C,"5.0 "," the United States "," January 11, 2025",Color: BlackSize: Medium,Verified Purchase,Like,
Raymond G. Phillips,Fitness,https://www.amazon.com/gp/customer-reviews/R1VH6U11S16B8S/ref=cm_cr_getr_d_rvw_ttl?ie=UTF8&ASIN=B0DDXV6G1C,"3.0 "," the United States "," January 11, 2025",,Verified Purchase,Not a snug fit,
TD,Shirt Feels Amazing on Skin,https://www.amazon.com/gp/customer-reviews/R1JC50RD7EVDLL/ref=cm_cr_getr_d_rvw_ttl?ie=UTF8&ASIN=B0DDXV6G1C,"5.0 "," the United States "," January 11, 2025",Color: BlackSize: Large,Verified Purchase,Great quality and shirt feels great on skin with no undershirt needed. 5-9 190lbs. Ordered a Large Size and ordering more colors. Shirt can be worn with Slacks or Jeans.,
jeff walstrom,Great,https://www.amazon.com/gp/customer-reviews/R1G2ZRKV7WKDFA/ref=cm_cr_getr_d_rvw_ttl?ie=UTF8&ASIN=B0DDXV6G1C,"5.0 "," the United States "," January 7, 2025",Color: Light GreySize: Small,Verified Purchase,I own 5 different colors of these shirts now. The only downside is that it's made in CHINA,
DerekM,I Love Coofandy products,https://www.amazon.com/gp/customer-reviews/R25CLNW9IUJWYR/ref=cm_cr_getr_d_rvw_ttl?ie=UTF8&ASIN=B0DDXV6G1C,"5.0 "," the United States "," January 6, 2025",Color: BlackSize: Large,Verified Purchase,Great Fit on the shirts.  I am 66 but go to the gym and active daily.  material fits to your body.  Lots of complements.,
Vito M. Santoro,Great Style and Fit,https://www.amazon.com/gp/customer-reviews/R3NKAJYSGU8389/ref=cm_cr_getr_d_rvw_ttl?ie=UTF8&ASIN=B0DDXV6G1C,"5.0 "," the United States "," January 4, 2025",Color: GreenSize: Medium,Verified Purchase,The material is soft and well styled. Looks good and wears well.,
Mike P,Good shirt,https://www.amazon.com/gp/customer-reviews/R5W8UU0B82P0J/ref=cm_cr_getr_d_rvw_ttl?ie=UTF8&ASIN=B0DDXV6G1C,"5.0 "," the United States "," January 3, 2025",Color: BlackSize: Large,Verified Purchase,Love the fit. And the comfort and smoothness of the material. Solid shirt.,
Just.Ral,Amazing,https://www.amazon.com/gp/customer-reviews/R396UPY5HZ9TEE/ref=cm_cr_getr_d_rvw_ttl?ie=UTF8&ASIN=B0DDXV6G1C,"5.0 "," the United States "," January 3, 2025",Color: Olive GreenSize: Large,Verified Purchase,Fits so well and love the color,
Chelsey Slattery,Nice Dress Shirt,https://www.amazon.com/gp/customer-reviews/RYO3GNSPRJ5JZ/ref=cm_cr_getr_d_rvw_ttl?ie=UTF8&ASIN=B0DDXV6G1C,"5.0 "," the United States "," January 3, 2025",Color: Army GreenSize: XX-Large,Verified Purchase,"This shirt is comfortable, true to size and looks really nice on.",
Lisa,Perfect fit,https://www.amazon.com/gp/customer-reviews/RB6JZ2KZ5FXFH/ref=cm_cr_getr_d_rvw_ttl?ie=UTF8&ASIN=B0DDXV6G1C,"5.0 "," the United States "," January 3, 2025",Color: BlackSize: Large,Verified Purchase,"I bought this for my husband (he works out quite a bit) and it was a perfect fit. The neck was too tight but that was ok because he didn't need to close it. He was happy with the fit, color and material.",
Danielle burger,Fits good,https://www.amazon.com/gp/customer-reviews/R2VJMFVG47JB1K/ref=cm_cr_getr_d_rvw_ttl?ie=UTF8&ASIN=B0DDXV6G1C,"5.0 "," the United States "," January 1, 2025",Color: Denim BlueSize: Medium,Verified Purchase,My boyfriend is a size medium but he has problem with the button in the chest. This shirt didn't do that. He look very good it in. I will be buying more colors for him I would just buy it. He will like it.,
KG1,Leaves were too short,https://www.amazon.com/gp/customer-reviews/R3IL4NVN6U3UT4/ref=cm_cr_getr_d_rvw_ttl?ie=UTF8&ASIN=B0DDXV6G1C,"3.0 "," the United States "," December 27, 2024",,Verified Purchase,The shirt itself was okay but the sleeves were way too short for an extra large shirt,
eric romestant,Great shirt,https://www.amazon.com/gp/customer-reviews/R9L9NQ98A7DTR/ref=cm_cr_getr_d_rvw_ttl?ie=UTF8&ASIN=B0DDXV6G1C,"5.0 "," the United States "," December 23, 2024",,Verified Purchase,Nothing,
Julian Gutierrez,Perfect,https://www.amazon.com/gp/customer-reviews/R1TVP2DOA9FOSF/ref=cm_cr_getr_d_rvw_ttl?ie=UTF8&ASIN=B0DDXV6G1C,"5.0 "," the United States "," December 19, 2024",Color: BlackSize: Large,Verified Purchase,The shirt fit perfectly I will definitely buy another. It’s a shirt that I will recommend,
Jack,Very nice shirt 👕,https://www.amazon.com/gp/customer-reviews/R8KFZGREZUJ8Z/ref=cm_cr_getr_d_rvw_ttl?ie=UTF8&ASIN=B0DDXV6G1C,"5.0 "," the United States "," December 17, 2024",Color: WhiteSize: Large,Verified Purchase,Good material,
Tami Anderson,Shirt,https://www.amazon.com/gp/customer-reviews/R16FLUXDEWW2ZA/ref=cm_cr_getr_d_rvw_ttl?ie=UTF8&ASIN=B0DDXV6G1C,"3.0 "," the United States "," December 16, 2024",Color: WhiteSize: Large,Verified Purchase,Good stretch to it but has a weird fishy smell,
Great ramps but i didn’t get any straps !!!,This shirt is very comfortable,https://www.amazon.com/gp/customer-reviews/R7YDIO37OUPC4/ref=cm_cr_getr_d_rvw_ttl?ie=UTF8&ASIN=B0DDXV6G1C,"5.0 "," the United States "," December 16, 2024",Color: Light KhakiSize: Medium,Verified Purchase,I ware it for a church Christmas party and got many compliments,2
Larry E.,Fits Good but…….,https://www.amazon.com/gp/customer-reviews/R3JU9Z6GKGTSZU/ref=cm_cr_getr_d_rvw_ttl?ie=UTF8&ASIN=B0DDXV6G1C,"4.0 "," the United States "," December 16, 2024",Color: Denim BlueSize: Medium,Verified Purchase,Top button fell off shirt taking it out of the package. Overall I like the shirt and fits well,
Scott Finnan,Great fit,https://www.amazon.com/gp/customer-reviews/R3OG8ACEHU2KT9/ref=cm_cr_getr_d_rvw_ttl?ie=UTF8&ASIN=B0DDXV6G1C,"5.0 "," the United States "," December 15, 2024",Color: RedSize: Medium,Verified Purchase,I’m 5’11 195lbs with a muscular build and purchased a medium size. Finally found a high quality shirt that accentuates my build. Love the stretchiness of these shirts which make them very comfortable to wear.  Great value for the money!,
Roxanne Franklin,Dress shirt,https://www.amazon.com/gp/customer-reviews/R1DDQ02MBB4ZYH/ref=cm_cr_getr_d_rvw_ttl?ie=UTF8&ASIN=B0DDXV6G1C,"2.0 "," the United States "," December 15, 2024",Color: BlackSize: 3X-Large,Verified Purchase,"First, when opened this item smelled terrible, it lost the terrible smell when aired. Second this shirt, meant for a single  man can be washed but not dryed with dryer.  He may get one wear but I  doubt more",
Anton Harmon,Great fit,https://www.amazon.com/gp/customer-reviews/RGZNCP59CUCZY/ref=cm_cr_getr_d_rvw_ttl?ie=UTF8&ASIN=B0DDXV6G1C,"4.0 "," the United States "," December 13, 2024",Color: BlackSize: X-Large,Verified Purchase,Smooth,
Herbert Mendenhall,Stretching Shirt.,https://www.amazon.com/gp/customer-reviews/R2LXXNFXBFF4JR/ref=cm_cr_getr_d_rvw_ttl?ie=UTF8&ASIN=B0DDXV6G1C,"5.0 "," the United States "," December 13, 2024",Color: GreenSize: Medium,Verified Purchase,I like the quality and I bought a medium and I am 6 foot 173 lbs. It would look even better if my arms were bigger.  I would but again with more colors.,
John,Nice shirt for any occasion,https://www.amazon.com/gp/customer-reviews/R29OEEYUH7S8N1/ref=cm_cr_getr_d_rvw_ttl?ie=UTF8&ASIN=B0DDXV6G1C,"5.0 "," the United States "," December 12, 2024",Color: WhiteSize: Large,Verified Purchase,The fit and quality of shirt is great. White is more like a light ivory still white but not quite.,
Muskyman,Great Fit!,https://www.amazon.com/gp/customer-reviews/R2VWRR3Z9M120F/ref=cm_cr_getr_d_rvw_ttl?ie=UTF8&ASIN=B0DDXV6G1C,"5.0 "," the United States "," December 11, 2024",Color: Light KhakiSize: X-Large,Verified Purchase,"Great fit! Snug on the shoulders, chest and arms semi snug in the midsection",
Nick,Too Loose!,https://www.amazon.com/gp/customer-reviews/RXIKFX3QTSCA4/ref=cm_cr_getr_d_rvw_ttl?ie=UTF8&ASIN=B0DDXV6G1C,"1.0 "," the United States "," December 11, 2024",Color: RedSize: Small,Verified Purchase,"This is supposed to be a fitted shirt, hence the elastic material. I bought a small, which is the smallest size available. I am 5’9” and 165lbs, so not a huge guy, but not the smallest dude in the world either. This thing was super loose on me. Cannot understand how they make sizes up to XXL. You basically have to be 6’0” and 200 pounds to fit into a small the way the model does in the advertisement.",9
Emmanuel R.,Awesome shirts,https://www.amazon.com/gp/customer-reviews/R1PDUMKQYO7A98/ref=cm_cr_getr_d_rvw_ttl?ie=UTF8&ASIN=B0DDXV6G1C,"5.0 "," the United States "," December 11, 2024",Color: WhiteSize: X-Large,Verified Purchase,Very soft and the quality is amazing. Bang for your buck. Color and size are perfect. Highly recommend them.,
Chad Cain,Not wrinkle free,https://www.amazon.com/gp/customer-reviews/R3RSLOR5PXXIJ6/ref=cm_cr_getr_d_rvw_ttl?ie=UTF8&ASIN=B0DDXV6G1C,"2.0 "," the United States "," December 10, 2024",Color: Light GreySize: X-Large,Verified Purchase,Shirt feels great but material is like a wearable latex feeling. Definitely not wrinkle free like it states. Will keep the shorts I have but not order more.,
Amazon Customer,Fit,https://www.amazon.com/gp/customer-reviews/R3JPJ6OC3FAYZM/ref=cm_cr_getr_d_rvw_ttl?ie=UTF8&ASIN=B0DDXV6G1C,"4.0 "," the United States "," December 8, 2024",Color: Denim BlueSize: Medium,Verified Purchase,If you teeter on large and medium you will want a medium. The large is too big.,2
Amazon Customer,All colors are not equal,https://www.amazon.com/gp/customer-reviews/RKA3J4GMF650X/ref=cm_cr_getr_d_rvw_ttl?ie=UTF8&ASIN=B0DDXV6G1C,"3.0 "," the United States "," December 8, 2024",Color: Light GreySize: Medium,Verified Purchase,"Fits nice, feels nice, and every color I have looks nice, except white. The 1st white I received was stained pale yellow. I returned and ordered a new one. The yellow was much less noticeable but it's still not true white. Sad because I like the fit, look and feel of these shirts..",
Dennis Brumfield,Nice fit,https://www.amazon.com/gp/customer-reviews/R2IIPPB0I7AV6B/ref=cm_cr_getr_d_rvw_ttl?ie=UTF8&ASIN=B0DDXV6G1C,"5.0 "," the United States "," December 8, 2024",Color: Olive GreenSize: X-Large,Verified Purchase,Fits as described,
Nelson D Delacruz,Material and color,https://www.amazon.com/gp/customer-reviews/RBBWJ7NDXSZI2/ref=cm_cr_getr_d_rvw_ttl?ie=UTF8&ASIN=B0DDXV6G1C,"4.0 "," the United States "," December 7, 2024",Color: RedSize: XX-Large,Verified Purchase,It’s a soft and elastic very nice texture. Very brilliant color. Intense red.Bright,
leonardo alvernia,Excelente,https://www.amazon.com/gp/customer-reviews/R3W0LW4AQMWCYH/ref=cm_cr_getr_d_rvw_ttl?ie=UTF8&ASIN=B0DDXV6G1C,"5.0 "," the United States "," December 3, 2024",Color: BlackSize: Small,Verified Purchase,"Fresca y realmente elástica, buena apariencia,  cumplió míos expectativas",3
Amazon Customer,Great fit,https://www.amazon.com/gp/customer-reviews/R25FLIVA0FX8IW/ref=cm_cr_getr_d_rvw_ttl?ie=UTF8&ASIN=B0DDXV6G1C,"5.0 "," the United States "," December 3, 2024",Color: Navy BlueSize: X-Large,Verified Purchase,It’s really hard finding shirts that fit my husbands shoulders and then narrow at the waist. This shirt does both and looks great.,
Kindle Customer,Great shirt,https://www.amazon.com/gp/customer-reviews/RRVYKRF3N09YR/ref=cm_cr_getr_d_rvw_ttl?ie=UTF8&ASIN=B0DDXV6G1C,"5.0 "," the United States "," December 2, 2024",Color: Denim BlueSize: Large,Verified Purchase,One of the best,
Derek,Great Shirt,https://www.amazon.com/gp/customer-reviews/R19MS9AIDJ0PB7/ref=cm_cr_getr_d_rvw_ttl?ie=UTF8&ASIN=B0DDXV6G1C,"5.0 "," the United States "," December 1, 2024",Color: BlackSize: Large,Verified Purchase,"Great shirt, great price. It’s super comfortable, washability is easy, stretchy ness is a 10, and fits the body well. It won’t make you buff but you will feel good wearing it. I’ll be buying more colors. Size is accurate. I’m always a large at 5’11” and 205",3
Ron B.,Nice dress shirt,https://www.amazon.com/gp/customer-reviews/RO959VK5RP7LY/ref=cm_cr_getr_d_rvw_ttl?ie=UTF8&ASIN=B0DDXV6G1C,"5.0 "," the United States "," November 29, 2024",,Verified Purchase,Great fit,
clover2010,Not a fitted shirt,https://www.amazon.com/gp/customer-reviews/RM5TT0P4LHN03/ref=cm_cr_getr_d_rvw_ttl?ie=UTF8&ASIN=B0DDXV6G1C,"1.0 "," the United States "," November 26, 2024",Color: WhiteSize: Small,Verified Purchase,"This is a shirt for overweight people or men on steroids. I’m a very fit 5’ 8” man, and the size small is still way too big on me.",2
Paul,Fit and style.,https://www.amazon.com/gp/customer-reviews/R3R7PGRRDA1L4T/ref=cm_cr_getr_d_rvw_ttl?ie=UTF8&ASIN=B0DDXV6G1C,"5.0 "," the United States "," November 25, 2024",Color: BlackSize: Medium,Verified Purchase,"The shirt fits perfectly.  My girlfriend loves the look.  If she's happy, I'm happy.  Going to get the other colors.",
Samantha,Must have for bodybuilders,https://www.amazon.com/gp/customer-reviews/R2U6VTMOTRO5RO/ref=cm_cr_getr_d_rvw_ttl?ie=UTF8&ASIN=B0DDXV6G1C,"5.0 "," the United States "," November 16, 2024",Color: BlackSize: XX-Large,Verified Purchase,"My husband is a body builder with very wide back and small wait, huge arms and shoulders, it is a pain to shop for him. These fit perfect due t the stretch. Great quality for the price. Will be ordering more",
Felisa Howie,5’11” 215lbs,https://www.amazon.com/gp/customer-reviews/R166RUPJZPKRX1/ref=cm_cr_getr_d_rvw_ttl?ie=UTF8&ASIN=B0DDXV6G1C,"5.0 "," the United States "," November 15, 2024",Color: Light KhakiSize: X-Large,Verified Purchase,Love the feel of the shirt fits great in shoulders and chest! Will buy another.,
