标题,详情
Women's 2 Piece Blazer Outfits Sleeveless Crewneck Vest Wide Leg Pantsuit 2025 Dressy Casual Work Sets,"Fabric: Womens suit vest and pants set is crafted from soft, cozy, flowy and breathable fabric, ensuring a comfortable and friendly touch against your skin. This matching set contains a crew neck button down blazer vest and wide leg pants."
Women's 2 Piece Blazer Outfits Sleeveless Crewneck Vest Wide Leg Pantsuit 2025 Dressy Casual Work Sets,"Design: Womens suits 2 piece set features a classic round neck design, loose fit suitable for all body types, and slit hem ensures a slim and neat look, enhancing femininity. The palazzo pants keep you luxurious and comfortable all day long."
Women's 2 Piece Blazer Outfits Sleeveless Crewneck Vest Wide Leg Pantsuit 2025 Dressy Casual Work Sets,"Match: Vest and pants set women is a must-have in wardrobe. The blazer set is easily paired with casual shoes, heels, sneakers, different handbags and jewelry, or worn separately and mixed with your other clothes, creating a personalized fashion"
Women's 2 Piece Blazer Outfits Sleeveless Crewneck Vest Wide Leg Pantsuit 2025 Dressy Casual Work Sets,"Occasions: Whether in formal, semi-formal or casual occasions, our pantsuit for women dressy casual is the ideal attire. It is suitable for business, work, office, church, weddings, and also airport, travel, beach, going out, parties, clubs, etc."
Women's 2 Piece Blazer Outfits Sleeveless Crewneck Vest Wide Leg Pantsuit 2025 Dressy Casual Work Sets,"Size Guide: This linen vest set has six sizes, ensuring a good fit for women of all shapes. Please refer to our detailed size chart before ordering. Womens 2 piece outfits summer are machine washable in cold water. Low iron. Do not bleach."
Women's 2 Piece Blazer Outfits Sleeveless Crewneck Vest Wide Leg Pantsuit 2025 Dressy Casual Work Sets,
