评论用户,评论概述,评论链接,星级评分,评论地点,评论时间,类型,是否购买,评论详情,觉得该评论有帮助的人数
Anna-Claire,Cute and chic!,https://www.amazon.com/gp/customer-reviews/R3I0PW4XEO9LJU/ref=cm_cr_getr_d_rvw_ttl?ie=UTF8&ASIN=B0CB67X4BW,"5.0 "," the United States "," December 22, 2024",Color: Gold,Verified Purchase,"These earrings are great. Easy way to jazz up a simple outfit. They're on the heavy side so if you have sensitive ears I would look elsewhere, but they're great to put on for a special occasion. Looks expensive and giving 80s.",
Patricia faison,Beautiful,https://www.amazon.com/gp/customer-reviews/R30QPX22WNV37M/ref=cm_cr_getr_d_rvw_ttl?ie=UTF8&ASIN=B0CB67X4BW,"5.0 "," the United States "," August 22, 2024",Color: Gold,Verified Purchase,Looks expensive,
Diana,Beautiful but didn’t last long,https://www.amazon.com/gp/customer-reviews/R2DYB48YMJ7CZZ/ref=cm_cr_getr_d_rvw_ttl?ie=UTF8&ASIN=B0CB67X4BW,"3.0 "," the United States "," July 31, 2024",Color: Gold,Verified Purchase,They are so beautiful I almost want to repurchase them but they are made very cheap :( I only wore them twice. The back of the earring that goes through the ear broke right off,
leeha unique,BEAUTIFUL!,https://www.amazon.com/gp/customer-reviews/R37SQNBJ1JPR70/ref=cm_cr_getr_d_rvw_ttl?ie=UTF8&ASIN=B0CB67X4BW,"5.0 "," the United States "," July 22, 2024",,,"Gold square stud earrings are the epitome of understated elegance, and the pair I recently acquired has quickly become a staple in my jewelry collection. Their minimalist design and timeless appeal make them a versatile accessory suitable for various occasions. One of the standout qualities of these earrings is their versatility. The clean lines and classic design make them suitable for both everyday wear and special occasions. Whether paired with casual attire or formal dress, these earrings effortlessly add a touch of sophistication and refinement to any ensemble.",
JanD,Like the shape of these earrings,https://www.amazon.com/gp/customer-reviews/R1RBMKFJPRDUSS/ref=cm_cr_getr_d_rvw_ttl?ie=UTF8&ASIN=B0CB67X4BW,"3.0 "," the United States "," July 13, 2024",,,"These earrings have a very appealing shape. They are very lightweight. The quality of the earrings are okay. There are some slight imperfections such as a few tiny scratches and bubbles in the finish of one of the earrings. Regardless,  I like these and will wear them. The imperfections in the finish on the one earring is not noticeable when wearing them.",
Jaidaa,Cute earings,https://www.amazon.com/gp/customer-reviews/RZ4KZRNTN7JME/ref=cm_cr_getr_d_rvw_ttl?ie=UTF8&ASIN=B0CB67X4BW,"5.0 "," the United States "," July 5, 2024",Color: Croissant,,"Oh, these earings are so cute. Gold is so shiny and looks very expensive but I hate the packaging.",
shopper9876,LOVE these!!,https://www.amazon.com/gp/customer-reviews/R1WQ17EDXWU09V/ref=cm_cr_getr_d_rvw_ttl?ie=UTF8&ASIN=B0CB67X4BW,"5.0 "," the United States "," June 12, 2024",,Verified Purchase,These earrings are so cute!  They aren’t terribly heavy.  I wear them all the time!  Looks great with hair up or down.,
Cierra Swanson,"Absolutely stunning, but made my ears bleed",https://www.amazon.com/gp/customer-reviews/R3R8JTIUWQB9V3/ref=cm_cr_getr_d_rvw_ttl?ie=UTF8&ASIN=B0CB67X4BW,"3.0 "," the United States "," May 27, 2024",Color: Gold,Verified Purchase,"These earrings are so so cute. After wearing them for about 10 hours, they made my ears bleed :( I’m still going to wear them, but just for short periods of time.",
NotYourBusiness,Lovely But A Little Heavy,https://www.amazon.com/gp/customer-reviews/R25AOMCIX3C9VO/ref=cm_cr_getr_d_rvw_ttl?ie=UTF8&ASIN=B0CB67X4BW,"4.0 "," the United States "," April 23, 2024",Color: Croissant,,"These earrings are classic and really beautiful. I would give them five stars for aesthetics but I have to take off one star because they're a medium weight: not so uncomfortable that I can't wear them for a day, but I definitely notice they're there. I probably wouldn't wear these two days in a row because of the weight.",
Rachel Beal,Too big,https://www.amazon.com/gp/customer-reviews/R364E14F6JCDWW/ref=cm_cr_getr_d_rvw_ttl?ie=UTF8&ASIN=B0CB67X4BW,"2.0 "," the United States "," February 29, 2024",Color: Gold,Verified Purchase,"They look funky, thought they would be smaller",
Amanda,Beautiful,https://www.amazon.com/gp/customer-reviews/R38IS2H6AO5SA1/ref=cm_cr_getr_d_rvw_ttl?ie=UTF8&ASIN=B0CB67X4BW,"5.0 "," the United States "," January 30, 2024",Color: Gold,Verified Purchase,Get so many compliments,
Dana G.,Too heavy,https://www.amazon.com/gp/customer-reviews/R3HQWI0JN3OZC7/ref=cm_cr_getr_d_rvw_ttl?ie=UTF8&ASIN=B0CB67X4BW,"3.0 "," the United States "," January 24, 2024",,Verified Purchase,I liked these earrings but it was too heavy and big for my ears unfortunately,
Connie,Stylish,https://www.amazon.com/gp/customer-reviews/R3CCEI9REIWUK8/ref=cm_cr_getr_d_rvw_ttl?ie=UTF8&ASIN=B0CB67X4BW,"5.0 "," the United States "," January 17, 2024",Color: Rectangle,Verified Purchase,"I love these earrings. They are a little large, but not heavy. They definielty make a statement.",
Garrett Marshall,Bad Seller,https://www.amazon.com/gp/customer-reviews/R1FGG44ON5C2R5/ref=cm_cr_getr_d_rvw_ttl?ie=UTF8&ASIN=B0CB67X4BW,"1.0 "," the United States "," January 7, 2024",,Verified Purchase,"Only received one earring..  My Mom ordered these for me for Christmas and the second time I put them in, one of the backs broke completely off in my ear. I ordered them again and only received one earring.",
Katie W.,Light weight and secure,https://www.amazon.com/gp/customer-reviews/R1XGJO1IJL2DLN/ref=cm_cr_getr_d_rvw_ttl?ie=UTF8&ASIN=B0CB67X4BW,"1.0 "," the United States "," January 7, 2024",Color: Gold,Verified Purchase,Heavy and the back won’t stay on,
Tyler Boston,Super Big,https://www.amazon.com/gp/customer-reviews/R2J7TGDS39ZRDO/ref=cm_cr_getr_d_rvw_ttl?ie=UTF8&ASIN=B0CB67X4BW,"3.0 "," the United States "," January 6, 2024",Color: Gold,Verified Purchase,Didn’t realize how big they really were. But they  ended up growing on me,
Andrea Hall,Good,https://www.amazon.com/gp/customer-reviews/R2MC4MFYOT3WP8/ref=cm_cr_getr_d_rvw_ttl?ie=UTF8&ASIN=B0CB67X4BW,"4.0 "," the United States "," December 5, 2023",Color: Gold,Verified Purchase,"A little heavy after a while, but gorgeous",
Andrea Lynne Rose,Love these!,https://www.amazon.com/gp/customer-reviews/RFHQVJU4XLA5M/ref=cm_cr_getr_d_rvw_ttl?ie=UTF8&ASIN=B0CB67X4BW,"5.0 "," the United States "," November 6, 2023",,Verified Purchase,"Although these earrings are large statement earrings, they are not heavy at all! I really enjoy wearing these to add just a little bit more of a polished look to my outfits.",
M G M,Gorgeous,https://www.amazon.com/gp/customer-reviews/R294C175NHGOV2/ref=cm_cr_getr_d_rvw_ttl?ie=UTF8&ASIN=B0CB67X4BW,"5.0 "," the United States "," October 4, 2023",Color: Gold,Verified Purchase,They look great with my outfit,
Janu Mora,Perfecto,https://www.amazon.com/gp/customer-reviews/REA0DWDQX6WIH/ref=cm_cr_getr_d_rvw_ttl?ie=UTF8&ASIN=B0CB67X4BW,"5.0 "," the United States "," September 15, 2023",Color: Gold,Verified Purchase,Súper bonito un tamaño adecuado para mi gusto,
Melissa T,The Most Perfect Earrings,https://www.amazon.com/gp/customer-reviews/R111LS8D94RP72/ref=cm_cr_getr_d_rvw_ttl?ie=UTF8&ASIN=B0CB67X4BW,"5.0 "," the United States "," September 11, 2023",Color: Gold,Verified Purchase,I’m so glad I ended up purchasing these as I was hesitant on the quality. These look expensive and aren’t too heavy on the ears. They make every outfit look 100x better.,
Escarlyn,Stunning 🤩,https://www.amazon.com/gp/customer-reviews/R1MR5I958ORZE5/ref=cm_cr_getr_d_rvw_ttl?ie=UTF8&ASIN=B0CB67X4BW,"5.0 "," the United States "," August 14, 2023",Color: Gold,,"For a while i was looking for these earrings in this shape and size, im so happy that i found these because they’re perfect. The look elegant and sophisticated. They’re a little heavy but i find them complete. Quality is very good. For me these are 10/10.",
Mat3004,Stunning earrings,https://www.amazon.com/gp/customer-reviews/R2WRVN3VP9L52O/ref=cm_cr_getr_d_rvw_ttl?ie=UTF8&ASIN=B0CB67X4BW,"5.0 "," the United States "," August 3, 2023",Color: Gold,,"These earrings make you look classy and elegant. They elevated my confidence and most importantly, they look good with every outfit. I loved these, I highly recommend them.",
Liliana Pineda,Lovely pair!,https://www.amazon.com/gp/customer-reviews/R14FSEK0UDDD1E/ref=cm_cr_getr_d_rvw_ttl?ie=UTF8&ASIN=B0CB67X4BW,"5.0 "," the United States "," June 12, 2023",Color: Gold,Verified Purchase,Not too heavy and look amazing!,
Nicole H.,Just Adorable !,https://www.amazon.com/gp/customer-reviews/R231YLA2QY1DRN/ref=cm_cr_getr_d_rvw_ttl?ie=UTF8&ASIN=B0CB67X4BW,"5.0 "," the United States "," May 27, 2023",,,"I just read an article about what’s hot for 2023 in the jewelry department & geometric shapes was on the list so I jumped on these when I saw them. They’re cute as can be, lightweight & look fantastic w/ almost everything. I’m so excited to wear these !",
LV,,https://www.amazon.com/hz/reviews-render/report-review?ie=UTF8&ref=cm_cr_getr_d_rvw_hlp&csrfT=hDwC3ZXiOCMVDKQKbXRNmrHlCbikF%2BU0E6TFsXaiMbTYAAAAAGeXO58AAAAB&reviewId=R3QHB0UDLQLN28,"2.0 "," Canada "," January 13, 2024",,Verified Purchase,The earrings keep falling out of my ears.,
