评论用户,评论概述,评论链接,星级评分,评论地点,评论时间,类型,是否购买,评论详情,觉得该评论有帮助的人数
Susan M Spooner,i love the flat back screw posts,https://www.amazon.com/gp/customer-reviews/RZ94DFEBPVGW7/ref=cm_cr_getr_d_rvw_ttl?ie=UTF8&ASIN=B0BH19JP14,"5.0 "," the United States "," October 25, 2024",Color: Duck,Verified Purchase,"The duckies are adorable, very high quality, and most of all I love the flat back screw on posts. I could sleep in these.",
Robin,Cute but small,https://www.amazon.com/gp/customer-reviews/R1ILIXHCENVINC/ref=cm_cr_getr_d_rvw_ttl?ie=UTF8&ASIN=B0BH19JP14,"2.0 "," the United States "," August 5, 2024",Color: Duck,Verified Purchase,Cute but small,
Manessah Nieves,Adorable,https://www.amazon.com/gp/customer-reviews/R1DK25NENGPFLB/ref=cm_cr_getr_d_rvw_ttl?ie=UTF8&ASIN=B0BH19JP14,"5.0 "," the United States "," July 9, 2024",Color: Duck,Verified Purchase,The earrings are so adorable! Thanks,
Mel,Duck earrings,https://www.amazon.com/gp/customer-reviews/R9SK2FGUWYNA1/ref=cm_cr_getr_d_rvw_ttl?ie=UTF8&ASIN=B0BH19JP14,"5.0 "," the United States "," June 27, 2024",Color: Duck,Verified Purchase,Super comfortable and love the back.  The backs are flat so they don’t dig into your skin.  Easy to get on and off.  Plus they are super cute.,
Marlene,Keep an eye on the backings,https://www.amazon.com/gp/customer-reviews/R36Q5P0597I7HR/ref=cm_cr_getr_d_rvw_ttl?ie=UTF8&ASIN=B0BH19JP14,"3.0 "," the United States "," January 5, 2024",Color: Duck,Verified Purchase,"Cute earrings, but the flat screw backing does not secure sufficiently the post (not enough depth or even enough rotations).  Though I check them daily, I found that today, the backing had come loose and the earring fell out.  Good thing I was sedentary, else I’d not have noticed or found both earring parts.  Won’t buy earrings with that flat type of screw backing ever again.",3
Dave Jordan,So pretty in person!,https://www.amazon.com/gp/customer-reviews/R1IB2NGA39ACD6/ref=cm_cr_getr_d_rvw_ttl?ie=UTF8&ASIN=B0BH19JP14,"4.0 "," the United States "," August 13, 2023",Color: Hummingbird,,"These are so pretty. I was excited that these have flat backs, however, the hummingbird's beak if very sharp so sleeping in them was a no-go.  The other thing i didnt love is that both earring face the same way which I find to be a little odd... in fairness, that is how they are pictured, I just didnt really notice until I saw them on.",
Amy Joy,Sweet and Dainty Earrings,https://www.amazon.com/gp/customer-reviews/R20VW8GNFI9GYS/ref=cm_cr_getr_d_rvw_ttl?ie=UTF8&ASIN=B0BH19JP14,"5.0 "," the United States "," July 7, 2023",Color: Hummingbird,,"Very cute little hummingbird earrings in sweet colors. The quality is good for the price. The most noteworthy feature is the backs which screw on, making this a good choice for children's pierced ears, or anyone who likes dainty earrings that they won't lose while wearing them.",
