评论用户,评论概述,评论链接,星级评分,评论地点,评论时间,类型,是否购买,评论详情,觉得该评论有帮助的人数
Ysabel,Me encantaron,https://www.amazon.com/gp/customer-reviews/R2VGBOOIGTOGEZ/ref=cm_cr_getr_d_rvw_ttl?ie=UTF8&ASIN=B0CNW2SR9Z,"5.0 "," the United States "," January 9, 2025",Color: Pink,Verified Purchase,De mucha utilidad de hecho yo les estampe mi logo.,
Graceful Rose,Perfect for gifting,https://www.amazon.com/gp/customer-reviews/R1BLISANZ91IW2/ref=cm_cr_getr_d_rvw_ttl?ie=UTF8&ASIN=B0CNW2SR9Z,"5.0 "," the United States "," November 9, 2024",Color: Beige,Verified Purchase,"These bags are perfect for gifting jewelry! Not only are they functional in keeping necklaces from tangling, they also protect against tarnishing.",
Maria Zambrano,Happy,https://www.amazon.com/gp/customer-reviews/RKTKLN19KOYTT/ref=cm_cr_getr_d_rvw_ttl?ie=UTF8&ASIN=B0CNW2SR9Z,"5.0 "," the United States "," September 15, 2024",Color: Fresh Color,Verified Purchase,I like it 👌,
Claire T,Inconsistent Quality,https://www.amazon.com/gp/customer-reviews/R2XEW82EMLW2GM/ref=cm_cr_getr_d_rvw_ttl?ie=UTF8&ASIN=B0CNW2SR9Z,"3.0 "," the United States "," April 30, 2024",Color: Fresh Color,Verified Purchase,"This is the second time I have purchased these, and the quality was very different. The first time I purchased a mix of colors and they were very nice, high quality. The second time I purchased just the pink thinking they were the same product and they are not, they are thinner, strings having off, and the polishing cloths are hard and stuck together. Not at all the same quality, so very disappointing.",2
Luisa,Súper bonito y prácticos,https://www.amazon.com/gp/customer-reviews/R18I4VIGLMKC25/ref=cm_cr_getr_d_rvw_ttl?ie=UTF8&ASIN=B0CNW2SR9Z,"5.0 "," the United States "," April 11, 2024",Color: Fresh Color,Verified Purchase,"Cada bolsita tiene su pañito, muy buena inversión para negocio",
Andrea González,Rápido y el producto esperado,https://www.amazon.com/gp/customer-reviews/R2K07YF0AYXOBP/ref=cm_cr_getr_d_rvw_ttl?ie=UTF8&ASIN=B0CNW2SR9Z,"5.0 "," the United States "," February 26, 2024",Color: Black,Verified Purchase,"Las bolsas llegaron tal cual las especificaciones, el envío rápido, lo recomiendo y volveré a comprar",
Génesis,Me encantaron,https://www.amazon.com/gp/customer-reviews/R3AEF0RZYOZTA3/ref=cm_cr_getr_d_rvw_ttl?ie=UTF8&ASIN=B0CNW2SR9Z,"5.0 "," the United States "," November 25, 2023",Color: gray,Verified Purchase,Están perfectos,
Marisol Rose,Bonitas y prácticas,https://www.amazon.com/gp/customer-reviews/R2IJGPRBD5O9G4/ref=cm_cr_getr_d_rvw_ttl?ie=UTF8&ASIN=B0CNW2SR9Z,"5.0 "," the United States "," October 12, 2023",Color: Fresh Color,Verified Purchase,El tamaño de estas bolsitas para guardar tus joyas es perfecto y los colores me encantaron.,
Amanda C,very good quality for the price!,https://www.amazon.com/gp/customer-reviews/R3O5SJJ0UKG2SL/ref=cm_cr_getr_d_rvw_ttl?ie=UTF8&ASIN=B0CNW2SR9Z,"5.0 "," the United States "," June 28, 2023",Color: gray,Verified Purchase,very good quality for the price!,
Paola,,https://www.amazon.com/hz/reviews-render/report-review?ie=UTF8&ref=cm_cr_getr_d_rvw_hlp&csrfT=hPtT8AStBCEvVQXzfO8GrIH%2BsuBOvkF6jV%2BTtVK0CCQGAAAAAGebgEUAAAAB&reviewId=R3VUE43BYQPNVQ,"4.0 "," Mexico "," July 19, 2024",Color: Black,Verified Purchase,"Las bolsas están muy bien elaboradas, si traen un dobles pero es normal por el peso y por el empaque... El paño no es el adecuado para limpiar, no limpio la prueba que hice",
Taji08,,https://www.amazon.com/hz/reviews-render/report-review?ie=UTF8&ref=cm_cr_getr_d_rvw_hlp&csrfT=hBApxMciMJWdJm7%2FjKPNQR4p4MceK5%2BAX7m3WqYNv9%2BfAAAAAGebgEoAAAAB&reviewId=R3KAMG1GZ1FX9A,"5.0 "," Canada "," March 10, 2024",Color: Fresh Color,Verified Purchase,Most of my clients like the pink color😁,
Hamza alabbas,,https://www.amazon.com/hz/reviews-render/report-review?ie=UTF8&ref=cm_cr_getr_d_rvw_hlp&csrfT=hBHwgIOjr7UOp2uSdl4dQ0%2F%2FkE6bEI3VXv1SWYYGM88MAAAAAGebgEoAAAAB&reviewId=R3KHOZW42FS68S,"1.0 "," the United Arab Emirates "," December 12, 2023",Color: Beige,Verified Purchase,لم يصل المنتج بعد الانتظار شهر كامل,
