评论用户,评论概述,评论链接,星级评分,评论地点,评论时间,类型,是否购买,评论详情,觉得该评论有帮助的人数
Candice Hill,Great until washed,https://www.amazon.com/gp/customer-reviews/RZOQNAT1SK8JW/ref=cm_cr_getr_d_rvw_ttl?ie=UTF8&ASIN=B0CJ2KZC32,"2.0 "," the United States "," January 25, 2025",Color: Jet BlackSize: Small,Verified Purchase,Very similar feel compared to GB however after two gentle machine wash cycles fabric did not stand a chance. The tiny broken fiber knots developed on the shirt quickly.,
Shoe lover,Love!!,https://www.amazon.com/gp/customer-reviews/R2V35R7QK1PZWC/ref=cm_cr_getr_d_rvw_ttl?ie=UTF8&ASIN=B0CJ2KZC32,"5.0 "," the United States "," January 17, 2025",Color: RubySize: Large,Verified Purchase,"Super soft buttery fabric and double lined, very flattering material and v neck cut",
Nena,I love love love.,https://www.amazon.com/gp/customer-reviews/R17AV4SEIJZWT6/ref=cm_cr_getr_d_rvw_ttl?ie=UTF8&ASIN=B0CJ2KZC32,"5.0 "," the United States "," January 8, 2025",Color: Splashed WhiteSize: Large,,The quality is amazing. It’s thick and comfortable and true to size. I wear it under my scrubs to stay warm and get lots of compliments.,
KD,The best quality,https://www.amazon.com/gp/customer-reviews/R30AGJE4QV45FG/ref=cm_cr_getr_d_rvw_ttl?ie=UTF8&ASIN=B0CJ2KZC32,"5.0 "," the United States "," December 29, 2024",Color: Jet BlackSize: Large,Verified Purchase,Love this brand. All of their stuff has great quality material and is so comfortable. True to size. I’m a larger bust and L fits great. Decent compression but not super tight. True to color. Washes great but I do hang dry to avoid piling.,
Katrina K,Great top,https://www.amazon.com/gp/customer-reviews/R3K3C3HHH8B6BS/ref=cm_cr_getr_d_rvw_ttl?ie=UTF8&ASIN=B0CJ2KZC32,"5.0 "," the United States "," December 21, 2024",Color: Jet BlackSize: Medium,Verified Purchase,"Great quality, fits well, I’d recommend!",
KIngram,Love the fit!  Prone to lint.,https://www.amazon.com/gp/customer-reviews/R2P6HOALE96C9I/ref=cm_cr_getr_d_rvw_ttl?ie=UTF8&ASIN=B0CJ2KZC32,"4.0 "," the United States "," December 15, 2024",Color: Jet BlackSize: Medium,Verified Purchase,Perfect for what I needed. Fabric is prone to lint and fuzz but otherwise fabulous.,
maricela sierra,Comodidad. Funcional,https://www.amazon.com/gp/customer-reviews/RANJAT77FRDLZ/ref=cm_cr_getr_d_rvw_ttl?ie=UTF8&ASIN=B0CJ2KZC32,"5.0 "," the United States "," December 9, 2024",Color: TaffySize: Medium,Verified Purchase,Puedo usar como quiero: un vestido de escotes precioso. Me sirve para no mostrar la piel.,
Wonder Woman,Stylish and comfortable,https://www.amazon.com/gp/customer-reviews/R3LSA3RMHOEXWL/ref=cm_cr_getr_d_rvw_ttl?ie=UTF8&ASIN=B0CJ2KZC32,"5.0 "," the United States "," November 30, 2024",Color: MarsalaSize: Large,Verified Purchase,Great color great fit & comfortable. Love the neckline,
Elise Grace,Cheap materials,https://www.amazon.com/gp/customer-reviews/R511YDKXT3LI6/ref=cm_cr_getr_d_rvw_ttl?ie=UTF8&ASIN=B0CJ2KZC32,"2.0 "," the United States "," November 27, 2024",Color: RubySize: Small,Verified Purchase,Cute and flattering but wears out quickly after a few washes,
SF,Super soft and comfortable,https://www.amazon.com/gp/customer-reviews/R3O68L5S8WJ4RD/ref=cm_cr_getr_d_rvw_ttl?ie=UTF8&ASIN=B0CJ2KZC32,"5.0 "," the United States "," November 26, 2024",Color: MarsalaSize: X-Small,Verified Purchase,"These are amazing quality, super soft and comfortable.",
MRome,I am a fan!!!,https://www.amazon.com/gp/customer-reviews/R1KYSO7Q1JZALV/ref=cm_cr_getr_d_rvw_ttl?ie=UTF8&ASIN=B0CJ2KZC32,"5.0 "," the United States "," November 25, 2024",Color: MarsalaSize: Large,Verified Purchase,"Move over skyms there’s a new sheriff in town and it is pumey!! I have several there bodysuits, shape where cat suit. Look great they wash great they suck you in and all the right places they asked me to be a spoken person for them. I would do it in a second because I just love this product that much and referred people to them all the time.  I would, but I’m not going to pose in shape for Amazon lol unless I’m being paid lol",
mm,It was sent with stains and a hole!!!,https://www.amazon.com/gp/customer-reviews/R2KGHLN8RHQJ9/ref=cm_cr_getr_d_rvw_ttl?ie=UTF8&ASIN=B0CJ2KZC32,"1.0 "," the United States "," November 25, 2024",Color: Jet BlackSize: X-Large,Verified Purchase,,
Kari,Pills horribly,https://www.amazon.com/gp/customer-reviews/R1CWECK7H3UGCI/ref=cm_cr_getr_d_rvw_ttl?ie=UTF8&ASIN=B0CJ2KZC32,"1.0 "," the United States "," November 12, 2024",Color: TaffySize: Small,Verified Purchase,"I am so disappointed because I loved this shirt, the fit is flattering and the material was so soft. After washing it a few times it pills and it looks so horrible.",
Tally:),Good,https://www.amazon.com/gp/customer-reviews/R3GBID79V28G5F/ref=cm_cr_getr_d_rvw_ttl?ie=UTF8&ASIN=B0CJ2KZC32,"5.0 "," the United States "," October 28, 2024",Color: Splashed WhiteSize: XX-Large,Verified Purchase,The material is not to thick. It’s very stretchy. And with the outfit I made it into very comfy!!! I feel it fit well on my body. And maybe in the future if I was wanting to get another I wouldn’t be too worried about the price because it was worth it. It came 3 days early as well so money well spent.,3
Anonymous customer,The best shirts ever,https://www.amazon.com/gp/customer-reviews/RWONSQTJD3R4S/ref=cm_cr_getr_d_rvw_ttl?ie=UTF8&ASIN=B0CJ2KZC32,"5.0 "," the United States "," October 25, 2024",,Verified Purchase,"This shirt checks all the boxes. Double lined so it is not see-through. Extremely soft. Washes well and did not shrink in the washing machine. I own so many of the shirts from this brand and I keep going back to them. I will be buying more in other colors.  If i had to think of a con, I'd say that they can start to pill with a lot of use, but they respond very well to a fabric shaver and look brand new in seconds. It would be very hard to avoid pilling with this fabric type anyway.",
I did get a lot of compliments on it. I got my usual size xl but it sits weird in the belly area like it bunches a lot. Also to be honest! This really seems like it’s off Temu. I’ve ordered multiple clothes from Temu and it’s this stretchy material and the tag is exactly the same. I wouldn’t say it’s worth 40 but maybe if I had gotten a L instead it might not bunch how it is,Eh,https://www.amazon.com/gp/customer-reviews/R28ZI5L3SR6GJB/ref=cm_cr_getr_d_rvw_ttl?ie=UTF8&ASIN=B0CJ2KZC32,"2.0 "," the United States "," October 15, 2024",Color: Jet BlackSize: Large,Verified Purchase,I got this because of an influencer and the red shirt after one office day wear is like bumpy in spots it got caught. The black one the buttons literally one ripped off as I was trying to unbutton to put it on for the first time. I wouldn’t say you should get this. Much better ones from SHEIN,
Sara Coughlin,Not for long torso,https://www.amazon.com/gp/customer-reviews/R19XKYGC1RAJGQ/ref=cm_cr_getr_d_rvw_ttl?ie=UTF8&ASIN=B0CJ2KZC32,"2.0 "," the United States "," October 11, 2024",Color: Jet BlackSize: Medium,Verified Purchase,I’m 5’8 with a long torso and this was to uncomfortable to even wear besides that the quality seemed good.,
J5jackson,Cute but...,https://www.amazon.com/gp/customer-reviews/R2QVUO51XN1HSG/ref=cm_cr_getr_d_rvw_ttl?ie=UTF8&ASIN=B0CJ2KZC32,"3.0 "," the United States "," October 7, 2024",Color: TaffySize: Small,Verified Purchase,I have had this on for 3 hours and there is already pilling on the bodysuit.  Not worth it.,
Amanda,I bought 2!,https://www.amazon.com/gp/customer-reviews/R2866TZEI34X5/ref=cm_cr_getr_d_rvw_ttl?ie=UTF8&ASIN=B0CJ2KZC32,"5.0 "," the United States "," October 2, 2024",Color: Splashed WhiteSize: Small,Verified Purchase,Great long sleeve bodysuit at a great price!  I found it on social media and ended up buying a couple colors,
Kainaza Carzeau,Don't buy,https://www.amazon.com/gp/customer-reviews/R3RTGNJG3T4118/ref=cm_cr_getr_d_rvw_ttl?ie=UTF8&ASIN=B0CJ2KZC32,"1.0 "," the United States "," September 29, 2024",Color: MarsalaSize: Medium,Verified Purchase,These shirt are so popular in TikTok shop and everyone raves about the quality but its all lies they do not hold up in the washer there get the beaded lint balls on all areas there's friction don't buy you'll only get one wear out of them you'll be wasting your money,
Michelle Robinson,Quality fabric and true to size.,https://www.amazon.com/gp/customer-reviews/RRPX0Z5HEN0HU/ref=cm_cr_getr_d_rvw_ttl?ie=UTF8&ASIN=B0CJ2KZC32,"5.0 "," the United States "," September 27, 2024",Color: MarsalaSize: X-Small,Verified Purchase,"Magic, so soft , so on point, so beautiful, and quality fabric. Fits true to size.",
Fifi Quinn,So soft! Great fit!,https://www.amazon.com/gp/customer-reviews/R3RRK3PEX4LFKU/ref=cm_cr_getr_d_rvw_ttl?ie=UTF8&ASIN=B0CJ2KZC32,"5.0 "," the United States "," September 14, 2024",Color: ChocolateSize: Small,Verified Purchase,"Love this bodysuit! It’s incredibly soft, stretchy, hugs the curves, and looks great!",
Carolina Luchsinger,love it,https://www.amazon.com/gp/customer-reviews/R2R8O10KW9HGKA/ref=cm_cr_getr_d_rvw_ttl?ie=UTF8&ASIN=B0CJ2KZC32,"5.0 "," the United States "," September 12, 2024",Color: Jet BlackSize: Small,Verified Purchase,I used it for my last trip and I loved it! very cozy,
Amazon Customer,Best bodysuits,https://www.amazon.com/gp/customer-reviews/R3PTUYRWWH7WNC/ref=cm_cr_getr_d_rvw_ttl?ie=UTF8&ASIN=B0CJ2KZC32,"5.0 "," the United States "," September 10, 2024",Color: Jet BlackSize: Medium,Verified Purchase,I love these bodysuits. The material is so soft and hugs perfectly.,
Lou,Quality,https://www.amazon.com/gp/customer-reviews/R3ICVTXOV7XKD3/ref=cm_cr_getr_d_rvw_ttl?ie=UTF8&ASIN=B0CJ2KZC32,"5.0 "," the United States "," July 25, 2024",Color: Jet BlackSize: Large,Verified Purchase,I love how comfy and soft this fabric is also the quality the material isn’t sheer or thin like most shirts in stores great for the colder months helps keep your body heat in love these never really liked a specific brand for shirts but these are my all time favorite,
Amazon Customer,It’ll do!,https://www.amazon.com/gp/customer-reviews/R3JRH7WBFGYERD/ref=cm_cr_getr_d_rvw_ttl?ie=UTF8&ASIN=B0CJ2KZC32,"3.0 "," the United States "," June 1, 2024",Color: Splashed WhiteSize: Small,Verified Purchase,This is a great body suit but size up. It’s so clingy it hugs everything. The white is hard to wear it’s very see through and just kind of not quite there. It’s very soft and good compression but you will see your bra through it and you def need to wear one.,
Stone,Very comfortable,https://www.amazon.com/gp/customer-reviews/RWR07VF5LWHKL/ref=cm_cr_getr_d_rvw_ttl?ie=UTF8&ASIN=B0CJ2KZC32,"5.0 "," the United States "," June 1, 2024",,Verified Purchase,"Soft fabric, fits well, true to size",
Jessica L,Great bodysuit,https://www.amazon.com/gp/customer-reviews/R2Z9U8ELSV1QSI/ref=cm_cr_getr_d_rvw_ttl?ie=UTF8&ASIN=B0CJ2KZC32,"5.0 "," the United States "," May 30, 2024",Color: Jet BlackSize: Small,Verified Purchase,"Love these body suits from the thickness, to the fit, to the length of the sleeves. I have this in multiple colors!",
Mama Bear,Snags easily,https://www.amazon.com/gp/customer-reviews/R2AFUIBHP3EXH3/ref=cm_cr_getr_d_rvw_ttl?ie=UTF8&ASIN=B0CJ2KZC32,"3.0 "," the United States "," May 29, 2024",Color: RubySize: X-Small,Verified Purchase,You prob won’t be wearing it long- snags easily and then needs to be replaced.,
Amazon Customer,Thick and very fitted,https://www.amazon.com/gp/customer-reviews/R2CNL7TSP5P9M1/ref=cm_cr_getr_d_rvw_ttl?ie=UTF8&ASIN=B0CJ2KZC32,"4.0 "," the United States "," May 27, 2024",Color: MarsalaSize: Small,Verified Purchase,"I am petite (5’ 95lbs) and got the small. The material is thick and has good stretch, very much like a spandex or bathing suit. I think the small was definitely my size (and am sure a medium would be too big) but I wish it were not so tight/fitted around the torso, just so it would be a little more comfortable drinking, eating, etc. The color I got was “marsala” and looked very much like the picture — like a deep dusty rose with more red. Great color that pairs well with off-white, apricot, or cream pants.",
nicole williamson,Not for long torsos,https://www.amazon.com/gp/customer-reviews/R3H196XJFQBBGQ/ref=cm_cr_getr_d_rvw_ttl?ie=UTF8&ASIN=B0CJ2KZC32,"3.0 "," the United States "," May 25, 2024",Color: MarsalaSize: X-Small,Verified Purchase,"The color and quality of the bodysuit are awesome but the leg holes are very high cut, the crotch is very long and narrow, and the body suit itself is on the shorter side. All this is a recipe for a constant frontal wedgie if you have a longer torso. Also, If I wasn’t wearing high waisted pants, I’d be worried about the thong riding up and showing.  I loved it so much I kept it and tried to find a way to wear it comfortably, but it looks like it’s destined for the trash",
Rachel,So soft,https://www.amazon.com/gp/customer-reviews/R23KOLTDDOQI8/ref=cm_cr_getr_d_rvw_ttl?ie=UTF8&ASIN=B0CJ2KZC32,"5.0 "," the United States "," May 14, 2024",Color: Jet BlackSize: Medium,Verified Purchase,The fabric is so soft and VERY stretchy. Does not bunch when you sit down or anything!,
Customer,Pill after one wash,https://www.amazon.com/gp/customer-reviews/RKRFJ7XM4RWYO/ref=cm_cr_getr_d_rvw_ttl?ie=UTF8&ASIN=B0CJ2KZC32,"2.0 "," the United States "," May 8, 2024",Color: Jet BlackSize: Small,Verified Purchase,Love the fit but after just one wash it pilled everywhere.,
RunninGirl,Super soft but pills badly,https://www.amazon.com/gp/customer-reviews/RJJX43MVK5KPA/ref=cm_cr_getr_d_rvw_ttl?ie=UTF8&ASIN=B0CJ2KZC32,"3.0 "," the United States "," May 3, 2024",Color: Jet BlackSize: Small,Verified Purchase,"This bodysuit fits like a dream and is super soft. It’s lays flat, isn’t short in the torso and is very comfortable  The problem is the fabric pilled badly after only 2 times wearing. I washed it in cold water and hung it up to dry.  No dryer and it still pilled. The other color has performed much better. I don’t know what’s up with Black.",2
AMY,My go to for a night out.,https://www.amazon.com/gp/customer-reviews/R3HEY0OBVC1K24/ref=cm_cr_getr_d_rvw_ttl?ie=UTF8&ASIN=B0CJ2KZC32,"5.0 "," the United States "," April 27, 2024",Color: Jet BlackSize: Large,Verified Purchase,Jeans and this top.  Done.  You are welcome. Thumbs up.,
BargainHunter,Fabric pills sooooo bad,https://www.amazon.com/gp/customer-reviews/R2EKW8EY09MWN6/ref=cm_cr_getr_d_rvw_ttl?ie=UTF8&ASIN=B0CJ2KZC32,"2.0 "," the United States "," April 19, 2024",Color: Jet BlackSize: Small,,"Once the viral obsession with this brand dies down, I can see the ratings decrease. Out of the bag the garment is great…pretty color, soft, stretchy, fits like a dream! But ONE maybe TWO washes later is looks cheap due to the excessive pilling. $28 is a lot for something you can maybe where twice without considering whether or not to throw it away. Save your money.",
garzashe,Buttery soft,https://www.amazon.com/gp/customer-reviews/R3BC2227JVAVMT/ref=cm_cr_getr_d_rvw_ttl?ie=UTF8&ASIN=B0CJ2KZC32,"5.0 "," the United States "," April 11, 2024",Color: PoolSize: Medium,Verified Purchase,One of the most beautiful bodysuits I've purchased. The color is a show stopper!  The feel of this bodysuit is incredible! Will purchase in other colors.,
ashley,"DUUUUUPPPPPPEEEEEE, love her.",https://www.amazon.com/gp/customer-reviews/RLVGIHR6H7O46/ref=cm_cr_getr_d_rvw_ttl?ie=UTF8&ASIN=B0CJ2KZC32,"5.0 "," the United States "," April 8, 2024",Color: RubySize: X-Large,Verified Purchase,"This is 100% the dupe of all dupes I have bought on amazon thus far. I have multiple pieces of you know what brand and this checks all the boxes in comparison. Bought the red for lunar ny and vday. It snatches, it is thick enough to go braless, the snaps don't awkwardly unsnap midday, it feels like butta, you know her, you love her, just get it and enjoy!",2
Sydney,Pills after 1 wear,https://www.amazon.com/gp/customer-reviews/R2T3G3XE35K7GW/ref=cm_cr_getr_d_rvw_ttl?ie=UTF8&ASIN=B0CJ2KZC32,"2.0 "," the United States "," April 2, 2024",Color: MarsalaSize: Small,Verified Purchase,The style and color are great. Unfortunately it pilled after one wear.,
Amazon Customer,"Great shirt, just a few minor things…",https://www.amazon.com/gp/customer-reviews/RDTA8BJC2B8RM/ref=cm_cr_getr_d_rvw_ttl?ie=UTF8&ASIN=B0CJ2KZC32,"4.0 "," the United States "," April 1, 2024",Color: Splashed WhiteSize: Large,Verified Purchase,"Overall, I love this shirt. Even though it’s layered, the white one is still see through. Also, being taller, the torso is a little short so it rides up pretty bad. But it’s high quality and very pretty! I might order another one in a different color and size and see if that helps.",
Marissa,Amazing fabric!,https://www.amazon.com/gp/customer-reviews/R1DXX5HE6UTO6A/ref=cm_cr_getr_d_rvw_ttl?ie=UTF8&ASIN=B0CJ2KZC32,"5.0 "," the United States "," March 29, 2024",Color: MarsalaSize: Small,Verified Purchase,I love the fabric! Hugs the body and is very soft and comfy!,
Jacque,Didn’t work for me,https://www.amazon.com/gp/customer-reviews/R310A6SKMDSQAC/ref=cm_cr_getr_d_rvw_ttl?ie=UTF8&ASIN=B0CJ2KZC32,"2.0 "," the United States "," March 27, 2024",Color: Splashed WhiteSize: XX-Large,Verified Purchase,Loved the black so went back for a white. Not sure what the difference was but did not fit the same.,
"The worst top ever , waste of money , it started peeling after one day of wearing before even one wash . Do yourself a favor and don’t throw your money",worst quality,https://www.amazon.com/gp/customer-reviews/R1A2BZ1VFWT9J8/ref=cm_cr_getr_d_rvw_ttl?ie=UTF8&ASIN=B0CJ2KZC32,"1.0 "," the United States "," March 25, 2024",Color: Jet BlackSize: Small,Verified Purchase,"worst top , started peeling fiest day of wearing before i even washed it",
Sandra williams,Material pitted after one wear,https://www.amazon.com/gp/customer-reviews/R2R8UL7BCQZPIN/ref=cm_cr_getr_d_rvw_ttl?ie=UTF8&ASIN=B0CJ2KZC32,"2.0 "," the United States "," March 25, 2024",Color: MarsalaSize: Medium,Verified Purchase,Super comfortable but material pitted after one wear.,
Rose,Two bodysuits ordered months apart and  both are defective,https://www.amazon.com/gp/customer-reviews/R19ZA4GTGTY9PS/ref=cm_cr_getr_d_rvw_ttl?ie=UTF8&ASIN=B0CJ2KZC32,"1.0 "," the United States "," March 17, 2024",Color: MarsalaSize: Medium,Verified Purchase,"I orderd two in different colors. Both suits arrived stained and faded. planned on wearing for an occasion. Very disappointed. The first photo is the first one I ordered. I ordered another and it arrived with the same defect with a V shaped area faded, lighter along with uneven color splotches on the back.",
Jamie Blot,Loved upon arrival… but word to the wise…,https://www.amazon.com/gp/customer-reviews/RZF5C06H6TJRR/ref=cm_cr_getr_d_rvw_ttl?ie=UTF8&ASIN=B0CJ2KZC32,"4.0 "," the United States "," March 17, 2024",,Verified Purchase,"Absolutely loveeeee this! Ordered in multiple colors, BUT do not put it in the dryer!!! It will get pilly! Seems to be ok if you hang to dry, which I usually do… one snuck in the dryer by mistake :( This is actually one of my go to layering pieces! Love wearing these under short sleeved shirts for those extra chilly days! Will definitely keep getting more!",
Ashley koser,Pilling,https://www.amazon.com/gp/customer-reviews/R3QLFP5QUG8P8M/ref=cm_cr_getr_d_rvw_ttl?ie=UTF8&ASIN=B0CJ2KZC32,"1.0 "," the United States "," March 16, 2024",Color: Splashed WhiteSize: Medium,,Bought the black one. Only worn once and the pilling is crazy!! I guess now I have a cute shirt to wear doing farm chores.,
Tiffany,Amazing quality,https://www.amazon.com/gp/customer-reviews/R244R5UAEWM5BA/ref=cm_cr_getr_d_rvw_ttl?ie=UTF8&ASIN=B0CJ2KZC32,"5.0 "," the United States "," March 15, 2024",Color: Splashed WhiteSize: Medium,Verified Purchase,"This is fitting and flattering, great material and not see-through at all.",
Noelle M.,Pills after one wear,https://www.amazon.com/gp/customer-reviews/R3STRPVQKM6PWQ/ref=cm_cr_getr_d_rvw_ttl?ie=UTF8&ASIN=B0CJ2KZC32,"1.0 "," the United States "," March 14, 2024",Color: MarsalaSize: X-Large,Verified Purchase,"I wore this one time and this is what it looked like. Such a shame because it was super soft ,comfortable, and looks nice. But they should be returnable.",
Aleah Arauza,Super comfortable,https://www.amazon.com/gp/customer-reviews/R1MMA3AMI9X3CE/ref=cm_cr_getr_d_rvw_ttl?ie=UTF8&ASIN=B0CJ2KZC32,"5.0 "," the United States "," March 5, 2024",Color: Jet BlackSize: Small,Verified Purchase,The best material I have experienced. True to size and so versatile :),
June,Pilling,https://www.amazon.com/gp/customer-reviews/R3UKVKOW2LKPNZ/ref=cm_cr_getr_d_rvw_ttl?ie=UTF8&ASIN=B0CJ2KZC32,"2.0 "," the United States "," February 29, 2024",Color: Jet BlackSize: Large,Verified Purchase,So cute and comfy but after the first night it started pilling in several areas.,
candlehappies,Very inconsistent SIZING,https://www.amazon.com/gp/customer-reviews/R1BXB0FG4WT56T/ref=cm_cr_getr_d_rvw_ttl?ie=UTF8&ASIN=B0CJ2KZC32,"2.0 "," the United States "," February 28, 2024",Color: PoolSize: X-Small,Verified Purchase,Omg I’m sooooo disappointed!! I love these bodysuits they are great quality. I am very petite and have tried every body suit on Amazon and pumiey are the only ones that actually fit. I have about 9 of the short sleeve ones and they fit great. I got this out of packing and new immediately this wasn’t right. I’m 5’ and 110lbs. Ordered the same size and the crotch went down to my knees… I think they switched the sizing in the tags .,
Justin,Fabric fraying and suit is too high cut,https://www.amazon.com/gp/customer-reviews/RI7OTFNZR1XD9/ref=cm_cr_getr_d_rvw_ttl?ie=UTF8&ASIN=B0CJ2KZC32,"2.0 "," the United States "," February 26, 2024",Color: Jet BlackSize: Small,Verified Purchase,"This body suit is super soft and after two washes the sleeve edges are already fraying. In addition, unless you are wearing super high cut pants the skin shows on the hips and in the back because the hips are cut too high. I’m 5’4”.",
Aalok,Amazing!,https://www.amazon.com/gp/customer-reviews/R35L3320VVVJO0/ref=cm_cr_getr_d_rvw_ttl?ie=UTF8&ASIN=B0CJ2KZC32,"5.0 "," the United States "," February 25, 2024",Color: MarsalaSize: Small,Verified Purchase,"The color Marsala is beautiful and the fabric is so luxurious. It’s so soft and very stretchy - I have a short torso and this is not too long but if you were taller, it would stretch and not be uncomfortable! The v is not too deep for those of us with larger chests - which i was concerned about.",2
Tammy Fogleman,Perfect,https://www.amazon.com/gp/customer-reviews/R1HAKISTYQD1BD/ref=cm_cr_getr_d_rvw_ttl?ie=UTF8&ASIN=B0CJ2KZC32,"5.0 "," the United States "," February 21, 2024",Color: Jet BlackSize: X-Small,Verified Purchase,"I am 4’11 120lbs and got an XS. I have only good thought about this shirt. The stretch is perfect. It’s not see-through. I have a long torso and it wasn’t pulling too much in the front or back. The neck line is perfect, I do not have big boobs, 30B. Highly recommend.",
LeeLou,BODYSUITS ARE GREAT FOR PLUS SIZES!,https://www.amazon.com/gp/customer-reviews/R7NUDP30CLPTC/ref=cm_cr_getr_d_rvw_ttl?ie=UTF8&ASIN=B0CJ2KZC32,"5.0 "," the United States "," February 21, 2024",Color: Jet BlackSize: XX-Large,Verified Purchase,"I was ley about ordering a bodysuit until I saw an influencer reviewing this brand. It's got a double layer,  so it smooths everything out,  but it's incredible comfortable.  Totally getting more.I'm 255 lbs, 5'9"", 40D. XXL fit perfectly.",4
Ashley Z.,The softest body suit ever,https://www.amazon.com/gp/customer-reviews/R1TYX1QOU3Z2ET/ref=cm_cr_getr_d_rvw_ttl?ie=UTF8&ASIN=B0CJ2KZC32,"5.0 "," the United States "," February 20, 2024",Color: MarsalaSize: X-Large,Verified Purchase,"I recently purchased this bodysuit, and it's truly a game-changer in my wardrobe. The fabric feels incredibly smooth and creamy against the skin. I was pleasantly surprised by the non-sheer quality of even with the white one. The double lining really holds you in and gives it a luxurious feel. The v-nick is flattering without being too low.  I've worn these for both casual and work. Highly recommend it to anyone looking for the perfect bodysuit!",
S Lewandoski,Just buy it,https://www.amazon.com/gp/customer-reviews/R17OCFRSBD0PJ4/ref=cm_cr_getr_d_rvw_ttl?ie=UTF8&ASIN=B0CJ2KZC32,"5.0 "," the United States "," February 19, 2024",Color: Jet BlackSize: X-Large,Verified Purchase,"Material is soft, not see through, and extremely comfortable. Quality item. Design for the back makes it so you have no panty lines. Very slimming. Also very easy restroom use. Have bought in multiple neckline, sleeve styles and colors.",
Kelly,Buttery soft!,https://www.amazon.com/gp/customer-reviews/R23F5IFWTTCE7D/ref=cm_cr_getr_d_rvw_ttl?ie=UTF8&ASIN=B0CJ2KZC32,"5.0 "," the United States "," February 15, 2024",Color: MarsalaSize: Small,Verified Purchase,Love this body suit and the color is perfect!,
Ayl Perez,A good Skims dupe,https://www.amazon.com/gp/customer-reviews/R3JY55Q6LZISST/ref=cm_cr_getr_d_rvw_ttl?ie=UTF8&ASIN=B0CJ2KZC32,"5.0 "," the United States "," February 15, 2024",Color: RubySize: Medium,Verified Purchase,"The quality of this material feels so soft and felt great on my body. I own some skims bodysuits, which are also amazing. However, skims is so expensive. I feel like this is the best alternative.",
Olena Bauer,Very soft,https://www.amazon.com/gp/customer-reviews/RFC34Y1Z4G6U8/ref=cm_cr_getr_d_rvw_ttl?ie=UTF8&ASIN=B0CJ2KZC32,"5.0 "," the United States "," February 11, 2024",Color: Splashed WhiteSize: Medium,Verified Purchase,Great quality!!!,
