评论用户,评论概述,评论链接,星级评分,评论地点,评论时间,类型,是否购买,评论详情,觉得该评论有帮助的人数
Pinkfent,Chemical smell ⚠️⛔️☣️👃,https://www.amazon.com/gp/customer-reviews/RJFNI9LDMWOZE/ref=cm_cr_getr_d_rvw_ttl?ie=UTF8&ASIN=B0BYW7TGJF,"1.0 "," the United States "," January 22, 2025",Color: ChampagneSize: XX-Large,Verified Purchase,Poor quality has a cheap chemaical smell…feels like window curtains and does not hold up after 1 wash cycle Does not fit as well the seized are wrong I’m 2x and I bought 2x but it fits (like L),
Chordello bethell,Smooth,https://www.amazon.com/gp/customer-reviews/R3U3KLE3779RCW/ref=cm_cr_getr_d_rvw_ttl?ie=UTF8&ASIN=B0BYW7TGJF,"5.0 "," the United States "," December 16, 2024",Color: BlueSize: Small,Verified Purchase,Got all kinds of compliments on it in Turks,
Mrdk,ok,https://www.amazon.com/gp/customer-reviews/R1J09T04VATZ5E/ref=cm_cr_getr_d_rvw_ttl?ie=UTF8&ASIN=B0BYW7TGJF,"5.0 "," the United States "," December 10, 2024",Color: Navy BlueSize: Large,Verified Purchase,good,
steven,Miami Vice style!,https://www.amazon.com/gp/customer-reviews/R22XQPVD7KG7GW/ref=cm_cr_getr_d_rvw_ttl?ie=UTF8&ASIN=B0BYW7TGJF,"4.0 "," the United States "," December 8, 2024",Color: Navy BlueSize: XX-Large,Verified Purchase,Purchased for a cruise. Feals like silky PJs. Wears like em too. They are silky Pj's. They fit. I'm short and fat and 2x works. The price point seems pretty good.  Wearable poolside I hope.,
Ciro T.,Very confortable,https://www.amazon.com/gp/customer-reviews/R3DT1K24K3SVC8/ref=cm_cr_getr_d_rvw_ttl?ie=UTF8&ASIN=B0BYW7TGJF,"5.0 "," the United States "," November 26, 2024",Color: BlackSize: XX-Large,Verified Purchase,"Love it, I will be buying more they are very confortable.",
Alex Spears,Elegant,https://www.amazon.com/gp/customer-reviews/R3M8J5IC9N9YDM/ref=cm_cr_getr_d_rvw_ttl?ie=UTF8&ASIN=B0BYW7TGJF,"5.0 "," the United States "," November 14, 2024",Color: Dark GreenSize: Large,Verified Purchase,I love the way it looks on me,
Great product and fast shipping and it does fit the 2023 Polaris 570SP,Nice Outfit,https://www.amazon.com/gp/customer-reviews/R3LJB3P3R206ID/ref=cm_cr_getr_d_rvw_ttl?ie=UTF8&ASIN=B0BYW7TGJF,"5.0 "," the United States "," November 13, 2024",Color: Dark GreenSize: X-Large,Verified Purchase,Good quality and true to fit,
Antonio Pinero,Está hermoso,https://www.amazon.com/gp/customer-reviews/R27UU2IVAHFEQL/ref=cm_cr_getr_d_rvw_ttl?ie=UTF8&ASIN=B0BYW7TGJF,"5.0 "," the United States "," November 3, 2024",Color: ChampagneSize: Large,Verified Purchase,Muy buena calidad de tela,
Christian2Richard T. Fisher,Looks Great.,https://www.amazon.com/gp/customer-reviews/RU1LIBKNAI60/ref=cm_cr_getr_d_rvw_ttl?ie=UTF8&ASIN=B0BYW7TGJF,"5.0 "," the United States "," October 13, 2024",Color: BlackSize: X-Large,Verified Purchase,"Looks, and Feels great.",
buena musica para conocedores,Not good at all,https://www.amazon.com/gp/customer-reviews/R1UETGGKH96XWE/ref=cm_cr_getr_d_rvw_ttl?ie=UTF8&ASIN=B0BYW7TGJF,"1.0 "," the United States "," October 9, 2024",Color: WhiteSize: Medium,Verified Purchase,The shirt ripe just trying it,
Tommy Temple,Small sizing,https://www.amazon.com/gp/customer-reviews/RME0BMA6MESQW/ref=cm_cr_getr_d_rvw_ttl?ie=UTF8&ASIN=B0BYW7TGJF,"2.0 "," the United States "," September 27, 2024",Color: ChampagneSize: XX-Large,Verified Purchase,Looks good just don’t fit vary well,
Bryan Preezy,Terrible compra,https://www.amazon.com/gp/customer-reviews/R19QG2KXVGEZH6/ref=cm_cr_getr_d_rvw_ttl?ie=UTF8&ASIN=B0BYW7TGJF,"1.0 "," the United States "," September 21, 2024",Color: WhiteSize: Medium,Verified Purchase,"El producto aparte de que tardó y hubieron cambios de fecha para la entrega fue una compra horrible, no lo recomendaría para nada, me llegó un conjunto con el diseño impreso super pixelado en la tela, malísima calidad.",
Joness,"Print sucks, material sucks",https://www.amazon.com/gp/customer-reviews/R1DIW7WD0ZCQP0/ref=cm_cr_getr_d_rvw_ttl?ie=UTF8&ASIN=B0BYW7TGJF,"1.0 "," the United States "," September 21, 2024",Color: WhiteSize: Large,Verified Purchase,"Don't buy, it's not a good quality print",
Kinte,"Stylish, expensive look",https://www.amazon.com/gp/customer-reviews/R3VJUU3BH0YBDA/ref=cm_cr_getr_d_rvw_ttl?ie=UTF8&ASIN=B0BYW7TGJF,"5.0 "," the United States "," September 8, 2024",Color: Lake BlueSize: X-Large,Verified Purchase,Value for money. Just get it,
BYRON,Very comfortable and stylish,https://www.amazon.com/gp/customer-reviews/R16U551IYMUYX0/ref=cm_cr_getr_d_rvw_ttl?ie=UTF8&ASIN=B0BYW7TGJF,"5.0 "," the United States "," August 31, 2024",Color: BlackSize: Large,Verified Purchase,"This short outfit is perfect for a warm day, light weight, silky material, fits perfectly. If you dress it up it won’t look like pajamas. I will definitely order another one.",3
FalseFaith,Style and comfort,https://www.amazon.com/gp/customer-reviews/RWTZUA26Q8MWK/ref=cm_cr_getr_d_rvw_ttl?ie=UTF8&ASIN=B0BYW7TGJF,"5.0 "," the United States "," August 15, 2024",Color: PinkSize: XX-Large,Verified Purchase,"This was a spur of the moment purchase that I can happily say I am well satisfied with. The outfit has become one of my favorites in my wardrobe. Very affordable, the fabric is extremely soft. Fits the way I assumed it would. All around a very high quality stylish product. Will be buying in other colors",3
G. Poole,Comfort,https://www.amazon.com/gp/customer-reviews/R1VYV84JWGFDZZ/ref=cm_cr_getr_d_rvw_ttl?ie=UTF8&ASIN=B0BYW7TGJF,"5.0 "," the United States "," August 14, 2024",Color: Wine RedSize: XX-Large,Verified Purchase,Nice looking lounge wear.,
Joshua,Wow! Feels amazing (5stars) and looks even better—stitching sux (two holes alread 1 star),https://www.amazon.com/gp/customer-reviews/R99W3705DQ6W0/ref=cm_cr_getr_d_rvw_ttl?ie=UTF8&ASIN=B0BYW7TGJF,"3.0 "," the United States "," August 13, 2024",Color: PurpleSize: Small,Verified Purchase,"My sister absolutely didn’t want me to wear this out. I did and it was so great because it was swelteringly hot and I was cool and the top and shorts feel great! However, the stitching isn’t solid and it’s already ripped in two spots. I’ll return for the same item and have a seamstress just double the stitching and it should be perfect!",
LJ,"Looks like pajamas, returned but nice looking.",https://www.amazon.com/gp/customer-reviews/RZ153LUSQ2OTR/ref=cm_cr_getr_d_rvw_ttl?ie=UTF8&ASIN=B0BYW7TGJF,"1.0 "," the United States "," July 31, 2024",Color: Navy BlueSize: Large,Verified Purchase,Look like pajamas,
Liz Booth,Good!,https://www.amazon.com/gp/customer-reviews/R2MDI81UWEQNNV/ref=cm_cr_getr_d_rvw_ttl?ie=UTF8&ASIN=B0BYW7TGJF,"4.0 "," the United States "," July 30, 2024",Color: BlackSize: X-Large,Verified Purchase,"My boyfriend liked how comfortable the fit was! The color matched his skin tone perfectly, and it was really easy and lightweight.",
Just Jones,Nice fit,https://www.amazon.com/gp/customer-reviews/RUYZZ079QFH3M/ref=cm_cr_getr_d_rvw_ttl?ie=UTF8&ASIN=B0BYW7TGJF,"5.0 "," the United States "," July 23, 2024",Color: WhiteSize: Small,Verified Purchase,"I ordered this outfit for my son‘s baby shower. He loved the look and the feel of it. There were more pictures, but for some reason, I could not post them. But it is a great buy.",
keisha,Love,https://www.amazon.com/gp/customer-reviews/R3SA761YBULGIH/ref=cm_cr_getr_d_rvw_ttl?ie=UTF8&ASIN=B0BYW7TGJF,"5.0 "," the United States "," July 13, 2024",Color: Rose RedSize: Large,Verified Purchase,I’m in love,
Amazon Customer,Bought for the hubby,https://www.amazon.com/gp/customer-reviews/R25FD1DEWUDMEI/ref=cm_cr_getr_d_rvw_ttl?ie=UTF8&ASIN=B0BYW7TGJF,"5.0 "," the United States "," July 7, 2024",Color: WhiteSize: X-Large,Verified Purchase,My husband likes the set. I had to buy it again bc I washed it with other clothes and the material started falling apart. Want to assume it was my doing. He asked me to buy him another one bc he liked it that much. I’ll write another review after I see how it looks after proper washing. Super comfy. Relax fit.,
solomon patterson,My vacation,https://www.amazon.com/gp/customer-reviews/RHZQ441GQVH72/ref=cm_cr_getr_d_rvw_ttl?ie=UTF8&ASIN=B0BYW7TGJF,"5.0 "," the United States "," July 6, 2024",Color: Dark GreenSize: Medium,Verified Purchase,I bought this outfit for my vacation and it came on time. Also the out fit me completely,
Jacqueline Lewis Hairston,Fab fit,https://www.amazon.com/gp/customer-reviews/R11IONMJEVU7W9/ref=cm_cr_getr_d_rvw_ttl?ie=UTF8&ASIN=B0BYW7TGJF,"5.0 "," the United States "," June 8, 2024",Color: PurpleSize: XX-Large,Verified Purchase,Purchased for a pajama party. XXL. Great fit,
Og,False advertisement,https://www.amazon.com/gp/customer-reviews/RYM1BSBQWC9MF/ref=cm_cr_getr_d_rvw_ttl?ie=UTF8&ASIN=B0BYW7TGJF,"1.0 "," the United States "," June 4, 2024",Color: Lake BlueSize: X-Large,Verified Purchase,Cheap looking nothing compared to advertised product very disappointed when received package immediately returned for full refund,
A T,Get one,https://www.amazon.com/gp/customer-reviews/R2DZBGCU566OMN/ref=cm_cr_getr_d_rvw_ttl?ie=UTF8&ASIN=B0BYW7TGJF,"5.0 "," the United States "," June 3, 2024",Color: BlackSize: Large,Verified Purchase,The material is great and the size is on point,
fadi,Quality very good 👍,https://www.amazon.com/gp/customer-reviews/R2CHQLLUIMEL9Y/ref=cm_cr_getr_d_rvw_ttl?ie=UTF8&ASIN=B0BYW7TGJF,"5.0 "," the United States "," May 27, 2024",Color: Navy BlueSize: Medium,Verified Purchase,"Best beach set i ever bought, bahamas vibes",
TiaraB,Short set,https://www.amazon.com/gp/customer-reviews/R19LS0LKWVK83E/ref=cm_cr_getr_d_rvw_ttl?ie=UTF8&ASIN=B0BYW7TGJF,"5.0 "," the United States "," May 20, 2024",Color: BlueSize: X-Large,Verified Purchase,"Very stylish, comfortable, breathable great quality material",7
Keith,Disappointed,https://www.amazon.com/gp/customer-reviews/R8964VOP66K4F/ref=cm_cr_getr_d_rvw_ttl?ie=UTF8&ASIN=B0BYW7TGJF,"1.0 "," the United States "," May 11, 2024",Color: BlackSize: X-Large,Verified Purchase,The shorts had a rip in them. Very disappointed because I bought this to wear to a themed event.,
Incognito,Great Look:,https://www.amazon.com/gp/customer-reviews/R29PO3U0Q97NXZ/ref=cm_cr_getr_d_rvw_ttl?ie=UTF8&ASIN=B0BYW7TGJF,"5.0 "," the United States "," May 8, 2024",Color: Lake GreenSize: Medium,Verified Purchase,Lived It. Tons of Compliments. Fantastic.,
james kenney jr,Fast delivery,https://www.amazon.com/gp/customer-reviews/R1YJ40PDRI6XG9/ref=cm_cr_getr_d_rvw_ttl?ie=UTF8&ASIN=B0BYW7TGJF,"5.0 "," the United States "," March 29, 2024",Color: BlackSize: Medium,Verified Purchase,"This is a very nice set. The fabric is very nice,  the quality is great and the fit is perfect",
Crystal White,True to size,https://www.amazon.com/gp/customer-reviews/R1PSEJYSP8YKHG/ref=cm_cr_getr_d_rvw_ttl?ie=UTF8&ASIN=B0BYW7TGJF,"5.0 "," the United States "," March 18, 2024",Color: Lake BlueSize: Medium,Verified Purchase,My husband loved this outfit,
Spelanta youenka jean,Very good 👍,https://www.amazon.com/gp/customer-reviews/R2XR22PABJKFD3/ref=cm_cr_getr_d_rvw_ttl?ie=UTF8&ASIN=B0BYW7TGJF,"2.0 "," the United States "," February 25, 2024",,Verified Purchase,,
Vincent Taylor,Nice,https://www.amazon.com/gp/customer-reviews/R2LNOKL6GFC2D5/ref=cm_cr_getr_d_rvw_ttl?ie=UTF8&ASIN=B0BYW7TGJF,"4.0 "," the United States "," January 17, 2024",Color: Wine RedSize: X-Large,Verified Purchase,The sleeves are a little tight for me but I do workout,
Al Phillips,Very silky smooth and handsome,https://www.amazon.com/gp/customer-reviews/R3O7WFUZAK2FPT/ref=cm_cr_getr_d_rvw_ttl?ie=UTF8&ASIN=B0BYW7TGJF,"5.0 "," the United States "," January 16, 2024",Color: Dark GreenSize: Large,Verified Purchase,"Perfectly sized, looks & feels great. Not a cheap looking design. Colors for the green one is absolutely gorgeous!!! One problem, as with any silky material, be prepared for fabric fraying at the seams. Be proactive and sew any separated seams back together before washing or a larger fray will occur. (FYI: Just par for the course.)",2
Tish,True to size,https://www.amazon.com/gp/customer-reviews/RONB7ZTBZ3AIQ/ref=cm_cr_getr_d_rvw_ttl?ie=UTF8&ASIN=B0BYW7TGJF,"4.0 "," the United States "," January 11, 2024",Color: WhiteSize: Small,Verified Purchase,Fits perfect...my husband loves this look,
Juan Carlos Medina,Nothing,https://www.amazon.com/gp/customer-reviews/R1DGS183Z38EE4/ref=cm_cr_getr_d_rvw_ttl?ie=UTF8&ASIN=B0BYW7TGJF,"4.0 "," the United States "," November 25, 2023",Color: BlackSize: XX-Large,Verified Purchase,Comturble,
Dera,So cute,https://www.amazon.com/gp/customer-reviews/R3O8JTKTQ8W5LF/ref=cm_cr_getr_d_rvw_ttl?ie=UTF8&ASIN=B0BYW7TGJF,"5.0 "," the United States "," November 15, 2023",Color: Dark GreenSize: X-Large,Verified Purchase,I bought his outfit to match mines i ordered off SHEIN and it went perfectly,
Karry Rose,Bruno mars,https://www.amazon.com/gp/customer-reviews/R2EP9YIWESM2KI/ref=cm_cr_getr_d_rvw_ttl?ie=UTF8&ASIN=B0BYW7TGJF,"5.0 "," the United States "," November 2, 2023",Color: Wine RedSize: Medium,Verified Purchase,Bought for a Halloween costume. Very light weight and looks great.,
Did not fit ! I will send it back,Size,https://www.amazon.com/gp/customer-reviews/R1ON60WKPRPMM8/ref=cm_cr_getr_d_rvw_ttl?ie=UTF8&ASIN=B0BYW7TGJF,"1.0 "," the United States "," October 29, 2023",Color: BlackSize: XX-Large,Verified Purchase,Too small,
Marco,Looks great,https://www.amazon.com/gp/customer-reviews/R7EJFRL485LJV/ref=cm_cr_getr_d_rvw_ttl?ie=UTF8&ASIN=B0BYW7TGJF,"5.0 "," the United States "," October 27, 2023",Color: Dark GreenSize: Medium,Verified Purchase,This is a medium shirt . I like how it looks . Very sleek and comfortable.,
gary smith,"Didn,t have to go out and shop for my outfits.",https://www.amazon.com/gp/customer-reviews/R2QVH8PE7TIBOK/ref=cm_cr_getr_d_rvw_ttl?ie=UTF8&ASIN=B0BYW7TGJF,"4.0 "," the United States "," October 22, 2023",Color: WhiteSize: XX-Large,Verified Purchase,I'm going on a cruise for new years wearing the outfits.,
Mike,Feels great,https://www.amazon.com/gp/customer-reviews/R3KYA9PIAVR8I9/ref=cm_cr_getr_d_rvw_ttl?ie=UTF8&ASIN=B0BYW7TGJF,"3.0 "," the United States "," October 10, 2023",Color: WhiteSize: XX-Large,Verified Purchase,These outfits are extremely comfortable and they look good I got a yt one and the purple only gripe I have is the drawstring comes out way too easy and it's not easy to get it back in once you pull it out so my yt outfit came with the string only in on one side and then I accidentally pulled it out and now I can't wear it without the drawstring otherwise they're nice,
Janai Collins,Hubby loved it!!,https://www.amazon.com/gp/customer-reviews/RFUOMESP598P0/ref=cm_cr_getr_d_rvw_ttl?ie=UTF8&ASIN=B0BYW7TGJF,"5.0 "," the United States "," September 26, 2023",Color: BlueSize: Small,Verified Purchase,I bought this for my hubby for our elopement I’m Vegas!! It did not disappoint! We looked great!! I bought a small for him they kinda run big but definitely a great buy for the price!!!,5
TriLL WiLL Rucker,I felt So Boujiie with Outfit on,https://www.amazon.com/gp/customer-reviews/R1VQ688W4TV78M/ref=cm_cr_getr_d_rvw_ttl?ie=UTF8&ASIN=B0BYW7TGJF,"5.0 "," the United States "," September 20, 2023",Color: Lake BlueSize: XX-Large,Verified Purchase,It Was for my best friend bday trip for our day on the Tiki Boat 🚢 and I felt fly it fit so good and was so stylish I will be getting more stuff from yall I definitely love it,
Marcus,Too big,https://www.amazon.com/gp/customer-reviews/R3C5Y6CX9F1C62/ref=cm_cr_getr_d_rvw_ttl?ie=UTF8&ASIN=B0BYW7TGJF,"2.0 "," the United States "," September 19, 2023",Color: WhiteSize: Small,Verified Purchase,Smaller needs to fit a little tighter,
John Connolly,Add 2 sizes.,https://www.amazon.com/gp/customer-reviews/R1W0J7H12HPHVU/ref=cm_cr_getr_d_rvw_ttl?ie=UTF8&ASIN=B0BYW7TGJF,"3.0 "," the United States "," September 7, 2023",Color: BlackSize: Medium,Verified Purchase,"Came real small as a L. Decent fabric but warm no breathing., nice design though.",
Michael P. Dickerson,Payed for new received used.,https://www.amazon.com/gp/customer-reviews/R22W4MKKC1S07/ref=cm_cr_getr_d_rvw_ttl?ie=UTF8&ASIN=B0BYW7TGJF,"2.0 "," the United States "," August 18, 2023",Color: BlackSize: Large,Verified Purchase,Draw string string missing from shorts and a used condom was in the pocket of shorts.,
Joseph Legesse,Love it!,https://www.amazon.com/gp/customer-reviews/R17WDH44NBVOQG/ref=cm_cr_getr_d_rvw_ttl?ie=UTF8&ASIN=B0BYW7TGJF,"5.0 "," the United States "," August 17, 2023",Color: Navy BlueSize: Large,Verified Purchase,Very smooth and fits nicely. Great lounge clothing for the summer!,
Silver,Good fit,https://www.amazon.com/gp/customer-reviews/R3I0ADBDYB6AVI/ref=cm_cr_getr_d_rvw_ttl?ie=UTF8&ASIN=B0BYW7TGJF,"4.0 "," the United States "," August 17, 2023",Color: BlackSize: Large,Verified Purchase,It’s a perfect fit exactly as the measurements,9
Victoria Taylor-Holloway,Nice quality,https://www.amazon.com/gp/customer-reviews/R3N9X1YGGREE64/ref=cm_cr_getr_d_rvw_ttl?ie=UTF8&ASIN=B0BYW7TGJF,"5.0 "," the United States "," August 12, 2023",Color: BlackSize: X-Large,Verified Purchase,"Fits true to size and nice quality. Although, I will admit to having a seamstress adjust it just a bit to my personal preference (shortened up the legs on the shorts). Just what I needed for a 70’s party.",
L.V.,Size small,https://www.amazon.com/gp/customer-reviews/R2WCF4O7WSWXHQ/ref=cm_cr_getr_d_rvw_ttl?ie=UTF8&ASIN=B0BYW7TGJF,"5.0 "," the United States "," August 11, 2023",Color: WhiteSize: Small,Verified Purchase,"Nice, I’m 5,9 at 137, add your own flavor to it, I did a simple scarf in the front to bring it out,  I pretty sure I could have gotten away with a XS, my opinion this outfit not really made for bigger guys but that’s just me",3
darrell cooper,very nice quality,https://www.amazon.com/gp/customer-reviews/R197LAF2PAUOA5/ref=cm_cr_getr_d_rvw_ttl?ie=UTF8&ASIN=B0BYW7TGJF,"5.0 "," the United States "," August 7, 2023",Color: Dark GreenSize: Medium,Verified Purchase,Came in an timely manner I love it,
Ansar Waajada,Two piece men’s pajamas,https://www.amazon.com/gp/customer-reviews/RRVPDXP3P5PI2/ref=cm_cr_getr_d_rvw_ttl?ie=UTF8&ASIN=B0BYW7TGJF,"5.0 "," the United States "," July 28, 2023",Color: Wine RedSize: Large,Verified Purchase,Fits well and has a nice silky feel,
Allodoxaphobia,Stylish summer outfit,https://www.amazon.com/gp/customer-reviews/R2CNYGR55XHB4C/ref=cm_cr_getr_d_rvw_ttl?ie=UTF8&ASIN=B0BYW7TGJF,"4.0 "," the United States "," July 26, 2023",Color: Navy BlueSize: Small,,15 yo very happy w this outfit . Works well in 80-90 degrees weather. Fits perfectly on LA scene.,
Jasmine W,Nice quality,https://www.amazon.com/gp/customer-reviews/RMGO5D6E5DGTX/ref=cm_cr_getr_d_rvw_ttl?ie=UTF8&ASIN=B0BYW7TGJF,"5.0 "," the United States "," July 25, 2023",Color: BlackSize: Large,Verified Purchase,Fits true to size. Good quality. Looks nice.,
Chris jimenez,Problem fixed,https://www.amazon.com/gp/customer-reviews/RA2X5QEB8SX5I/ref=cm_cr_getr_d_rvw_ttl?ie=UTF8&ASIN=B0BYW7TGJF,"4.0 "," the United States "," July 25, 2023",Color: PurpleSize: Medium,Verified Purchase,It's amazing in any sense 👌 soon ill upload an updated picture 📷 the only issue I had was that I got a wrong package 📦 but they resend me the right one now ill.be getting another pair,
Amazon Customer,Good fit,https://www.amazon.com/gp/customer-reviews/RNSZEJ5AVGESV/ref=cm_cr_getr_d_rvw_ttl?ie=UTF8&ASIN=B0BYW7TGJF,"5.0 "," the United States "," July 24, 2023",Color: BlackSize: Large,Verified Purchase,Great,
Labeautefeminine,"Beautiful, Rich looking outfit",https://www.amazon.com/gp/customer-reviews/R22PF4KQ6QFRVV/ref=cm_cr_getr_d_rvw_ttl?ie=UTF8&ASIN=B0BYW7TGJF,"5.0 "," the United States "," July 17, 2023",Color: BlackSize: Medium,Verified Purchase,"Very nice outfit. Great satin fabric. Versace looks outfit. My hobby wore it to an Egyptian night party, he was spectacular. We pair it with Versace accessories. He looks like the rich roman Egyptian. True to size. He is 175 lbs 5.8 ft, wears 40 blazer and 32 pants. Bought a medium .",8
Erik Hull,Vibrant and Stylish Men's Hawaiian Shirt Set for a Casual Summer Look!,https://www.amazon.com/gp/customer-reviews/R1B8K2PX9WA7DY/ref=cm_cr_getr_d_rvw_ttl?ie=UTF8&ASIN=B0BYW7TGJF,"4.0 "," the United States "," July 7, 2023",Color: BlackSize: XX-Large,,"I recently purchased the OYOZONE Men's Hawaiian Shirt and Short Set, and overall, I am quite pleased with my purchase. This two-piece outfit offers a laid-back and stylish look, perfect for any casual summer occasion.  Let's start with the shirt - the vibrant prints and colors are eye-catching and give off a fun tropical vibe. The satin fabric feels smooth and comfortable against the skin, making it a breathable choice for hotter days. The short sleeves allow for easy movement, and the button-down design adds a touch of versatility to the overall look.  The shorts, which come as part of this set, are equally stylish and comfortable. They fit well and offer ample room to move around freely. The draw string ensures a snug fit without digging into the skin, providing all-day comfort. Although it could have been a longer string. The breathable fabric allows for proper airflow, helping to keep me cool during the summer heat.  However, the reason I deducted one star from my rating is due to a minor flaw in one of the pockets. Unfortunately, upon inspection, I noticed a small hole in one of the pockets. While it doesn't affect the overall functionality or appearance of the outfit, it is worth noting this defect. I hope it was an isolated occurrence and not a common issue with the product.  Aside from this, the OYOZONE Men's Hawaiian Shirt and Short Set is a great choice for those looking for a casual and stylish ensemble. It's perfect for beach parties, barbecues, or even just a relaxed outing with friends. The print options available are impressive, offering a wide variety to suit different tastes and preferences.  In terms of fit, I found the sizing to be accurate. Ordering based on the provided size chart ensured a comfortable and well-fitting set. The quality of the fabric is decent, though not as premium as expected, but considering the price point, it's understandable.  Overall, despite the minor flaw in one of the pockets, I am satisfied with my purchase. This vibrant and stylish Men's Hawaiian Shirt and Short Set from OYOZONE is a great addition to my summer wardrobe. Be sure to check the pockets thoroughly upon receiving your item, but don't let this deter you from experiencing this fashionable and casual outfit for yourself!",3
Tony Wilson,I Never Want to Take This Off,https://www.amazon.com/gp/customer-reviews/R3TK2W69HKUXIE/ref=cm_cr_getr_d_rvw_ttl?ie=UTF8&ASIN=B0BYW7TGJF,"5.0 "," the United States "," June 25, 2023",Color: BlackSize: X-Large,,"I absolutely adore this outfit. I've been getting deep into matching sets recently, and this one is a slight cut above the others that I've found. Because I'm preparing myself for a trip to see wifey, who lives overseas, I'll bring this along.  First, let's talk about the design and color. Black and gold might be a generic color pairing, but this outfit really makes good use of it. I especially love the gold trimming. Also, the black is a DEEP black. Like a jet black.  The shirt fits perfectly. There's no tightness around the waist or underneath the arms, and I got this outfit in a slightly smaller size than I should have. The shorts are a LITTLE snug, but I think that I will adjust to that over time.  I don't know what the outfit is made from (maybe satin?), but it's buttery soft. I feel like a king wearing it. I definitely want to encourage anyone who likes outfits like this to order this and give it a try. It definitely won't disappoint.",
Chris E.,"Quality material, correct sizing, a bit pricey",https://www.amazon.com/gp/customer-reviews/R3I5J2SCEA4UGP/ref=cm_cr_getr_d_rvw_ttl?ie=UTF8&ASIN=B0BYW7TGJF,"4.0 "," the United States "," June 1, 2023",Color: Navy BlueSize: XX-Large,,"The only reason this isn't five stars is because of the value of clothing available today. This fits exactly as advertised, which is refreshing. The material seems to be of high quality and well made. I wouldn't necessary call it a ""Hawaiian"" shirt but maybe more of a ""pajama"". But it looks good, fits good, and feels good.",3
K mac,Sexy Man,https://www.amazon.com/gp/customer-reviews/R12M5Q8881RFWK/ref=cm_cr_getr_d_rvw_ttl?ie=UTF8&ASIN=B0BYW7TGJF,"5.0 "," the United States "," May 27, 2023",Color: BlackSize: Medium,,"This is a very silky soft set. It keeps my husband cool in the summer, even on a hot southern day. The gold accents are what makes this set unique and one of a kind. It can be worn casual or fashionable. The size is true so order usual size.",
Rafael,Me gusto como me quedo,https://www.amazon.com/gp/customer-reviews/RQJ1SWVPXR5ZL/ref=cm_cr_getr_d_rvw_ttl?ie=UTF8&ASIN=B0BYW7TGJF,"5.0 "," the United States "," May 27, 2023",Color: WhiteSize: Small,Verified Purchase,Me gusto mucho,
Micheal,"nice looking set, fits well and looks good",https://www.amazon.com/gp/customer-reviews/R31DZIGGN6A0OO/ref=cm_cr_getr_d_rvw_ttl?ie=UTF8&ASIN=B0BYW7TGJF,"5.0 "," the United States "," May 24, 2023",Color: BlackSize: Medium,,"Fit as expected.  Nice material and stitching, hangs well and looks great!",
CreoleQueen337,Nice Set,https://www.amazon.com/gp/customer-reviews/R5OAX62945WVV/ref=cm_cr_getr_d_rvw_ttl?ie=UTF8&ASIN=B0BYW7TGJF,"5.0 "," the United States "," May 22, 2023",Color: Wine RedSize: Small,,This is a nice set.  Great for the beach or weekends.  Great quality.  Feels great on.,
