Jasper Thomas,Awesome!,https://www.amazon.com/gp/customer-reviews/RAMIAV2CT3VF7/ref=cm_cr_getr_d_rvw_ttl?ie=UTF8&ASIN=B0BYW7TGJF,"5.0 "," the United States "," May 16, 2023",Color: Navy BlueSize: XX-Large,,I Love this set! It's very comfortable and looks amazing in person.  I wore the shirt alone to an event and everyone complimented me the entire night. People also kept wanting to touch it because of how silky is looks!,
Be the reason someone smiles today,Meet expectation,https://www.amazon.com/gp/customer-reviews/R34TLL8P1YENUF/ref=cm_cr_getr_d_rvw_ttl?ie=UTF8&ASIN=B0BYW7TGJF,"5.0 "," the United States "," May 16, 2023",Color: Wine RedSize: X-Large,,The size is correct,
David,Nice cloth,https://www.amazon.com/gp/customer-reviews/RDY15NVB66GW3/ref=cm_cr_getr_d_rvw_ttl?ie=UTF8&ASIN=B0BYW7TGJF,"5.0 "," the United States "," May 14, 2023",Color: BlackSize: Medium,,"Very nice design cloth for me and I tried it and fit for me, and comfortable. Great quality and material, great product and reasonable price.",
Plant Bae,"I felt like a high roller in Vegas, but just ate pizza. Sweet set.",https://www.amazon.com/gp/customer-reviews/R3O1GDHTNJ1WDT/ref=cm_cr_getr_d_rvw_ttl?ie=UTF8&ASIN=B0BYW7TGJF,"4.0 "," the United States "," May 12, 2023",Color: BlackSize: XX-Large,,"The colors and prints are so vibrant and make a bold statement. The satin material is also incredibly smooth and comfortable to wear all day. The set is versatile, and I can dress it up or down depending on the occasion. However, I did notice that the set wrinkles easily and the shorts are a bit shorter than expected. Despite these minor issues, I would highly recommend this set to anyone looking to add a touch of luxury to their wardrobe.",
JT,Comfortable lounge wear,https://www.amazon.com/gp/customer-reviews/R1MYSGFO23LOQO/ref=cm_cr_getr_d_rvw_ttl?ie=UTF8&ASIN=B0BYW7TGJF,"5.0 "," the United States "," May 12, 2023",Color: BlackSize: Large,,This lounge wear set looks great. It is soft and feels luxurious. It is comfortable. True to size. Great value.,
Beautiful Soul,Looks as pictured!,https://www.amazon.com/gp/customer-reviews/RBBRBM95NV7PN/ref=cm_cr_getr_d_rvw_ttl?ie=UTF8&ASIN=B0BYW7TGJF,"5.0 "," the United States "," May 10, 2023",Color: BlackSize: Large,,"Nice men's outfit! It is a satin/silky look, but it is nice. This can be worn for a night out on the town or a fashionable party. Great price for the value.",
Chris S,Good looking shirt and shorts set that is perfect for hot weather.,https://www.amazon.com/gp/customer-reviews/R2VZ1G1CUW33BB/ref=cm_cr_getr_d_rvw_ttl?ie=UTF8&ASIN=B0BYW7TGJF,"5.0 "," the United States "," May 9, 2023",Color: Wine RedSize: X-Large,,"I ordered this OYOZONE Men's Hawaiian Shirt and Short Set for myself and I really think it looks and fits good on me. The material the set is made from is very lightweight, silky smooth, breathable and the wine-red color is deep, rich and good looking.  It is a blend of 98% polyester and 2% spandex but has no stretch to it even though it contains a little spandex in the blend. The shirt and shorts fit true to size for me and sits comfortably with just the right amount of bagginess that I prefer in this type of clothing. This is the perfect set to wear during the summer and I am happy with it.",
Anne B,Nice design,https://www.amazon.com/gp/customer-reviews/R2EGDNTHK2Y400/ref=cm_cr_getr_d_rvw_ttl?ie=UTF8&ASIN=B0BYW7TGJF,"5.0 "," the United States "," May 9, 2023",Color: Navy BlueSize: Medium,,"Very nice blue color, very vibrant. Material feels good on the skin. And it fits as expected",
Remiyyah,Great 2 piece,https://www.amazon.com/gp/customer-reviews/R4HEBP62O9YON/ref=cm_cr_getr_d_rvw_ttl?ie=UTF8&ASIN=B0BYW7TGJF,"5.0 "," the United States "," May 9, 2023",Color: Wine RedSize: Small,,This two piece outfit looks attractive on the body and the material is silky smooth to the touch.,
Josh,Soft comfy set,https://www.amazon.com/gp/customer-reviews/R2G18BL6W73QA3/ref=cm_cr_getr_d_rvw_ttl?ie=UTF8&ASIN=B0BYW7TGJF,"4.0 "," the United States "," May 8, 2023",Color: BlackSize: XX-Large,,I like how soft and silky this outfit feels. The material is very thin however it is not breathable. After a few minutes in a warm environment you start to sweat. The outfit is very lightweight and might be best as a pajama suit. Color is very deep and rich which was a plus.,
RAY BRITO,GOOD BUY!,https://www.amazon.com/gp/customer-reviews/RKXMKT2Q2Z4A8/ref=cm_cr_getr_d_rvw_ttl?ie=UTF8&ASIN=B0BYW7TGJF,"5.0 "," the United States "," May 8, 2023",Color: BlackSize: XX-Large,,Fits true to size and it's very comfortable,
Davy Krieger,So shiny and posh!,https://www.amazon.com/gp/customer-reviews/R1EYJC55XD1U6J/ref=cm_cr_getr_d_rvw_ttl?ie=UTF8&ASIN=B0BYW7TGJF,"4.0 "," the United States "," May 8, 2023",Color: BlackSize: X-Large,,"It's not perfectly clear from the pictures, but this is a very high shine satin material. It's very thin, too - almost making it inappropriate for the public, unless showing off is your thing! But as a lounging around, hot weather pajama set, I feel like a fancy, fancy man indeed.",
Tim Weintraut,Fits great love the color.,https://www.amazon.com/gp/customer-reviews/R2NUCAPJ0M466L/ref=cm_cr_getr_d_rvw_ttl?ie=UTF8&ASIN=B0BYW7TGJF,"5.0 "," the United States "," May 8, 2023",Color: Navy BlueSize: X-Large,,"They feel and look kinda like pajamas, very comfortable. I Like the design and the style but probably will not wear them together.",34
Marc A.,"Shirt is okay, shorts are gigantic.",https://www.amazon.com/gp/customer-reviews/R10TZDS898RWFK/ref=cm_cr_getr_d_rvw_ttl?ie=UTF8&ASIN=B0BYW7TGJF,"4.0 "," the United States "," May 7, 2023",Color: Navy BlueSize: Medium,,"First off, I'm 5'10"" and 165lbs. I usually wear a medium size shirt and a 30X32 pants. While the medium shirt fits me fine, the shorts are gigantic, and I couldn't even wear them. This is fine, since I really got this for the shirt, which I do like. Still, be aware that there seems to be a mismatch between the two items.",2
J Black,Nice set,https://www.amazon.com/gp/customer-reviews/R31VIMYBXA92V9/ref=cm_cr_getr_d_rvw_ttl?ie=UTF8&ASIN=B0BYW7TGJF,"4.0 "," the United States "," May 6, 2023",Color: BlackSize: XX-Large,,Comfortable.  Looks good.,
Shena C.,Nice,https://www.amazon.com/gp/customer-reviews/R3SHZ27H0Q8MPW/ref=cm_cr_getr_d_rvw_ttl?ie=UTF8&ASIN=B0BYW7TGJF,"5.0 "," the United States "," May 4, 2023",Color: Dark GreenSize: X-Large,,"This is nice and silky. Great price will put together doesn’t look cheap price is right runs a little big so you might wanna try getting a size smaller but if you like it comfortable, the size should be great for you.",
Aaditya,Loved the gold wavy bordering.,https://www.amazon.com/gp/customer-reviews/R2RMOXD0UVOF7D/ref=cm_cr_getr_d_rvw_ttl?ie=UTF8&ASIN=B0BYW7TGJF,"5.0 "," the United States "," May 2, 2023",Color: Wine RedSize: Small,,"Two-piece outfit that combines silky material with a unique pattern in several nice colors.  Fits Perfectly.  The pattern on the outfit, particularly the gold wavy bordering around the shirt and shorts, is a nice feature and reminiscent of historic gold relief found in buildings or temples.",
Robert Strecker,this outfit was meant for me - i love it,https://www.amazon.com/gp/customer-reviews/RSEM2U2ZSIYQC/ref=cm_cr_getr_d_rvw_ttl?ie=UTF8&ASIN=B0BYW7TGJF,"5.0 "," the United States "," April 28, 2023",Color: Dark GreenSize: Medium,,I have daydreamed about the perfect summer outfit designs that would combine a silky material with another pattern that was completely outside that visual approach. I have to look no further with this great looking two piece outfit from the Oyozone brand. This is available in several nice colors which made it hard for me to choose which on i wanted to order. I honestly love all of the color options and had narrowed it down to either the red or green. I went with the green because it is less common within a silky material. I like the dark shade of the green used with that making it a great pairing with the shiny effect of the green. I like how the medium size i ordered fits like a medium with it being more of a slimmer fitting affair. I like the pattern that appears as a boarder along the edges of the button down shirt then around the leg region of the shorts. The gold dominant color of the wavy pattern is reminiscent of a gold relief that would be around a historic building or inside a temple. I am a fan of that kind of wavy bordering in general so that is a nice feature of the shirt part of this outfit. The fact that this is a button down shirt gives you that opportunity to control the front which is beneficial in the summer heat. This is as comfortable as it looks with the inner material being kind to the skin. The outer silkiness makes it easy to move around on a couch or other furniture. You can create a slide effect when on a leather couch or other material that allows for that. This outfit definitely stands out when you wear it in public. I received several compliments on it at the store when i was grocery shopping. To conclude i am vey happy with this and recommend it for anyone who likes to add a bit of animation to their everyday clothing.,
Money Mike,,https://www.amazon.com/hz/reviews-render/report-review?ie=UTF8&ref=cm_cr_getr_d_rvw_hlp&csrfT=hErhJdrQzEsOqRkj4eYLZvVKzewaoxpXqJIPK1t%2B6bXkAAAAAGebnJcAAAAB&reviewId=R8EIY8THF74LN,"5.0 "," Canada "," September 2, 2024",Color: BlackSize: Medium,Verified Purchase,"Excellent fabric. Silky, airy material that you can hardly feel against your skin. I took to wearing them as pajamas because they are so darn comfy and cool. The pattern just work really well for PJs, too. Although I could wear it around on a nice summer day and no one would know the difference.",
Alejandro Márquez,,https://www.amazon.com/hz/reviews-render/report-review?ie=UTF8&ref=cm_cr_getr_d_rvw_hlp&csrfT=hOZ5OAu2tRDVgBt%2BLmdxFmQ0HJ0JmoTgUwpDeSAsWO7XAAAAAGebnJcAAAAB&reviewId=R1FHVW8XL7WI7U,"5.0 "," Mexico "," June 10, 2024",Color: Dark GreenSize: Medium,Verified Purchase,"El conjunto es espectacular, pedí talla M, mido 180cm y peso 70kg, sin embargo debo decir que la camisa es muy larga y tuve coserla a mano para que tuviera una longitud adecuada del pecho y espalda quedó excelente, muchos cumplidos además ese color va genial con el tono de piel",
