Matthew C.,Tiny bit big but worth it,https://www.amazon.com/gp/customer-reviews/R2ILA30TZN1XBW/ref=cm_cr_getr_d_rvw_ttl?ie=UTF8&ASIN=B08P3Z7LCF,"5.0 "," the United States "," July 15, 2021",Color: Shiny Silver,Verified Purchase,"Got the all silver, super nice quality and eye catching shine.",
amora,Now I can tell the time,https://www.amazon.com/gp/customer-reviews/R3HEYP7U068X26/ref=cm_cr_getr_d_rvw_ttl?ie=UTF8&ASIN=B08P3Z7LCF,"5.0 "," the United States "," July 14, 2021",Color: Blood Red/Silver,Verified Purchase,It's was a nice watch thanks,
David & Amanda,Great product.,https://www.amazon.com/gp/customer-reviews/R3M15Q96MREG09/ref=cm_cr_getr_d_rvw_ttl?ie=UTF8&ASIN=B08P3Z7LCF,"5.0 "," the United States "," July 10, 2021",Color: Silver Black Panther,Verified Purchase,Very nice looking.,
Sheena,Looks just as picture 😍,https://www.amazon.com/gp/customer-reviews/R2NKLOEHDVTOKT/ref=cm_cr_getr_d_rvw_ttl?ie=UTF8&ASIN=B08P3Z7LCF,"5.0 "," the United States "," June 16, 2021",Color: Blood Red/Silver,Verified Purchase,he is so happy and he loves it plus I appreciate the bonus gift 😊,
John keifer,Will turn you green fast don't buy it,https://www.amazon.com/gp/customer-reviews/R11NZA2SXVLJ2P/ref=cm_cr_getr_d_rvw_ttl?ie=UTF8&ASIN=B08P3Z7LCF,"1.0 "," the United States "," June 7, 2021",Color: ST10327 RN Silver Green Money,Verified Purchase,"Turned my wrist green on 2nd day ,don't buy it",
Christopher H.,It’s a nice watch but it doesn’t last very long and will turn ya green,https://www.amazon.com/gp/customer-reviews/R2IJIV93I3B8JY/ref=cm_cr_getr_d_rvw_ttl?ie=UTF8&ASIN=B08P3Z7LCF,"3.0 "," the United States "," May 31, 2021",Color: Blood Red/Silver,,It lasted a couple of months then my wrist started turning green and it started tarnishing a lot. Pretty embarrassing I loved this watch such a shame it only lasted this long.,
david e.,Terrific Offer,https://www.amazon.com/gp/customer-reviews/R1MFOASRU7BT4V/ref=cm_cr_getr_d_rvw_ttl?ie=UTF8&ASIN=B08P3Z7LCF,"4.0 "," the United States "," May 7, 2021",Color: Gold Black Panther,Verified Purchase,Beautiful watch. Excellent purchase.  Would recommend to anyone.,
luis,Great 👍🏻 🕺🏻,https://www.amazon.com/gp/customer-reviews/R13GTVI51ZZF29/ref=cm_cr_getr_d_rvw_ttl?ie=UTF8&ASIN=B08P3Z7LCF,"5.0 "," the United States "," May 2, 2021",Color: Blood Red/Silver,Verified Purchase,Love it and came with a little gift as well 🕺🏻,
Karmen Moreno Rodriguez,Very Satisfied,https://www.amazon.com/gp/customer-reviews/R1MQEM80RC88J8/ref=cm_cr_getr_d_rvw_ttl?ie=UTF8&ASIN=B08P3Z7LCF,"5.0 "," the United States "," April 23, 2021",Color: Gold Blood Red,Verified Purchase,Great Product,
ksk,Amazing product,https://www.amazon.com/gp/customer-reviews/REDHLUC5D5K3K/ref=cm_cr_getr_d_rvw_ttl?ie=UTF8&ASIN=B08P3Z7LCF,"5.0 "," the United States "," April 22, 2021",Color: GunGold Blood Red,Verified Purchase,Amazing product way more then glad I purchased this watch will definitely be buying from seller again...,
Stephon,Good looking jewelry,https://www.amazon.com/gp/customer-reviews/R2YVY1GX7Y2P3S/ref=cm_cr_getr_d_rvw_ttl?ie=UTF8&ASIN=B08P3Z7LCF,"5.0 "," the United States "," April 19, 2021",Color: Shiny Silver,Verified Purchase,Good looking jewelry,
Darryl,Great jewelry for a reasonable price,https://www.amazon.com/gp/customer-reviews/R3PADY81ONME19/ref=cm_cr_getr_d_rvw_ttl?ie=UTF8&ASIN=B08P3Z7LCF,"5.0 "," the United States "," April 18, 2021",Color: Gold Royal Blue,Verified Purchase,Shining Big,
Said,Muy bueno,https://www.amazon.com/gp/customer-reviews/R2K25XUN1AT71F/ref=cm_cr_getr_d_rvw_ttl?ie=UTF8&ASIN=B08P3Z7LCF,"4.0 "," the United States "," April 15, 2021",Color: Silver Black Panther,,Esta genial solo me gustaría poder escoger el tamaño por que me quedo muy flojo 🥲,
Desire Beasley,Beautifullllll 😍😍😍😍💦,https://www.amazon.com/gp/customer-reviews/RXIR6UE9NX193/ref=cm_cr_getr_d_rvw_ttl?ie=UTF8&ASIN=B08P3Z7LCF,"5.0 "," the United States "," April 6, 2021",Color: Shiny Silver,Verified Purchase,I love it it’s beautiful it doesn’t fit but I’m going to remove the links to make it fit 😍,
Crissy mosley,Two is better,https://www.amazon.com/gp/customer-reviews/R276AS13ELQUYF/ref=cm_cr_getr_d_rvw_ttl?ie=UTF8&ASIN=B08P3Z7LCF,"5.0 "," the United States "," April 1, 2021",Color: Blood Red/Silver,Verified Purchase,My husband and I bought matching watches..we love them,
Timmy,Worth buying,https://www.amazon.com/gp/customer-reviews/R2RFNGB5AG50MO/ref=cm_cr_getr_d_rvw_ttl?ie=UTF8&ASIN=B08P3Z7LCF,"5.0 "," the United States "," March 29, 2021",Color: Blood Red/Silver,Verified Purchase,Eye catching,
Amazon Customer,Nice,https://www.amazon.com/gp/customer-reviews/R3W1H729FRG5U3/ref=cm_cr_getr_d_rvw_ttl?ie=UTF8&ASIN=B08P3Z7LCF,"3.0 "," the United States "," March 19, 2021",Color: Blood Red/Silver,Verified Purchase,Nice,
Shania Stoney,Everything shines and color pops will get lots of compliments and looks,https://www.amazon.com/gp/customer-reviews/R1WP8UB55ZCRPI/ref=cm_cr_getr_d_rvw_ttl?ie=UTF8&ASIN=B08P3Z7LCF,"5.0 "," the United States "," March 19, 2021",Color: Blood Red/Silver,Verified Purchase,Can’t wait to wear have to adjust to my small wrist loveeee Great Quality highly recommended,
John Smith,Amazing,https://www.amazon.com/gp/customer-reviews/R3V0FILZNCDW2H/ref=cm_cr_getr_d_rvw_ttl?ie=UTF8&ASIN=B08P3Z7LCF,"5.0 "," the United States "," March 19, 2021",Color: Gold Black Panther,Verified Purchase,This product is nothing short of fantastic! I love it!,
Alisha Brewington,Great gift!,https://www.amazon.com/gp/customer-reviews/R3LRB1BEPN6BKI/ref=cm_cr_getr_d_rvw_ttl?ie=UTF8&ASIN=B08P3Z7LCF,"5.0 "," the United States "," March 17, 2021",Color: Blood Red/Silver,Verified Purchase,Hubby loved it!,
Ashley,Great gift,https://www.amazon.com/gp/customer-reviews/R23OFITX1TS3B4/ref=cm_cr_getr_d_rvw_ttl?ie=UTF8&ASIN=B08P3Z7LCF,"5.0 "," the United States "," March 16, 2021",Color: Blood Red/Silver,Verified Purchase,I bought this for Valentine’s Day for my fiancé he loves watches. It’s very shiny and he likes it,
