评论用户,评论概述,评论链接,星级评分,评论地点,评论时间,类型,是否购买,评论详情,觉得该评论有帮助的人数
sean,Fits well,https://www.amazon.com/gp/customer-reviews/R24EIU264J5KOC/ref=cm_cr_getr_d_rvw_ttl?ie=UTF8&ASIN=B08P3Z7LCF,"5.0 "," the United States "," January 9, 2025",Color: ST10327 RN Black Blood Red,Verified Purchase,Looks sharp fits well thanks,
Arianna,It’s a very clean watch,https://www.amazon.com/gp/customer-reviews/R3O2A01Y5W86CU/ref=cm_cr_getr_d_rvw_ttl?ie=UTF8&ASIN=B08P3Z7LCF,"5.0 "," the United States "," November 21, 2024",Color: Blood Red/Silver,Verified Purchase,I like it alot,
Alan Alberto,Wonderful!!,https://www.amazon.com/gp/customer-reviews/R2GR4RCFC5YN96/ref=cm_cr_getr_d_rvw_ttl?ie=UTF8&ASIN=B08P3Z7LCF,"5.0 "," the United States "," April 11, 2024",Color: Blood Red/Silver,Verified Purchase,"The watch looks exactly like in the picture, Shipping was fast. I am happy with the purchase!",
Kyla Watson,Bling Watch,https://www.amazon.com/gp/customer-reviews/R1OT8H0CA04SP/ref=cm_cr_getr_d_rvw_ttl?ie=UTF8&ASIN=B08P3Z7LCF,"5.0 "," the United States "," February 29, 2024",Color: Silver Black Panther,Verified Purchase,It's beautiful....absolutely gorgeous!!,
Mustafa,Very nice and worth it,https://www.amazon.com/gp/customer-reviews/R2AMDD5TK26DL9/ref=cm_cr_getr_d_rvw_ttl?ie=UTF8&ASIN=B08P3Z7LCF,"5.0 "," the United States "," February 6, 2024",Color: Blood Red/Silver,,Super good and shiny very good for price,
marilu reyna,beautiful,https://www.amazon.com/gp/customer-reviews/RHA30PN5O37F3/ref=cm_cr_getr_d_rvw_ttl?ie=UTF8&ASIN=B08P3Z7LCF,"5.0 "," the United States "," January 24, 2024",Color: Blood Red/Silver,Verified Purchase,love it! it came packaged very well. also had a pair of ear rings included. very blingy watch. looks great.,
David Hudson,Wonderful,https://www.amazon.com/gp/customer-reviews/R2Z5YP1ZSFN9FH/ref=cm_cr_getr_d_rvw_ttl?ie=UTF8&ASIN=B08P3Z7LCF,"5.0 "," the United States "," January 4, 2024",Color: Silver Black Panther,Verified Purchase,Looks amazing and they even gave me a free pair of earrings,
Buster rhymed,TIME’s up ho’s down,https://www.amazon.com/gp/customer-reviews/R156ZJ8TT2V6V5/ref=cm_cr_getr_d_rvw_ttl?ie=UTF8&ASIN=B08P3Z7LCF,"5.0 "," the United States "," December 22, 2023",Color: Classic Slv Slv,Verified Purchase,"On hood, this time piece screams certified hustla watch yo chick I might cross yuh. I be like Ben 10 cookin that white on folk n’em yiundstan. 11/10 wit this buss down",3
Brandi Olivarez,Looks great,https://www.amazon.com/gp/customer-reviews/R1SF5288K2FSQH/ref=cm_cr_getr_d_rvw_ttl?ie=UTF8&ASIN=B08P3Z7LCF,"5.0 "," the United States "," December 1, 2023",,Verified Purchase,Bought this for my teenage son. He loves it. Looks really nice and is heavy. The sparkle is incredible. Great product.,2
Tatiana De La Sancha,Inexpensive but looked expensive,https://www.amazon.com/gp/customer-reviews/RRBWP95D0RPRK/ref=cm_cr_getr_d_rvw_ttl?ie=UTF8&ASIN=B08P3Z7LCF,"5.0 "," the United States "," November 26, 2023",Color: Gold Blood Red,Verified Purchase,"Cheap but good quality, super shiny",
Iamtheprezident,Awesome buy!!!!,https://www.amazon.com/gp/customer-reviews/R3HWZOQ05VDYE9/ref=cm_cr_getr_d_rvw_ttl?ie=UTF8&ASIN=B08P3Z7LCF,"5.0 "," the United States "," October 19, 2023",Color: Gold Blood Red,,Awesome buy!!!!,
Crown custom closets Corp,Nice,https://www.amazon.com/gp/customer-reviews/R2CAD50P15O3V0/ref=cm_cr_getr_d_rvw_ttl?ie=UTF8&ASIN=B08P3Z7LCF,"5.0 "," the United States "," August 22, 2023",Color: Silver Black Panther,Verified Purchase,Very nice for the price and honestly keeps time better than my expensive diamond watch,
David Martens,Clunky,https://www.amazon.com/gp/customer-reviews/R47DXIY6LN1KS/ref=cm_cr_getr_d_rvw_ttl?ie=UTF8&ASIN=B08P3Z7LCF,"3.0 "," the United States "," August 19, 2023",Color: ST10327 RN Silver Green Money,Verified Purchase,Very heavy and kind of chintzy...unable to remove links to adjust size.,
Jeffery Fuller,Watch hitting can even wash it make sure to dry it,https://www.amazon.com/gp/customer-reviews/R33OLFG9R1WF7A/ref=cm_cr_getr_d_rvw_ttl?ie=UTF8&ASIN=B08P3Z7LCF,"5.0 "," the United States "," May 29, 2023",Color: Blood Red/Silver,Verified Purchase,Watch last a long long time if you get the silver and red one,
James  Brown,Nice,https://www.amazon.com/gp/customer-reviews/RGNU0PQVYEBL4/ref=cm_cr_getr_d_rvw_ttl?ie=UTF8&ASIN=B08P3Z7LCF,"5.0 "," the United States "," May 9, 2023",Color: Silver Black Panther,Verified Purchase,Nice,
Jenny Mbogne,The quality,https://www.amazon.com/gp/customer-reviews/R1UXR2CZ8MZISD/ref=cm_cr_getr_d_rvw_ttl?ie=UTF8&ASIN=B08P3Z7LCF,"4.0 "," the United States "," April 16, 2023",Color: Blood Red/Silver,Verified Purchase,It's good 👍,
Jerri Garcia,Poor quality,https://www.amazon.com/gp/customer-reviews/R2G8IV4DVA4CNO/ref=cm_cr_getr_d_rvw_ttl?ie=UTF8&ASIN=B08P3Z7LCF,"1.0 "," the United States "," April 4, 2023",Color: Gold Blood Red,Verified Purchase,Watch arrived with missing stones. Would like a refund or a watch that isn't missing stones!,
Billie Brown,My husband loves it,https://www.amazon.com/gp/customer-reviews/R19MLYW59XHB8X/ref=cm_cr_getr_d_rvw_ttl?ie=UTF8&ASIN=B08P3Z7LCF,"4.0 "," the United States "," March 16, 2023",Color: Classic Slv Slv,Verified Purchase,My husband loves this,2
Julian Torres,Love it,https://www.amazon.com/gp/customer-reviews/R1RD52ZZN5Q1NX/ref=cm_cr_getr_d_rvw_ttl?ie=UTF8&ASIN=B08P3Z7LCF,"5.0 "," the United States "," February 27, 2023",Color: Silver Black Panther,Verified Purchase,I received the package quickly and exactly as displayed online . I love it!,
man who liks to buy things,Very shiny,https://www.amazon.com/gp/customer-reviews/R1FKO2PYF7HAN7/ref=cm_cr_getr_d_rvw_ttl?ie=UTF8&ASIN=B08P3Z7LCF,"5.0 "," the United States "," February 22, 2023",Color: Gold Blood Red,Verified Purchase,Shiny and comes with cool box. Would recommend,
Jhylian Mccall,I LOVE IT !!!,https://www.amazon.com/gp/customer-reviews/R2ZWNFXBJ0Y8OR/ref=cm_cr_getr_d_rvw_ttl?ie=UTF8&ASIN=B08P3Z7LCF,"5.0 "," the United States "," February 7, 2023",Color: Blood Red/Silver,Verified Purchase,I really love the watch and I really love they way you sent a small free gift as well .,
Clifford Tolbert,Beautiful watch.,https://www.amazon.com/gp/customer-reviews/R1VHY8JAVMWDU3/ref=cm_cr_getr_d_rvw_ttl?ie=UTF8&ASIN=B08P3Z7LCF,"5.0 "," the United States "," February 1, 2023",Color: Blood Red/Silver,Verified Purchase,My son really loves this watch. Looks great and quite happy with purchase. Could not be happier.,
Destinee,Better then expected,https://www.amazon.com/gp/customer-reviews/R37U78RNTSG16E/ref=cm_cr_getr_d_rvw_ttl?ie=UTF8&ASIN=B08P3Z7LCF,"5.0 "," the United States "," January 27, 2023",Color: Blood Red/Silver,Verified Purchase,Bought it as a gift for my boyfriend and he is absolutely in love with it. Highly recommend,
Chill,Horrible,https://www.amazon.com/gp/customer-reviews/RWU1OWQFGHPLH/ref=cm_cr_getr_d_rvw_ttl?ie=UTF8&ASIN=B08P3Z7LCF,"1.0 "," the United States "," January 24, 2023",Color: Rose Gold,Verified Purchase,The price should be $1,
Marlo Paglinawan,Great product,https://www.amazon.com/gp/customer-reviews/R2846P686GJFJY/ref=cm_cr_getr_d_rvw_ttl?ie=UTF8&ASIN=B08P3Z7LCF,"5.0 "," the United States "," January 13, 2023",Color: Blood Red/Silver,Verified Purchase,Worth it 😁,
Mr. Jones,Nice Watch,https://www.amazon.com/gp/customer-reviews/R6MRAR20HMQIV/ref=cm_cr_getr_d_rvw_ttl?ie=UTF8&ASIN=B08P3Z7LCF,"5.0 "," the United States "," January 13, 2023",Color: Blood Red/Silver,Verified Purchase,Great quality.,
Valerie,Nice watch,https://www.amazon.com/gp/customer-reviews/R39BWX8U93HMZF/ref=cm_cr_getr_d_rvw_ttl?ie=UTF8&ASIN=B08P3Z7LCF,"5.0 "," the United States "," January 12, 2023",Color: Blood Red/Silver,Verified Purchase,I loved it got alot of compliments,
Jacob Wilson,"Best buy ever, thank you.",https://www.amazon.com/gp/customer-reviews/R2HEMPRRU4063M/ref=cm_cr_getr_d_rvw_ttl?ie=UTF8&ASIN=B08P3Z7LCF,"5.0 "," the United States "," January 10, 2023",Color: Gold Blood Red,Verified Purchase,"I enjoy the product, great buy.",
Dawson lee,Looks very real,https://www.amazon.com/gp/customer-reviews/R1E816NZ1SUVIZ/ref=cm_cr_getr_d_rvw_ttl?ie=UTF8&ASIN=B08P3Z7LCF,"5.0 "," the United States "," January 3, 2023",Color: Blood Red/Silver,Verified Purchase,"As someone who was very skeptical about this product, it has really surprised me. It's so icey its ridiculous like I didn't expect the diamonds to shine like this",
BB in Kansas,Beautiful!,https://www.amazon.com/gp/customer-reviews/R1JV342VPNSEIX/ref=cm_cr_getr_d_rvw_ttl?ie=UTF8&ASIN=B08P3Z7LCF,"5.0 "," the United States "," December 6, 2022",Color: Blood Red/Silver,Verified Purchase,Love the bling on my wrist.  Nice color red face on the watch.,
Jaymusic,Love it!,https://www.amazon.com/gp/customer-reviews/RF7Z9MLRPJMH0/ref=cm_cr_getr_d_rvw_ttl?ie=UTF8&ASIN=B08P3Z7LCF,"5.0 "," the United States "," November 27, 2022",Color: Shiny Silver,Verified Purchase,"Love the set, great value for the price",
Joel Ortiz,It's definitely worth the value ..it's a very nice watch and don't cost a lot,https://www.amazon.com/gp/customer-reviews/R1N0T2YE83KT3I/ref=cm_cr_getr_d_rvw_ttl?ie=UTF8&ASIN=B08P3Z7LCF,"5.0 "," the United States "," October 30, 2022",Color: Gold Blood Red,Verified Purchase,No issues at all,
Joseph deuesenberry,ABSOLUTELY perfect does have good weight!!!,https://www.amazon.com/gp/customer-reviews/R2ABHMAIZYU465/ref=cm_cr_getr_d_rvw_ttl?ie=UTF8&ASIN=B08P3Z7LCF,"5.0 "," the United States "," October 2, 2022",Color: Blood Red/Silver,Verified Purchase,,
Amazon Customer,It good,https://www.amazon.com/gp/customer-reviews/R2M3Y20IWCDMOE/ref=cm_cr_getr_d_rvw_ttl?ie=UTF8&ASIN=B08P3Z7LCF,"5.0 "," the United States "," September 27, 2022",Color: Silver Black Panther,Verified Purchase,I like it,
Val hernandez,It was trash. Cheaper than it looked. Broke first time I wore it,https://www.amazon.com/gp/customer-reviews/R2WLQN13VLKYE6/ref=cm_cr_getr_d_rvw_ttl?ie=UTF8&ASIN=B08P3Z7LCF,"1.0 "," the United States "," September 6, 2022",Color: Blood Red/Silver,Verified Purchase,Nothing to like about it,
Chabeli Romero,Awesome watch,https://www.amazon.com/gp/customer-reviews/RBNOU0FZDTKKT/ref=cm_cr_getr_d_rvw_ttl?ie=UTF8&ASIN=B08P3Z7LCF,"5.0 "," the United States "," August 14, 2022",Color: Blood Red/Silver,Verified Purchase,Pretty nice size. Diamonds dancing! Free earrings. Thank you Charles Raymond Officials.,
DMart180,Icey,https://www.amazon.com/gp/customer-reviews/R3TDB42SXC0IX1/ref=cm_cr_getr_d_rvw_ttl?ie=UTF8&ASIN=B08P3Z7LCF,"4.0 "," the United States "," August 7, 2022",Color: Shiny Silver,Verified Purchase,Icey,
James Fontus,The shipping was very fast and it's look exactly like the picture,https://www.amazon.com/gp/customer-reviews/RHHWFW2Y8S6QB/ref=cm_cr_getr_d_rvw_ttl?ie=UTF8&ASIN=B08P3Z7LCF,"5.0 "," the United States "," August 6, 2022",Color: Rose Gold,Verified Purchase,I like everything about it,
Diamond,Excited,https://www.amazon.com/gp/customer-reviews/R1HJFFFD6CVFTE/ref=cm_cr_getr_d_rvw_ttl?ie=UTF8&ASIN=B08P3Z7LCF,"5.0 "," the United States "," July 17, 2022",Color: ST10327 RN Silver Green Money,Verified Purchase,My bf was so excited when he saw his father's days gift he can't wait to wear it on a special day,
TooCuteShan👑 🇯🇲,Just beautiful 😍,https://www.amazon.com/gp/customer-reviews/R3M7ZOPSBES9BO/ref=cm_cr_getr_d_rvw_ttl?ie=UTF8&ASIN=B08P3Z7LCF,"5.0 "," the United States "," June 1, 2022",Color: Blood Red/Silver,Verified Purchase,This watch is everything 😍,
Jill Gray,I received what I paid for and it was delivered when promised,https://www.amazon.com/gp/customer-reviews/R2O4AM7UO1JHGA/ref=cm_cr_getr_d_rvw_ttl?ie=UTF8&ASIN=B08P3Z7LCF,"5.0 "," the United States "," May 20, 2022",Color: Blood Red/Silver,Verified Purchase,I received what I paid for and it was delivered when. For my son's prom,
Justin,Trash,https://www.amazon.com/gp/customer-reviews/R1R8QWBWJGATYL/ref=cm_cr_getr_d_rvw_ttl?ie=UTF8&ASIN=B08P3Z7LCF,"1.0 "," the United States "," May 17, 2022",Color: Blood Red/Silver,,Watch is straight junk fake plastic rhinestones all crooked and ridiculous looking and get ready for your wrist to turn black as soon as you sweat in the slightest bit.,
Toby Burnett,It’s a nice watch but too small and  want fit me,https://www.amazon.com/gp/customer-reviews/R2MWJS9QUKNA71/ref=cm_cr_getr_d_rvw_ttl?ie=UTF8&ASIN=B08P3Z7LCF,"5.0 "," the United States "," May 13, 2022",Color: Blood Red/Silver,Verified Purchase,"Would not fit, too small",
Kathy,It was worth the money💯🥰,https://www.amazon.com/gp/customer-reviews/R104VO584LNAWU/ref=cm_cr_getr_d_rvw_ttl?ie=UTF8&ASIN=B08P3Z7LCF,"5.0 "," the United States "," April 10, 2022",Color: Blood Red/Silver,Verified Purchase,,
Jerrod,Amazing,https://www.amazon.com/gp/customer-reviews/R3O0M0IPIYRN7Q/ref=cm_cr_getr_d_rvw_ttl?ie=UTF8&ASIN=B08P3Z7LCF,"5.0 "," the United States "," March 10, 2022",Color: Blood Red/Silver,Verified Purchase,To be honest  i was worried its going to be plasticy but its not and to be fair its well priced for what you get highly recommended,
Jordan Bledsoe,"Love the watch,  people stare.",https://www.amazon.com/gp/customer-reviews/R3KDQNWETOXPUQ/ref=cm_cr_getr_d_rvw_ttl?ie=UTF8&ASIN=B08P3Z7LCF,"5.0 "," the United States "," March 3, 2022",Color: Blood Red/Silver,Verified Purchase,"Love the watch , people state.",
Dragife,Absolutely stunning watch!  More of a conversation piece than my $4000 watches,https://www.amazon.com/gp/customer-reviews/R10KFULZTGT18F/ref=cm_cr_getr_d_rvw_ttl?ie=UTF8&ASIN=B08P3Z7LCF,"5.0 "," the United States "," March 2, 2022",Color: Blood Red/Silver,Verified Purchase,"Ok first of all, I don't buy $4000 watches.  But I was gifted several by a close family friend.  This watch has gotten more compliments and comments than any of those watches combined.  Its flashy, it looks expensive.  No one has to know.  Don't wear it with a tshirt.  If you wear it with a nice suit?  People will think you are fly. I got it as a joke but honestly its no joke.  Runs great, keeps great time and honestly sets itself apart.  Solidly put together. I was super impressed!!!!  Mine is Red, I think Black would tone it down enough to make it more realistic looking but....matchy matchy.....",7
Luke Holsey,Try to wear mostly on special occasions. Beautiful watch.,https://www.amazon.com/gp/customer-reviews/R3MYGIVYWCO9BD/ref=cm_cr_getr_d_rvw_ttl?ie=UTF8&ASIN=B08P3Z7LCF,"5.0 "," the United States "," February 21, 2022",Color: Blood Red/Silver,Verified Purchase,A really good value for you're money.,
ray ray,Fully Iced Out Nothing,https://www.amazon.com/gp/customer-reviews/R1W90SJ7QLX57R/ref=cm_cr_getr_d_rvw_ttl?ie=UTF8&ASIN=B08P3Z7LCF,"2.0 "," the United States "," February 19, 2022",Color: Gold Blood Red,Verified Purchase,All I will say is this. The video Real Fully Iced Out And Their Fully Iced Out,2
Evan,Largely Excellent,https://www.amazon.com/gp/customer-reviews/R3JXFQHRCPZZXP/ref=cm_cr_getr_d_rvw_ttl?ie=UTF8&ASIN=B08P3Z7LCF,"4.0 "," the United States "," February 18, 2022",Color: Silver Black Panther,Verified Purchase,"Amazing shine, feels nice (does run big, will likely need a few link’s taken off). The only other minor complaint is that the wrist band part on the very back of the watch is not shiny. So near the part where it clips together, it doesn’t shine. But otherwise, great watch for the price!",6
joways,Bad lock,https://www.amazon.com/gp/customer-reviews/R2AL2KEG8GRESJ/ref=cm_cr_getr_d_rvw_ttl?ie=UTF8&ASIN=B08P3Z7LCF,"1.0 "," the United States "," February 15, 2022",Color: Silver Black Panther,Verified Purchase,The lock its bad keep opening,
Mina,Recommend it!,https://www.amazon.com/gp/customer-reviews/R1D4DRJN7SL3OG/ref=cm_cr_getr_d_rvw_ttl?ie=UTF8&ASIN=B08P3Z7LCF,"5.0 "," the United States "," February 2, 2022",Color: Blood Red/Silver,Verified Purchase,"Looks super stylish and matched with everything. It’s a bit big, but it still fits over a jacket",
Leah Beery,Decent Price for A Boujee Looking Watch!!,https://www.amazon.com/gp/customer-reviews/RHWU9EJCX8OXM/ref=cm_cr_getr_d_rvw_ttl?ie=UTF8&ASIN=B08P3Z7LCF,"5.0 "," the United States "," February 1, 2022",Color: Blood Red/Silver,Verified Purchase,"Let me tell yall I thought this watch was going to be cheap looking, and I thought it was a little sketchy, but when this came in, I could not believe how much it looked like a $50,000 watch! I bought this for my best friend for Christmas, and he loved it and freaked out how sparkly it was. If you need a boujee looking expensive watch, this is for you!",
Bunny,Great gift,https://www.amazon.com/gp/customer-reviews/R1750W7A8HRRL5/ref=cm_cr_getr_d_rvw_ttl?ie=UTF8&ASIN=B08P3Z7LCF,"5.0 "," the United States "," January 30, 2022",Color: Blood Red/Silver,Verified Purchase,Brought it for my dad and he loved it (even though he doesn’t really like anything too extravagant).,
Alia Tianna,Very pretty! Cute for pictures,https://www.amazon.com/gp/customer-reviews/R3D7185B9PV6DV/ref=cm_cr_getr_d_rvw_ttl?ie=UTF8&ASIN=B08P3Z7LCF,"5.0 "," the United States "," January 14, 2022",Color: Shiny Silver,,"It’s super pretty from a distance. When you get up close you can clearly see it’s very fake and cheap. But it was perfect for what I wanted, just something cute to show off sometimes for pictures and maybe even go out with it once or twice. Pretty great value for money it was only $20 guys IDK what kind of super high quality some of these reviews were expecting.",2
Saifeddin m.,I just like it so much.,https://www.amazon.com/gp/customer-reviews/R37O2R7DTHKJQH/ref=cm_cr_getr_d_rvw_ttl?ie=UTF8&ASIN=B08P3Z7LCF,"5.0 "," the United States "," January 13, 2022",Color: Blood Red/Silver,Verified Purchase,It’s amazing,
Samuel Haleem,Cheap plasticy  material,https://www.amazon.com/gp/customer-reviews/R4J7SVEPBOVFS/ref=cm_cr_getr_d_rvw_ttl?ie=UTF8&ASIN=B08P3Z7LCF,"1.0 "," the United States "," January 12, 2022",Color: Gold Black Panther,Verified Purchase,"I know this is a cheap watch but the quality is so bad it should be priced at 5 bucks at most, I’m returning it",2
Amazon Customer,Blingy,https://www.amazon.com/gp/customer-reviews/R1BIL82OS87T29/ref=cm_cr_getr_d_rvw_ttl?ie=UTF8&ASIN=B08P3Z7LCF,"4.0 "," the United States "," January 12, 2022",Color: ST10327 RN Silver Green Money,Verified Purchase,"I got this for my son for christmas, he loves it!  the packaging is sleek and sturdy, My only complaint is that it came with a pin missing from the watch not ne properly attached, however the pin was loose in the box.  Not a HUGE deal beause a few links needed to be removed anyways....its beautiful.",
Zach B.,Watch is beautiful and received a free gift set of earrings 😍,https://www.amazon.com/gp/customer-reviews/RD2ERHJ5NN3SQ/ref=cm_cr_getr_d_rvw_ttl?ie=UTF8&ASIN=B08P3Z7LCF,"5.0 "," the United States "," January 3, 2022",Color: Gold Royal Blue,Verified Purchase,For business casual wear at work watch is beautiful thank you. I will be ordering another  watch the red color face. Thank you 💓,
mom,Nanny gift,https://www.amazon.com/gp/customer-reviews/RN1SJ0KJG6419/ref=cm_cr_getr_d_rvw_ttl?ie=UTF8&ASIN=B08P3Z7LCF,"5.0 "," the United States "," December 28, 2021",Color: Blood Red/Silver,,"M grandson loves it, its nice a big, does not look cheep.",
Cornelius,Beautiful!! Why buy a 1000$ dollar watch when you can get one that looks like it?,https://www.amazon.com/gp/customer-reviews/R1Q64F3Z1JCLN6/ref=cm_cr_getr_d_rvw_ttl?ie=UTF8&ASIN=B08P3Z7LCF,"5.0 "," the United States "," December 28, 2021",Color: Blood Red/Silver,Verified Purchase,"As I said, why buy a ridiculously expensive watch when you can get one that looks like one that has such beautiful quality. Definerly UNDER-priced for such an amazing watch",
gabbie,Really nice watch.,https://www.amazon.com/gp/customer-reviews/RWUDOUXQ60GFK/ref=cm_cr_getr_d_rvw_ttl?ie=UTF8&ASIN=B08P3Z7LCF,"4.0 "," the United States "," December 27, 2021",Color: Silver Black Panther,Verified Purchase,The watch fit our expectations really nice and Shiney my husband really liked it,
Tatiana💓,great birthday gift,https://www.amazon.com/gp/customer-reviews/R2X7Y6AD2K2U7X/ref=cm_cr_getr_d_rvw_ttl?ie=UTF8&ASIN=B08P3Z7LCF,"5.0 "," the United States "," December 22, 2021",Color: Blood Red/Silver,Verified Purchase,Bought this for my husband for his birthday. It’s super luxurious looking almost looks like a high end watch. He loved it. It’s a little too big for him but he’s skinny so that was to be expected. All around a great gift for someone special!,
Chris,6 stars if I could,https://www.amazon.com/gp/customer-reviews/RJBCLXB2JYLZB/ref=cm_cr_getr_d_rvw_ttl?ie=UTF8&ASIN=B08P3Z7LCF,"5.0 "," the United States "," December 6, 2021",Color: Gold Blood Red,Verified Purchase,Even included a gift of stainless steel ear studs……..6 stars if I could,
Jamieka Ezeokobe,Money Boss,https://www.amazon.com/gp/customer-reviews/R1J6W8IJDVE8F8/ref=cm_cr_getr_d_rvw_ttl?ie=UTF8&ASIN=B08P3Z7LCF,"5.0 "," the United States "," December 2, 2021",Color: Gold Blood Red,Verified Purchase,"Made my man stand out like a true Boss that he is, everyone wanted to know where he got it n what it was.",
"""just one time to love""",So disappointed,https://www.amazon.com/gp/customer-reviews/R3AXR63B3L6KPS/ref=cm_cr_getr_d_rvw_ttl?ie=UTF8&ASIN=B08P3Z7LCF,"2.0 "," the United States "," November 23, 2021",Color: Blood Red/Silver,Verified Purchase,Not good I'm having problems with the locking mechanism,
Lidor,The watch looks better when it comes! :D,https://www.amazon.com/gp/customer-reviews/R31UNUUDNVT5VR/ref=cm_cr_getr_d_rvw_ttl?ie=UTF8&ASIN=B08P3Z7LCF,"5.0 "," the United States "," November 12, 2021",Color: Silver Black Panther,Verified Purchase,Looks even better and a little bigger when it comes and its very shiny,
Kenard Kinsler,Nice,https://www.amazon.com/gp/customer-reviews/R3VGI369STXMLD/ref=cm_cr_getr_d_rvw_ttl?ie=UTF8&ASIN=B08P3Z7LCF,"5.0 "," the United States "," October 26, 2021",Color: Gold Blood Red,Verified Purchase,Get a lot of compliments with this watch just wish it was real,
Lacey Anderson,Hella good,https://www.amazon.com/gp/customer-reviews/RN9UTHZ4RPXD0/ref=cm_cr_getr_d_rvw_ttl?ie=UTF8&ASIN=B08P3Z7LCF,"4.0 "," the United States "," October 17, 2021",Color: Blood Red/Silver,Verified Purchase,The dimbonds where good,2
Jaky,Beautiful watch,https://www.amazon.com/gp/customer-reviews/R2GM9VLEAXY7C8/ref=cm_cr_getr_d_rvw_ttl?ie=UTF8&ASIN=B08P3Z7LCF,"5.0 "," the United States "," September 15, 2021",Color: Blood Red/Silver,Verified Purchase,The watch looks really good and shines so much. Looks very expensive. Highly recommend,
Z,NiCE QuaLity,https://www.amazon.com/gp/customer-reviews/RLUPX0YECGDOF/ref=cm_cr_getr_d_rvw_ttl?ie=UTF8&ASIN=B08P3Z7LCF,"5.0 "," the United States "," September 3, 2021",Color: Gold Blood Red,Verified Purchase,Looks Real!!!!!! Not for everyday wear. You could get rob for this. Be careful!,
Cameron Bailey,"The price, new colour, new dimension",https://www.amazon.com/gp/customer-reviews/R5ONRY5HT3B2Z/ref=cm_cr_getr_d_rvw_ttl?ie=UTF8&ASIN=B08P3Z7LCF,"5.0 "," the United States "," August 28, 2021",Color: Gold Blood Red,Verified Purchase,What I like is the colour of the watch gives it an autumn vibe while wearing fall clothing,
Pamela Sharpe,Nice watch,https://www.amazon.com/gp/customer-reviews/R3NMVP81D7QHTR/ref=cm_cr_getr_d_rvw_ttl?ie=UTF8&ASIN=B08P3Z7LCF,"5.0 "," the United States "," August 20, 2021",Color: Blood Red/Silver,Verified Purchase,I ordered this for my nephew and he looked it. This was his second one from this company and he wants other colors.,
Laila farr,Worth the money,https://www.amazon.com/gp/customer-reviews/RDTF54R96X5R1/ref=cm_cr_getr_d_rvw_ttl?ie=UTF8&ASIN=B08P3Z7LCF,"5.0 "," the United States "," August 13, 2021",Color: Blood Red/Silver,Verified Purchase,Purchased this for my husband and I would definitely purchase again he loves this watch,
Treasure Philligin,Even better than pictured,https://www.amazon.com/gp/customer-reviews/R27B52FD8CKFIM/ref=cm_cr_getr_d_rvw_ttl?ie=UTF8&ASIN=B08P3Z7LCF,"5.0 "," the United States "," August 10, 2021",Color: Gold Black R#,Verified Purchase,I didn’t expect much from this watch. It was a gift for my son. It was very inexpensive so I expected a cheap and knock off version. When I opened the package I was very surprised. The “diamonds” are all in place and shine bright. The watch works great. Very happy with this purchase!,
Janiah Thomas,It’s very heavy duty and was worth buying,https://www.amazon.com/gp/customer-reviews/R28A7ZBVNEBGB0/ref=cm_cr_getr_d_rvw_ttl?ie=UTF8&ASIN=B08P3Z7LCF,"5.0 "," the United States "," August 9, 2021",Color: Blood Red/Silver,Verified Purchase,,
Quentin,Looks expensive & it shines👏,https://www.amazon.com/gp/customer-reviews/R214UNXP9A6FIZ/ref=cm_cr_getr_d_rvw_ttl?ie=UTF8&ASIN=B08P3Z7LCF,"5.0 "," the United States "," August 4, 2021",Color: Blood Red/Silver,Verified Purchase,Omg!👏 It truly is worth it looks hella expensive it's little to big to fit hopefully I'll get those clips off so it can fit on my arm but overall it's lit🔥,
Lee Gilmore,The price,https://www.amazon.com/gp/customer-reviews/R1KKV67TOORA6B/ref=cm_cr_getr_d_rvw_ttl?ie=UTF8&ASIN=B08P3Z7LCF,"5.0 "," the United States "," August 1, 2021",Color: Blood Red/Silver,Verified Purchase,The watch stands out alot.People love the style of it.,
Alexxx .,watch .,https://www.amazon.com/gp/customer-reviews/R1X8E922Y6JAQN/ref=cm_cr_getr_d_rvw_ttl?ie=UTF8&ASIN=B08P3Z7LCF,"2.0 "," the United States "," July 20, 2021",Color: Blood Red/Silver,Verified Purchase,"it is way to big !! the shipping is fast but I didn’t know the size so I just ordered it and found out it was to big !! If you plan on buying this , make sure your wrist isn’t smaller than usual because this watch will not fit on you .",
