Works great and fast delivery.,,https://www.amazon.com/hz/reviews-render/report-review?ie=UTF8&ref=cm_cr_getr_d_rvw_hlp&csrfT=hFFYBGCbzGIqlJhuzooWltGLA93A09H5pUoeSDFS3SytAAAAAGebywwAAAAB&reviewId=RA5YK3VQSLH7B,"5.0 "," Australia "," November 10, 2024",Color: Open Cuff - Gold,Verified Purchase,"Runs small, I have small wrists and was able to adjust it to my size. Great quality and fast delivery.",
Jv,,https://www.amazon.com/hz/reviews-render/report-review?ie=UTF8&ref=cm_cr_getr_d_rvw_hlp&csrfT=hAW8Y8Kfm0odsldZd%2FVy9SyX6HTnbALssSvYu4KTxC24AAAAAGebywwAAAAB&reviewId=R1GJ2QQENSV3HK,"4.0 "," Canada "," November 6, 2024",Color: Bypass Cuff - Gold,Verified Purchase,This bracelet is much more substantial than expected. Its weight and shine makes it look like it’s a higher quality piece of jewelry.,
Bali,,https://www.amazon.com/hz/reviews-render/report-review?ie=UTF8&ref=cm_cr_getr_d_rvw_hlp&csrfT=hCLsBO9ci9l33sigXLYNvnrFUXSw06JgE4E4wgnigRdhAAAAAGebywwAAAAB&reviewId=R1TW36MZZKXR06,"1.0 "," Canada "," September 19, 2024",Color: Bypass Cuff - White-Gold,Verified Purchase,wore this 3 times and noticed already going copper brownish,
Helenestpierre,,https://www.amazon.com/hz/reviews-render/report-review?ie=UTF8&ref=cm_cr_getr_d_rvw_hlp&csrfT=hOFbN9qTy6Yi120J3IfdVExIQ5BLNfcBKy3mEHVzIiKEAAAAAGebyw8AAAAB&reviewId=R9VCLKQZQ45JS,"5.0 "," Canada "," September 13, 2024",Color: Open Cuff - White-Gold,Verified Purchase,Jadorequalite,
Deee,,https://www.amazon.com/hz/reviews-render/report-review?ie=UTF8&ref=cm_cr_getr_d_rvw_hlp&csrfT=hPulni55XrJsDNENiAuZ4r6pyageLdl3%2FR%2Fhnruy8UIMAAAAAGebyw8AAAAB&reviewId=R3VG23HHXEBTGW,"5.0 "," Canada "," September 13, 2024",Color: Bypass Cuff - Gold,Verified Purchase,It’s cute … looks cool …,
Haleh Kassiri,,https://www.amazon.com/hz/reviews-render/report-review?ie=UTF8&ref=cm_cr_getr_d_rvw_hlp&csrfT=hMFGtWIQazJRMVFGtR%2FTvrl4l3%2BKGuCgvUNCSl4ol0SjAAAAAGebyw8AAAAB&reviewId=R2J2I0BT2NKEHS,"4.0 "," Canada "," August 28, 2024",Color: Bypass Cuff - Gold,Verified Purchase,I haven’t used it yet but it looks good for the price and it’s pretty too,
emily,,https://www.amazon.com/hz/reviews-render/report-review?ie=UTF8&ref=cm_cr_getr_d_rvw_hlp&csrfT=hLNaXnQ1roJmVuqJDVRbkV2Q6TeHY9J3Gd693bpwTELiAAAAAGebyw8AAAAB&reviewId=RRZSE09IJJY8Z,"5.0 "," Australia "," July 8, 2024",Color: Open Cuff - Gold,Verified Purchase,"Absolute steal for the price, great quality.",
Linda,,https://www.amazon.com/hz/reviews-render/report-review?ie=UTF8&ref=cm_cr_getr_d_rvw_hlp&csrfT=hE%2FaO1RbDpmrnYXTYpnJ4ilaWIXe%2B%2BjnOFp3D76I7efGAAAAAGebyw8AAAAB&reviewId=R147ITR3O1B5WJ,"1.0 "," Canada "," June 23, 2024",Color: Bypass Cuff - Gold,Verified Purchase,I don't like it because it lacks a clasp.,
Bo Kopcewicz,,https://www.amazon.com/hz/reviews-render/report-review?ie=UTF8&ref=cm_cr_getr_d_rvw_hlp&csrfT=hExc2WSI88dvzptwUTU4GJYX7xrXaHCkDHJrBQmgE7HyAAAAAGebyw8AAAAB&reviewId=R1EHGRMZ4C8LMS,"1.0 "," Canada "," June 9, 2024",Color: Irregular Cuff - Gold Round,Verified Purchase,It is veeeery thin,
kori b,,https://www.amazon.com/hz/reviews-render/report-review?ie=UTF8&ref=cm_cr_getr_d_rvw_hlp&csrfT=hC1mKoq35mT6HnhheN9ZIt0%2FLxZ4gARXqcFIjRzTR2QDAAAAAGebyw8AAAAB&reviewId=R1NTXYZ2YSW1LJ,"5.0 "," Australia "," June 5, 2024",Color: Open Cuff - Gold,Verified Purchase,such a pretty bangle - very solid and sturdy but cna also be adjusted!! the shipping took less than 48 hrs and the packaging was fine. very happy,
umm,,https://www.amazon.com/hz/reviews-render/report-review?ie=UTF8&ref=cm_cr_getr_d_rvw_hlp&csrfT=hP8bYRHlP3FkHhxCaf8ndod3qeXoM4UsGVEIMnWzkwSdAAAAAGebyw8AAAAB&reviewId=R2O78VIGXDITNT,"4.0 "," Canada "," June 4, 2024",Color: Bypass Cuff - Matte Gold,Verified Purchase,here’s the thing…i really love this bangle and it can be perfectly fit and resized to any arm but the colour is just not it. after i think 2 wears it lost its shiny gold colour completely and now its like a dull metal colour. i of course still wear it cause i really like the design and shape but beware of the colour. i found it weird considering i have other things from this brand that didn’t tarnish at all.,
TouliP22,,https://www.amazon.com/hz/reviews-render/report-review?ie=UTF8&ref=cm_cr_getr_d_rvw_hlp&csrfT=hCNNKd9bHeTaihuZhKCLQwiGNLRtX1ckE9qjuN8J9OpdAAAAAGebyw8AAAAB&reviewId=R1AMHSU1NR7HOK,"5.0 "," Australia "," April 25, 2024",Color: Bypass Cuff - Gold,Verified Purchase,Love this bangle So well made Looks more expensive than what I paid Fast delivery,
Barbara West,,https://www.amazon.com/hz/reviews-render/report-review?ie=UTF8&ref=cm_cr_getr_d_rvw_hlp&csrfT=hN5wmU5GC4TAnm6XO6dShzRs1vrKyJTN8af%2FKaUgK1zeAAAAAGebyxMAAAAB&reviewId=R18YGYG0KGBLPN,"5.0 "," Australia "," December 27, 2023",Color: Bypass Cuff - Gold,Verified Purchase,It was a lovely feminine bangle and my granddaughter loved it.,
007,,https://www.amazon.com/hz/reviews-render/report-review?ie=UTF8&ref=cm_cr_getr_d_rvw_hlp&csrfT=hBghirvNXSSg%2Fib5xHsrKmczjRLjLqBfOnlzflbbndMPAAAAAGebyxMAAAAB&reviewId=RJJG75ZOAZKQP,"5.0 "," Canada "," November 13, 2023",Color: Open Cuff - Gold,Verified Purchase,"Very nice and has a classy look to it. A little awkward to get on, but once it's on it's fine. Not too tight. Would recommend.",
Marcela De Icaza Serment,,https://www.amazon.com/hz/reviews-render/report-review?ie=UTF8&ref=cm_cr_getr_d_rvw_hlp&csrfT=hIBHI8IKJacD2DLh2ojJRYikS8WwWJHvYIDrA0DcBLjFAAAAAGebyxMAAAAB&reviewId=RA9A8LOBJYMV2,"5.0 "," Mexico "," August 29, 2023",Color: Open Cuff - Gold,Verified Purchase,"Justo como en la foto, me encantó",
Desiree,,https://www.amazon.com/hz/reviews-render/report-review?ie=UTF8&ref=cm_cr_getr_d_rvw_hlp&csrfT=hF%2BRz0n9AyWXsuk2OiZele%2FImBD%2FJF2etNONUp1NkquBAAAAAGebyxMAAAAB&reviewId=R3R9KG3O83KMKD,"3.0 "," Canada "," April 26, 2023",Color: Bypass Cuff - Gold,Verified Purchase,The shape should be more elongated than round to match the actual shape of one's wrist.,
