Noa,Need in every color!,https://www.amazon.com/gp/customer-reviews/R3KBQ43QL4H6DY/ref=cm_cr_getr_d_rvw_ttl?ie=UTF8&ASIN=B0BLY4R1GS,"5.0 "," the United States "," March 28, 2023",Color: B-light GraySize: Small,Verified Purchase,"in love with these tops! I ordered 2 different colors and I definitely need more. super comfy, definitely a skims dupe",
Patricia Romero,"Fits so well, never wrinkles",https://www.amazon.com/gp/customer-reviews/R2QV35IFTC8FF6/ref=cm_cr_getr_d_rvw_ttl?ie=UTF8&ASIN=B0BLY4R1GS,"5.0 "," the United States "," March 27, 2023",Color: B-blackSize: Small,Verified Purchase,"This shirt has become a closet staple I had to get another one. It’s so buttery soft and flattering. If your looking for something that will never do you wrong, get THis.",
Amazon Customer,Skims dupe? Maybe?,https://www.amazon.com/gp/customer-reviews/R3IE19QCRMXEG9/ref=cm_cr_getr_d_rvw_ttl?ie=UTF8&ASIN=B0BLY4R1GS,"5.0 "," the United States "," March 27, 2023",Color: A-greySize: Large,Verified Purchase,"Came here via a tiktok, was not disappointed- ordered a medium and a large. Both fit pretty much the same. Very tight and supportive, I’m a 32DD and felt comfortable wearing without a bra. Material feels very nice. Went back and bought 2 other colors",2
s,Tight fit,https://www.amazon.com/gp/customer-reviews/R1J7YGDRDHT70P/ref=cm_cr_getr_d_rvw_ttl?ie=UTF8&ASIN=B0BLY4R1GS,"5.0 "," the United States "," March 25, 2023",Color: B-blackSize: Small,Verified Purchase,I love how tight the shirt is and fits perfectly compared to other shirts where it’s loose and not fit.,
Lindsey Forte,Great Urban Outfitters dupe,https://www.amazon.com/gp/customer-reviews/RIBK5ZZSCSD0/ref=cm_cr_getr_d_rvw_ttl?ie=UTF8&ASIN=B0BLY4R1GS,"5.0 "," the United States "," March 22, 2023",,Verified Purchase,I really liked this shirt for my daughter and so did she. It was not as short as I was expecting so that was a good surprise.,3
Kristi Whitmire,Perfect Basic Tee,https://www.amazon.com/gp/customer-reviews/RGLC9AHVV6F99/ref=cm_cr_getr_d_rvw_ttl?ie=UTF8&ASIN=B0BLY4R1GS,"5.0 "," the United States "," March 17, 2023",Color: B-whiteSize: Small,Verified Purchase,"Could have used a medium for a bit more room, but small does fit",
Rebecca Love,"Size up, but it’s amazing!",https://www.amazon.com/gp/customer-reviews/R2AX5EKN891T14/ref=cm_cr_getr_d_rvw_ttl?ie=UTF8&ASIN=B0BLY4R1GS,"5.0 "," the United States "," March 17, 2023",,Verified Purchase,"Not at wear a small in tops, got a large because I was worried about it being tight and see through. Glad i did. Perfect boxy but fitted look. Ordering more today!",
Karina,Nice dupe,https://www.amazon.com/gp/customer-reviews/R1COOK918AVF9S/ref=cm_cr_getr_d_rvw_ttl?ie=UTF8&ASIN=B0BLY4R1GS,"4.0 "," the United States "," March 11, 2023",Color: B-light GraySize: Small,Verified Purchase,The material is soft and I like how it fits. I ordered a small (my usual size) and think it’s a good fit. I wasn’t sure about it at first but after wearing it out once I decided I liked it. Nice skims dupe for way less!,2
Alexis Katzbeck,After trying these I’ll be selling my SKIMS - Size Up!!!!!!,https://www.amazon.com/gp/customer-reviews/R28Y3VZH24IZ6O/ref=cm_cr_getr_d_rvw_ttl?ie=UTF8&ASIN=B0BLY4R1GS,"5.0 "," the United States "," March 9, 2023",,Verified Purchase,"I am absolutely obsessed with these tops. The fabric, the fit, the cut - all of it!!! I will be selling my SKIMS tees after buying these!!! I am a 34C and usually size M/L and I am SO glad I sized up, I would recommend it. I went with a L and they fit perfect!!! Going to be buying all of the colors! They snatch and hug your body just right.",4
Aléja,Like it,https://www.amazon.com/gp/customer-reviews/R2RQ7BGT9X5X6Q/ref=cm_cr_getr_d_rvw_ttl?ie=UTF8&ASIN=B0BLY4R1GS,"5.0 "," the United States "," March 8, 2023",Color: B-blackSize: Medium,Verified Purchase,"I really like these shirts, I brought 4. They’re really comfortable. If they were buttery soft they would only be that much better but they are soft. They do rise often but it’s a really great product and I do recommend it.",
Aquesia Word,Top is darker than photo,https://www.amazon.com/gp/customer-reviews/RV4SPCPR54S1M/ref=cm_cr_getr_d_rvw_ttl?ie=UTF8&ASIN=B0BLY4R1GS,"4.0 "," the United States "," March 5, 2023",Color: B-brownSize: Large,Verified Purchase,"Very nice fit. Simple basic to have and comfortable. True to size, just wish it was a little lighter in color",11
Jayden Ruby,it’s okay…,https://www.amazon.com/gp/customer-reviews/R255GH478KKDWD/ref=cm_cr_getr_d_rvw_ttl?ie=UTF8&ASIN=B0BLY4R1GS,"4.0 "," the United States "," March 3, 2023",,Verified Purchase,it’s a weird texture and just isn’t the same…,2
Christin Moodley,Cute but color is off,https://www.amazon.com/gp/customer-reviews/R1P3VGOO57E3JA/ref=cm_cr_getr_d_rvw_ttl?ie=UTF8&ASIN=B0BLY4R1GS,"4.0 "," the United States "," February 15, 2023",Color: B-light GraySize: Medium,Verified Purchase,"I ordered 3 different colors and I love the fit for the price. My only issue is that the light grey is not true to the color shown. It's definitely not grey, its a light nude pink.",2
Never came,Tagged as delivered and was never delivered,https://www.amazon.com/gp/customer-reviews/R9HICWNRHPLW0/ref=cm_cr_getr_d_rvw_ttl?ie=UTF8&ASIN=B0BLY4R1GS,"1.0 "," the United States "," February 14, 2023",Color: B-light GraySize: Small,Verified Purchase,"One of the shirts in my order was never delivered. No response from seller, unable to get refund. The one that did get delivered was very cropped for some reason?? theres extra fabric underneath that shows through across your chest, the short sleeves stick out and buckle when you bend over. Jusf overall bad",9
susan in houston,Skims dupe,https://www.amazon.com/gp/customer-reviews/R13866WTUDEE6Q/ref=cm_cr_getr_d_rvw_ttl?ie=UTF8&ASIN=B0BLY4R1GS,"5.0 "," the United States "," January 9, 2023",Color: A-greySize: Medium,Verified Purchase,"Was looking for a skims dupe and this shirt feels and looks similar. I got a size medium, really flattering",10
Olydia.,,https://www.amazon.com/hz/reviews-render/report-review?ie=UTF8&ref=cm_cr_getr_d_rvw_hlp&csrfT=hKxUo%2BzAYa%2BADKtHXBNcbOSfgzkwIC%2FAxVazuFHU42ABAAAAAGecDpQAAAAB&reviewId=R2IOD3D9D93TRO,"5.0 "," Mexico "," May 28, 2024",Color: B-brownSize: Large,Verified Purchase,"Me gustó casi todo ,tela fina , color muy bonito, todo perfecto el único detalle es pedir una talla más , pero lo demás estoy encantada claro que la vuelvo a comprar .",
Maria,,https://www.amazon.com/hz/reviews-render/report-review?ie=UTF8&ref=cm_cr_getr_d_rvw_hlp&csrfT=hEPy8oBFrGaYRodtR9UohlBRFR0VtpM16EvuN7XITqvNAAAAAGecDpQAAAAB&reviewId=R1SJEPXLZ3IMSA,"3.0 "," Canada "," August 10, 2023",Color: B-dark BrownSize: Large,Verified Purchase,The brown top online is a very cool tone medium dark brown. However the colour I received is a very warm brown that is a completely different shade. The material is good but a bit thin & stains very very easily,
Stephanie,,https://www.amazon.com/hz/reviews-render/report-review?ie=UTF8&ref=cm_cr_getr_d_rvw_hlp&csrfT=hOYsgRY%2FM5zIJh4NHvg5ojn0Cz472zUhQPjifkBaij86AAAAAGecDpQAAAAB&reviewId=R1OI2XMCAY4O0R,"3.0 "," Canada "," March 26, 2023",Color: B-blackSize: Medium,Verified Purchase,"This shirt is not a cotton blend it was the whole reason why I wanted it , it’s like polyester spandex or something l, it doesn’t fit exactly like the model and I’m the size of the model with a larger chest I sized up to a medium otherwise it would have been too small it the shoulders and I am a small size in most shirts. I’m keeping anyways it’s a basic black tee it’s over priced in my opinion :) I wouldn’t pay over 20$ for another one or maybe 10$ actually lol ..",3
