评论用户,评论概述,评论链接,星级评分,评论地点,评论时间,类型,是否购买,评论详情,觉得该评论有帮助的人数
Mar,Poorly built,https://www.amazon.com/gp/customer-reviews/R2WP1UBQHDRHOL/ref=cm_cr_getr_d_rvw_ttl?ie=UTF8&ASIN=B0BLY4R1GS,"1.0 "," the United States "," October 14, 2024",Color: B-light GraySize: Small,Verified Purchase,Looks and  feels cheap. Very hard to remove any sort of stains,
Aryana Mender,Fav Shirt,https://www.amazon.com/gp/customer-reviews/R2E1IP1SKTNW5B/ref=cm_cr_getr_d_rvw_ttl?ie=UTF8&ASIN=B0BLY4R1GS,"5.0 "," the United States "," October 12, 2024",Color: A-greySize: Small,Verified Purchase,This is seriously one of my favorite shirts ever I honestly totally forgot I bought it here on Amazon. I seriously wear it once a week it fits so amazing the texture is so comfortable. Amazing quality great for the money.,
Brittany villarreal,Bad material,https://www.amazon.com/gp/customer-reviews/R29PBSFOFJGR3P/ref=cm_cr_getr_d_rvw_ttl?ie=UTF8&ASIN=B0BLY4R1GS,"1.0 "," the United States "," August 22, 2024",Color: B-blackSize: Medium,Verified Purchase,Horrible quality more like a work out shirt material,
lily t,Flattering Skims Dupe,https://www.amazon.com/gp/customer-reviews/R3C0KWE1OI5GYB/ref=cm_cr_getr_d_rvw_ttl?ie=UTF8&ASIN=B0BLY4R1GS,"5.0 "," the United States "," August 10, 2024",Color: B-blackSize: Small,Verified Purchase,"Looks and feels just like the expensive shirt from Skims. I 100% recomend. Looks adorable with a pair of jeans to go out, a mini skirt for a party, or even leggings to a workout. So comfy.",
Taylor Tingley,Awful,https://www.amazon.com/gp/customer-reviews/R3M0BH3VD28V10/ref=cm_cr_getr_d_rvw_ttl?ie=UTF8&ASIN=B0BLY4R1GS,"1.0 "," the United States "," March 21, 2024",Color: B-light GraySize: Large,Verified Purchase,"I would give it zero stars if I could, I didn’t even get to wear it one time before it was unraveling. Save your money.",
Fernanda,Flattering and True to size,https://www.amazon.com/gp/customer-reviews/R1XG0ZEMMV7HJX/ref=cm_cr_getr_d_rvw_ttl?ie=UTF8&ASIN=B0BLY4R1GS,"5.0 "," the United States "," February 26, 2024",,Verified Purchase,I got this shirt in a size small and it fit perfectly for a person with a small bust. It also is pretty stretchy and its not so tight fitting which allows for comfort. I recently wore this shirt and truly is so flattering! The material is good quality and can either be dressed up or dressed down.,
Tawny Marceaux,Very thin,https://www.amazon.com/gp/customer-reviews/R4GS9RUR1MKW9/ref=cm_cr_getr_d_rvw_ttl?ie=UTF8&ASIN=B0BLY4R1GS,"4.0 "," the United States "," February 5, 2024",Color: B-whiteSize: Small,Verified Purchase,I would’ve given this shirt a five star but it was a little see through. Plus I’ve washed it once so far and the arms shrank which made it a little uncomfortable to wear. Too bad because the style is really nice.,
Summerhill,Previously Worn,https://www.amazon.com/gp/customer-reviews/R3EJ4596KVN9HQ/ref=cm_cr_getr_d_rvw_ttl?ie=UTF8&ASIN=B0BLY4R1GS,"1.0 "," the United States "," November 22, 2023",Color: B-dark BrownSize: Large,Verified Purchase,"The t-shirt arrived with the smell of deodorant in the armpit areas. The item was also unraveling at the hem upon arrival of the t-shirt. Clearly, this was a used and returned item.",
Kindle Customer,NEVER CAME IN:(,https://www.amazon.com/gp/customer-reviews/RUQEKRFVTX32G/ref=cm_cr_getr_d_rvw_ttl?ie=UTF8&ASIN=B0BLY4R1GS,"1.0 "," the United States "," November 15, 2023",,Verified Purchase,From the past reviews this top looked perfect for any occasion but unfortunately never shipped and never received.,
Leslie Alonso,Great fabric!,https://www.amazon.com/gp/customer-reviews/R306TZFHD6WO4A/ref=cm_cr_getr_d_rvw_ttl?ie=UTF8&ASIN=B0BLY4R1GS,"5.0 "," the United States "," October 24, 2023",Color: B-whiteSize: Medium,Verified Purchase,I sweat so much when I’m at work (BT w/ kids) and this material I sweat a lot less and you cannot see it! It is a bit see through so you need to find the perfect white bra for it.,
Amazon Customer,Chic,https://www.amazon.com/gp/customer-reviews/R1LLYAD3ZA01KZ/ref=cm_cr_getr_d_rvw_ttl?ie=UTF8&ASIN=B0BLY4R1GS,"5.0 "," the United States "," September 29, 2023",Color: A-greySize: Small,Verified Purchase,"Looks expensive. This dark color gray is everything, it’s so flattering - the fit and fabric and perfect.",
Jessica,Okay,https://www.amazon.com/gp/customer-reviews/RQMH8W8GJ2DNN/ref=cm_cr_getr_d_rvw_ttl?ie=UTF8&ASIN=B0BLY4R1GS,"3.0 "," the United States "," September 17, 2023",,Verified Purchase,I didn't like the fabric!,
Amazon Customer,Tighter than anticipated,https://www.amazon.com/gp/customer-reviews/R2UMBS8F0SYFEQ/ref=cm_cr_getr_d_rvw_ttl?ie=UTF8&ASIN=B0BLY4R1GS,"4.0 "," the United States "," September 14, 2023",Color: B-whiteSize: Small,Verified Purchase,"Much tighter than anticipated based on reviews. However, I am a 32D and about 115 pounds. It was skin tight, and I was hoping for a more relaxed style.  I ordered a small but think a medium/ large would be better. It’s really smooth and nice material. But pretty see through. A nude colored bra would be fine. or cute colored bralette if you wanted to spice it up!",
Samantha M,Skims DUPE,https://www.amazon.com/gp/customer-reviews/R2ZUBDKS8YJOH7/ref=cm_cr_getr_d_rvw_ttl?ie=UTF8&ASIN=B0BLY4R1GS,"5.0 "," the United States "," August 29, 2023",Color: B-blackSize: Medium,Verified Purchase,GREAT quality. Cannot say enough about this shirt. Definitely worth the purchase. It has now become a staple in my wardrobe.,
Tara Lennon,Completely see through,https://www.amazon.com/gp/customer-reviews/R1EWXLGRBWUUIL/ref=cm_cr_getr_d_rvw_ttl?ie=UTF8&ASIN=B0BLY4R1GS,"1.0 "," the United States "," August 21, 2023",Color: B-whiteSize: Small,Verified Purchase,"100% see through. Not a soft material, more of an athletic moisture wicking material. But completely sheer. Returning it.",
Mikay,NOT a Skims Dupe,https://www.amazon.com/gp/customer-reviews/R3GMU0GZ1GMOTA/ref=cm_cr_getr_d_rvw_ttl?ie=UTF8&ASIN=B0BLY4R1GS,"1.0 "," the United States "," August 17, 2023",Color: B-whiteSize: Medium,Verified Purchase,I have a ton of skims tees and other loungewear but decided to see what these “dupes” are all about and just…no. The material feels like a cheap under armour shirt. Skip it and buy the real thing if you’re looking for quality.,
Peyton Wager,Perfect fit,https://www.amazon.com/gp/customer-reviews/R23BH2HYH0KO4Z/ref=cm_cr_getr_d_rvw_ttl?ie=UTF8&ASIN=B0BLY4R1GS,"5.0 "," the United States "," August 15, 2023",Color: B-whiteSize: Medium,Verified Purchase,Good quality and I like that it isn’t a crop top!,
Amazone Customare,Fits a child,https://www.amazon.com/gp/customer-reviews/RGDJIQF5X6VWI/ref=cm_cr_getr_d_rvw_ttl?ie=UTF8&ASIN=B0BLY4R1GS,"1.0 "," the United States "," August 15, 2023",Color: A-greySize: Large,Verified Purchase,"Size L was tight on my 8 year old son. But it does stretch. If you want a completely skin tight shirt, this is it.",
Taylor Lee,fits perfect,https://www.amazon.com/gp/customer-reviews/R2WYJBMNSV2YYU/ref=cm_cr_getr_d_rvw_ttl?ie=UTF8&ASIN=B0BLY4R1GS,"5.0 "," the United States "," August 14, 2023",Color: A-greySize: Small,Verified Purchase,"fits super snug and is very comfy, can wear professionally and out too",
Lia Love,Love this. Fits right but very cute,https://www.amazon.com/gp/customer-reviews/R2S49RGJ0DYACZ/ref=cm_cr_getr_d_rvw_ttl?ie=UTF8&ASIN=B0BLY4R1GS,"5.0 "," the United States "," August 1, 2023",Color: A-greySize: Large,Verified Purchase,"Wasn't expecting as right of a fit but I actually like it more like this. Material is spandex like and stretchy, not see through. Love this shirt!",
Pink.,Gotta get more!,https://www.amazon.com/gp/customer-reviews/R1KD1DA9VF5ZI5/ref=cm_cr_getr_d_rvw_ttl?ie=UTF8&ASIN=B0BLY4R1GS,"4.0 "," the United States "," August 1, 2023",,Verified Purchase,"This one was an accidental great find! Ordered a few tops last minute for a beach trip and now I want more! Fits comfortably on my big shoulders, not too snug, stretches plenty, and sits at a flattering length too! Super soft material.. washed s couple times now and it's held up well too!",
jessica,Easy,https://www.amazon.com/gp/customer-reviews/R2PAQ7IW6I0A8K/ref=cm_cr_getr_d_rvw_ttl?ie=UTF8&ASIN=B0BLY4R1GS,"5.0 "," the United States "," July 31, 2023",,Verified Purchase,"Simple, easy black top! Stretchy and lightweight.",
Minah,cute,https://www.amazon.com/gp/customer-reviews/R2496FSLU5KUQB/ref=cm_cr_getr_d_rvw_ttl?ie=UTF8&ASIN=B0BLY4R1GS,"4.0 "," the United States "," July 28, 2023",Color: B-blackSize: Medium,Verified Purchase,i love wearing this to work out or just casual wear. it’s lightweight and breathable but it also flatters the body well. just be careful when washing because it can get those little lint balls on them,4
Amazon Customer,Cute and comfortable,https://www.amazon.com/gp/customer-reviews/R3LN74P4KXETP0/ref=cm_cr_getr_d_rvw_ttl?ie=UTF8&ASIN=B0BLY4R1GS,"4.0 "," the United States "," July 21, 2023",,Verified Purchase,"I’ve never owned a Skims tshirt so I can’t say if it’s a dupe or not. But it’s fitted, sexy, and comfortable. Can be dressed up or dressed down. I ordered the green and love the color- it matches the photo. I do recommend sizing up- I am 5’4”, 145lbs, and a 36DD. I usually wear a medium, but am glad I listened to other reviews and ordered the large as a medium would be too cropped and too snug. Will be ordering more in other colors!",
Cathlyn,It's NOT A COTTON BLEND! FIX THE DESCRIPTION!!,https://www.amazon.com/gp/customer-reviews/R3PEGXA38MRR04/ref=cm_cr_getr_d_rvw_ttl?ie=UTF8&ASIN=B0BLY4R1GS,"2.0 "," the United States "," July 20, 2023",Color: B-dark BrownSize: Medium,Verified Purchase,"It fits true to size, but PLEASE BE TRUTHFUL AND SAY THAT IT IS 95% POLYESTER AND 5% SPANDEX.",
cragmar22,Great quality,https://www.amazon.com/gp/customer-reviews/R3C87BGTD1J0Y8/ref=cm_cr_getr_d_rvw_ttl?ie=UTF8&ASIN=B0BLY4R1GS,"5.0 "," the United States "," July 12, 2023",Color: B-greenSize: Medium,Verified Purchase,Great quality. True to size. I’m 5’7” and 146 pounds. The medium fit fine.,
Christiane Costa,Nice dupe,https://www.amazon.com/gp/customer-reviews/R3LD2NT295AQFW/ref=cm_cr_getr_d_rvw_ttl?ie=UTF8&ASIN=B0BLY4R1GS,"5.0 "," the United States "," July 11, 2023",Color: A-greySize: Medium,Verified Purchase,"First great, love the color",
Melissa Reyna Ríos,Tan cómodo!,https://www.amazon.com/gp/customer-reviews/R3PAIZ0FRSDYGM/ref=cm_cr_getr_d_rvw_ttl?ie=UTF8&ASIN=B0BLY4R1GS,"5.0 "," the United States "," July 5, 2023",Color: B-greenSize: Medium,Verified Purchase,Amo su diseño tan simple y cómodo!!! Va con todo!,
Jenn,Recommend,https://www.amazon.com/gp/customer-reviews/R3MEXN8SKOWKHI/ref=cm_cr_getr_d_rvw_ttl?ie=UTF8&ASIN=B0BLY4R1GS,"5.0 "," the United States "," July 3, 2023",Color: B-whiteSize: Medium,Verified Purchase,"This shirt is from good material. I have it in green and white. I am in between sizes, small or medium. Its a bit tight. I ended up ordering a size large.",
Alexis S,Great fit!,https://www.amazon.com/gp/customer-reviews/R2D1QS51TKCUFL/ref=cm_cr_getr_d_rvw_ttl?ie=UTF8&ASIN=B0BLY4R1GS,"5.0 "," the United States "," June 28, 2023",Color: B-brownSize: Small,Verified Purchase,"I've been trying to expand my wardrobe color and I was pleasantly surprised with this shirt. This shirt made me feel and look great! I am used to wearing dark clothes, but this shirt was flattering. I fluctuate around 98-103lbs with a relatively flat chest.  It was a perfect fit! The material felt like the kind used for athletic wear but that's not a bad thing! It was light and comfortable without being sheer. A great basic for any closet! Happy with my purchase!",
Olivia,10/10,https://www.amazon.com/gp/customer-reviews/R1RHXC8P6J9EYB/ref=cm_cr_getr_d_rvw_ttl?ie=UTF8&ASIN=B0BLY4R1GS,"5.0 "," the United States "," June 27, 2023",Color: B-light GraySize: Small,Verified Purchase,"Amazing basic, I wear this to the gym, work, out and about! Material is amazing lightweight but fitted.",
XL … maybe for a small child.,Disappointed at size and quality,https://www.amazon.com/gp/customer-reviews/R2TUW2VRUOQ370/ref=cm_cr_getr_d_rvw_ttl?ie=UTF8&ASIN=B0BLY4R1GS,"2.0 "," the United States "," June 22, 2023",,Verified Purchase,I was really hoping this would be an actual XL or maybe even a tighter L on me but it is thin and tiny. I am plus size and busty but when I know this is probably a size M at its max.,
Alison Regalado,Just what I was looking for!,https://www.amazon.com/gp/customer-reviews/R2V5DXUEX40QHO/ref=cm_cr_getr_d_rvw_ttl?ie=UTF8&ASIN=B0BLY4R1GS,"5.0 "," the United States "," June 21, 2023",,Verified Purchase,"Soft material, but not that super slippery feel you get with some of the Skims dupes. Just slightly cropped.",
Danielle,Cute design awful material,https://www.amazon.com/gp/customer-reviews/R277XA087X09E6/ref=cm_cr_getr_d_rvw_ttl?ie=UTF8&ASIN=B0BLY4R1GS,"1.0 "," the United States "," June 20, 2023",Color: A-greySize: Small,Verified Purchase,It looks just like the picture but the material isn’t breathable at all and if you sweat at all it sinks in the fabric and stinks. I put it straight in the donate pile.,
I ordered this and the package came empty,Cute,https://www.amazon.com/gp/customer-reviews/R3A6S5Z1QFZ8PP/ref=cm_cr_getr_d_rvw_ttl?ie=UTF8&ASIN=B0BLY4R1GS,"3.0 "," the United States "," June 17, 2023",Color: B-greenSize: Medium,Verified Purchase,Definitely size up for a cuter look,
B,Don't bother wasting your money,https://www.amazon.com/gp/customer-reviews/R24MUUHEBQWQFL/ref=cm_cr_getr_d_rvw_ttl?ie=UTF8&ASIN=B0BLY4R1GS,"1.0 "," the United States "," June 13, 2023",Color: B-whiteSize: Medium,Verified Purchase,I ordered 4 of these shirts in different colors. The white one was completely see through so I returned it. 2 of the others were only worn once and washed once and the stitching came out of the all the hems on both.,
Marc Thompson,Not thought out,https://www.amazon.com/gp/customer-reviews/RK5L8QX8YUTP/ref=cm_cr_getr_d_rvw_ttl?ie=UTF8&ASIN=B0BLY4R1GS,"2.0 "," the United States "," June 11, 2023",,Verified Purchase,"The top was discolored. Ordered a blue, received a greenish gray. Cheap, cheap, cheap material. Almost feels like I'm wearing a ribbon. I'd say you get what you paid for considering it is $30 on the Urban Outfitters website.",
Lexxa,Feels cheap,https://www.amazon.com/gp/customer-reviews/R8BM2ZJSNO93K/ref=cm_cr_getr_d_rvw_ttl?ie=UTF8&ASIN=B0BLY4R1GS,"1.0 "," the United States "," June 5, 2023",,Verified Purchase,Material is weird not really black and just overall feels cheap.,
Ems,Eh,https://www.amazon.com/gp/customer-reviews/RTY2UXV3IL37M/ref=cm_cr_getr_d_rvw_ttl?ie=UTF8&ASIN=B0BLY4R1GS,"3.0 "," the United States "," June 2, 2023",Color: B-whiteSize: Medium,Verified Purchase,"This is definitely not a skims dupe because the material is the stuff athletic type and not soft and buttery. It’s flattering, but if you’re expecting skims you’ll be disappointed. Ordered a M and might exchange for a L if I can get past the cheap feeling material.",
Christen,M,https://www.amazon.com/gp/customer-reviews/R30V5REMHHE6ID/ref=cm_cr_getr_d_rvw_ttl?ie=UTF8&ASIN=B0BLY4R1GS,"2.0 "," the United States "," May 29, 2023",Color: B-brownSize: Small,Verified Purchase,"I wouldn’t rank this equal to skims products but I can see where they might get that. It’s more of a shiny, little stretch material. A bit long for a Tshirt, decent quality",
Rebecca John,One word: Butter,https://www.amazon.com/gp/customer-reviews/R1CUQUT7IWJOW2/ref=cm_cr_getr_d_rvw_ttl?ie=UTF8&ASIN=B0BLY4R1GS,"5.0 "," the United States "," May 27, 2023",Color: B-dark BrownSize: Medium,Verified Purchase,This top literally feels like butter on your skin. It is so cute and comes in so many different colors. I have them in three different colors and I wear them all the time. They’re great to wear on its own or pair with a cute jacket. Either way it won’t disappoint. It is not a loose shirt it does stick to your skin but it is stretchy. So be wise when you order. I got a medium and it was great for me. Will definitely be buying more!,2
jules,Runs VERY small,https://www.amazon.com/gp/customer-reviews/R1YCG8RE035GK6/ref=cm_cr_getr_d_rvw_ttl?ie=UTF8&ASIN=B0BLY4R1GS,"3.0 "," the United States "," May 23, 2023",Color: B-light BlueSize: Small,Verified Purchase,"Nice quality, but very small. I normally wear a Small, I ordered a Medium based in reviews…Still super small. Disappointed, but Amazon free returns makes this type of return effortless.",
AIM,Nope,https://www.amazon.com/gp/customer-reviews/RFJIUSZALG1YY/ref=cm_cr_getr_d_rvw_ttl?ie=UTF8&ASIN=B0BLY4R1GS,"1.0 "," the United States "," May 22, 2023",,Verified Purchase,Did not like the material or the smell. Returning.,
Kendra James,"Not like Skims at all, but cute",https://www.amazon.com/gp/customer-reviews/R36QHAUS9OMI1X/ref=cm_cr_getr_d_rvw_ttl?ie=UTF8&ASIN=B0BLY4R1GS,"3.0 "," the United States "," May 14, 2023",Color: B-light BlueSize: Small,Verified Purchase,This tee has gone viral on tik tok for being a skims dupe. It is not. Not even a similar material but is still cute and soft.,
Placeholder,Skims dupe,https://www.amazon.com/gp/customer-reviews/R1HZFGSD9R987J/ref=cm_cr_getr_d_rvw_ttl?ie=UTF8&ASIN=B0BLY4R1GS,"5.0 "," the United States "," May 12, 2023",,Verified Purchase,Skims dupe,2
José novelo,Cute,https://www.amazon.com/gp/customer-reviews/R1H4GLCISEXWUN/ref=cm_cr_getr_d_rvw_ttl?ie=UTF8&ASIN=B0BLY4R1GS,"5.0 "," the United States "," May 8, 2023",Color: B-whiteSize: Small,Verified Purchase,Worth it! Super cute,
Nikole,Tight fit but soft,https://www.amazon.com/gp/customer-reviews/R1XDCIR97BC2E7/ref=cm_cr_getr_d_rvw_ttl?ie=UTF8&ASIN=B0BLY4R1GS,"5.0 "," the United States "," May 5, 2023",Color: A-greySize: Large,Verified Purchase,I like the color and feel of this top. I use it for casual wear.,
American Citizen,Tiny t,https://www.amazon.com/gp/customer-reviews/R2TLX6KEEKDNC3/ref=cm_cr_getr_d_rvw_ttl?ie=UTF8&ASIN=B0BLY4R1GS,"3.0 "," the United States "," May 4, 2023",,Verified Purchase,"T shirt is very small. Im normally US medium, ordered a large. Is smaller than expected. The shirts cute, no brand or wash instructions, looks homemade and that is just fine. Hikes up a bit when sitting.",
Amazon Customer,Buy!,https://www.amazon.com/gp/customer-reviews/R3AOE20BQYIMM0/ref=cm_cr_getr_d_rvw_ttl?ie=UTF8&ASIN=B0BLY4R1GS,"5.0 "," the United States "," May 1, 2023",Color: A-greySize: Large,Verified Purchase,Love these even more than my skims ones. Super flattering. I got a large and it fit totally fine. They only thing is the bottom seems kinda got loose so be careful when washing,
Diamond J.,10/10,https://www.amazon.com/gp/customer-reviews/R2AF1WIPB5N2XS/ref=cm_cr_getr_d_rvw_ttl?ie=UTF8&ASIN=B0BLY4R1GS,"5.0 "," the United States "," May 1, 2023",,Verified Purchase,"No complaints, these are cute and a dupe for skims t shirts. Light weight, breathable, and the color was accurate to the photos. It took a little while to come but definitely worth it.",4
Callie,Probably from shein,https://www.amazon.com/gp/customer-reviews/R1PZLJLFJ30YVZ/ref=cm_cr_getr_d_rvw_ttl?ie=UTF8&ASIN=B0BLY4R1GS,"3.0 "," the United States "," April 29, 2023",Color: A-greySize: Medium,Verified Purchase,Feels like bathing suit or workout shirt. It’s cute . I never tried skims but i guess can be a dupe. Not worth the price in my opinion though. Could probably for sure find it on shein most likely,
Nyasia,Nice,https://www.amazon.com/gp/customer-reviews/R30A1FFQDY0X2Y/ref=cm_cr_getr_d_rvw_ttl?ie=UTF8&ASIN=B0BLY4R1GS,"5.0 "," the United States "," April 27, 2023",Color: B-brownSize: Large,Verified Purchase,Fits perfectly,
Mj,Good,https://www.amazon.com/gp/customer-reviews/R22VFMB4F6JBV0/ref=cm_cr_getr_d_rvw_ttl?ie=UTF8&ASIN=B0BLY4R1GS,"4.0 "," the United States "," April 26, 2023",Color: A-greySize: Large,Verified Purchase,Shirt is good and very comfortable. It was definitely returned as there was deodorant marks on it. But who doesn’t wash their clothes after buy them? It came out after washing it. 4 stars as the seller could have done better.,
Jill,As shirts go this one is comfortable and looks good.,https://www.amazon.com/gp/customer-reviews/RYBRTJA1ON6NB/ref=cm_cr_getr_d_rvw_ttl?ie=UTF8&ASIN=B0BLY4R1GS,"4.0 "," the United States "," April 24, 2023",Color: B-light GraySize: Large,Verified Purchase,I would definitely recommend buying this shirt,
M. Isabel,Shirt review,https://www.amazon.com/gp/customer-reviews/RE8PCGR0Q8FJR/ref=cm_cr_getr_d_rvw_ttl?ie=UTF8&ASIN=B0BLY4R1GS,"4.0 "," the United States "," April 19, 2023",Color: B-light GraySize: Medium,Verified Purchase,Wear a good bra with it because a line will show,
Leslie Tavarez,completely see through,https://www.amazon.com/gp/customer-reviews/R3CKIA20FW6NZK/ref=cm_cr_getr_d_rvw_ttl?ie=UTF8&ASIN=B0BLY4R1GS,"3.0 "," the United States "," April 16, 2023",Color: B-light BlueSize: Large,Verified Purchase,"these are cute but their see through, you will need to wear a bra with these",
Cindy,Best neutral shirts,https://www.amazon.com/gp/customer-reviews/R2PR31TU3CQD7Q/ref=cm_cr_getr_d_rvw_ttl?ie=UTF8&ASIN=B0BLY4R1GS,"5.0 "," the United States "," April 14, 2023",Color: B-blackSize: Small,Verified Purchase,I love these ! The material is great & I got myself multiple colors. They’re amazing night recommend !,
Julie,SKIMS DUPE FOR SURE!!,https://www.amazon.com/gp/customer-reviews/R1LLE74H2GWF6D/ref=cm_cr_getr_d_rvw_ttl?ie=UTF8&ASIN=B0BLY4R1GS,"4.0 "," the United States "," April 14, 2023",Color: B-brownSize: Large,Verified Purchase,"I’m 5’9 about 155 pounds. I read some reviews saying that you need to size up and that is absolutely true. I usually wear a S or M but I got a L and it fit just right, so SIZE UP!! The colors are a little darker than I was expecting but still very nice. I love the fit. I repurchased a bunch of them in different colors",6
Mal,NOT LIKE SKIMS,https://www.amazon.com/gp/customer-reviews/R35N7SH1OX5AAB/ref=cm_cr_getr_d_rvw_ttl?ie=UTF8&ASIN=B0BLY4R1GS,"1.0 "," the United States "," April 13, 2023",Color: A-greySize: Large,Verified Purchase,These are not a skims dupe. They are thin and run small.,
Kat,More on the fitted side,https://www.amazon.com/gp/customer-reviews/R19PNIURUDF0MG/ref=cm_cr_getr_d_rvw_ttl?ie=UTF8&ASIN=B0BLY4R1GS,"4.0 "," the United States "," April 11, 2023",Color: B-brownSize: Medium,Verified Purchase,"It’s a great casual/staple shirt. The material is very soft, but definitely tight. Not a loose fit style.",2
Michaela flynn,Weird shoulders and material,https://www.amazon.com/gp/customer-reviews/RSQJ0TUCZW1V8/ref=cm_cr_getr_d_rvw_ttl?ie=UTF8&ASIN=B0BLY4R1GS,"2.0 "," the United States "," April 5, 2023",Color: A-greySize: Small,Verified Purchase,"Not a Skims dupe, this material is closer to sweat proof workout clothing, like Dry Fit from Nike. I ordered a small and the shoulders shrug up when my arms are down or moving, so it's not constructed super well. I'll be returning it, but if I were to keep it, it would be to use as a workout shirt, not for casual wear.",
Julie,No idea if it’s a dupe but I like it,https://www.amazon.com/gp/customer-reviews/R10GX02W5N6NYA/ref=cm_cr_getr_d_rvw_ttl?ie=UTF8&ASIN=B0BLY4R1GS,"4.0 "," the United States "," April 4, 2023",Color: B-blackSize: Small,Verified Purchase,"I haven’t ever felt the skims shirts but this material is like athletic material. Feels the same as some of my workout tanks. It’s definitely stretchy and a little cropped. If you want a full length tee this is not what you’re looking for. I like this length though for the gym, it just slightly overlaps with my leggings. Lightweight and  breathable. Not sure i would wear it outside the gym though since it just feels like athletic clothing. Also I wish they made XS, I like my tops to fit pretty tight especially around the upper chest and neck area and this is just a little looser than I like personally.",
Cassandra Parra,SKIMS DUPE,https://www.amazon.com/gp/customer-reviews/R1A2XV5TCKKP2Y/ref=cm_cr_getr_d_rvw_ttl?ie=UTF8&ASIN=B0BLY4R1GS,"5.0 "," the United States "," April 2, 2023",Color: B-whiteSize: Small,Verified Purchase,Do not sleep on these shirts. I bought 5 of them! They are soooo buttery smooth and they look so nice!,
zac miguel,White tee is see through,https://www.amazon.com/gp/customer-reviews/R1OLMZSZU2HZG6/ref=cm_cr_getr_d_rvw_ttl?ie=UTF8&ASIN=B0BLY4R1GS,"2.0 "," the United States "," April 1, 2023",Color: B-whiteSize: Medium,Verified Purchase,The white tee is see through but the fit was great. I just wished it was double lined. I’m 5’2 and currently 8 month pregnant at 149 lbs and ordered a medium which fit great and it’s tight enough that it would fit fine post preg but I need one that’s double lined,
sisali salazar,Great fit and nice material! Got so many compliments.,https://www.amazon.com/gp/customer-reviews/R251VSMXZYDXEJ/ref=cm_cr_getr_d_rvw_ttl?ie=UTF8&ASIN=B0BLY4R1GS,"5.0 "," the United States "," March 30, 2023",Color: B-blackSize: Small,Verified Purchase,It is nice material and fit great. I would definitely size down if you are planning on ordering. Will definitely be ordering more!,2
Shadow Barr,Very flattering to for work or casual,https://www.amazon.com/gp/customer-reviews/R3S2HDTP0GV9X6/ref=cm_cr_getr_d_rvw_ttl?ie=UTF8&ASIN=B0BLY4R1GS,"5.0 "," the United States "," March 28, 2023",Color: B-light GraySize: Large,Verified Purchase,This top is great. The material feel more luxury. But I will say to size up. I got a large and it’s perfect for tucking into pants but maybe to not have it tucked in. It runs short as well. Overall a really good purchase for work clothes or wearing casually.,2
