Banarax,"Looks fancy, costs little",https://www.amazon.com/gp/customer-reviews/R1RMPLGL8DYFND/ref=cm_cr_getr_d_rvw_ttl?ie=UTF8&ASIN=B071YL713B,"5.0 "," the United States "," September 26, 2022",Color: Black Face,Verified Purchase,"Yeah, the 3 smaller dials are just there for decoration, but so what? It's a good looking watch that costs less than $20 lol",
Balasia McNeil,Nice gold,https://www.amazon.com/gp/customer-reviews/R1RKGI7272HREY/ref=cm_cr_getr_d_rvw_ttl?ie=UTF8&ASIN=B071YL713B,"5.0 "," the United States "," September 18, 2022",Color: gold&gold,Verified Purchase,It’s a good fit to use as jewelry for a 90s themed party.,
Amazon Customer,Nice looking watch so far,https://www.amazon.com/gp/customer-reviews/RUBNQTGMMLN3K/ref=cm_cr_getr_d_rvw_ttl?ie=UTF8&ASIN=B071YL713B,"4.0 "," the United States "," September 11, 2022",Color: Black Face,Verified Purchase,"Nice looking watch so far, wasn't too difficult adjusting the band so it could fit my wrist properly. Doesn't feel too sturdy but it works. I'll wait and see how it holds out",
Dwhite214,Good watch for the money!,https://www.amazon.com/gp/customer-reviews/R2UNDRDNO1WL4K/ref=cm_cr_getr_d_rvw_ttl?ie=UTF8&ASIN=B071YL713B,"4.0 "," the United States "," August 31, 2022",Color: gold&gold,Verified Purchase,"Came in good packaging and on time. Even had tools to remove links which was cool. Good fit, hadn't faded in several wears. Overall pleased!",
Stephanie,Gift for boyfriend,https://www.amazon.com/gp/customer-reviews/R1X3LRQF4AAPHJ/ref=cm_cr_getr_d_rvw_ttl?ie=UTF8&ASIN=B071YL713B,"3.0 "," the United States "," August 25, 2022",Color: Gold&black,Verified Purchase,Purchased as a gift to my boyfriend as a starter watch. It’s hard to read and can be very heavy on the wrists.,
Demetrius W.,Lots of compliments,https://www.amazon.com/gp/customer-reviews/R3BNECL23M9NKB/ref=cm_cr_getr_d_rvw_ttl?ie=UTF8&ASIN=B071YL713B,"5.0 "," the United States "," August 14, 2022",Color: Gold&black,Verified Purchase,This watch is very nice and something that has become one of my most favorite essentials.  Great quality for the price and just goes with any outfit.  Came well packaged and sturdy.  I think it’s definitely a good product overall.,2
Shaykela,Cute,https://www.amazon.com/gp/customer-reviews/R3FSOY6MLSAL2Q/ref=cm_cr_getr_d_rvw_ttl?ie=UTF8&ASIN=B071YL713B,"5.0 "," the United States "," August 1, 2022",Color: gold&gold,Verified Purchase,Very stylish,
John Lukas,Excellent,https://www.amazon.com/gp/customer-reviews/R3A3I3M7LFZRST/ref=cm_cr_getr_d_rvw_ttl?ie=UTF8&ASIN=B071YL713B,"5.0 "," the United States "," July 31, 2022",Color: Gold&black,Verified Purchase,Excellent condition. Easy to set up and adjusted to fit right,
DIANA M. VARGAS,Damaged and can't return,https://www.amazon.com/gp/customer-reviews/R2WGX2NZI1XICS/ref=cm_cr_getr_d_rvw_ttl?ie=UTF8&ASIN=B071YL713B,"1.0 "," the United States "," July 29, 2022",Color: green&gold,,Arrived damaged and it can't be return,
Ernst Damessous,Time,https://www.amazon.com/gp/customer-reviews/RJDPRW7K7TAGP/ref=cm_cr_getr_d_rvw_ttl?ie=UTF8&ASIN=B071YL713B,"5.0 "," the United States "," July 27, 2022",Color: green&gold,Verified Purchase,Keep times,
Patricia,The watch is amazing good quality,https://www.amazon.com/gp/customer-reviews/R1RO4AUH6TRHBN/ref=cm_cr_getr_d_rvw_ttl?ie=UTF8&ASIN=B071YL713B,"5.0 "," the United States "," July 22, 2022",Color: silver&black,Verified Purchase,Bought it for my dad and he loved it. When I saw it I was very pleased and it look and feels very expensive,
Jay,Beautiful!,https://www.amazon.com/gp/customer-reviews/RPDFG0MDXUXDA/ref=cm_cr_getr_d_rvw_ttl?ie=UTF8&ASIN=B071YL713B,"5.0 "," the United States "," July 20, 2022",Color: gold&gold,Verified Purchase,"It took me a little while to take a few links out but let me just say, this watch looks better in person. I might need to order abother one just to have.",
marlon brown,Very nice purchase for my son,https://www.amazon.com/gp/customer-reviews/R2SNM889KH8N44/ref=cm_cr_getr_d_rvw_ttl?ie=UTF8&ASIN=B071YL713B,"5.0 "," the United States "," July 18, 2022",Color: silver&black,Verified Purchase,Great gift for a young man,
Clara Wright,"Classy, affordable watch",https://www.amazon.com/gp/customer-reviews/RIRVJ8SDZ4D09/ref=cm_cr_getr_d_rvw_ttl?ie=UTF8&ASIN=B071YL713B,"5.0 "," the United States "," July 11, 2022",Color: green&gold,Verified Purchase,Gave it to my husband for his birthday and he loves it. Good value with expensive look.,
Jacqueline,Very Nice,https://www.amazon.com/gp/customer-reviews/R1XD8ND32J83JO/ref=cm_cr_getr_d_rvw_ttl?ie=UTF8&ASIN=B071YL713B,"5.0 "," the United States "," July 7, 2022",Color: Black Face,Verified Purchase,Perfect for a child.,
Marquise Howard,Nice,https://www.amazon.com/gp/customer-reviews/R2WJTC2CASZIYC/ref=cm_cr_getr_d_rvw_ttl?ie=UTF8&ASIN=B071YL713B,"5.0 "," the United States "," July 6, 2022",Color: gold&gold,Verified Purchase,Really like the Watch,
Ms. Shan,Great accent piece,https://www.amazon.com/gp/customer-reviews/R353YDEH07H1GN/ref=cm_cr_getr_d_rvw_ttl?ie=UTF8&ASIN=B071YL713B,"5.0 "," the United States "," June 14, 2022",Color: Black Face,Verified Purchase,Got it to complement my son's prom fit. Great purchase!!!,
Elvis,I like this Gold Stainless Steel Wrist Watch,https://www.amazon.com/gp/customer-reviews/R2OYV6SNWZBDPY/ref=cm_cr_getr_d_rvw_ttl?ie=UTF8&ASIN=B071YL713B,"5.0 "," the United States "," May 27, 2022",Color: Gold&black,Verified Purchase,It is looking nice on my wrist.,
Aarihanna,Perfect,https://www.amazon.com/gp/customer-reviews/R17L0L3ZFBLLUE/ref=cm_cr_getr_d_rvw_ttl?ie=UTF8&ASIN=B071YL713B,"5.0 "," the United States "," May 21, 2022",Color: gold&gold,Verified Purchase,I perched this for my 11 year old son who wanted a gold watch for his school dance. He loves it !!!! It’s good quality for the money. I just had to take the some links out and it fit him perfectly. I would definitely perches it again,
Tasha Davis,Love the watch,https://www.amazon.com/gp/customer-reviews/RWA065Z4Y2ZN8/ref=cm_cr_getr_d_rvw_ttl?ie=UTF8&ASIN=B071YL713B,"5.0 "," the United States "," May 11, 2022",Color: Black Face,Verified Purchase,It almost look like a movado,
J H,Hard to change links?  I didn’t have to 🤪🤪,https://www.amazon.com/gp/customer-reviews/R2EXYENTVPEDOI/ref=cm_cr_getr_d_rvw_ttl?ie=UTF8&ASIN=B071YL713B,"4.0 "," the United States "," May 5, 2022",Color: Black Face,Verified Purchase,Very pretty watch! Fake little hands! Mine fit prefect! Good price looks expensive looks cool!,
Amazon Customer,Broke within 2 months,https://www.amazon.com/gp/customer-reviews/R3IJA54G3HNI2E/ref=cm_cr_getr_d_rvw_ttl?ie=UTF8&ASIN=B071YL713B,"3.0 "," the United States "," April 10, 2022",Color: Black Face,Verified Purchase,If you’re looking for something for a kid or just for a certain look then this is nice but won’t last morethan a month or two.,
Shawn,Not good,https://www.amazon.com/gp/customer-reviews/R1F13YMJBWA7Z2/ref=cm_cr_getr_d_rvw_ttl?ie=UTF8&ASIN=B071YL713B,"2.0 "," the United States "," April 2, 2022",Color: Black Face,Verified Purchase,"The watch looks nice. But my first day putting it on, I didn't even make it out the front door before it fell apart lol. Yea it can be fixed, but if it happened once, it'll happen again. Returning",
Kay Kay,I need a refund!!!!! This is crap!!!,https://www.amazon.com/gp/customer-reviews/RE0T2LMMN7T2N/ref=cm_cr_getr_d_rvw_ttl?ie=UTF8&ASIN=B071YL713B,"1.0 "," the United States "," March 20, 2022",Color: gold&gold,Verified Purchase,very cheap looking and the watch face is too big Refund! Refund! Refund! Refund! Refund! Refund!,
Mariela gil,Great watch,https://www.amazon.com/gp/customer-reviews/R1JXHRN44HSXBC/ref=cm_cr_getr_d_rvw_ttl?ie=UTF8&ASIN=B071YL713B,"5.0 "," the United States "," March 6, 2022",Color: Black Face,Verified Purchase,Such a Beauty,
Wally & Deni Magno,It quit in two months.. couldn't get it working again.,https://www.amazon.com/gp/customer-reviews/R2PBP938Z40JW/ref=cm_cr_getr_d_rvw_ttl?ie=UTF8&ASIN=B071YL713B,"2.0 "," the United States "," February 27, 2022",Color: silver&black,Verified Purchase,Even after changing the battery.. it still wouldn't work.,
sabrina,Watch,https://www.amazon.com/gp/customer-reviews/RPJTMA2SRPUMB/ref=cm_cr_getr_d_rvw_ttl?ie=UTF8&ASIN=B071YL713B,"4.0 "," the United States "," February 15, 2022",Color: gold&gold,Verified Purchase,Very nice,
Franklin Lambert,Must have!!,https://www.amazon.com/gp/customer-reviews/R3LAKYOSYD6M85/ref=cm_cr_getr_d_rvw_ttl?ie=UTF8&ASIN=B071YL713B,"5.0 "," the United States "," February 1, 2022",Color: Black Face,Verified Purchase,"Well made and stylish, can't beat the price as well..",
Ronald Rabin,FIT,https://www.amazon.com/gp/customer-reviews/R3S6JMNXB5TAQX/ref=cm_cr_getr_d_rvw_ttl?ie=UTF8&ASIN=B071YL713B,"2.0 "," the United States "," January 18, 2022",Color: Gold&black,Verified Purchase,CAN'T REMOVE LINKS TO GET PROPER FIT,
Wb,Good looking watch for the low,https://www.amazon.com/gp/customer-reviews/R3B70H9XUFTXZW/ref=cm_cr_getr_d_rvw_ttl?ie=UTF8&ASIN=B071YL713B,"5.0 "," the United States "," January 18, 2022",Color: silver&black,Verified Purchase,Good looking watch It’s worth the buck,
Noah,Would buy it again,https://www.amazon.com/gp/customer-reviews/R29NDOWVH8CI07/ref=cm_cr_getr_d_rvw_ttl?ie=UTF8&ASIN=B071YL713B,"5.0 "," the United States "," December 14, 2021",Color: green&gold,Verified Purchase,A lot of people in the reviews when I was looking to buy said that the battery was crap and died in a week. But I’ve had mine for 2 months with no signs of the battery dieing.,
Dimitric Lee,Really nice watch! Looks Amazing,https://www.amazon.com/gp/customer-reviews/R1056RFGRQ21BM/ref=cm_cr_getr_d_rvw_ttl?ie=UTF8&ASIN=B071YL713B,"5.0 "," the United States "," December 13, 2021",Color: gold&gold,Verified Purchase,It looks real! Very nice,
Toniscia Hyman,It's a good product,https://www.amazon.com/gp/customer-reviews/R3AC227XT14JSO/ref=cm_cr_getr_d_rvw_ttl?ie=UTF8&ASIN=B071YL713B,"5.0 "," the United States "," December 9, 2021",Color: Black Face,,It's a good item,
Customerqt,Nicely wrap,https://www.amazon.com/gp/customer-reviews/RPDBD7W42543H/ref=cm_cr_getr_d_rvw_ttl?ie=UTF8&ASIN=B071YL713B,"5.0 "," the United States "," December 2, 2021",Color: Black Face,Verified Purchase,Great quality,
