评论用户,评论概述,评论链接,星级评分,评论地点,评论时间,类型,是否购买,评论详情,觉得该评论有帮助的人数
Shaun Mohammed,Very cheap looking,https://www.amazon.com/gp/customer-reviews/RRW3WY1AY5718/ref=cm_cr_getr_d_rvw_ttl?ie=UTF8&ASIN=B071YL713B,"1.0 "," the United States "," December 24, 2024",Color: gold&gold,Verified Purchase,It feels very cheap,
Lilly Maynard,Love the way it looks; died after 3 days,https://www.amazon.com/gp/customer-reviews/R1B41EL5TB2L9B/ref=cm_cr_getr_d_rvw_ttl?ie=UTF8&ASIN=B071YL713B,"3.0 "," the United States "," December 1, 2024",Color: silver&black,Verified Purchase,I love the way the watch looks but it died and quite working after 3 days. I put a new battery in and it still doesn’t work 😢,
Zsa-Nise Raquel Francis,Beautiful!,https://www.amazon.com/gp/customer-reviews/R3LFWKO6HK5MF6/ref=cm_cr_getr_d_rvw_ttl?ie=UTF8&ASIN=B071YL713B,"5.0 "," the United States "," November 22, 2024",Color: green&gold,Verified Purchase,This watch was worth every penny and more. I was very impressed with the quality and the colors. This was a gift for my cousin and he was beyond excited to wear it. Thanks so much!,
Keemo,Cheap,https://www.amazon.com/gp/customer-reviews/R3UPX9MN87LUMF/ref=cm_cr_getr_d_rvw_ttl?ie=UTF8&ASIN=B071YL713B,"1.0 "," the United States "," October 30, 2024",Color: gold&gold,Verified Purchase,This watch is very cheap material and flimsy. I guess you get what you pay for. The links didn’t even come out and as you pull the link out the band bent soon as you take the links out.,
jim heimann,Broken band,https://www.amazon.com/gp/customer-reviews/R2G4DBXFVNV1AO/ref=cm_cr_getr_d_rvw_ttl?ie=UTF8&ASIN=B071YL713B,"1.0 "," the United States "," October 11, 2024",Color: Gold&black,Verified Purchase,Band is broken,
Jadaaa,Stylish,https://www.amazon.com/gp/customer-reviews/R2GUREDUMIW7ZM/ref=cm_cr_getr_d_rvw_ttl?ie=UTF8&ASIN=B071YL713B,"5.0 "," the United States "," October 9, 2024",Color: gold&gold,Verified Purchase,"Bought as a gift for my Fiancé birthday, he loved it. It was reasonably priced.",
David P,DO NOT BUY THIS!,https://www.amazon.com/gp/customer-reviews/R1448OQBAYX0K/ref=cm_cr_getr_d_rvw_ttl?ie=UTF8&ASIN=B071YL713B,"1.0 "," the United States "," October 4, 2024",Color: Gold&black,Verified Purchase,A total waste of money and time (pun intended).  This watch completely died within a month.,
Johnny S,Here are the extra tools and tips to removing links,https://www.amazon.com/gp/customer-reviews/R221NWSCJ3MLLL/ref=cm_cr_getr_d_rvw_ttl?ie=UTF8&ASIN=B071YL713B,"4.0 "," the United States "," September 14, 2024",Color: gold&gold,Verified Purchase,"I needed a hammer, wd-40, box, and small flathead set to remove and then add the pin back to remove links.  Put some indents on the box to help hold the watch in place while removing pins.  Hammer the pin into the 1st segment of the vertical link just to pilot it in place, then line up the rest. Clean the pin and spray with a little wd-40 to help get it back in place. It takes patience to line this up and get it going.  You may need 1.4 or 2.0 flathead to keep the link push led out to maximize the hole opening to drive the pin back back in.  Hope this helps, too my about 30 to 40 mins to remove 3 links and place 2 pins backs in.  Will make a good prop watch for a night out. Will see how long it lasts for $20 bucks.",2
Me,Love it,https://www.amazon.com/gp/customer-reviews/R186WBXRU4EGAJ/ref=cm_cr_getr_d_rvw_ttl?ie=UTF8&ASIN=B071YL713B,"5.0 "," the United States "," September 3, 2024",Color: green&gold,Verified Purchase,Light weight removed 4 links easily,
Gavin,For the price this is really Great,https://www.amazon.com/gp/customer-reviews/R14AH0GWL4O0VX/ref=cm_cr_getr_d_rvw_ttl?ie=UTF8&ASIN=B071YL713B,"5.0 "," the United States "," August 18, 2024",Color: silver&black,Verified Purchase,Looking for a cheap but great quality watch this is it,
Ancillia,Same as in photo,https://www.amazon.com/gp/customer-reviews/R2EKY2MDMXF8ZL/ref=cm_cr_getr_d_rvw_ttl?ie=UTF8&ASIN=B071YL713B,"5.0 "," the United States "," August 15, 2024",Color: Gold,Verified Purchase,Was a great gift for my spouse he loves it very much,
Lakshmi Mandavilli,Watch,https://www.amazon.com/gp/customer-reviews/R1C87K5LO09VHA/ref=cm_cr_getr_d_rvw_ttl?ie=UTF8&ASIN=B071YL713B,"1.0 "," the United States "," August 5, 2024",Color: Black Face,Verified Purchase,Died after a month,
Good watch,Its a little hard to adjust the size,https://www.amazon.com/gp/customer-reviews/RQV2JILMUY03Q/ref=cm_cr_getr_d_rvw_ttl?ie=UTF8&ASIN=B071YL713B,"5.0 "," the United States "," July 25, 2024",Color: silver&black,Verified Purchase,It’s pretty good quality for the price it fits my wrist well and i have small wrists its a little hard to adjust the size but other then that its a great watch,
Elaine,Good looking watch ⌚️,https://www.amazon.com/gp/customer-reviews/R24K02MBPSIA76/ref=cm_cr_getr_d_rvw_ttl?ie=UTF8&ASIN=B071YL713B,"5.0 "," the United States "," July 16, 2024",Color: gold&gold,Verified Purchase,Gave this watch to my grandson for his graduation and he loves the look of it.,
Liz HK,Great watch for the price. Perfect last minute prom accessory.,https://www.amazon.com/gp/customer-reviews/R3S88QDOSVG6BF/ref=cm_cr_getr_d_rvw_ttl?ie=UTF8&ASIN=B071YL713B,"5.0 "," the United States "," June 27, 2024",Color: Black Face,Verified Purchase,Very happy with the look and price of this watch. It was just what my son needed to finish of his prom look on a budget.,2
Justin,Great Value,https://www.amazon.com/gp/customer-reviews/RT306C4XZUD0O/ref=cm_cr_getr_d_rvw_ttl?ie=UTF8&ASIN=B071YL713B,"5.0 "," the United States "," June 20, 2024",Color: gold&gold,Verified Purchase,"This watch looks really nice for the price, im very happy with it. It did come very large, i had to remove like 4 links to get it to fit snug on my wrist because i have long skinny wrists lol, which was a BIT of a pain but no problem. overall its worth your money if your good with your hands and got a few tools laying around.",
Janey Sons,Kept stopping,https://www.amazon.com/gp/customer-reviews/R157S46U70MJLQ/ref=cm_cr_getr_d_rvw_ttl?ie=UTF8&ASIN=B071YL713B,"3.0 "," the United States "," June 6, 2024",Color: Gold&black,Verified Purchase,The watch was cheap looking and did not work properly for long. Buyers beware.,
Jamilla watkins,The spring bar fell out,https://www.amazon.com/gp/customer-reviews/RAD3F5Q77URIQ/ref=cm_cr_getr_d_rvw_ttl?ie=UTF8&ASIN=B071YL713B,"3.0 "," the United States "," May 20, 2024",Color: silver&black,Verified Purchase,Didn’t have the watch long had to pay $20 to get it fitted then spring bar fell out while I was wearing it  Don’t buy it’s not worth it,
loni,DONT GET !!!,https://www.amazon.com/gp/customer-reviews/R1IINERGDADADE/ref=cm_cr_getr_d_rvw_ttl?ie=UTF8&ASIN=B071YL713B,"1.0 "," the United States "," May 9, 2024",Color: gold&gold,Verified Purchase,"it is basically impossible to adjust, I probably stabbed myself with the tool five different times trying to get the pins out. it’s is the most unpractical watch ever.",
Whiskey Ginger,Given as Gift,https://www.amazon.com/gp/customer-reviews/R1AMMJLYLKNUPT/ref=cm_cr_getr_d_rvw_ttl?ie=UTF8&ASIN=B071YL713B,"5.0 "," the United States "," April 26, 2024",Color: gold&gold,Verified Purchase,"The recipient loved this watch. It looks great and it works better. Quality is great as well, does not irritate sensitive skin.",
kay,Hubby loved it,https://www.amazon.com/gp/customer-reviews/R2CBCUDFBT8BJ8/ref=cm_cr_getr_d_rvw_ttl?ie=UTF8&ASIN=B071YL713B,"4.0 "," the United States "," April 24, 2024",Color: Black Face,Verified Purchase,Bout for hubby just as an appreciation gift and he love it . The color and quality so far is good for the price,
Tom,LOOKS EXPENSIVE.,https://www.amazon.com/gp/customer-reviews/R2SU7ZVSQ9PGU5/ref=cm_cr_getr_d_rvw_ttl?ie=UTF8&ASIN=B071YL713B,"5.0 "," the United States "," April 11, 2024",Color: Gold&black,Verified Purchase,"I get more compliments about this watch. Usually they say ""Like your watch"". I think it is the black face on gold. My first black face. It is very easy to read. It needed a couple links removed for my wrist so I bought a watch repair kit which made the job very easy.",
Lovely Bailey,great watch for the price!,https://www.amazon.com/gp/customer-reviews/R3U2BCV5K99X98/ref=cm_cr_getr_d_rvw_ttl?ie=UTF8&ASIN=B071YL713B,"5.0 "," the United States "," February 26, 2024",Color: Gold&black,Verified Purchase,Looks just like the picture!,
Simmy Boby,Very cute but terrible battery!,https://www.amazon.com/gp/customer-reviews/RMHXD511FGBKD/ref=cm_cr_getr_d_rvw_ttl?ie=UTF8&ASIN=B071YL713B,"3.0 "," the United States "," February 15, 2024",Color: gold&gold,Verified Purchase,"A very cute watch, I loved wearing it! But the battery didn't last at all. Waiting to get it changed.",
James,Got a lot of compliments!,https://www.amazon.com/gp/customer-reviews/R20TEPB5WJEZCV/ref=cm_cr_getr_d_rvw_ttl?ie=UTF8&ASIN=B071YL713B,"5.0 "," the United States "," February 9, 2024",Color: gold&gold,Verified Purchase,"This is a great looking watch, got me a lot of compliments",
Susana Monroe,Very hard to size,https://www.amazon.com/gp/customer-reviews/RSRJ4PVDRWGPY/ref=cm_cr_getr_d_rvw_ttl?ie=UTF8&ASIN=B071YL713B,"2.0 "," the United States "," February 1, 2024",Color: silver&black,Verified Purchase,"It came with a few tools that don’t have any use. If you want to buy this watch, make sure you buy resizing tools separate because the ones that come with it have no use.",
DIYKentucky,Not worth one cent!,https://www.amazon.com/gp/customer-reviews/R1O7188LZ84S2M/ref=cm_cr_getr_d_rvw_ttl?ie=UTF8&ASIN=B071YL713B,"1.0 "," the United States "," January 19, 2024",Color: gold&gold,Verified Purchase,"When I ordered this watch I was aware that it was inexpensive.  However, when this watch was received I opened the box and immediately noticed the minute hand flopping back and forward as I handled it.  Such lack of quality is stunning even in this price range.  Obviously I returned the watch and Amazon issued me a credit the same day!  Good for Amazon, extremely horrible for this piece of scrap metal.  DON'T buy it...you have been warned.",
Steve shields,Don’t buy,https://www.amazon.com/gp/customer-reviews/R28RIQ1R8P8CIR/ref=cm_cr_getr_d_rvw_ttl?ie=UTF8&ASIN=B071YL713B,"1.0 "," the United States "," December 29, 2023",Color: gold&gold,Verified Purchase,Nice looking watch but horrible design. You cannot take any links out. So it does not fit it’s JUNK…,
Tytianna,Beautiful watch,https://www.amazon.com/gp/customer-reviews/R15CAQ9KOWY8TQ/ref=cm_cr_getr_d_rvw_ttl?ie=UTF8&ASIN=B071YL713B,"5.0 "," the United States "," December 23, 2023",Color: gold&gold,Verified Purchase,"Beautiful watch, definitely worth the purchase.",
Gigi,Trash,https://www.amazon.com/gp/customer-reviews/R14Y1PBFKYR481/ref=cm_cr_getr_d_rvw_ttl?ie=UTF8&ASIN=B071YL713B,"1.0 "," the United States "," December 15, 2023",Color: gold&gold,Verified Purchase,Extremely light. The pen they send to take out the links that broke along with the watch. Couldn’t even wear it.,
Brooklynn,Not great quality,https://www.amazon.com/gp/customer-reviews/R29IWL5HBVGLWZ/ref=cm_cr_getr_d_rvw_ttl?ie=UTF8&ASIN=B071YL713B,"1.0 "," the United States "," December 14, 2023",Color: gold&gold,Verified Purchase,"Really excited for this watch and then when we went to take out some of the links because it was too big, they all got stuck. It took hours to try to fix. Not worth it.",
Maritza,Mi reloj lindo,https://www.amazon.com/gp/customer-reviews/R184HREC9Z8PHS/ref=cm_cr_getr_d_rvw_ttl?ie=UTF8&ASIN=B071YL713B,"5.0 "," the United States "," December 13, 2023",Color: Black Face,Verified Purchase,"Esta muy lindo, espero q me dure mucho🙏🙏🙏🙏",
Spencer Miller,Does even work,https://www.amazon.com/gp/customer-reviews/R2T6U418P7O40N/ref=cm_cr_getr_d_rvw_ttl?ie=UTF8&ASIN=B071YL713B,"1.0 "," the United States "," October 30, 2023",Color: gold&gold,Verified Purchase,My watch looks good but the dial is to big so I can't get it to start ticking.,
phyllis potts,Watch,https://www.amazon.com/gp/customer-reviews/R2I2EOLSVQZBTE/ref=cm_cr_getr_d_rvw_ttl?ie=UTF8&ASIN=B071YL713B,"5.0 "," the United States "," October 27, 2023",Color: Gold&black,Verified Purchase,He loved it,
shapshiftr,Watch,https://www.amazon.com/gp/customer-reviews/R3DO6TTN2CX0SP/ref=cm_cr_getr_d_rvw_ttl?ie=UTF8&ASIN=B071YL713B,"5.0 "," the United States "," September 13, 2023",Color: gold&gold,Verified Purchase,"Nice looking watch. Didn't look cheap, I've got allot of compliments.",
Sunamjamframa,Great watch,https://www.amazon.com/gp/customer-reviews/R2GXM49PS5149N/ref=cm_cr_getr_d_rvw_ttl?ie=UTF8&ASIN=B071YL713B,"5.0 "," the United States "," August 24, 2023",Color: gold&gold,Verified Purchase,Love it! Dive pools no issues,
Better than I expected it to be 🔥🔥,Ehhh,https://www.amazon.com/gp/customer-reviews/R2HQZXRJFI8FJM/ref=cm_cr_getr_d_rvw_ttl?ie=UTF8&ASIN=B071YL713B,"3.0 "," the United States "," July 18, 2023",Color: gold&gold,Verified Purchase,"It look nice, but the quality is really cheap",
Marek Mendrok,Watch,https://www.amazon.com/gp/customer-reviews/R1AOBXH36TX1XX/ref=cm_cr_getr_d_rvw_ttl?ie=UTF8&ASIN=B071YL713B,"5.0 "," the United States "," July 16, 2023",Color: gold&gold,Verified Purchase,Good watch so far no problem,
Brent Hostetler,Large man’s watch.,https://www.amazon.com/gp/customer-reviews/R3UAL9U5VNPB05/ref=cm_cr_getr_d_rvw_ttl?ie=UTF8&ASIN=B071YL713B,"5.0 "," the United States "," July 15, 2023",Color: gold&gold,Verified Purchase,The wrist band on this watch is to large for most people. I had to have 2 links taken out.  For the price this is a good watch. Looks like an expensive watch.,
Everything was wonderful,Bright Bright,https://www.amazon.com/gp/customer-reviews/R2N2B6CKJGNYH7/ref=cm_cr_getr_d_rvw_ttl?ie=UTF8&ASIN=B071YL713B,"5.0 "," the United States "," July 15, 2023",Color: gold&gold,Verified Purchase,Great product,
Jaxon kyoshi joko,Most Links are not removable at all,https://www.amazon.com/gp/customer-reviews/R2TYGF3HVB7BQC/ref=cm_cr_getr_d_rvw_ttl?ie=UTF8&ASIN=B071YL713B,"1.0 "," the United States "," July 10, 2023",Color: Gold&black,Verified Purchase,"Tried removing links of watch along with the arrows pointing in the direction in which links can be pushed out, but some of them are utterly impossible to remove. Some of the links come out with ease, and others are immovable. I used the tool that came with the watch, but there is no divot to place the tool into, the huge rods are bigger than the tool. The tool snapped under the pressure immediately. No matter how much force I put into moving the rod in the direction it’s supposed to move it won’t budge. It got to the point where I took a hammer to the tool on the rod (like the instructions said), and the rod still wouldn’t budge. I put all my strength with my hand into the tool on the rod, and it slid off and went right into my finger, causing me to bleed. The watch is in pieces with links getting ripped off of the watch as I tried to move the rod. I feel like it’s just really faulty manufacturing. It should be easier for a rod to move than the it should be for the watch to buckle and break under the pressure it takes to even try to move a rod… designed to move. I don’t know what I expected for 23$. If the rods all moved like advertised, I’d give it 2.5 stars, but now I just have a heap of broken links, and some rods that still refuse to budge. Waste of money",7
Lamont R.,Doesn’t look like the watch in the pic,https://www.amazon.com/gp/customer-reviews/RIHF3XRK29WB2/ref=cm_cr_getr_d_rvw_ttl?ie=UTF8&ASIN=B071YL713B,"2.0 "," the United States "," June 10, 2023",Color: Gold&black,,It’s to small doesn’t look the same,
Bergen,Chamber cosplay killed it,https://www.amazon.com/gp/customer-reviews/R2ZNZ0Z7HRKCJO/ref=cm_cr_getr_d_rvw_ttl?ie=UTF8&ASIN=B071YL713B,"4.0 "," the United States "," June 3, 2023",Color: Gold&black,Verified Purchase,"It’s a good, cheap, slightly adjustable watch. Used for cosplay, served its purpose",
leonard mcbride,Looks great but falls apart,https://www.amazon.com/gp/customer-reviews/R1QV8SNXO1PD4L/ref=cm_cr_getr_d_rvw_ttl?ie=UTF8&ASIN=B071YL713B,"2.0 "," the United States "," May 23, 2023",Color: Black Face,Verified Purchase,"This is my second of these watched. First one I ordered was great, this one has a malfunctioning retaining pen. Watch keeps falling off",
Elijah Dean,"VERY CHEAPLY MADE, broke within 3 days",https://www.amazon.com/gp/customer-reviews/R1NBP9B3F3003K/ref=cm_cr_getr_d_rvw_ttl?ie=UTF8&ASIN=B071YL713B,"2.0 "," the United States "," May 8, 2023",Color: silver&black,Verified Purchase,"Within three days I undid the clasp and took off the watch as normal, and somehow the small rod that held on the links to the clasp fell off, so I can no longer wear it. Everything else was fine though, but very poor quality.",
Amazon Customer,"Lools great, thats it though.",https://www.amazon.com/gp/customer-reviews/R8XGR1DLRV6R/ref=cm_cr_getr_d_rvw_ttl?ie=UTF8&ASIN=B071YL713B,"3.0 "," the United States "," May 5, 2023",Color: green&gold,Verified Purchase,"I bought this strictly for a look to go with a suit. Worth the money in that sense The dials on the watch seem to flop around though when I turn the watch up or down. Just doesn't seem like it has tight internals. Just got the watch so not sure if it will be an issue in the future, but I wouldn't buy another one unless it was for a fashion purpose..",
Caspian,"Not stainless, can't set time, good for a $20 prop watch",https://www.amazon.com/gp/customer-reviews/R2MN8ZHZCLT3JW/ref=cm_cr_getr_d_rvw_ttl?ie=UTF8&ASIN=B071YL713B,"1.0 "," the United States "," May 4, 2023",Color: gold&gold,Verified Purchase,"Watch is feather weight.  No way it's stainless steel.  Also, the set knob would not work, so it doesn't keep time.  I bought it for a prop for a costume, which is why I only spent $20.  So for a $20 prop that you don't want to use and is mis-advertized as stainless, than it's a good watch.  If you really think you will use it...then it's a hard pass.",
Cory Giacalone,Cheap...and not worth even 20$,https://www.amazon.com/gp/customer-reviews/R3RMVP09URO79G/ref=cm_cr_getr_d_rvw_ttl?ie=UTF8&ASIN=B071YL713B,"1.0 "," the United States "," April 21, 2023",Color: Black Face,Verified Purchase,Broke in under a month...the watch clasps bent...and then the watch just fell apart. Horrible quality even for 20$. Just because a watch is cheap....it doesn't mean that it should fall apart in a month.,
Jakes,Too large,https://www.amazon.com/gp/customer-reviews/RCBQIFKCCBH1Z/ref=cm_cr_getr_d_rvw_ttl?ie=UTF8&ASIN=B071YL713B,"1.0 "," the United States "," April 10, 2023",Color: gold&gold,Verified Purchase,I don’t think there’s a single person in the world with a wrist wide enough to wear this watch. It hangs on any hand and looks sloppily designed. Bland and non-reflective design. Waste of money.,
lamar,"it's about the look, not the price of it",https://www.amazon.com/gp/customer-reviews/R2EGUH5YOZZW55/ref=cm_cr_getr_d_rvw_ttl?ie=UTF8&ASIN=B071YL713B,"5.0 "," the United States "," March 20, 2023",Color: gold&gold,Verified Purchase,,2
Anthony F. Sr.,Beautiful watch,https://www.amazon.com/gp/customer-reviews/R1M0IW9H5E3ZBF/ref=cm_cr_getr_d_rvw_ttl?ie=UTF8&ASIN=B071YL713B,"5.0 "," the United States "," January 19, 2023",Color: gold&gold,Verified Purchase,For the price man I'll be buying my groomsmen them,
SPJ,Gold!,https://www.amazon.com/gp/customer-reviews/RTJF6EZD72D00/ref=cm_cr_getr_d_rvw_ttl?ie=UTF8&ASIN=B071YL713B,"5.0 "," the United States "," January 19, 2023",Color: Gold&black,Verified Purchase,"This watch is pretty good for $25! It’s not as heavy as $100 watches, but it still looks like it’s worth more. AOK",
Don Cheech,Too hard to operate,https://www.amazon.com/gp/customer-reviews/R2NA8YNFFFKQNC/ref=cm_cr_getr_d_rvw_ttl?ie=UTF8&ASIN=B071YL713B,"3.0 "," the United States "," January 3, 2023",Color: gold&gold,Verified Purchase,It was nice looking but too hard to set.,
Siera B,Get it!,https://www.amazon.com/gp/customer-reviews/R1UAOTXWX21OZ5/ref=cm_cr_getr_d_rvw_ttl?ie=UTF8&ASIN=B071YL713B,"5.0 "," the United States "," December 26, 2022",Color: gold&gold,Verified Purchase,Great gift!! Even better in person,
Charles weaver,"Very nice  , made a  wonderful Christmas gift",https://www.amazon.com/gp/customer-reviews/RYJORKSRC1QUW/ref=cm_cr_getr_d_rvw_ttl?ie=UTF8&ASIN=B071YL713B,"4.0 "," the United States "," December 26, 2022",Color: Black Face,Verified Purchase,The style was nice for the price.,
Twigg,Junk ...pure $#&%ing JUNK!,https://www.amazon.com/gp/customer-reviews/RZFEF6C5MXO4Z/ref=cm_cr_getr_d_rvw_ttl?ie=UTF8&ASIN=B071YL713B,"1.0 "," the United States "," December 24, 2022",Color: Gold&black,Verified Purchase,"This watch is garbage! First thing is that it feels like it's made of tin. It's so light and flimsy it's like I got it out of a cereal box. Second thing is you can't size it like they say in the instructions. The pins are NOT removable! I tried for over an hour and all I did was scratch the watch a bunch. The pins never moved. I found the arrows and used every tool I cool find. I broke every toothpick I own. Thanks I now am out $25 for this trash watch and now I need to buy more toothpicks. I can't return it now because it's damaged... don't waste your money. You're better off going to Walmart or even a thrift store and getting a better watch for the same money. I am beyond mad and I don't care what kind of customer service they have, I won't wear this watch for the fact that this basically a kids toy sized for the hulk, made from recycled tin cans and made by people who have no business around watches.",3
Rather not say,Beautiful and affordable,https://www.amazon.com/gp/customer-reviews/R3W2ZLVWCV59Y7/ref=cm_cr_getr_d_rvw_ttl?ie=UTF8&ASIN=B071YL713B,"5.0 "," the United States "," December 24, 2022",Color: Black Face,Verified Purchase,"I bought this for my significant other. He hasn’t worn it yet, so I can’t speak on the quality but it is BEAUTIFUL and way cheaper than many other watches",
Kyle Roquemore Jr,GOOD WATCH,https://www.amazon.com/gp/customer-reviews/R1DM1J3UA5FMQZ/ref=cm_cr_getr_d_rvw_ttl?ie=UTF8&ASIN=B071YL713B,"5.0 "," the United States "," December 13, 2022",Color: gold&gold,Verified Purchase,Very quality watch for the price & it is sturdy. Im impressed I didn’t think it would be a decent watch…and it looks real. 💯 I just went to have a few links taken out because it was a little big. Other than that great watch!,3
Tasha Grant-Reid,It looks the same,https://www.amazon.com/gp/customer-reviews/R1NB3UT73RCKA7/ref=cm_cr_getr_d_rvw_ttl?ie=UTF8&ASIN=B071YL713B,"3.0 "," the United States "," December 9, 2022",Color: Gold&black,Verified Purchase,It does look very sturdy but it's nice nonetheless. Too pricey though.,
Kalifah D,Came defective,https://www.amazon.com/gp/customer-reviews/R13LMKX7SNOIGG/ref=cm_cr_getr_d_rvw_ttl?ie=UTF8&ASIN=B071YL713B,"1.0 "," the United States "," December 1, 2022",Color: Black Face,Verified Purchase,The watch looks great but it came defective. The minute hand was loose and moving back and forth.,
Akecia,Wanted something affordable and nice for my husband,https://www.amazon.com/gp/customer-reviews/RIFR8N2UPV7JQ/ref=cm_cr_getr_d_rvw_ttl?ie=UTF8&ASIN=B071YL713B,"5.0 "," the United States "," November 24, 2022",Color: gold&gold,Verified Purchase,He loved his watch it was perfect fit him so well,
Ashton S.,"Very nice, very cheap",https://www.amazon.com/gp/customer-reviews/R2RLRID0PM3OTP/ref=cm_cr_getr_d_rvw_ttl?ie=UTF8&ASIN=B071YL713B,"5.0 "," the United States "," November 21, 2022",Color: Gold&black,Verified Purchase,"Went through hell and back with this. Used it while swimming and other activities. Wear it in a shipyard all the time. I accidentally hit it off of something and the glass shattered but that's my own fault. All in all, works well for the money and will go through just about anything.",3
Vanrod92,I returned it,https://www.amazon.com/gp/customer-reviews/R37D53G66Y49GO/ref=cm_cr_getr_d_rvw_ttl?ie=UTF8&ASIN=B071YL713B,"1.0 "," the United States "," November 17, 2022",Color: gold&gold,Verified Purchase,It looked damaged/used upon arrival- scratches on it several areas. Returned it.,
Amazon Customer,Looks nice.  Didn't last.,https://www.amazon.com/gp/customer-reviews/R1341G0N9G35VD/ref=cm_cr_getr_d_rvw_ttl?ie=UTF8&ASIN=B071YL713B,"2.0 "," the United States "," November 8, 2022",Color: Gold&black,Verified Purchase,"I bought this watch twice.  The band on the first one broke after a few months. The second one started losing time after a few months.  So, I decided to pay a little more in hopes of getting a watch that would last more than a few months.",
Jesse,Great price,https://www.amazon.com/gp/customer-reviews/R1TCL7EN2ECQWZ/ref=cm_cr_getr_d_rvw_ttl?ie=UTF8&ASIN=B071YL713B,"5.0 "," the United States "," November 5, 2022",Color: Gold&black,Verified Purchase,"I love the watch it was exactly what I was expecting & you can’t beat the price . The only complain is that it was a little difficult to  resize the watch , but after a few attempts I got it done !",
Queen Fonda,Came scratched as if this item had been returned before.,https://www.amazon.com/gp/customer-reviews/R2WB3RI79WLXEX/ref=cm_cr_getr_d_rvw_ttl?ie=UTF8&ASIN=B071YL713B,"2.0 "," the United States "," October 4, 2022",Color: silver&black,Verified Purchase,See the scratch below the ‘200’? I just opened the package 10 minutes ago and that was there. And I tried wiping it and realized it’s ingrained in the metal. Also no plastic covering on the watch face when I took it out of the box. You guys gotta do a better job of checking your returns before sending them back out. Will not order again.,
