标题,详情
Belle Poque 1950s Vintage Dress for Women Sleeveless Homecoming Dresses Cocktail Party A-Line Summer Dress,"Features: 1950s vintage style, sleeveless, square V neck/sweetheart neckline, vibrant floral pattern/plaid/solid color dress, A-Line silhouette, swing skirt, decorative buttons in the front, concealed zipper at back, smocked/shirred back side to give more room for ladies"
Belle Poque 1950s Vintage Dress for Women Sleeveless Homecoming Dresses Cocktail Party A-Line Summer Dress,"Occasion: Perfect for daily casual, vintage party, easter, church, wedding guest, tea party, bridal shower, swing dancing, beach, dating, vacation, wedding, homecoming, birthday, date, cocktail party dress, work, dinner, anniversary, theme party dress, and other occasions"
Belle Poque 1950s Vintage Dress for Women Sleeveless Homecoming Dresses Cocktail Party A-Line Summer Dress,"Style: Classy floral pattern for this retro dress, and the waist party has pleated elastic band to shows your curve and beauty"
Belle Poque 1950s Vintage Dress for Women Sleeveless Homecoming Dresses Cocktail Party A-Line Summer Dress,Garment Care: Hand wash in gentle cold water. Machine wash in laundry bag. Iron the folds before photography. Do not bleach
Belle Poque 1950s Vintage Dress for Women Sleeveless Homecoming Dresses Cocktail Party A-Line Summer Dress,Notes: Please refer to our Size Chart before order dress (please ignore the Amazon's)
Belle Poque 1950s Vintage Dress for Women Sleeveless Homecoming Dresses Cocktail Party A-Line Summer Dress,
