标题,详情
9 PCS 16G Stainless Steel Horseshoe Septum Rings for Women Cartilage Helix Tragus Earrings Daith Earrings Hoop Snake Bat Gothic Piercing Jewelry,"Cartilage Earrings Set: 9PCS Cartilage Daith Earring in One Order, 5Pcs Horseshoe Ring and 4Pcs Segment Clicker Rings, Suitable Both Women and Men for Daily Wearing"
9 PCS 16G Stainless Steel Horseshoe Septum Rings for Women Cartilage Helix Tragus Earrings Daith Earrings Hoop Snake Bat Gothic Piercing Jewelry,"Detail Size:16 Gauge=1.2mm, Inner Diameter.: 10mm, Horseshoe Rings&Hinged Segment Clicker Rings for Daith, Septum, Cartilage, Helix Tragus, Conch Piercing"
9 PCS 16G Stainless Steel Horseshoe Septum Rings for Women Cartilage Helix Tragus Earrings Daith Earrings Hoop Snake Bat Gothic Piercing Jewelry,"Safe Material: 316L Stainless Steel Made, Lead&Nickel Free, Safe to Wear without Skin Problem, High Polished and Well-Plated Surface, Comfortable Wear Feeling and Lasting Color Retention"
9 PCS 16G Stainless Steel Horseshoe Septum Rings for Women Cartilage Helix Tragus Earrings Daith Earrings Hoop Snake Bat Gothic Piercing Jewelry,"Ideal Gifts-9Pcs Different Styles Daith Earring Set Will be the Best Gift for Anniversaries, Birthdays, , Valentine's Day, Mother's Day, Thanksgiving, Christmas"
9 PCS 16G Stainless Steel Horseshoe Septum Rings for Women Cartilage Helix Tragus Earrings Daith Earrings Hoop Snake Bat Gothic Piercing Jewelry,"Elegant Care Instructions: To maintain the luster and longevity of your jewelry, gently clean with a soft cloth after each wear. Avoid contact with water, chemicals, and extreme temperatures. Store in the original box or a soft pouch to protect from scratches and tarnish. Regular maintenance will ensure your jewelry remains a cherished piece for years to come"
9 PCS 16G Stainless Steel Horseshoe Septum Rings for Women Cartilage Helix Tragus Earrings Daith Earrings Hoop Snake Bat Gothic Piercing Jewelry,
