EJohnson,Buttery Smooth,https://www.amazon.com/gp/customer-reviews/R1ENS32J0GVO95/ref=cm_cr_getr_d_rvw_ttl?ie=UTF8&ASIN=B07ZP7L2X9,"5.0 "," the United States "," January 17, 2025",Size: X-LargeColor: Blackgrey Camo,Verified Purchase,"These pants are amazing! Super stretchy, lightweight, smooth, with pockets! They are everything that I need in athletic leggings!",
Tina Barnes,Best joggers,https://www.amazon.com/gp/customer-reviews/R3GPKNB4KSPKJ1/ref=cm_cr_getr_d_rvw_ttl?ie=UTF8&ASIN=B07ZP7L2X9,"5.0 "," the United States "," January 6, 2025",Size: LargeColor: Black,Verified Purchase,I had bought other joggers but they started pilling. These stay nice no matter how much you wear or wash. Love them & I wear them almost every day. I have 4 colors in them.,
Anoni Miss,Nice product,https://www.amazon.com/gp/customer-reviews/R2SYFBEGAHFJ3W/ref=cm_cr_getr_d_rvw_ttl?ie=UTF8&ASIN=B07ZP7L2X9,"5.0 "," the United States "," January 17, 2025",Size: MediumColor: Dark Olive,Verified Purchase,"fits well, fabric is a bit thin but not see-through at all, just will show every imperfection",
S,Love these!,https://www.amazon.com/gp/customer-reviews/R2CALKXAWJWIB4/ref=cm_cr_getr_d_rvw_ttl?ie=UTF8&ASIN=B07ZP7L2X9,"5.0 "," the United States "," January 14, 2025",Size: MediumColor: Olive Green,Verified Purchase,I love these joggers. I’ll buy more in all the different colors. I’m 5’1” 150 lbs and the medium fit perfectly.,
Ashley,Perfect fit,https://www.amazon.com/gp/customer-reviews/R38NM9O7IGEHKV/ref=cm_cr_getr_d_rvw_ttl?ie=UTF8&ASIN=B07ZP7L2X9,"5.0 "," the United States "," January 18, 2025",Size: SmallColor: Bright Pink,Verified Purchase,I’m 5’8” and 151lbs. A small fit me perfectly. The joggers are comfortable and worth the purchase.,
Julie Jayo,The Gym People Joggers,https://www.amazon.com/gp/customer-reviews/R3GHYSXGXK626G/ref=cm_cr_getr_d_rvw_ttl?ie=UTF8&ASIN=B07ZP7L2X9,"5.0 "," the United States "," January 3, 2025",Size: MediumColor: Denim Blue,Verified Purchase,"LOVE these pants! They are so flattering on. I purchased three other colors today! Wished that the pant came in a set. I am 5’2”, 126 pounds, I ordered a medium. Perfect fit.",
Trisha,As advertised,https://www.amazon.com/gp/customer-reviews/R3107MNRV3TWV8/ref=cm_cr_getr_d_rvw_ttl?ie=UTF8&ASIN=B07ZP7L2X9,"5.0 "," the United States "," January 17, 2025",Size: XX-LargeColor: Black,Verified Purchase,The pants are very comfortable and smooth. The size and fit is perfect.,
Dixie-Ann Sawin,Good quality,https://www.amazon.com/gp/customer-reviews/R1IWF42E580SQF/ref=cm_cr_getr_d_rvw_ttl?ie=UTF8&ASIN=B07ZP7L2X9,"4.0 "," the United States "," December 17, 2024",Size: SmallColor: Wine Red,Verified Purchase,"This product was lightweight, esthetically pleasing, and extremely comfortable. it was easy to do daily tasks with!",
PSGV,They don’t have to be shorten,https://www.amazon.com/gp/customer-reviews/R2Q1XXUW8IF2GG/ref=cm_cr_getr_d_rvw_ttl?ie=UTF8&ASIN=B07ZP7L2X9,"5.0 "," the United States "," December 31, 2024",Size: LargeColor: Black,Verified Purchase,"I really like them, there comfortable and large enough pockets for my phone. Normally I wood have to hem them ,but the style  you don’t need to. Very nice material and machine was is great.",
LaurelAlex,Love these....BTW I accidentally gave the Seller a 1-star rating previously... SO SORRY. 5-star!,https://www.amazon.com/gp/customer-reviews/R247GUP4GLLRTO/ref=cm_cr_getr_d_rvw_ttl?ie=UTF8&ASIN=B07ZP7L2X9,"5.0 "," the United States "," January 15, 2025",Size: MediumColor: Denim Blue,Verified Purchase,Very comfortable... sizing was correct for what I ordered. Nice Quality!,
Gina VILIBORGHI,The first thing that I noticed was the good fit,https://www.amazon.com/gp/customer-reviews/R3OS9RYJTSHFVT/ref=cm_cr_getr_d_rvw_ttl?ie=UTF8&ASIN=B07ZP7L2X9,"5.0 "," the United States "," January 8, 2025",Size: X-LargeColor: Blue,Verified Purchase,I love that I can wear them anytime and they are very comfortable and they look great. I also love the color and price.,
Aprille,So comfortable!,https://www.amazon.com/gp/customer-reviews/R27VON21EZWSHA/ref=cm_cr_getr_d_rvw_ttl?ie=UTF8&ASIN=B07ZP7L2X9,"5.0 "," the United States "," January 6, 2025",Size: LargeColor: Black,Verified Purchase,The most comfy pants I have had in a while. Perfect sizing and it has POCKETS! Am absolutely going to order more colors.,
Heather Glenn,Not all colors fit the same,https://www.amazon.com/gp/customer-reviews/R32SHHJ2A493JB/ref=cm_cr_getr_d_rvw_ttl?ie=UTF8&ASIN=B07ZP7L2X9,"4.0 "," the United States "," December 3, 2024",Size: X-LargeColor: Black,Verified Purchase,I love the black camo joggers I have so I ordered the black ones. They were way tighter than the camo ones that I have. I sent them back. Just be aware of sizing difference.,2
MMBen,Great pants but strongly scented!,https://www.amazon.com/gp/customer-reviews/RKNV6Q4H66OK8/ref=cm_cr_getr_d_rvw_ttl?ie=UTF8&ASIN=B07ZP7L2X9,"4.0 "," the United States "," November 22, 2024",Size: LargeColor: Black,Verified Purchase,"These are so comfy and also nice looking! I wear them hiking and to church. I especially like top of the waistband because it doesn't roll down! However, the pants smelled sooooo perfumey when the arrived and I had to wash them three times before wearing and they still have a mild scent. Yuck!",
Amazon Customer,Shiny not matte joggers,https://www.amazon.com/gp/customer-reviews/R2A6F4WUE8KJLO/ref=cm_cr_getr_d_rvw_ttl?ie=UTF8&ASIN=B07ZP7L2X9,"5.0 "," the United States "," January 5, 2025",Size: MediumColor: Black,Verified Purchase,The pants are soft and have a suck in feel. Know that the pants are shiny and not matte. Very comfortable though!,
ben,Love these pants,https://www.amazon.com/gp/customer-reviews/RIDQEQ21T8DBY/ref=cm_cr_getr_d_rvw_ttl?ie=UTF8&ASIN=B07ZP7L2X9,"5.0 "," the United States "," December 31, 2024",Size: X-LargeColor: Dark Blue Green,Verified Purchase,These are the best pants. I work from home and absolutely love wearing these. I also wear them to travel in. They are the best ever.,
kathy,COMFORTABLE,https://www.amazon.com/gp/customer-reviews/RI7WQ7KR76PKH/ref=cm_cr_getr_d_rvw_ttl?ie=UTF8&ASIN=B07ZP7L2X9,"5.0 "," the United States "," January 17, 2025",Size: LargeColor: Blue,Verified Purchase,These fit perfectly and are soo comfortable,
Cari Bickley,LOVE THESE,https://www.amazon.com/gp/customer-reviews/R36PZZTON7HQA2/ref=cm_cr_getr_d_rvw_ttl?ie=UTF8&ASIN=B07ZP7L2X9,"5.0 "," the United States "," January 4, 2025",Size: LargeColor: Bright Grey,Verified Purchase,"These are the most comfortable pants - lightweight and yet sturdy!  Love the feel, color, fit!  GREAT buy!",
Amanda Yates,Sooo comfortable!!!,https://www.amazon.com/gp/customer-reviews/R12O4UNCWX3FEH/ref=cm_cr_getr_d_rvw_ttl?ie=UTF8&ASIN=B07ZP7L2X9,"5.0 "," the United States "," December 30, 2024",Size: 3X-LargeColor: Black,Verified Purchase,These are so buttery soft and comfy. They’re definitely not tight and won’t suck you in but they’re fitted enough and comfy. I would definitely purchase another pair.,
DonTha,Great Quality,https://www.amazon.com/gp/customer-reviews/R28BQP891KCKUH/ref=cm_cr_getr_d_rvw_ttl?ie=UTF8&ASIN=B07ZP7L2X9,"5.0 "," the United States "," January 7, 2025",Size: MediumColor: Black,Verified Purchase,These are my favorite joggers and are so comfortable. Very good price and great quality.,
J. Hahn,The Best,https://www.amazon.com/gp/customer-reviews/R1190CGVM8U3SH/ref=cm_cr_getr_d_rvw_ttl?ie=UTF8&ASIN=B07ZP7L2X9,"5.0 "," the United States "," November 18, 2024",Size: XX-LargeColor: Dark Grey,Verified Purchase,"These pants are the best! The material is soft and stretchy, but not so much that they look stretched out after all day wear. I've worn them a couple of times before washing them and they still looked great the second wear, after wearing them all day the first day (to work in an office, so they were not ""dirty"").  They fit perfectly - not too lose and not too tight. I did size up so they would not be right in the waist and they are just snug enough to be slimming and hold everything in :)  Those are also very versatile. I wear them in a corporate environment and also wear them casually all weekend.  I think I need more pairs. After falling in love with the first pair, I have since bought three more pairs!",17
Beverly,Fit is good.,https://www.amazon.com/gp/customer-reviews/R8RDF3BIMEP5R/ref=cm_cr_getr_d_rvw_ttl?ie=UTF8&ASIN=B07ZP7L2X9,"5.0 "," the United States "," January 13, 2025",Size: LargeColor: Denim Blue,Verified Purchase,"Very comfortable, size was good",
margaret vasquez,As described,https://www.amazon.com/gp/customer-reviews/R2ELLCEEKXXZK1/ref=cm_cr_getr_d_rvw_ttl?ie=UTF8&ASIN=B07ZP7L2X9,"5.0 "," the United States "," January 14, 2025",Size: LargeColor: Vintage Purple,Verified Purchase,Fits well. Fabric great. Comfortable.,
Bette B,Fit perfect,https://www.amazon.com/gp/customer-reviews/R12CTEALC2AG9Z/ref=cm_cr_getr_d_rvw_ttl?ie=UTF8&ASIN=B07ZP7L2X9,"5.0 "," the United States "," December 30, 2024",Size: XX-LargeColor: Blue,Verified Purchase,I ordered 2 more pair after I received the first 2.  These are  comfortable and look nice enough to wear out of the house.,
Amazon Customer,"Love these,own 3 pair now",https://www.amazon.com/gp/customer-reviews/R2ON2LWE4F1HQ0/ref=cm_cr_getr_d_rvw_ttl?ie=UTF8&ASIN=B07ZP7L2X9,"5.0 "," the United States "," January 9, 2025",Size: XX-LargeColor: Black,Verified Purchase,These are so comfy and stylish. True to size. Highly recommend.,
nancy e. Lallement,Love love,https://www.amazon.com/gp/customer-reviews/R1PATYYHR5WX7Z/ref=cm_cr_getr_d_rvw_ttl?ie=UTF8&ASIN=B07ZP7L2X9,"5.0 "," the United States "," December 30, 2024",Size: MediumColor: Light Purple,Verified Purchase,I love these leggings. I just bought my third pair. They fit perfectly. So comfortable and love the pockets.,
Iris Espinoza,Perfect joggers!,https://www.amazon.com/gp/customer-reviews/R3V47UAK8D4E4C/ref=cm_cr_getr_d_rvw_ttl?ie=UTF8&ASIN=B07ZP7L2X9,"5.0 "," the United States "," December 18, 2024",Size: X-SmallColor: Denim Blue,Verified Purchase,I’m 5’1 105lbs and they fit so nicely! Finally pants that aren’t too long or too wide! Don’t mind the 2nd pic in my daughter’s room I was in the middle of cleaning and thought oh look at my pants! So comfy and nice! 😊 I like the shape it gives me and it’s not tight!,14
Amazon Customer,Good quality,https://www.amazon.com/gp/customer-reviews/R2VPKUJV1W84WW/ref=cm_cr_getr_d_rvw_ttl?ie=UTF8&ASIN=B07ZP7L2X9,"5.0 "," the United States "," December 31, 2024",Size: MediumColor: Black,Verified Purchase,I have to buy this again and again because of the quality and very comfortable. I love it.,
Emily,Swish pants,https://www.amazon.com/gp/customer-reviews/RZGV4H61FJI6D/ref=cm_cr_getr_d_rvw_ttl?ie=UTF8&ASIN=B07ZP7L2X9,"5.0 "," the United States "," January 8, 2025",Size: X-LargeColor: Black,Verified Purchase,LOVE! They are definitely sports mom on the go,
Andrew V Donaldson,Comfy,https://www.amazon.com/gp/customer-reviews/RJLD6ICID232P/ref=cm_cr_getr_d_rvw_ttl?ie=UTF8&ASIN=B07ZP7L2X9,"5.0 "," the United States "," December 7, 2024",Size: X-LargeColor: Black,Verified Purchase,"I have been looking for a comfortable leggings without feeling exposed and I found it in these leggings. My husband bought four of these in two different sizes XL and L both sizes fit differently but perfectly. The material is soft and comfortable. I love them so much I bought my daughter a few pairs. Get them, you won't regret it l!",
Tammie Peace,Perfect fit and really nice material,https://www.amazon.com/gp/customer-reviews/R2GHFAA61WI9GP/ref=cm_cr_getr_d_rvw_ttl?ie=UTF8&ASIN=B07ZP7L2X9,"5.0 "," the United States "," December 7, 2024",Size: XX-LargeColor: Black,Verified Purchase,"These fit me so well . I ordered my usual size XXL , I am 5’5” and 210 lbs . The material is VERY NICE . They are not two thin and not thick either . Great for yoga , coffee , errands , shopping , etc … Price point was good for these leggings !! I will order more or put on my Santa list 😀",
Raquel McVeigh,Comfortable,https://www.amazon.com/gp/customer-reviews/R24JFGED5UWBWO/ref=cm_cr_getr_d_rvw_ttl?ie=UTF8&ASIN=B07ZP7L2X9,"5.0 "," the United States "," December 20, 2024",Size: X-LargeColor: Black,Verified Purchase,These are absolutely amazing and flattering. They give enough support and enough comfortable room. I bought a pair thrn immediately bought two more. I did not size up. Just ordered my normal size and they fit amazing.,
Fred,Material & fit,https://www.amazon.com/gp/customer-reviews/R2AUWJP2RIO2KQ/ref=cm_cr_getr_d_rvw_ttl?ie=UTF8&ASIN=B07ZP7L2X9,"5.0 "," the United States "," January 9, 2025",Size: LargeColor: Dark Grey,Verified Purchase,"Lightweight, comfortable & true to size. Ordering again.",
Alba L.,Bonita y cómoda,https://www.amazon.com/gp/customer-reviews/R1OEH9WO5L9TEQ/ref=cm_cr_getr_d_rvw_ttl?ie=UTF8&ASIN=B07ZP7L2X9,"5.0 "," the United States "," January 11, 2025",Size: MediumColor: Bright Pink,Verified Purchase,Regia prenda para el gimnasio y la caminata,
T. Curtis,Soft and comfy!,https://www.amazon.com/gp/customer-reviews/RXL1AQX3VW0V2/ref=cm_cr_getr_d_rvw_ttl?ie=UTF8&ASIN=B07ZP7L2X9,"5.0 "," the United States "," December 30, 2024",Size: X-LargeColor: Vintage Purple,Verified Purchase,"I bought them in 2 colors, they are ultra comfortable for casual wear or for working out. The feel like butter!",
Tonia Henry,Good pants.,https://www.amazon.com/gp/customer-reviews/R876GMVB2IR2C/ref=cm_cr_getr_d_rvw_ttl?ie=UTF8&ASIN=B07ZP7L2X9,"4.0 "," the United States "," October 23, 2024",Size: MediumColor: Dark Grey,Verified Purchase,"I'm tall (5'9''), so the issue with joggers for me is that they tend to fit more like fitted calf-length leggings rather than pants that should hit at the ankle and be a bit loose. Nevertheless, I've accepted this fate and really like the color/feel/style of these pants. They are comfy and good for days or evenings when the temperature is not too hot but not really cold yet either. Nice waistline too (the stretchy waist instead of a drawstring).",3
Maria Ibanez,Bought them in 4 colors!,https://www.amazon.com/gp/customer-reviews/RUAGW0OL8DT94/ref=cm_cr_getr_d_rvw_ttl?ie=UTF8&ASIN=B07ZP7L2X9,"5.0 "," the United States "," December 17, 2024",Size: SmallColor: Dark Grey,Verified Purchase,These pants are so comfortable and light weight. I tried them on and immediately came back to my Amazon app and bought three more in different colors. Love the feeling of softness and how they look on me. I was confused about why it had a warning staying it was a frequently returned item.,11
Elisabeth Thompson,Good pair of joggers,https://www.amazon.com/gp/customer-reviews/R1R8U47FEDNQ94/ref=cm_cr_getr_d_rvw_ttl?ie=UTF8&ASIN=B07ZP7L2X9,"4.0 "," the United States "," December 14, 2024",Size: SmallColor: Black,Verified Purchase,"Fit great, soft fabric and good price",
Kayzee,great joggers,https://www.amazon.com/gp/customer-reviews/R39L9N8PIOZSJ7/ref=cm_cr_getr_d_rvw_ttl?ie=UTF8&ASIN=B07ZP7L2X9,"5.0 "," the United States "," January 3, 2025",Size: MediumColor: Dark Grey,Verified Purchase,these joggers are soft and comfortable.  Great for work or leisure.,
Diane Miller,Very comfy!,https://www.amazon.com/gp/customer-reviews/R2XTJ3Y6PQIDFQ/ref=cm_cr_getr_d_rvw_ttl?ie=UTF8&ASIN=B07ZP7L2X9,"5.0 "," the United States "," December 29, 2024",Size: MediumColor: Brick Red,Verified Purchase,"Great joggers, true to size . Colors are vibrant and they are very lightweight . Will continuevto purchase this brand.",
Kevin Dodge,Super comfy,https://www.amazon.com/gp/customer-reviews/R34RNVG0KBHZI5/ref=cm_cr_getr_d_rvw_ttl?ie=UTF8&ASIN=B07ZP7L2X9,"5.0 "," the United States "," December 30, 2024",Size: MediumColor: Grey Purple,Verified Purchase,"These are soft, thin but not see through. Length is good. I got the medium, I am 5’7” 150 pounds.",
gayle jones,Product is too big.,https://www.amazon.com/gp/customer-reviews/R3A4ZF4G4CRVR5/ref=cm_cr_getr_d_rvw_ttl?ie=UTF8&ASIN=B07ZP7L2X9,"5.0 "," the United States "," January 7, 2025",Size: X-LargeColor: Black,Verified Purchase,Legging are great just too big.i,
Amazon Customer,These are fantastic,https://www.amazon.com/gp/customer-reviews/R32YG5H1Q3VKGX/ref=cm_cr_getr_d_rvw_ttl?ie=UTF8&ASIN=B07ZP7L2X9,"5.0 "," the United States "," December 31, 2024",Size: LargeColor: Dark Grey,Verified Purchase,These do not disappoint!! They are soft and comfy!! I must order more!!!,
Pamela Scott,So comfy,https://www.amazon.com/gp/customer-reviews/R4TEY36VQSUW9/ref=cm_cr_getr_d_rvw_ttl?ie=UTF8&ASIN=B07ZP7L2X9,"5.0 "," the United States "," January 5, 2025",Size: SmallColor: Dark Grey,Verified Purchase,Great weight and fit,
JJG,Perfect fit,https://www.amazon.com/gp/customer-reviews/R2U6DTY8U4J2Z9/ref=cm_cr_getr_d_rvw_ttl?ie=UTF8&ASIN=B07ZP7L2X9,"5.0 "," the United States "," January 3, 2025",Size: X-LargeColor: Black,Verified Purchase,Love these.  A perfect fit and very comfortable.,
Alejandra,Love it!,https://www.amazon.com/gp/customer-reviews/R1XLTMUJ03LTWE/ref=cm_cr_getr_d_rvw_ttl?ie=UTF8&ASIN=B07ZP7L2X9,"4.0 "," the United States "," November 13, 2024",Size: LargeColor: Black,Verified Purchase,"Slightly waterproof, the fabric is soft and comfortable. ideal for travel and the gym. I'm 1.50cm tall and the M fit perfectly.",
Markar,Love the pant; color not so much,https://www.amazon.com/gp/customer-reviews/R319KZPMGG5IY6/ref=cm_cr_getr_d_rvw_ttl?ie=UTF8&ASIN=B07ZP7L2X9,"4.0 "," the United States "," October 10, 2024",Size: LargeColor: Denim Blue,Verified Purchase,"I am impressed with these jogger-style pants. I like the fabric and the style. The large fits perfect - I’m 5’3” and 145. Pockets are great. However, I ordered the denim blue. It isn’t any shade of blue. I’m not exactly sure what color it is. And nothing seems to go with the color - even a white t-shirt doesn’t look all that great. I’m considering returning them for navy or grey. But I definitely want a pair - maybe two!",3
Shelley,Joggers,https://www.amazon.com/gp/customer-reviews/R2UMSXL6OE9VZ7/ref=cm_cr_getr_d_rvw_ttl?ie=UTF8&ASIN=B07ZP7L2X9,"5.0 "," the United States "," December 7, 2024",Size: MediumColor: Black,Verified Purchase,"So comfy!  I was skeptical about the material, boy was I wrong.  These joggers are so comfortable and fits perfectly.  Great value for the money. I’m always cold, but these seem to keep me from having to grab a blanket non stop. I will definitely be buying more.",2
ELA,Comfortable and easy fabric,https://www.amazon.com/gp/customer-reviews/RBUJW5UVGCW2B/ref=cm_cr_getr_d_rvw_ttl?ie=UTF8&ASIN=B07ZP7L2X9,"5.0 "," the United States "," December 27, 2024",Size: LargeColor: Black,Verified Purchase,I've been very happy with the fit and comfort of these pants.  I wear these often when traveling.,
Shannon Dalton,Pants,https://www.amazon.com/gp/customer-reviews/RNFKMH3IY155P/ref=cm_cr_getr_d_rvw_ttl?ie=UTF8&ASIN=B07ZP7L2X9,"5.0 "," the United States "," December 22, 2024",Size: MediumColor: Black,Verified Purchase,"Lightweight, size is accurate, color is vibrant. I wouldn't say these are warm by any means. This is definitely more of a spring/ fall pant",
Karen,Great quality,https://www.amazon.com/gp/customer-reviews/RDNUHVFYUWJ37/ref=cm_cr_getr_d_rvw_ttl?ie=UTF8&ASIN=B07ZP7L2X9,"5.0 "," the United States "," December 29, 2024",Size: LargeColor: Blue,Verified Purchase,"I own 4 pairs, that’s how much I like these.",
Kay L Dutton,They feel really comfortable.,https://www.amazon.com/gp/customer-reviews/R15QO3YL91EOZ1/ref=cm_cr_getr_d_rvw_ttl?ie=UTF8&ASIN=B07ZP7L2X9,"5.0 "," the United States "," December 17, 2024",Size: XX-LargeColor: Black,Verified Purchase,You may want to order 1 size larger to reduce tightness around the waist. They feel great and  my husband loves the way I look when wearing them.,
Georgia,Good quality,https://www.amazon.com/gp/customer-reviews/R1V070GVTACBDG/ref=cm_cr_getr_d_rvw_ttl?ie=UTF8&ASIN=B07ZP7L2X9,"5.0 "," the United States "," December 18, 2024",Size: LargeColor: Dark Blue Green,Verified Purchase,Love the fit the quality A little pricey but will buy again They are thick Colors are nice They are smooth and soft,
KellyB,Comfy,https://www.amazon.com/gp/customer-reviews/RNQVZRL2SCY0H/ref=cm_cr_getr_d_rvw_ttl?ie=UTF8&ASIN=B07ZP7L2X9,"5.0 "," the United States "," November 30, 2024",Size: LargeColor: Dark Grey,Verified Purchase,"Although I had to order in a larger size I knew these will be comfortable. I wish only that the fabric was warmer. What I like is that these fit a petite woman if you pull the waistband all the way up , the cuffs fall at my ankles. I ordered two more in the larger size.",2
Rachael,So comfortable,https://www.amazon.com/gp/customer-reviews/R188PX9XOC2XMO/ref=cm_cr_getr_d_rvw_ttl?ie=UTF8&ASIN=B07ZP7L2X9,"5.0 "," the United States "," November 25, 2024",Size: X-LargeColor: Black,Verified Purchase,"Thick enough to feel covered up without being too hot. Very soft, I got an XL but probably could have gone down a size if I wanted a tighter fit. The pants part is baggier but the waist is stretchy but fits perfectly. Tapers at the ankle without being too tight. Overall, incredibly comfortable, will wear these pants for lounging/running errands.",
Tammy Knipp,The most comfortable!!,https://www.amazon.com/gp/customer-reviews/R3RTU8NFIXHYJH/ref=cm_cr_getr_d_rvw_ttl?ie=UTF8&ASIN=B07ZP7L2X9,"5.0 "," the United States "," December 8, 2024",Size: X-LargeColor: Black,Verified Purchase,I feel like they run a little small but I’m glad I ordered up a size! They are the most comfortable joggers and buttery soft ❤️ definitely buying more!!,
