评论用户,评论概述,评论链接,星级评分,评论地点,评论时间,类型,是否购买,评论详情,觉得该评论有帮助的人数
EG,So Comfy,https://www.amazon.com/gp/customer-reviews/R8B3F2V109JH1/ref=cm_cr_arp_d_rvw_ttl?ie=UTF8&ASIN=B07ZP7L2X9,"5.0 "," the United States "," October 23, 2024",Size: LargeColor: Black,Verified Purchase,"These pants have truly impressed me with their versatility, comfort, and style. These athletic leggings are perfect for a variety of activities, from working out to lounging at home. The fabric is incredibly soft and stretchy, providing a snug fit that moves with you during any activity.  One of the standout features is the practical design. The joggers come with well-placed pockets that are deep enough to securely hold my phone, keys, and other essentials while I’m on the go. This feature is a game-changer, especially when I’m out running or in the middle of a workout session, and I need easy access to my belongings. The waistband is wide and elastic, ensuring a comfortable fit that stays in place without digging into my skin.  The tapered leg design adds a modern and stylish touch to these joggers, making them suitable for both active and casual wear. I love that I can transition seamlessly from a yoga class to running errands without feeling underdressed. The material is also moisture-wicking, which keeps me dry and comfortable even during intense workouts. It’s evident that these pants were designed with the active woman in mind.  Another aspect that sets these joggers apart is their durability. I’ve washed them multiple times, and they still look and feel as good as new. The color doesn’t fade, and the fabric maintains its elasticity and softness. This level of quality is rare, especially at such an affordable price point.  I also appreciate the variety of colors and sizes available. There’s something for everyone, and finding the perfect fit is easy. The quality and affordability of these joggers make them a great addition to any wardrobe, whether you're an athlete or just someone who appreciates comfort and style in their everyday wear.  These pants have quickly become my go-to choice for workouts, yoga sessions, and casual outings. They offer the perfect blend of functionality and fashion, making them a must-have for any active woman. Highly recommended!",83
Casey Carville,Perfect,https://www.amazon.com/gp/customer-reviews/R2YGNOACXPOI28/ref=cm_cr_arp_d_rvw_ttl?ie=UTF8&ASIN=B07ZP7L2X9,"5.0 "," the United States "," December 29, 2024",Size: LargeColor: Black,Verified Purchase,"I’ve been looking for a pair of flattering joggers since I’m kind of tired of the leggings look. I was originally looking for some with jersey material when I came across these. I would describe them as a cross between joggers and leggings and they are fantastic! The material is similar to leggings - stretchy and silky. Like the kind of material dog/cat hair doesn’t stick to (this is super important to me because we have four dogs and three cats). They have slight compression through the lower belly which is great since I’ve had 2 kids. They are PERFECT for going to kids sport events or the gym. They feel super durable, not see through at all despite the leggings-like fabric, and perfect weight material for any season (at least in Texas). For fit reference, I’m about 10 pounds heavier than I usually am right now and I’m fairly bottom-heavy. Right now, I wear medium in leggings, 10-12 in jeans, and medium T-shirts. Since these are joggers, I wanted a looser fit so I got a Large… as you can see by the pics they are NOT loose. I would definitely say they are more snug than expected but I actually love them. I rarely go by the size charts since my measurements always put me in between sizes, but in this case, I think the size chart would probably have been pretty accurate and with my current weight & measurements, and XL would have given me the fit I thought I was looking for. But once I lose this extra 10-15 pounds from the holidays they’ll be perfect. I’m 5’5”, 180 pounds. Measurements are bust: 40” (36 DD), waist 33”, hips 45”.",44
M.H.,Very comfortable,https://www.amazon.com/gp/customer-reviews/R4VYRDGLWS5GB/ref=cm_cr_arp_d_rvw_ttl?ie=UTF8&ASIN=B07ZP7L2X9,"4.0 "," the United States "," November 12, 2024",Size: X-LargeColor: Black,Verified Purchase,"Very comfortable. Slick nylon feel yoga pant material (as opposed to Terry, jersey or cotton). Its 80% polyamide, 20% spandex. Has some stretch. Soft comfort feel.  Love pockets, and wide band at waist.  I'm 5'1"" and they are slightly long, but tapered ankle holds that extra 1/2-1"" length. Loose fit around thigh & shin. I think they'll be nice for workout yoga, lounging, or possibly ""loungy"" airplane trips.",20
Danielle Humphrey,I didn’t believe the hype… now I get it,https://www.amazon.com/gp/customer-reviews/R202DS9FZ1YR3I/ref=cm_cr_arp_d_rvw_ttl?ie=UTF8&ASIN=B07ZP7L2X9,"5.0 "," the United States "," December 6, 2024",Size: LargeColor: Blue,Verified Purchase,"I have heard and seen these talked about in a few places.  Normally I don’t believe the hype around fast fashion. I am on the hunt for some good athletic wear that can be dual purpose. These surprised me! They are comfy, stylish, and great material! There is a funky odor to them out of the package. I am sure it will wash out. They are true to size. Material is plushy and stretchy. They will be great for winter and early spring.",22
gydget,Wonderful,https://www.amazon.com/gp/customer-reviews/R3HG9OOKQNGD9Q/ref=cm_cr_arp_d_rvw_ttl?ie=UTF8&ASIN=B07ZP7L2X9,"5.0 "," the United States "," January 18, 2025",Size: LargeColor: Blue,Verified Purchase,"These are absolutely the best! I bought one pair and as soon as I put them one bought a second pair. The fit was perfect, they look and feel great.",
Jetset Femme,"Great for price point, didn’t fit my body type",https://www.amazon.com/gp/customer-reviews/R3RUM8F9SVUFX7/ref=cm_cr_arp_d_rvw_ttl?ie=UTF8&ASIN=B07ZP7L2X9,"5.0 "," the United States "," December 2, 2024",Size: SmallColor: Black,Verified Purchase,"My body type: 5’4, slim legs/arms, straight waist/hips, round butt/chest. 128 lbs. Gain weight in waist first. Ordered size S. I look like a rectangle from the front and a curvy S from the side.  Pros: great for price point, light weight material, wide waist band (comfy) and has pockets  Cons: a bit short for me (I have longer legs for my height), too big in lower stomach/hips and under butt. I bought a S and should have ordered a XS.  These would probably be good for a lean, straight build (the fabric would hang nicely) or curvy build (could nicely fill out the cut). My bigger butt (but no hips) to smaller legs body shape made the fabric buckle in a weird way on my build.",27
DaisyMae1954,Awesome buy!,https://www.amazon.com/gp/customer-reviews/R3LJ37MHOT45QF/ref=cm_cr_arp_d_rvw_ttl?ie=UTF8&ASIN=B07ZP7L2X9,"5.0 "," the United States "," December 28, 2024",Size: MediumColor: Black,Verified Purchase,"So glad I bought these! They’re so comfortable! They fit perfectly and I’m sort of awkwardly between sizes a bit and I’m very happy with the fit. They are thick enough to not see through but not too thick whereas it’s uncomfortable for any ND folks who have any sensory issues. Pockets are great; I can fit my phone and whatnot without worrying I may lose it. These can be worn to the gym or even business casual! I work in a healthcare setting and I can look nice and prepared for whatever the day throws my way, Love love love!",7
Opinionated,Hand wash?,https://www.amazon.com/gp/customer-reviews/ROGDDTAE6YZM6/ref=cm_cr_arp_d_rvw_ttl?ie=UTF8&ASIN=B07ZP7L2X9,"4.0 "," the United States "," January 7, 2025",Size: MediumColor: Black,Verified Purchase,"I was busy and gave in to an Alexa recommendation without reviewing. The AI did a good job of recommending some thin I would like at a reasonable price. I received them in a day. The fit is perfect, they feel good and are well made. They have no Care tag, so I had to go online to find it. Hand Wash Only. Really? For athletic clothes? I definitely won’t be doing that! I’ll post later how a machine wash comes out.",4
Jennifer,GOAT!!!,https://www.amazon.com/gp/customer-reviews/R1UZ3VIKK59ZF6/ref=cm_cr_arp_d_rvw_ttl?ie=UTF8&ASIN=B07ZP7L2X9,"5.0 "," the United States "," January 17, 2025",Size: X-LargeColor: Vintage Purple,Verified Purchase,Greatest Of All Time!!! Add to your cart! These are my favorite joggers I have ever owned. Tight enough to stay up but not too tight to irritate. The fabric is nice and soft and for those of us that sweat easily it’s not fleece lined or anything which I prefer. Plus the pockets are nice and deep for hands or your phone. The panty line is also very minimal. I’m ordering more!,
Kailey,Pretty good!,https://www.amazon.com/gp/customer-reviews/R3IJPU2N907UN/ref=cm_cr_arp_d_rvw_ttl?ie=UTF8&ASIN=B07ZP7L2X9,"4.0 "," the United States "," January 10, 2025",Size: SmallColor: Black,Verified Purchase,If you’re someone in between sizes I would definitely size down. I should have known better based on reviews and i’ll be exchanging them for a smaller size. I’m 5’7 and weigh 115 and got a small but extra small would be a lot better. You can dress these up or down and they’re very comfortable with a great material!,
John A Fredd,So comfortable!,https://www.amazon.com/gp/customer-reviews/R20TATOR9O5IWT/ref=cm_cr_getr_d_rvw_ttl?ie=UTF8&ASIN=B07ZP7L2X9,"5.0 "," the United States "," January 11, 2025",Size: MediumColor: Blue,Verified Purchase,"Leggings are my daily wardrobe because they are just so relaxed and comfortable. I decided to give these joggers a try to have a different look and something a little looser. The color is as expected (navy) The size is a perfect fit. I bought the medium - I am 5""4 and 134 lbs. They are so comfortable and soft. I will definitely keep these on the favorites list to purchase more colors.",
Sally H,Women’s Joggers,https://www.amazon.com/gp/customer-reviews/R2HB8T9GLSUOZL/ref=cm_cr_getr_d_rvw_ttl?ie=UTF8&ASIN=B07ZP7L2X9,"4.0 "," the United States "," January 14, 2025",Size: MediumColor: Dark Blue Green,Verified Purchase,I love these! They are made with quality materials. They have pockets and are very flattering on. I also liked the ribbed ankles on pant leg. I’m 5’1” tall and 125 lbs. I wear a medium. True to size.,
Taylor Behringer,Great material,https://www.amazon.com/gp/customer-reviews/R56F7TMAMP7XR/ref=cm_cr_getr_d_rvw_ttl?ie=UTF8&ASIN=B07ZP7L2X9,"4.0 "," the United States "," December 30, 2024",Size: MediumColor: Dark Grey,Verified Purchase,"These were exactly what I was expecting. Great length, soft stretchy material. The waist sits above the hips but below the belly button. The color is beautiful. Only reason I’m giving 4 stars instead of 5 is they were just slightly snug in the thigh and booty area but I am pretty in between sizes. Maybe they would’ve worked perfect if I ordered a large.",
sowens,nice selection/great fit,https://www.amazon.com/gp/customer-reviews/RMWWT79SMPHS2/ref=cm_cr_getr_d_rvw_ttl?ie=UTF8&ASIN=B07ZP7L2X9,"5.0 "," the United States "," January 8, 2025",Size: SmallColor: Black,Verified Purchase,"Love these joggers!! I’ve bought almost every color. They fit nicely, aren’t too tight in the waist or hips. I’m curvy right now and they allow for those curves. They’re slightly longer than my legs but I bought the large petite. They do tend to stretch out a little in the waist and slide down, especially if I have my phone and credit card case in my pockets but it’s not bothersome.",
Amazon Customer,So flipping soft but I should’ve sized down,https://www.amazon.com/gp/customer-reviews/RPQFJLVRZ3L6U/ref=cm_cr_getr_d_rvw_ttl?ie=UTF8&ASIN=B07ZP7L2X9,"4.0 "," the United States "," December 26, 2024",Size: X-LargeColor: Light Purple,Verified Purchase,"I went with the suggested size by Amazon and they are baggy in all the wrong places. Since I’m using them for their intended purpose (walking around the neighborhood) idc too much but if you want these for both exercise then public use, I’d suggest sizing down. I’m 5’ 8”/5’ 9” and 185ish with pear/hourglass shape. These somehow made my butt disappear 🤣 again, super flipping soft though!! I don’t not recommend.",7
jewelrygal,Comfortable Stylish Pants,https://www.amazon.com/gp/customer-reviews/R3JARMHS6309ZT/ref=cm_cr_getr_d_rvw_ttl?ie=UTF8&ASIN=B07ZP7L2X9,"5.0 "," the United States "," January 6, 2025",Size: SmallColor: Blue,Verified Purchase,I love love these pants!  They are so soft & comfortable & cool in hot weather.  They are stylish & can be dressed up or down as needed & can be worn with so many different tops & jackets or toppers!  I purchased the hemmed style not the elastic jogger style since I like that better:). I plan to purchase more in other colors (I purchased black.),
momof4,Be aware the gray is a purple tone,https://www.amazon.com/gp/customer-reviews/R2L6GELBLAFVQ2/ref=cm_cr_getr_d_rvw_ttl?ie=UTF8&ASIN=B07ZP7L2X9,"4.0 "," the United States "," December 29, 2024",Size: LargeColor: Dark Grey,Verified Purchase,I would have read these five stars however the gray like seems to be the case nowadays is a purple grey- not grey grey. It’s a bummer. I keep looking for something that will match my gray sweatshirts but nothing seems to be out there. I am 140 pounds 5’7” I ordered a medium. They were a tad baggy.,
Wasey M Kheiri,Great product but didn’t fit right,https://www.amazon.com/gp/customer-reviews/R2V3LGSH05KQ74/ref=cm_cr_getr_d_rvw_ttl?ie=UTF8&ASIN=B07ZP7L2X9,"4.0 "," the United States "," January 18, 2025",Size: MediumColor: Dark Grey,Verified Purchase,The quality of the product is great. It didn’t fit well though.,
Olivia L,Exceeded expectations,https://www.amazon.com/gp/customer-reviews/R1AW2VPIWY8VTI/ref=cm_cr_getr_d_rvw_ttl?ie=UTF8&ASIN=B07ZP7L2X9,"5.0 "," the United States "," December 18, 2024",Size: XX-LargeColor: Black,Verified Purchase,"Umm.. these are Heavenly. I am a black leggings addict and that’s the only thing I’ve felt comfortable in postpartum since having two babies in 2 1/2 years. But these look and feel amazing!! They are honestly more comfortable than leggings. I will be ordering more. I’m 5’9, 220 lbs for reference with large hips and wear size 16 long jeans. I’m pleased with the length on these which is hard to come by. I would also think they’d be comfy if you’re pregnant. The waist is like leggings only not as tight, at least for me. Im a high waisted girl, these are not high waisted but sit above the hips just right and don’t cut into me. I love em! Just like the perfect casual pants, maybe a step or two up from sweats that you can wear around the house or running errands or to work out. Im a stay at home mom so they’re perfect for my lifestyle.",41
Leslie,Great joggers!,https://www.amazon.com/gp/customer-reviews/R1GZS3QFZ9FYUS/ref=cm_cr_getr_d_rvw_ttl?ie=UTF8&ASIN=B07ZP7L2X9,"5.0 "," the United States "," January 11, 2025",Size: SmallColor: Black,Verified Purchase,These joggers I think run a little big. I went down a size in them. They feel like a good pair of spandex leggings but fit like a jogger. It’s a great mix of the both. The material is a little thicker than leggings though.,
Dawn R Labertew,Nice but…,https://www.amazon.com/gp/customer-reviews/RFD99HA1APSNE/ref=cm_cr_getr_d_rvw_ttl?ie=UTF8&ASIN=B07ZP7L2X9,"4.0 "," the United States "," December 28, 2024",Size: MediumColor: Dark Grey,Verified Purchase,"I guess I need to read more closely to the description. They are real nice pants and fit well but, I wanted sweatpants. Thick ones. These are thin and not the nice fleece sweats. Keeping them because I can wear them to work.",
Ashley,GET THEM!,https://www.amazon.com/gp/customer-reviews/R1149ZFR0YM5ND/ref=cm_cr_getr_d_rvw_ttl?ie=UTF8&ASIN=B07ZP7L2X9,"5.0 "," the United States "," December 30, 2024",Size: MediumColor: Black,Verified Purchase,"For reference I am 5'6 and weigh approx. 170 and ordered a Med. I did not want them too loose or too tight and they are a perfect fit. They fit tighter around my ankle, slightly loose on my legs without looking baggy and fit perfect on my butt so it doesn't look flat or what I call grandma butt. Get them, get them, get them!!!! I will be ordering more!",2
whitneyh,Great joggers!,https://www.amazon.com/gp/customer-reviews/R1DJLK23F87MMS/ref=cm_cr_getr_d_rvw_ttl?ie=UTF8&ASIN=B07ZP7L2X9,"5.0 "," the United States "," January 3, 2025",Size: X-LargeColor: Black,Verified Purchase,"These are super comfortable and soft. They are not see through. I highly recommend. The sizing was correct for me. I have a bigger butt and hips with a small waist and they fit well. If you have a smaller butt, I could see them being a little baggy in that area.",
Susan Slifkin,Athletic lounge pants,https://www.amazon.com/gp/customer-reviews/R1EE5MPJV3I4SC/ref=cm_cr_getr_d_rvw_ttl?ie=UTF8&ASIN=B07ZP7L2X9,"5.0 "," the United States "," January 16, 2025",Size: X-LargeColor: Blue,Verified Purchase,What I love most is how versatile these pants are. They transition from a workout to casual wear. The fit is perfect with plenty of stretch for maximum comfort,
Michelle,Thinner material but comfortable,https://www.amazon.com/gp/customer-reviews/R3VJZHH8F807P6/ref=cm_cr_getr_d_rvw_ttl?ie=UTF8&ASIN=B07ZP7L2X9,"4.0 "," the United States "," December 29, 2024",Size: LargeColor: Dark Grey,Verified Purchase,These are okay not my favorite I purchased the thick yoga pants from the same brand and absolutely loved them I had high hopes for these they are thinner and just not what I had hoped for,
Shelley P,Nice leggings,https://www.amazon.com/gp/customer-reviews/R1P7644VWOCTMP/ref=cm_cr_getr_d_rvw_ttl?ie=UTF8&ASIN=B07ZP7L2X9,"5.0 "," the United States "," January 9, 2025",Size: LargeColor: Blue,Verified Purchase,"Amazon recommended to size up. I am a 10 in regular pants so I ordered a large. Way too big  for me ! Unfortunately had to send back & order a medium, hoping these will fit",
TNGrammie,Fit and Fabric Feel,https://www.amazon.com/gp/customer-reviews/R2ZPGXZZBT71VD/ref=cm_cr_getr_d_rvw_ttl?ie=UTF8&ASIN=B07ZP7L2X9,"5.0 "," the United States "," January 5, 2025",Size: XX-LargeColor: Black,Verified Purchase,"Except for the fact that I'm lazy, and usually only hand wash my dress clothes, I love these pants.  They have an excellent fit,  pockets,  and great soft material thickness.  I also enjoy their warmth.  I have purchased a second pair because of the quality!",
Trudy Ella,Stretchy but wonderful fit.,https://www.amazon.com/gp/customer-reviews/R3PJS89QVSWI1K/ref=cm_cr_getr_d_rvw_ttl?ie=UTF8&ASIN=B07ZP7L2X9,"5.0 "," the United States "," January 11, 2025",Size: X-LargeColor: Black,Verified Purchase,"Love the fit and fabric.  So comfortable I will be ordering another pair.  Roomy but not baggy.  Did a yoga leg workout and was able to bend, do side kicks without any issues.",
scarlet,Comfy pants,https://www.amazon.com/gp/customer-reviews/R353ZZV78JRQVW/ref=cm_cr_getr_d_rvw_ttl?ie=UTF8&ASIN=B07ZP7L2X9,"5.0 "," the United States "," January 16, 2025",Size: X-SmallColor: Denim Blue,Verified Purchase,"These are my second pair of these comfy, well fitting, loose but not real baggy pants. You can exercise in them and wear for almost any reason. They are 20% spandex",
Karee F,Wow!,https://www.amazon.com/gp/customer-reviews/R3TBXOS75KYN1M/ref=cm_cr_getr_d_rvw_ttl?ie=UTF8&ASIN=B07ZP7L2X9,"5.0 "," the United States "," January 7, 2025",Size: LargeColor: Black,Verified Purchase,"These are so nice! Very comfortable!  The thickness is just right, the material is soft, the fit is good and they are very comfortable!  I got size large because I am over 5’8” and I am about 148-150 lbs. perfect fit!",
Cindy B.,The Gym People are the winners!,https://www.amazon.com/gp/customer-reviews/R2U1GM2JX6BUPF/ref=cm_cr_getr_d_rvw_ttl?ie=UTF8&ASIN=B07ZP7L2X9,"5.0 "," the United States "," January 9, 2025",Size: SmallColor: Black,Verified Purchase,"I love the joggers from The Gym People. In my opinion they are more comfortable than Baleaf joggers. Both are great, but for me it would be The Gym People first, and Baleaf would be second.",
Amazon Customer,OMG,https://www.amazon.com/gp/customer-reviews/R1GDZTW0SGIVM8/ref=cm_cr_getr_d_rvw_ttl?ie=UTF8&ASIN=B07ZP7L2X9,"5.0 "," the United States "," January 16, 2025",Size: XX-LargeColor: Black,Verified Purchase,I tried them on and was in love with them.  The material is fantastic and fits great.  I can see me living in them.,
G. Lee,"Nice, but loose",https://www.amazon.com/gp/customer-reviews/R3T6EHAD2DBU5A/ref=cm_cr_getr_d_rvw_ttl?ie=UTF8&ASIN=B07ZP7L2X9,"4.0 "," the United States "," December 15, 2024",Size: MediumColor: Dark Green,Verified Purchase,"Normally, I wear size medium pants and fits more snug. But, the joggers is loose. I'm about 5'1 and it is little too long for me it rides above my belly. Material is stretchy, and feels thick enough. I should've gone for size small but I'll hang onto them.",
Gail,LOVE These pants! please offer more colors in size XXL.,https://www.amazon.com/gp/customer-reviews/RBALF35DDA3GC/ref=cm_cr_getr_d_rvw_ttl?ie=UTF8&ASIN=B07ZP7L2X9,"5.0 "," the United States "," January 8, 2025",Size: XX-LargeColor: Black,Verified Purchase,"I adore these pants. They are very comfortable, flattering and I love the price! My only request is that you offer more colors in size XXL. I especially want some in bright Pink and the light grey blue.",
WowAmazon,Great pair of joggers!!,https://www.amazon.com/gp/customer-reviews/R1LRTQN54LA63C/ref=cm_cr_getr_d_rvw_ttl?ie=UTF8&ASIN=B07ZP7L2X9,"5.0 "," the United States "," January 17, 2025",Size: MediumColor: Black,Verified Purchase,"This pair of joggers is so comfortable, hem hits at the perfect spot. Love the pockets. Got black.. May get in other colors!",
Amazon Customer,Very soft and good quality,https://www.amazon.com/gp/customer-reviews/R1Q8Y0WTVRG65H/ref=cm_cr_getr_d_rvw_ttl?ie=UTF8&ASIN=B07ZP7L2X9,"4.0 "," the United States "," December 23, 2024",Size: SmallColor: Black,Verified Purchase,I was a little disappointed that these were a spandex material rather than a cotton material but they are comfy and cute so I will keep them.,
Precious McCoy,Running pants,https://www.amazon.com/gp/customer-reviews/R3VSAPGLGKCOGB/ref=cm_cr_getr_d_rvw_ttl?ie=UTF8&ASIN=B07ZP7L2X9,"5.0 "," the United States "," January 16, 2025",Size: XX-LargeColor: Dark Grey,Verified Purchase,Loved these pants.  They are comfortable and fit great. I bought 2 pair and went back and ordered another pair.,
Plamoui,Nice joggers,https://www.amazon.com/gp/customer-reviews/R8I0RLY57REL2/ref=cm_cr_getr_d_rvw_ttl?ie=UTF8&ASIN=B07ZP7L2X9,"4.0 "," the United States "," December 29, 2024",Size: MediumColor: Black,Verified Purchase,I like the versatility of wearing joggers instead of leggings all the time. Nice material. Make sure to size down.,
MsLing,Super Comfy and Slimming,https://www.amazon.com/gp/customer-reviews/R1Z32JLO4V3UQA/ref=cm_cr_getr_d_rvw_ttl?ie=UTF8&ASIN=B07ZP7L2X9,"5.0 "," the United States "," January 6, 2025",Size: LargeColor: Black,Verified Purchase,"I just love these joggers.  Very comfy and the material is soft.  I just ordered a second pair.  They are perfect for running errands, walking the dogs, hanging out at home.",
Jody W.,Great fit!,https://www.amazon.com/gp/customer-reviews/R2R88XEJJF7AQB/ref=cm_cr_getr_d_rvw_ttl?ie=UTF8&ASIN=B07ZP7L2X9,"5.0 "," the United States "," January 18, 2025",Size: X-LargeColor: Blue,Verified Purchase,"These are perfect! They are not skin tight,  just a little room to feel comfortable.  I highly recommend!",
beandip,Shouldn't have sized down,https://www.amazon.com/gp/customer-reviews/R1E39BDKFXOUKA/ref=cm_cr_getr_d_rvw_ttl?ie=UTF8&ASIN=B07ZP7L2X9,"5.0 "," the United States "," December 29, 2024",Size: LargeColor: Dark Grey,Verified Purchase,"I love these. Super soft & comfy. However, I sized down based on other reviews and got a large, but I should've gotten an xl instead. They just barely fit so I'm keeping them, but they're a little tight in the stomach. The legs have plenty of room though.",
Beth A. Siress,Cute,https://www.amazon.com/gp/customer-reviews/ROEC237ML8D05/ref=cm_cr_getr_d_rvw_ttl?ie=UTF8&ASIN=B07ZP7L2X9,"5.0 "," the United States "," January 4, 2025",Size: LargeColor: Blackgrey Camo,Verified Purchase,"I got these for the gym,  but you can wear them all day. I put them on in the morning and run all my errands. They are very comfortable when I'm working out, nice stretch to them.",
Disappointed,So comfortable and the color is great!,https://www.amazon.com/gp/customer-reviews/R2F4GOONR5KJ6W/ref=cm_cr_getr_d_rvw_ttl?ie=UTF8&ASIN=B07ZP7L2X9,"5.0 "," the United States "," January 19, 2025",Size: LargeColor: Green Blue,Verified Purchase,These leggings are very comfortable-they are silky feeling and the color is so different-nice change from the basic black.,
Kam,You will NOT regret purchasing,https://www.amazon.com/gp/customer-reviews/R39A2WIBMMWICP/ref=cm_cr_getr_d_rvw_ttl?ie=UTF8&ASIN=B07ZP7L2X9,"5.0 "," the United States "," December 9, 2024",Size: SmallColor: Black,Verified Purchase,"I bought these with low expectations because I've already returned two similar products. I'm 5’ 7” and weigh 125-130 lbs. I am blown away by the fit and feel of these joggers. They are pretty thin, so I was a bit concerned about wearing them today with the low temperature and rain, but I was plenty warm. I've put some other colors on my Giftster list for the holidays with family. If you've made it this far and are on the fence, DO IT. Plus, if you hate them, send’em back; win, win.",
