Erin Hales,Own in two colors now!,https://www.amazon.com/gp/customer-reviews/R3Q3XMODICVB08/ref=cm_cr_getr_d_rvw_ttl?ie=UTF8&ASIN=B0CZDX67YD,"5.0 "," the United States "," September 27, 2023",Team Name: ClassicSize: SmallColor: Olive Green,Verified Purchase,"I’ve had this for a while in blue and it’s so comfortable and has held up so well that I bought it in green last week. So easy to throw on for around the house or paired with a flannel or denim jacket for running errands. I could see how it would work well for sports, I’ve just never used it for that 😅 Overall I highly recommend!",
Erika,Little shorter than expected,https://www.amazon.com/gp/customer-reviews/R34ESN2HFBP0DC/ref=cm_cr_getr_d_rvw_ttl?ie=UTF8&ASIN=B0CZDX67YD,"4.0 "," the United States "," February 9, 2023",Team Name: ClassicSize: SmallColor: Black,Verified Purchase,"Great stretch, good quality dress. It fit well, but will return because it was shorter than I expected. The dress covers the built in shorts, but barely. And the shorts end at the bottom of your butt cheeks. So the dress is only a couple inches past that point. I also ordered Old Navy’s Powersoft dress with built in shorts and bra. That one hit more mid thigh for me, and I prefer that length.",9
The jack family,Love it !,https://www.amazon.com/gp/customer-reviews/RNRP9JUDXAVUM/ref=cm_cr_getr_d_rvw_ttl?ie=UTF8&ASIN=B0CZDX67YD,"5.0 "," the United States "," June 5, 2023",Team Name: ClassicSize: MediumColor: Black,Verified Purchase,"I just had a baby and still have a belly that makes me look pregnant so I was looking for something to wear that was cute , great for summer and helped hide my belly . Well this dress is it!! I had a XL in the past and wearing it threw out my pregnancy I ended up stretching it out bad . So I went and bought a medium in hopes I would eventually fit into it. But to my surprise I fit in it and it makes me feel amazing .",11
Annie Xiong,So comfy and cute for everyday!,https://www.amazon.com/gp/customer-reviews/R1LM71RSQJY3LV/ref=cm_cr_getr_d_rvw_ttl?ie=UTF8&ASIN=B0CZDX67YD,"5.0 "," the United States "," June 16, 2023",Team Name: ClassicSize: MediumColor: Black,Verified Purchase,"This was so cute and great material! I love the pockets and the fact that it has built in shorts, so theres no lines showing under the dress. I would wear underwear that doesn't show seams to keep it that way. The fact that it's like a romper underneath the dress is nice because it keeps your tummy tucked in. It has padding in the breast area so no bra is needed. I am 5'2 weighing 169-170 pounds and i fit a medium perfectly!",4
Sarah B.,Obsessed!,https://www.amazon.com/gp/customer-reviews/R2GLG54RIFM9FL/ref=cm_cr_getr_d_rvw_ttl?ie=UTF8&ASIN=B0CZDX67YD,"5.0 "," the United States "," March 11, 2024",Team Name: ClassicSize: X-SmallColor: Black,Verified Purchase,I purchased this for an upcoming trip to Disney.  I will be wearing this all spring and summer.  It is so comfortable and flattering.  I wish it came in more colors!,
Tiff,Magic,https://www.amazon.com/gp/customer-reviews/RMNB3VTR74TUF/ref=cm_cr_getr_d_rvw_ttl?ie=UTF8&ASIN=B0CZDX67YD,"5.0 "," the United States "," April 15, 2024",Team Name: ClassicSize: MediumColor: Black,Verified Purchase,It does everything I wanted and more. Comfy and sexy. Very pleased with my purchase!,
Jessica Steadman Jelinek,Halara knock off,https://www.amazon.com/gp/customer-reviews/R306XELX901JJJ/ref=cm_cr_getr_d_rvw_ttl?ie=UTF8&ASIN=B0CZDX67YD,"5.0 "," the United States "," June 7, 2024",Team Name: ClassicSize: MediumColor: Sea Blue,Verified Purchase,So easy to put on and fits well,
Amazon Customer,So comfortable and flattering!,https://www.amazon.com/gp/customer-reviews/R3MRAZKY36Y10F/ref=cm_cr_getr_d_rvw_ttl?ie=UTF8&ASIN=B0CZDX67YD,"5.0 "," the United States "," June 29, 2023",Team Name: ClassicSize: X-LargeColor: Black,Verified Purchase,"This is honestly my first review after being a long time and very frequent prime consumer. I love this dress… the pockets are always a plus. The fit is awesome. I am 5’9 and about 200 lbs with a curvy/thick  figure. Got an XL and it is very comfortable without being too tight or loose, just right.  Wanting to buy more in other colors but would love for the maker to add a back cutout feature (below the skirt where the shorts meet) for easy potty usage.",5
Hlb2n8,The ultimate exercise/errand dress,https://www.amazon.com/gp/customer-reviews/R2UYBV2BFVRIVY/ref=cm_cr_getr_d_rvw_ttl?ie=UTF8&ASIN=B0CZDX67YD,"5.0 "," the United States "," October 22, 2023",Team Name: ClassicSize: MediumColor: Black,Verified Purchase,I bought this dress to play “tennis” in it. I swear I wore it all summer. I work out in it. I wear it to the grocery store. I even wore it while 9 months pregnant because it had such a stretchy material. It fits like a glove and the top layer hides my belly. I have it in two colors! It feels light weight. 135 lbs and I wear a medium.,
Laura Victoria,ehhhh,https://www.amazon.com/gp/customer-reviews/R264KQE582YKUL/ref=cm_cr_getr_d_rvw_ttl?ie=UTF8&ASIN=B0CZDX67YD,"3.0 "," the United States "," May 16, 2024",Team Name: ClassicSize: XX-LargeColor: Black,Verified Purchase,"Good quality, but if you have a bigger chest. This ain't for you.",
Leah J.,Cute and comfortable,https://www.amazon.com/gp/customer-reviews/R6TQZ7AS14O8W/ref=cm_cr_getr_d_rvw_ttl?ie=UTF8&ASIN=B0CZDX67YD,"5.0 "," the United States "," March 14, 2024",Team Name: ClassicSize: SmallColor: Black,Verified Purchase,Bought this months ago and still love it! Great material that has not pilled since purchasing. So cute and versatile. Easy to throw on for an easy outfit! Would purchase again.,
