Sondra,"Super cute, fits great",https://www.amazon.com/gp/customer-reviews/R1YVWERCJ68U3D/ref=cm_cr_getr_d_rvw_ttl?ie=UTF8&ASIN=B0CZDX67YD,"5.0 "," the United States "," July 19, 2024",Team Name: ClassicSize: MediumColor: Black,Verified Purchase,"Super cute, huge fan of the IUGA products, this fits great and is extremely comfortable -- will be buying in diff colors",
Robin E.,Great for hot days chasing toddlers,https://www.amazon.com/gp/customer-reviews/R1CK673GEHGSVT/ref=cm_cr_getr_d_rvw_ttl?ie=UTF8&ASIN=B0CZDX67YD,"5.0 "," the United States "," May 21, 2024",Team Name: ClassicSize: X-LargeColor: Black,Verified Purchase,I can get sweaty in this and still feel comfortable it has the shorts so I can bend over and grab my kid without feeling scared I’m flashing someone. Super comfy and flattering I want every color. Wears with tennis shoes or sandals I love them,
SD Customer2010,Quality,https://www.amazon.com/gp/customer-reviews/R2TW45OF7GMX1F/ref=cm_cr_getr_d_rvw_ttl?ie=UTF8&ASIN=B0CZDX67YD,"5.0 "," the United States "," July 18, 2024",Team Name: ClassicSize: MediumColor: Black,Verified Purchase,Very nice and comfy. Not tight or lose I ordered medium. I'm 124 lbs fits perfect  Thank you Amazon,
Jessica,10/10. Seriously loveeeee,https://www.amazon.com/gp/customer-reviews/RYTY38XPDGB4S/ref=cm_cr_getr_d_rvw_ttl?ie=UTF8&ASIN=B0CZDX67YD,"5.0 "," the United States "," July 4, 2024",Team Name: ClassicSize: X-LargeColor: Black,Verified Purchase,I bought this active dress for a beach vacation and it was perfect! It fit pretty true to size. I'm usually a 16/18 and got the XL!!!,5
Kelsey K.,Better than imagined,https://www.amazon.com/gp/customer-reviews/R2W2JZZ2QYCPAI/ref=cm_cr_getr_d_rvw_ttl?ie=UTF8&ASIN=B0CZDX67YD,"5.0 "," the United States "," July 3, 2024",Team Name: ClassicSize: X-LargeColor: Black,Verified Purchase,"This dress is hands down the BEST fitting dress I've purchased. I'm a size 12/14, apron belly, saggy boobs and this SLAPPED.",2
JB,Just buy it!,https://www.amazon.com/gp/customer-reviews/RLWJL84FNY4I7/ref=cm_cr_getr_d_rvw_ttl?ie=UTF8&ASIN=B0CZDX67YD,"5.0 "," the United States "," March 7, 2023",Team Name: ClassicSize: X-LargeColor: Sea Blue,Verified Purchase,"READ THE REVIEWS FOR SIZING! According to the size chart, I would have been an XXL. But I listened to the reviews and looked at the pics of people wearing the dress. I got an XL and it fits perfectly! I'm 200lbs., 5'7"", and postpartum by 4months with my second kid via c-section- so you know what belly and boob situation we are working with. The boob area wasn't the most supportive, but I wore a cotton maternity sports bra underneath and it worked well for support. LOVE the pockets. I could bring my phone and credit card without bringing a purse (which is great because I'm just carrying baby things in a backpack). I haven't washed it yet, but I'm sure the boob inserts will fall out and get creased. But I'd definitely buy more in other colors.",
Kindle Customer,Too expensive,https://www.amazon.com/gp/customer-reviews/RET69G5VUET6V/ref=cm_cr_getr_d_rvw_ttl?ie=UTF8&ASIN=B0CZDX67YD,"4.0 "," the United States "," July 17, 2022",,Verified Purchase,"The fit on the chest was a little weird for me. I ordered a large and I'm a 34D and it feels like the cups (which I later removed) couldn't support me correctly. It sort of creates this single block of narrow chest like I'm a Nintendo 64 polygon. I ended up wearing a sports bra underneath and it looks a bit better, especially after shortening the straps to be less revealing. I like the length too (5'3"") but I wish it did a little more to make my waist smaller. There was also potential for some flattering compression on the tummy area, but it really doesn't do much at all. Overall, pretty cute dress! I think it's worth maybe half as much as I paid, but it's still cute.",7
Cecille,Super cute and flattering!,https://www.amazon.com/gp/customer-reviews/R1CP1YTBE0M16B/ref=cm_cr_getr_d_rvw_ttl?ie=UTF8&ASIN=B0CZDX67YD,"5.0 "," the United States "," September 10, 2023",Team Name: ClassicSize: SmallColor: Black,Verified Purchase,"I was looking for the perfect tennis/athletic dress and have finally found it. I am 5'2 and got a size small. The fit and length is perfect. I love the built in bra and shorts, it feels super secure and the fit is very flattering. It sucks you in just a bit at the waist and doesn't have too much of a flare (which I prefer). It's not too loose but not too tight (aka perfect). The straps are also adjustable which is a huge plus. If you're looking for a super comfy dress that can be dressed up or down, this is the one. I'm definitely getting this in more colors!!",
Evelyn,Bathroom review.,https://www.amazon.com/gp/customer-reviews/R13PHY27T1N55/ref=cm_cr_getr_d_rvw_ttl?ie=UTF8&ASIN=B0CZDX67YD,"3.0 "," the United States "," July 18, 2024",Team Name: ClassicSize: LargeColor: White,Verified Purchase,"I love the Quality of the fabric and everything, but to use the bathroom you got to take all the whole dress off.",
MM_OK,Curvy Girl Friendly,https://www.amazon.com/gp/customer-reviews/R1KD02AB2QNIN2/ref=cm_cr_getr_d_rvw_ttl?ie=UTF8&ASIN=B0CZDX67YD,"5.0 "," the United States "," July 30, 2024",Team Name: ClassicSize: LargeColor: Black,Verified Purchase,Super cute! Flattering style and practical design.,
Micayla Bean,Love this brand,https://www.amazon.com/gp/customer-reviews/R14FCR5EVUFZKX/ref=cm_cr_getr_d_rvw_ttl?ie=UTF8&ASIN=B0CZDX67YD,"5.0 "," the United States "," September 13, 2023",Team Name: ClassicSize: XX-LargeColor: Black,Verified Purchase,"IUGA is such a good brand. The fabric and seam quality is always high. The size charts are accurate.  I have so many pairs of their yoga shorts that I use for running. They have been worn and washed over and over and there is no pilling, the seams maintain their integrity, and they are just as stretchy as the day I got them. This dress is the exact same.  I also have a halara dress and this one fits me better. The fabric is maybe not as butter smooth and the more expensive brands, but I still find it super comfortable and I wear this one more than my halara.",3
Kyle Loudan,"So cute and comfy, yet casual!",https://www.amazon.com/gp/customer-reviews/R2K0QHYY65HBNQ/ref=cm_cr_getr_d_rvw_ttl?ie=UTF8&ASIN=B0CZDX67YD,"5.0 "," the United States "," March 13, 2024",Team Name: ClassicSize: MediumColor: Black,Verified Purchase,"This dress is amazing! The material was great, stretchy but had good compression which made it very flattering. I was looking for something cute and light weight to wear in Puerto Rico since we were planning to do a lot of walking in the heat. This dress did not disappoint and I will probably buy other colors!",3
Allison fernandez,Love this dress!,https://www.amazon.com/gp/customer-reviews/RE9EV9EITP4H1/ref=cm_cr_getr_d_rvw_ttl?ie=UTF8&ASIN=B0CZDX67YD,"5.0 "," the United States "," June 7, 2024",Team Name: ClassicSize: SmallColor: Black,Verified Purchase,"Cinches in all the right places.  Very versatile, You can dress it up or down! Quality thick stretchy material! I want one in every color!",
D-Mon,"No fuss, easy wearing",https://www.amazon.com/gp/customer-reviews/R1ATG6C3W6U0Y7/ref=cm_cr_getr_d_rvw_ttl?ie=UTF8&ASIN=B0CZDX67YD,"5.0 "," the United States "," May 20, 2024",Team Name: ClassicSize: LargeColor: Black,Verified Purchase,"Loved this dress, true to size. I ordered the black one and wore to a beach vacation. Looked so cute on while hiding the extra weight I carry in my midsection.",
Kevin & Ida,Great dress but built in bra didn’t fit …,https://www.amazon.com/gp/customer-reviews/R1W7U8H9N8PP6I/ref=cm_cr_getr_d_rvw_ttl?ie=UTF8&ASIN=B0CZDX67YD,"4.0 "," the United States "," July 11, 2023",Team Name: ClassicSize: LargeColor: Black,Verified Purchase,"I absolutely loved this dress but the built in bra was not long enough ( I’m a C cup) & was not comfortable at all around my chest area, so unfortunately I had to return - if I went up a size, the dress would be loose on me & I’m not going for that look. Also, it has built in shape-wear so you feel held in which was great. Just wish the built in bra was a little longer.",3
Laurel,So cute & comfortable,https://www.amazon.com/gp/customer-reviews/R1E4QJD9CVEVZP/ref=cm_cr_getr_d_rvw_ttl?ie=UTF8&ASIN=B0CZDX67YD,"5.0 "," the United States "," May 27, 2024",Team Name: ClassicSize: LargeColor: Black,Verified Purchase,"So cute, SO comfy. Only problem is that it looks like I’m trying to flash everyone when I get my phone out of my pocket. Love the fit, great length.",
Ashley Gordon,comfortable,https://www.amazon.com/gp/customer-reviews/R37A2GUM0ORIMD/ref=cm_cr_getr_d_rvw_ttl?ie=UTF8&ASIN=B0CZDX67YD,"5.0 "," the United States "," July 8, 2024",Team Name: ClassicSize: LargeColor: Black,Verified Purchase,Perfect for an amusement park! Love the built in bra!,
Monica Paige,Perfect for tall women,https://www.amazon.com/gp/customer-reviews/R33G34P7OKQ0SC/ref=cm_cr_getr_d_rvw_ttl?ie=UTF8&ASIN=B0CZDX67YD,"5.0 "," the United States "," May 24, 2024",Team Name: ClassicSize: MediumColor: Black,Verified Purchase,"5’8 long legs, this dress size medium is perfect. Very cute cut and even with a larger chest 34D the girls are in place. Very comfy will order more colors.",
Amazon Customer,Better then A&F traveler dress,https://www.amazon.com/gp/customer-reviews/R67RGLJEMZZ4Q/ref=cm_cr_getr_d_rvw_ttl?ie=UTF8&ASIN=B0CZDX67YD,"5.0 "," the United States "," June 30, 2022",Team Name: ClassicSize: MediumColor: Black,Verified Purchase,"I wanted to try this dress because I wanted a traveler dress in black but did not really care for the fabric or shortness of the A&F traveler. I bought theirs in the blue Medium Tall and it was still very short (I am only 5'7). This dupe had good reviews and was 1/2 the price so i wanted to try it out. I was expecting this dress to be similar in length to A&F so I considered sizing up to Large for length. I am glad I didn't. This dress was perfect with plenty of room. I got a medium (chest 32DD, waist 28, hips 38.5. I have an athletic build, normally wear a 6 US). I definitely recommend this dress instead of the traveler, especially for the price. I actually prefer this fabric, it is very soft. I am going to live in this dress this summer and will probably order more.",2
Isla Hughes,Love it!,https://www.amazon.com/gp/customer-reviews/R34X7PFD6IDS89/ref=cm_cr_getr_d_rvw_ttl?ie=UTF8&ASIN=B0CZDX67YD,"5.0 "," the United States "," July 21, 2024",Team Name: ClassicSize: MediumColor: Black,Verified Purchase,Love it! Perfect fit for everyday!,
Liz,LOVE. And long enough for tall women,https://www.amazon.com/gp/customer-reviews/RJLCA49QJVO7F/ref=cm_cr_getr_d_rvw_ttl?ie=UTF8&ASIN=B0CZDX67YD,"5.0 "," the United States "," May 19, 2024",Team Name: ClassicSize: X-LargeColor: Sea Blue,Verified Purchase,I have bought this in 4 colors. I LOVE it. Favorite fitness dress by far and can dress up. Long enough for tall girls (I am 5’10 and curvy),
Crystal L,Obsessed!,https://www.amazon.com/gp/customer-reviews/R2M9ZHWYBP7OK6/ref=cm_cr_getr_d_rvw_ttl?ie=UTF8&ASIN=B0CZDX67YD,"5.0 "," the United States "," April 11, 2024",Team Name: ClassicSize: SmallColor: Black,Verified Purchase,"Amazing quality, it’s true to size, and is perfect for summer! I really love this dress and it has adjustable straps and built in padding with is great because you don’t have to wear a bra! It’s perfect for nursing too!",
Navy Berlin,Fits great and super comfortable,https://www.amazon.com/gp/customer-reviews/RYX6L9JKDLA3C/ref=cm_cr_getr_d_rvw_ttl?ie=UTF8&ASIN=B0CZDX67YD,"5.0 "," the United States "," May 14, 2024",Team Name: ClassicSize: SmallColor: Black,Verified Purchase,I love this athletic dress so much I bought a second one. I love that there is a spot to put your phone in the leg pocket. It’s comfy and cute!,2
Mary Perry,Exactly what I wanted,https://www.amazon.com/gp/customer-reviews/R1I7BNYUH3LXBC/ref=cm_cr_getr_d_rvw_ttl?ie=UTF8&ASIN=B0CZDX67YD,"5.0 "," the United States "," June 23, 2024",Team Name: ClassicSize: MediumColor: Black,Verified Purchase,I am 5’2” and 135lb and the medium is perfect. It is exactly what I wanted,
Blair Singleton,Perfect tennis dress,https://www.amazon.com/gp/customer-reviews/RS17GVPXMQVL3/ref=cm_cr_getr_d_rvw_ttl?ie=UTF8&ASIN=B0CZDX67YD,"5.0 "," the United States "," July 26, 2023",Team Name: ClassicSize: MediumColor: Black,Verified Purchase,"This is exactly what I was looking for! I have combed the internet and tried on several, and this is it. I'm 5""0 150lbs and DDD cup. I purchased a Medium. The adjustable straps make the built in bra work perfectly. Being short, I have struggled to find a tennis dress that isn't too long, and this one still hits 6 inches above the top of my knee. The shorts are fantastic!! They are fitted, but not so tight that you can't pull them aside to pee (if you don't want to take your whole dress off in public after sweating). Just buy it. I'm getting more colors!",3
Blair,Exactly What I've Been Looking For,https://www.amazon.com/gp/customer-reviews/REQKNEG9ED1VV/ref=cm_cr_getr_d_rvw_ttl?ie=UTF8&ASIN=B0CZDX67YD,"5.0 "," the United States "," August 2, 2023",Team Name: ClassicSize: X-SmallColor: Olive Green,Verified Purchase,"I've been searching high and low for a tennis dress that I liked in terms of style, length, quality, and color. I came across this on amazon prime day and took advantage of the deal, and I wish I bought more than one in a different color! It is the perfect length for me, the fabric is very comfortable, I'm a 32D and the top still fits perfectly, and the color looks exactly like the picture! Absolutely love the pockets in the shorts. If you have been stuck searching high and low like me, this is the dress to get. I'm serious. It is worth every penny.",
aafroms,The best dress ever!,https://www.amazon.com/gp/customer-reviews/R34RR6QWNM3MMY/ref=cm_cr_getr_d_rvw_ttl?ie=UTF8&ASIN=B0CZDX67YD,"5.0 "," the United States "," August 19, 2022",Team Name: ClassicSize: MediumColor: Olive Green,Verified Purchase,"I LOVE this fitness dress. I bought it to compare to the Z by Zella motion tank dress and it’s far superior. I’ve now purchased 3 more! I love having two pockets instead of one and the adjustable straps make a big difference. This style comes with light padding/cups for moderate support which is fine for me because I’m not as blessed in that department. The stretch in the shorts is perfect for back where I am more than blessed. The skirt length and cut is very flattering. It falls in a way that doesn’t hide my curves but it still helps conceal any bloating I may have. I am basically living in these dresses. I’ve worn it for exercise, errands, lounging at home, happy hour and I bought the lime colored one for the vacation I’m taking next week.",
tucker,Love it!,https://www.amazon.com/gp/customer-reviews/R2J9J8W55B0AKU/ref=cm_cr_getr_d_rvw_ttl?ie=UTF8&ASIN=B0CZDX67YD,"5.0 "," the United States "," June 11, 2022",Team Name: ClassicSize: X-LargeColor: Black,Verified Purchase,"Dress it up, dress it down, perfect for all things summer! It’s so comfortable and so flattering. A little bit of a pain when you need to pee, but worth the hassle. I’m short so it’s a bit longer on me than I was hoping, but not so much as to be frumpy. I might have been able to get away with the next size down, but I don’t like things to squish out, so went with the size my measurements suggested. I will definitely be ordering in other colors and will probably try a large in my next one for comparison. The material is thick and the quality is great. Adjustable straps for just the right fit up top. I’m a runner and although I don’t think I would wear this to run, I can definitely see some lighter exercise being just fine in this dress. Very pleased with this purchase!!",2
Laura B,Super comfy athleisure!,https://www.amazon.com/gp/customer-reviews/R31HYELC4SCEW1/ref=cm_cr_getr_d_rvw_ttl?ie=UTF8&ASIN=B0CZDX67YD,"5.0 "," the United States "," July 25, 2024",Team Name: ClassicSize: MediumColor: Black,Verified Purchase,Very flattering,
Jordan,XL; 175lbs 5ft2in 38DD/36DDD,https://www.amazon.com/gp/customer-reviews/R6KZRL1FXPSUG/ref=cm_cr_getr_d_rvw_ttl?ie=UTF8&ASIN=B0CZDX67YD,"4.0 "," the United States "," July 7, 2023",Team Name: ClassicSize: X-LargeColor: Black,Verified Purchase,"I really like this dress. Thin, easy to put on, and comfyyy. The shorts were a little shorter than I needed, start to get chub rub by the afternoon. I ordered an XL for my chest size  (could have used a L everywhere else like length & belly) and I’m glad I did. It fit, but the top was very “full”. I dropped a star due to shorts length and fit in the chest.",19
Alexys Julian Lenzo,Best Dress Ever,https://www.amazon.com/gp/customer-reviews/RSY6U4YLVXAT3/ref=cm_cr_getr_d_rvw_ttl?ie=UTF8&ASIN=B0CZDX67YD,"5.0 "," the United States "," March 11, 2024",Team Name: ClassicSize: MediumColor: Black,Verified Purchase,"I ordered this dress for Disney, and it was perfect! So comfortable and lightweight and perfect for running around. It’s my go to outfit for summer! You can dress it up with cute sandals or wear it sporty with tennis shoes. It’s Amazing!",
Meghan,Comfy!!,https://www.amazon.com/gp/customer-reviews/RCDGXB5LCKPT1/ref=cm_cr_getr_d_rvw_ttl?ie=UTF8&ASIN=B0CZDX67YD,"4.0 "," the United States "," October 14, 2023",Team Name: ClassicSize: MediumColor: Black,Verified Purchase,"This was really cute! and comfortable. It was too short for me (I’m 5’9) and I got a Large which is a size up from what I usually am, so I ended up returning it.",
Kpizzo,Awesome dress!,https://www.amazon.com/gp/customer-reviews/R2KK2CNUIU9CEI/ref=cm_cr_getr_d_rvw_ttl?ie=UTF8&ASIN=B0CZDX67YD,"4.0 "," the United States "," July 20, 2022",Team Name: ClassicSize: MediumColor: Black,Verified Purchase,"This dress is so comfortable and flattering that anyone can wear it and feel like they look their best! Good material and nice stretch. I am 5' and it hits at a good length on me; approximately 2 inches above the knee - someone really tall may have a mini skirt on their hands, so be warned. Pockets for phone are nice but thin and may pull the dress down with the weight of a phone (I will not be using them unless I have to). Overall, great dress for the price compared to other ""boutiques"" or name brand stores. I will definitely purchase in another color.",
lisa hourin,Comfortable and flattering,https://www.amazon.com/gp/customer-reviews/RGDF2A8O4788P/ref=cm_cr_getr_d_rvw_ttl?ie=UTF8&ASIN=B0CZDX67YD,"5.0 "," the United States "," July 22, 2023",Team Name: ClassicSize: SmallColor: Black,Verified Purchase,"Love this dress, and a great price.  Quality seems really nice, fit is lovely.  I'm 5'9"", 145lb, size 2-4, long waisted (so onesies don't always work/pull at the crotch) and the size small fits well.  It is definitely short, but the shorts don't show.Not sure how it's going to workout when I have to pee when all sweaty (getting it up and down is a little tight) but so far so good.  Love that it doesn't show sweat a lot...took this picture right after I got back from a 50 min bike ride in VA summer (HOT).Recommend!",14
Evan Priestle,"Good fit, but snagged the first day",https://www.amazon.com/gp/customer-reviews/R2ZZDARHWJ1U9L/ref=cm_cr_getr_d_rvw_ttl?ie=UTF8&ASIN=B0CZDX67YD,"3.0 "," the United States "," June 19, 2024",Team Name: ClassicSize: SmallColor: Black,Verified Purchase,"Nice fit! Was really excited when it first arrived, but it snagged the first time I wore it.",
Louise,So cute!,https://www.amazon.com/gp/customer-reviews/R47KNOIFNBUHF/ref=cm_cr_getr_d_rvw_ttl?ie=UTF8&ASIN=B0CZDX67YD,"4.0 "," the United States "," August 2, 2023",Team Name: ClassicSize: X-LargeColor: White,Verified Purchase,I like this little tennis dress because it's not too short and it's not too tight. I can throw it on with a sneaker and a pony to run errands and transition right into a fun weekend evening with some hoops and slides. I got a white one and a black one!,
NikkiH87,Cute everyday/active wear dress,https://www.amazon.com/gp/customer-reviews/R1A500YSMPQZZV/ref=cm_cr_getr_d_rvw_ttl?ie=UTF8&ASIN=B0CZDX67YD,"5.0 "," the United States "," June 7, 2023",Team Name: ClassicSize: MediumColor: Sea Blue,Verified Purchase,"This dress is so comfortable and cute as heck. The body suit underneath is smoothing and holds you in a smidge. A little annoying (as all one piece outfits are) that when you go to the bathroom the whole thing has to be pulled down. Takes quick pee breaks while hiking off the table which sucks. 34d/dd and around a size 6, medium fit well. Tried on the large too and it fit okay but the body suit didn't look as sleek and rested weird on my butt. Inseam on the shorts is like 3"", little bit of ride up but for me it isn't uncomfortable.",4
Owen Caldwell,"Comfy & flattering, buy it!",https://www.amazon.com/gp/customer-reviews/RVJZST4Y7POEZ/ref=cm_cr_getr_d_rvw_ttl?ie=UTF8&ASIN=B0CZDX67YD,"5.0 "," the United States "," August 22, 2022",Team Name: ClassicSize: MediumColor: Black,Verified Purchase,"Stats: 5’7, 135lbs, 36B and a Mom of 2 small kiddos so my midsection is a far cry from what it once was. I took a Medium and and glad I did, though I probably could’ve gotten away with a small if I was okay with it being more fitted in the chest & midsection. My husband complimented me in this dress, which he rarely does. The shorts of the bodysuit do ride up a bit for me but not terribly. So comfy, perfect for running errands or being with my kids in the summer. Will probably get another color bc it’s so great. The pocket is nice but if you actually put your phone in it it makes my hips look too wide so I don’t but it’s nice to have if you need it.",
M. Socarras,sooooo good!!,https://www.amazon.com/gp/customer-reviews/R3N9IF7WSR5O6B/ref=cm_cr_getr_d_rvw_ttl?ie=UTF8&ASIN=B0CZDX67YD,"5.0 "," the United States "," June 16, 2023",Team Name: ClassicSize: MediumColor: Black,Verified Purchase,"this dress is so good. it sucks you in, doesnt show the fupa lol, bra support is good even without pads (i took them out). so versatile! i bought for a trip to disney world because i wanted something easy and lightweight. the shorts underneath suck you in and are a good length (i have big thighs) and hopefully will be long enough to prevent chafing. dress is super cute for day to day, athleisure, or even tailgates and stuff like that! highly recommend. it also was a great length considering im 5'3 ~ 140 lbs. I got a medium and its perf! BUY!!!",21
Caitlin,"But seriously, this dress led me to receive the most amazing compliment ever...",https://www.amazon.com/gp/customer-reviews/R12B7SA9UJ2UVC/ref=cm_cr_getr_d_rvw_ttl?ie=UTF8&ASIN=B0CZDX67YD,"5.0 "," the United States "," July 1, 2023",Team Name: ClassicSize: XX-LargeColor: Sea Blue,Verified Purchase,"I wore this dress to an event at a restaurant with my book club. When I arrived in this dress, my friends immediately gushed all over it and demanded that I send them the link.  + Such a beautiful color The fit is great Slimming Make my Chest look good Hugs the waist Easy to dress up or down  _ Cannot be in the dryer I love to drink beer, and I have to take this whole get up off in the restroom. I wish the shorts was just a tiny bit longer.",7
Kim Nichols,Perfect,https://www.amazon.com/gp/customer-reviews/R1W2XPSOWD8CHR/ref=cm_cr_getr_d_rvw_ttl?ie=UTF8&ASIN=B0CZDX67YD,"5.0 "," the United States "," June 7, 2024",Team Name: ClassicSize: MediumColor: Black,Verified Purchase,This dress is perfect. It’s supportive in all the right places.,
Kindle Customer,PERFECT,https://www.amazon.com/gp/customer-reviews/R2YL4VFS4LY14X/ref=cm_cr_getr_d_rvw_ttl?ie=UTF8&ASIN=B0CZDX67YD,"5.0 "," the United States "," April 2, 2024",Team Name: ClassicSize: LargeColor: Black,Verified Purchase,YYEESS this is so stinking cute!! It will be perfect for all the mom outings with the kids! flattering and long enough that I am no uncomortable. True to size!,
Kenton Berg,perfect dress for all day activities,https://www.amazon.com/gp/customer-reviews/R2YCNQULHAE4UO/ref=cm_cr_getr_d_rvw_ttl?ie=UTF8&ASIN=B0CZDX67YD,"5.0 "," the United States "," May 3, 2023",Team Name: ClassicSize: MediumColor: Sea Blue,Verified Purchase,"I bought this dress (through my family amazon) and I am 5’4 and 150 lbs, i got a medium and it fits so well! i love that it has built in shorts and the pockets are a good size, i can fit my phone and anything else i need on my person, which is always a struggle when wearing dresses! the only downside is that you have to take the whole thing off to pee, it’s like a bodysuit in the dress. i already ordered it in another color- it’s perfect for any activity and can be dressed up easily as well",
Alison,Great material and fit!,https://www.amazon.com/gp/customer-reviews/RKWOCGQQ5H0T1/ref=cm_cr_getr_d_rvw_ttl?ie=UTF8&ASIN=B0CZDX67YD,"4.0 "," the United States "," May 7, 2023",Team Name: ClassicSize: MediumColor: Sea Blue,Verified Purchase,Giving 4 stars instead of 5 solely because if length. The length is better than my OV exercise dress but it’s still a bit short for my preference. Hits just a little under the booty on me but still covers. The dress is also a little big but if I size down it would definitely be too short. Fits well enough & can’t beat the price for the quality. Keeping it!,10
