评论用户,评论概述,评论链接,星级评分,评论地点,评论时间,类型,是否购买,评论详情,觉得该评论有帮助的人数
Nicole,Everything I wanted,https://www.amazon.com/gp/customer-reviews/R3FZKDVD00PQP7/ref=cm_cr_arp_d_rvw_ttl?ie=UTF8&ASIN=B0CZDX67YD,"5.0 "," the United States "," July 13, 2024",Team Name: Easy PeezySize: LargeColor: Sea Blue,Verified Purchase,"Right out of the package the fabric is soft and sturdy. Well sewn. The color is pretty (dark blue). The dress is a little tricky to get on at first, but it's supportive and flattering. I'm a 36DD and it was a little hard to adjust the straps to tighten up the support, but not a big deal once you get them where you need them. I wish it was a tiny bit shorter, because I'm short but the length isn't awkward. I'm crossing my fingers that it's comfortable in the heat and humidity. I'll update my review is it's not breathable. I got the easy peezy style for the ability to use the restroom without having to take it off. I'm curious if the shorts will get stretched out over time. Definitely would buy more, but it seems like they're having trouble keeping them in stock.",7
MissBrit,Comfy Vacation Outfit,https://www.amazon.com/gp/customer-reviews/R2MGTKBZKA56SK/ref=cm_cr_arp_d_rvw_ttl?ie=UTF8&ASIN=B0CZDX67YD,"5.0 "," the United States "," August 5, 2024",Team Name: ClassicSize: LargeColor: Black,Verified Purchase,"I was looking for something comfy to wear to the airport and this athletic dress did not disappoint. The material is so comfy. It compresses at the right spots. My chest was supported well and it was very flattering in the stomach area and hid the mommy tummy. After the airport, I wore this dress in Miami. It was nice and airy which was great on a hot and humid day. I definitely recommend this dress.",
Amazon Customer,"Great fit, flattering at waistline but those with thicc thighs and chest might have a little trouble",https://www.amazon.com/gp/customer-reviews/R2WENKTENT5PDD/ref=cm_cr_arp_d_rvw_ttl?ie=UTF8&ASIN=B0CZDX67YD,"4.0 "," the United States "," June 8, 2022",Team Name: ClassicSize: LargeColor: Black,Verified Purchase,"**TW: Sizes/dimensions at bottom  This dress is fantastic and a great “dupe” of other athletic/tennis/traveler dresses that are often more expensive! What really sticks out to me is the flattering tapering at the waist line.  This dress can be easily dressed up or down, and is comfortable to walk around/run errands/make a day trip in! I have a larger chest, but felt decently supported in this dress, albeit there is a fair amount of cleavage especially when viewed from the top (not anything over-the-top or uncomfortable though). It also mushes your tatas together a la sports bra and there is no underwire, so do bear that in mind if that is a fit that you dislike.  The material of this dress is a stretchy, smooth athletic material. I love the supportive feeling of the attached bodysuit/romper, which is only stitched to the dress at the neckline, which I think is totally fine as it contributes to the flow of the dress (FYI—the dress can be lifted all the way to reveal the bodysuit underneath. I’m not sure why you’d do that, but you can!). As many others mentioned, you will have to roll the entire dress down off your body to use the restroom as with a one-piece swimsuit, so do bear that in mind in case you’re planning to wear this dress in a less private area!  Additionally, due to the flared/non-fitted fit of the dress, I could eat freely (I bloat without fail whenever I eat—even during low-carb meals!) but still retain that flattering tapered waistline! Huge star in my book. I did notice that after several hours of walking, the shorts ran up a bit and my (quite large/muscular) thighs were definitely chafing which we all know is a terribly uncomfortable experience. Weighing down the attached short pockets with my phone/wallet helped a little, but not entirely. For that reason, although I was decently happy with the length of the dress (I was worried it would be too short as shorter dresses often are on me), I wish the dress and shorts were an inch or two longer. I think in the future for days with lots of walking/exploring I will wear an extra pair of biker shorts over the top of the attached romper shorts in this dress for added inner thigh protection.  It’s also a teeny bit awkward getting to the mouths of the included pockets under the dress (despite the shorts), especially for frequently-accessed things like my phone or wallet, so I try to keep less frequently-needed items there.  I docked a star for the discomfort d/t chest and thighs, but all in all, I HIGHLY recommend this dress, and those close to me know that I have been raving about it non-stop lol. Big bobbie and leggie approved!  TW: here are my measurements (I ordered a Large in black and I believe it was spot-on): - Chest: 36DD, 39” - Underbust: 33” - Waist: 31” - Hips: 38” - Around the bum: 42”",90
Mariluz Hall,Great and comfortable choice,https://www.amazon.com/gp/customer-reviews/R29FB92D3RIGL3/ref=cm_cr_arp_d_rvw_ttl?ie=UTF8&ASIN=B0CZDX67YD,"5.0 "," the United States "," July 17, 2024",Team Name: ClassicSize: MediumColor: Black,Verified Purchase,"The outfit is a lot more comfortable than I had imagined. Think of a compression workout outfit, but with more space. I chose this dress to wear to walk around Disney because it is very hot in Florida. The outfit was perfect. It was not too tight nor too loose and has stretchy material. I’m 5’1 I weigh 150 and I chose a medium and it’s a perfect fit",
Hailee Parsons,Love this dress!,https://www.amazon.com/gp/customer-reviews/RDIE1BV4YAQSN/ref=cm_cr_arp_d_rvw_ttl?ie=UTF8&ASIN=B0CZDX67YD,"5.0 "," the United States "," November 13, 2024",Team Name: ClassicSize: MediumColor: Black,Verified Purchase,Bought this dress to take to Las Vegas to walk around in and it was PERFECT! The shorts underneath made me feel concealed and also helped my legs not chafe which is always a huge bonus. It fits really well and the straps are adjustable!,
Mackelise22,Good material but not for girlies who are self Conscious about their midsection,https://www.amazon.com/gp/customer-reviews/RPPFETA54NB0F/ref=cm_cr_arp_d_rvw_ttl?ie=UTF8&ASIN=B0CZDX67YD,"3.0 "," the United States "," May 8, 2024",Team Name: ClassicSize: XX-LargeColor: Black,Verified Purchase,"The material is wonderfully made and really nice. I got the 2x and  I’m 5’9 240 and carry most of my weight in my mid section. It fit, it just was tight around there and I didn’t like it showing. I wish it was a little more flowy. & it is pretty short but not too bad. I’m currently working hard to lose weight, so we shall see in a few months! It is low cut, but the pads in the bra part are really nice!!",4
Kerrie Basara,Cute and stylish,https://www.amazon.com/gp/customer-reviews/R1YSEZIHRGLD4K/ref=cm_cr_arp_d_rvw_ttl?ie=UTF8&ASIN=B0CZDX67YD,"5.0 "," the United States "," October 15, 2024",Team Name: ClassicSize: X-SmallColor: Black,Verified Purchase,"Flattering, comfortable, and priced well. Sized as expected.",
caddells,Dress,https://www.amazon.com/gp/customer-reviews/R16GTWDILQVDGL/ref=cm_cr_arp_d_rvw_ttl?ie=UTF8&ASIN=B0CZDX67YD,"5.0 "," the United States "," July 30, 2024",Team Name: ClassicSize: MediumColor: Black,Verified Purchase,This dress is so comfortable and flattering. It is soft and breathable in the summer heat. Highly recommend! Love the pocket in the shorts for your phone. If I could change anything I would make it so the shorts could be pulled down so you don’t have to strip down to go to the bathroom.,
Nanny,Gift,https://www.amazon.com/gp/customer-reviews/R2M3O34ND5LF68/ref=cm_cr_arp_d_rvw_ttl?ie=UTF8&ASIN=B0CZDX67YD,"4.0 "," the United States "," December 27, 2024",Team Name: Easy PeezySize: MediumColor: Sea Blue,Verified Purchase,This was a gift and a success,
Rachel,Sporty dress,https://www.amazon.com/gp/customer-reviews/R36TVZDZMJYMPN/ref=cm_cr_arp_d_rvw_ttl?ie=UTF8&ASIN=B0CZDX67YD,"5.0 "," the United States "," December 18, 2024",Team Name: ClassicSize: MediumColor: Black,Verified Purchase,This athletic dress is my all time favorite! Fits great. Not too tight. Has the underneath spandex with POCKETS! I ordered a medium and could wear it every single day! Will order all colors for the warmer weather!,
Liz,Amazing but lacking color brightness,https://www.amazon.com/gp/customer-reviews/R3EU30HOEO37SW/ref=cm_cr_getr_d_rvw_ttl?ie=UTF8&ASIN=B0CZDX67YD,"4.0 "," the United States "," June 25, 2024",Team Name: ClassicSize: X-SmallColor: Sea Blue,Verified Purchase,"Out of five orders this is my fav quality dress/short combo, if you’re boujee then don’t get it. Pull the shorts to the side to pee through the leg and get over it. It’s tight fitting and acts as a body suit. The conjunction of the bra and under garment work together to keep you tucked in and join at a sports bra line under the boob. I removed the pads although they did help to push up but I tossed them and replaced them with cakes I wasn’t looking for that I was going for casual and comfy in the summer heat. They did help the girls though but again wasn’t going for that. Not a real fan of the aesthetics of the adjustable back straps and that’s my only complaint. Looks kinda like you crossed the two straps yourself from the back. Was hoping for a brighter dark teal and it came as navy which matched my eyes and worked out I guess. Would highly recommend aside from the minor personal opinions! High quality likely not an easily snagged material and I am pretty rough with clothing. Hopefully they come out with other colors and improve the cross in the back!",2
Emily,Comfortable,https://www.amazon.com/gp/customer-reviews/R1OYITIZR8ZTHP/ref=cm_cr_getr_d_rvw_ttl?ie=UTF8&ASIN=B0CZDX67YD,"4.0 "," the United States "," September 23, 2024",Team Name: ClassicSize: X-LargeColor: Olive Green,Verified Purchase,"I LOVE the ""dress""! I love how it has pockets and adjustable straps. I have always hang dried it because I'm afraid it may shrink up. The length is about mid thigh for me. Before hanging make sure the pad inserts are flat and positioned correct because it will cause a crease in the pad. I'm 5'4 for reference.",
jon byers,Overall good not great,https://www.amazon.com/gp/customer-reviews/RKURFBIVTM4WY/ref=cm_cr_getr_d_rvw_ttl?ie=UTF8&ASIN=B0CZDX67YD,"4.0 "," the United States "," September 13, 2024",Team Name: ClassicSize: MediumColor: Black,Verified Purchase,I really loved the length of this and it was comfortable and well made. The M fit me well. I’m 5”5 and 145 lbs. what I didn’t like was that the cups are removable and shifted and the fabric across the chest puckered. I ended up getting one at Aerie instead and loved it. It was more expensive but had build in padding which I loved the fit of.,
Keely McCoy,Just okay,https://www.amazon.com/gp/customer-reviews/R3LL9LU0ZVOEMG/ref=cm_cr_getr_d_rvw_ttl?ie=UTF8&ASIN=B0CZDX67YD,"3.0 "," the United States "," January 1, 2025",Team Name: Easy PeezySize: MediumColor: Sea Blue,Verified Purchase,I have serval of these dresses made by body glove and in comparison these are very cheaply made. The top bunches up a bit at the neck line when you move and the fabric is thinner. Not horrible but my body glove dresses were cheaper. So meh 😑,
Nagem2424,Great dress,https://www.amazon.com/gp/customer-reviews/R285NFD64FPNAG/ref=cm_cr_getr_d_rvw_ttl?ie=UTF8&ASIN=B0CZDX67YD,"4.0 "," the United States "," October 15, 2024",Team Name: ClassicSize: MediumColor: Olive Green,Verified Purchase,Super comfortable and good quality,
DJ,Great summer outfit for chasing busy toddler,https://www.amazon.com/gp/customer-reviews/R2T18QX712A3ID/ref=cm_cr_getr_d_rvw_ttl?ie=UTF8&ASIN=B0CZDX67YD,"4.0 "," the United States "," September 2, 2024",Team Name: ClassicSize: MediumColor: Black,Verified Purchase,"Comfortable, flattering, and an easy 1 piece outfit. Only downside is that it's not the easiest to use the bathroom in. Other than that, very cute and comfy.",
Sharon Boo,Nice feel,https://www.amazon.com/gp/customer-reviews/REJGI6JOVXAXY/ref=cm_cr_getr_d_rvw_ttl?ie=UTF8&ASIN=B0CZDX67YD,"4.0 "," the United States "," August 17, 2024",Team Name: ClassicSize: LargeColor: Black,Verified Purchase,Too big for me. Previously a large pre pregnancy and during currently a small/medium 4 months post partum.,
Madison Thayer,Love this!,https://www.amazon.com/gp/customer-reviews/RCCU1AUZUG3A5/ref=cm_cr_getr_d_rvw_ttl?ie=UTF8&ASIN=B0CZDX67YD,"5.0 "," the United States "," October 8, 2024",Team Name: Easy PeezySize: LargeColor: Black,Verified Purchase,Super cute and flattering. I get lots of compliments. It's breathable and super easy to use the restroom in!,
Amazon Customer,Fits great,https://www.amazon.com/gp/customer-reviews/R1K8WLSA06GY20/ref=cm_cr_getr_d_rvw_ttl?ie=UTF8&ASIN=B0CZDX67YD,"4.0 "," the United States "," June 2, 2024",Team Name: ClassicSize: SmallColor: White,Verified Purchase,"Bought size small and is true to size. Bought black and white. Only bad thing is that you can see the bra inserts through the white, so I will be returning that one.",
ysy,"Flattering dress, easy pregnancy outfit",https://www.amazon.com/gp/customer-reviews/R27NT3PE69FZFC/ref=cm_cr_getr_d_rvw_ttl?ie=UTF8&ASIN=B0CZDX67YD,"5.0 "," the United States "," October 15, 2024",Team Name: ClassicSize: X-SmallColor: Black,Verified Purchase,It’s very stretchy and holds everything im,
Lisa,Cute and comfortable,https://www.amazon.com/gp/customer-reviews/R3MNCS8U3XV4D3/ref=cm_cr_getr_d_rvw_ttl?ie=UTF8&ASIN=B0CZDX67YD,"4.0 "," the United States "," June 14, 2024",Team Name: ClassicSize: MediumColor: Black,Verified Purchase,This dress is cute and comfortable. Has the ability to be worn for both athletics or comfortability.,
Briana,OBSESSED,https://www.amazon.com/gp/customer-reviews/R1YYHXFHO11E79/ref=cm_cr_getr_d_rvw_ttl?ie=UTF8&ASIN=B0CZDX67YD,"5.0 "," the United States "," August 30, 2024",Team Name: ClassicSize: X-LargeColor: Flamingo,Verified Purchase,Ordered a similar style from A&F and these are superior in my opinion. Lightweight but still offers shaping/smoothing. The material is breathable and the shorts are the perfect length. I followed Amazon’s recommendation and ordered large. Can’t recommend more!!,
Nicole Griffin,Very flattering,https://www.amazon.com/gp/customer-reviews/R3B9A2LZHBXDZM/ref=cm_cr_getr_d_rvw_ttl?ie=UTF8&ASIN=B0CZDX67YD,"5.0 "," the United States "," July 13, 2024",Team Name: ClassicSize: MediumColor: Black,Verified Purchase,"This dress is so flattering. I like how it flairs out to hide a little tummy. It is great for walking, running errands or even going out. The medium fit my 5’4’’ 135 lb frame well. The length is on the longer more modest size but still cute. It can ride up just a bit so I wouldn’t wear this for jogging or running.",
Vkay,So flattering!,https://www.amazon.com/gp/customer-reviews/R3R6Z5NE3956C2/ref=cm_cr_getr_d_rvw_ttl?ie=UTF8&ASIN=B0CZDX67YD,"5.0 "," the United States "," September 2, 2024",Team Name: ClassicSize: X-LargeColor: Black,Verified Purchase,"Getting in other colors. Very flattering, comfortable. Wore for theme park days in 95° heat and for a summer pool day. Love the fit",
Bijou Williams,Comfortable & supportive,https://www.amazon.com/gp/customer-reviews/R2VRFIWXI8PQ84/ref=cm_cr_getr_d_rvw_ttl?ie=UTF8&ASIN=B0CZDX67YD,"5.0 "," the United States "," July 3, 2024",Team Name: ClassicSize: MediumColor: Black,Verified Purchase,"This dress is so insanely comfortable! I’m a size 6-8 and a 34 DD so I was struggling between buying a medium and a large, I went with the medium and it fits me perfectly. The fabric quality is great - built in bra is a game changer, the dress is comfortable and supportive enough to go braless!",2
Amanda Bertelli,Perfect dupe dress,https://www.amazon.com/gp/customer-reviews/R1PBR8Z43AEDAZ/ref=cm_cr_getr_d_rvw_ttl?ie=UTF8&ASIN=B0CZDX67YD,"5.0 "," the United States "," July 1, 2024",Team Name: ClassicSize: X-LargeColor: Sea Blue,Verified Purchase,"I've seen this dress from another popular brand all over Tik Tok shop but found this similar one on Amazon and had to give it a try. The material is buttery soft, has built in shorts to eliminate my thighs rubbing together and provides just enough tummy control. Will be living in this dress this summer and definitely buying more colors!",
Talita,So Beautiful and Comfortable,https://www.amazon.com/gp/customer-reviews/R2CD9RU6DUGON8/ref=cm_cr_getr_d_rvw_ttl?ie=UTF8&ASIN=B0CZDX67YD,"5.0 "," the United States "," August 28, 2024",Team Name: ClassicSize: MediumColor: Black,Verified Purchase,"It is a beautiful dress and perfect for going to Disney. I got one for myself and one for my daughter, and they fit great.",
Jenna Haynam,Comfortable and great for park days,https://www.amazon.com/gp/customer-reviews/RF162ACUN7J3H/ref=cm_cr_getr_d_rvw_ttl?ie=UTF8&ASIN=B0CZDX67YD,"5.0 "," the United States "," September 11, 2024",Team Name: ClassicSize: LargeColor: Black,Verified Purchase,Wrote this to a then park and it was so comfortable-would definitely buy again!,
MyUsernameRox,I like the slimline shape,https://www.amazon.com/gp/customer-reviews/R1XDAGZ3BH95S2/ref=cm_cr_getr_d_rvw_ttl?ie=UTF8&ASIN=B0CZDX67YD,"5.0 "," the United States "," July 20, 2024",Team Name: ClassicSize: SmallColor: Black,Verified Purchase,"This tennis dress has an A-line, fit-and-flare shape to it that I find really slimming and flattering. I’m keeping this one and returning others with more fluttery skirts. The built-in “shapewear” (not shaping or slimming, just smoothing) makes everything underneath smooth.",
Lisa Weinheimer,My favorite summer dress,https://www.amazon.com/gp/customer-reviews/R1RDWWS8OQES7E/ref=cm_cr_getr_d_rvw_ttl?ie=UTF8&ASIN=B0CZDX67YD,"5.0 "," the United States "," July 19, 2024",Team Name: ClassicSize: MediumColor: White,Verified Purchase,I’m so happy with this purchase! I bought it in 4 colors! It is so flattering and comfortable! I’m 5ft tall and 130lbs and ordered a medium and it fits perfectly! Great length and shape! I love the adjustable straps!,
Anonymous,Love love love!!!,https://www.amazon.com/gp/customer-reviews/RXSULNHEM67E3/ref=cm_cr_getr_d_rvw_ttl?ie=UTF8&ASIN=B0CZDX67YD,"5.0 "," the United States "," July 16, 2024",Team Name: ClassicSize: MediumColor: Black,Verified Purchase,"It's the perfect summer dress! I've worn this dress to summer parties, on nature walks, running errands. It's super comfy and makes the girls look good! Love the adjustable straps. Super slimming too! Just all around an awesome buy!",
Sylvia,Perfection!,https://www.amazon.com/gp/customer-reviews/R3DQELFPM5UEE5/ref=cm_cr_getr_d_rvw_ttl?ie=UTF8&ASIN=B0CZDX67YD,"5.0 "," the United States "," August 21, 2022",Team Name: ClassicSize: X-LargeColor: Black,Verified Purchase,"I have seen this dress on several influencers and kept putting it in my cart, then taking it out. I just didn’t think it was going to work on my body type. I gained the COVID 20 over the last two years and have a stomach pooch (okay…it might be more than a “pooch”). I ended up ordering this with the idea that I could return it if it didn’t work so “let’s just see what happens”. LOVE this. Very flattering even with a pooch. The built in shorts, bra and padding are top notch. Smooths everything out and holds things in. I got my regular size large (seriously considered XL though). The large is snug but not in a bad way. Hugs all the right places. The length hits right at my upper thigh which I wouldn’t care for if this was a skirt or dress but the shorts underneath give me confidence that I’m not going to be giving anyone a show. I got this in black. Will be great with a flannel tied around the waist and tennis shoes. I’ll probably live in this on weekends, at Disneyland, exploring new cities, etc.",4
EBS,The PERFECT dress!,https://www.amazon.com/gp/customer-reviews/R2SJICKASME07K/ref=cm_cr_getr_d_rvw_ttl?ie=UTF8&ASIN=B0CZDX67YD,"5.0 "," the United States "," August 15, 2023",Team Name: ClassicSize: LargeColor: Mauve,Verified Purchase,"Ugh I cannot say enough about this dress. I was just stopped last week by someone asking me about it. The shorts are super comfy but have no pockets, fyi. I typically wear it with sneakers and a jean jacket for that ""cool mom"" look. I also just slip on some flip-flops and run errands too.  Note that if you are blessed in the chest, this doesn't have a lot of coverage. It shows enough where I wouldn't wear it to work but it's ok for regular, everyday life.  Comparisons: Old Navy: I've tried on several of the Old Navy Sleeveless Powersoft Performance Racer-Back Mini Swing Dress and the large was slightly too big, but the medium was slightly too tight. The large fit me perfectly for this one.  Target: the ones I've tried on here just feel cheap. The material of this one is soft and stretchy.",7
Brittany bennett,One piece dress with shorts,https://www.amazon.com/gp/customer-reviews/R2MI2I2AQUI13W/ref=cm_cr_getr_d_rvw_ttl?ie=UTF8&ASIN=B0CZDX67YD,"5.0 "," the United States "," August 29, 2024",Team Name: ClassicSize: MediumColor: Olive Green,Verified Purchase,"Absolutely love!!!!  The fit, quality,  and the elasticity is amazing.  So comfortable.",
Shannon Dalton,Dress,https://www.amazon.com/gp/customer-reviews/RLMFE39P3KY6/ref=cm_cr_getr_d_rvw_ttl?ie=UTF8&ASIN=B0CZDX67YD,"5.0 "," the United States "," August 2, 2024",Team Name: ClassicSize: LargeColor: Black,Verified Purchase,Flattering dress. Quality is great. Breathable fabric. Washes well. Love the adjustable straps and built in bra. I'm 5'2 150lbs DD and there's no gaps or tight spots.,
Elaine,Love this dress,https://www.amazon.com/gp/customer-reviews/RPD807Q8QRXAO/ref=cm_cr_getr_d_rvw_ttl?ie=UTF8&ASIN=B0CZDX67YD,"5.0 "," the United States "," August 27, 2024",Team Name: ClassicSize: SmallColor: Black,Verified Purchase,"Perfect fit, love the material and adjustable straps- get alot of compliments",
Mariah,Super comfy,https://www.amazon.com/gp/customer-reviews/R1TSE9C3ZB8HXK/ref=cm_cr_getr_d_rvw_ttl?ie=UTF8&ASIN=B0CZDX67YD,"5.0 "," the United States "," June 13, 2024",Team Name: ClassicSize: X-LargeColor: Black,Verified Purchase,"I loved this dress. the way it fit and the way it hung was perfect. I personally didn't like the open back on me, due to back rolls and my insecurities about them, so i returned it but it looked great and fit perfect. I'm 5'9"" 185lb and ordered XL",
Marcia Davis,Love!!,https://www.amazon.com/gp/customer-reviews/R1YE4P1P0G60OA/ref=cm_cr_getr_d_rvw_ttl?ie=UTF8&ASIN=B0CZDX67YD,"5.0 "," the United States "," August 26, 2024",Team Name: ClassicSize: MediumColor: Black,Verified Purchase,"True to size, I’m 5’6” 147lb and got a M",
Veronica Perez,"Great quality , fits Long",https://www.amazon.com/gp/customer-reviews/R1L5N9XV06BUMO/ref=cm_cr_getr_d_rvw_ttl?ie=UTF8&ASIN=B0CZDX67YD,"5.0 "," the United States "," August 22, 2024",Team Name: ClassicSize: MediumColor: Black,Verified Purchase,"Quality is great, fits long for slim body shape. True to size.",
Kit,Get it!,https://www.amazon.com/gp/customer-reviews/RLPIXQM5J86AZ/ref=cm_cr_getr_d_rvw_ttl?ie=UTF8&ASIN=B0CZDX67YD,"5.0 "," the United States "," June 28, 2024",Team Name: ClassicSize: SmallColor: Black,Verified Purchase,"Soooo comfy and looks good. It was so hard to find a dress like this that wasn’t too long.  It’s perfect length. Built in bra. Just throw it on a go. Love it, buying it in every color.",
Savenu_RN_FNP,Mom Romper,https://www.amazon.com/gp/customer-reviews/RI0O5KFOCJC4K/ref=cm_cr_getr_d_rvw_ttl?ie=UTF8&ASIN=B0CZDX67YD,"5.0 "," the United States "," June 18, 2024",Team Name: ClassicSize: X-LargeColor: Black,Verified Purchase,"9 months pregnant and ordered an XL. 5’2 193lbs usually 143 size small/medium. Size XL gives belly room, but still snug in the belly area. I probably should have gotten XXL. Still cute and tolerable to wear. No bra necessary. Pockets are a plus. Get it!",3
SM,Comfortable and flattering,https://www.amazon.com/gp/customer-reviews/R4SVOBAMFZQDM/ref=cm_cr_getr_d_rvw_ttl?ie=UTF8&ASIN=B0CZDX67YD,"5.0 "," the United States "," June 21, 2024",Team Name: ClassicSize: LargeColor: Black,Verified Purchase,"Perfect to throw on for the casual summer wear. It comes with bra padding, which I removed and made it more breathable. The length is perfect and is good quality material. Very flattering, but not too loose.",
Amazon Customer,Fits perfect!,https://www.amazon.com/gp/customer-reviews/R3PHRYG1BPJJED/ref=cm_cr_getr_d_rvw_ttl?ie=UTF8&ASIN=B0CZDX67YD,"5.0 "," the United States "," August 1, 2024",Team Name: ClassicSize: X-SmallColor: Black,Verified Purchase,Love this product so much. It fits true to size and comes with high quality pockets and straps.,
Elein McCarty,Best dress ever,https://www.amazon.com/gp/customer-reviews/RFDTYL7H8JXBS/ref=cm_cr_getr_d_rvw_ttl?ie=UTF8&ASIN=B0CZDX67YD,"5.0 "," the United States "," July 19, 2024",Team Name: ClassicSize: MediumColor: Black,Verified Purchase,"Omg best and most comfortable dress ever, it fits sooo good and makes you look soooo slim!!! I’ll be getting every color! Obsessed",
Amazon Customer,The best!,https://www.amazon.com/gp/customer-reviews/RQZUTGJJJ4CCQ/ref=cm_cr_getr_d_rvw_ttl?ie=UTF8&ASIN=B0CZDX67YD,"5.0 "," the United States "," April 5, 2024",Team Name: ClassicSize: LargeColor: Black,Verified Purchase,I love this dress! Bought the black one for a recent Disney trip and it was so comfortable. The fabric is very soft. I’d say it runs true to size but maybe a tad small. I’m 5’5 150lb. Typically a size 8 and medium. The medium was a tad tight so I got the large. I like the fit much better. I’m coming back for more colors.,
