customer,longer than expected,https://www.amazon.com/gp/customer-reviews/RCSS0XD6Q1XJM/ref=cm_cr_getr_d_rvw_ttl?ie=UTF8&ASIN=B0D9W2LL3T,"4.0 "," the United States "," May 3, 2024",Fit Type: 2.5'' High waistedSize: SmallColor: White,Verified Purchase,"they look fine when i roll them but if i didn’t roll them they’d look ridiculous. the white is very see-through in the back so that’s a con. but i do like the pocket in the front. last two pictures show how long they are unrolled compared with other shorts that i love. i also got a small, idk if they’d be shorter as an xs but the small fits me well around my waist when rolled.",9
Taylor,Gorgeous and super comfy,https://www.amazon.com/gp/customer-reviews/R1M5PIGHZAF5SN/ref=cm_cr_getr_d_rvw_ttl?ie=UTF8&ASIN=B0D9W2LL3T,"5.0 "," the United States "," September 4, 2024",Fit Type: 2.5'' High waistedSize: LargeColor: Lake Blue,Verified Purchase,"I ordered these because I absolutely love the bright blue color and the high-waisted factor. They fit great, are ultra comfy and breathable, and I can tell that I’m gonna want to wear them constantly! Definitely recommend",
Sharon,Cute and comfortable!,https://www.amazon.com/gp/customer-reviews/R1B87FWUCQT8QN/ref=cm_cr_getr_d_rvw_ttl?ie=UTF8&ASIN=B0D9W2LL3T,"4.0 "," the United States "," April 17, 2024",Fit Type: 2.5'' High waistedSize: SmallColor: Blue54,Verified Purchase,"These shorts are a good length for me. The only issue I have is the pocket being on the left side. If you’re right handed like me, the pocket would be better on the right side.  The description says it’s on the left, but I didn’t realize it until I received them.  Not a deal breaker though!",
Kim,Love it,https://www.amazon.com/gp/customer-reviews/R3NN10M5BNW4O5/ref=cm_cr_getr_d_rvw_ttl?ie=UTF8&ASIN=B0D9W2LL3T,"4.0 "," the United States "," July 12, 2022",Fit Type: 2.5'' High waistedSize: SmallColor: Violet,Verified Purchase,"I got three pairs of these in gray-blue, lavender, and black. I love them all! I tried medium and small and went with the small side (I’m 5’7” and 125 lbs). Two reasons I didn’t give 5 stars:  1. I love the phone pocket, but I think it would be even better if there were instead spandex liners with a pocket inside of the shorts. My phone kind of bounces around when I’m wearing these since it’s attached to the loose outer part. It hasn’t been a huge problem—I don’t notice it once I’ve been running for a few minutes, although sometimes I find myself pulling up the shorts a little bit since my phone seems to drag them down about an inch or so on one side every now and then. Which leads me to my next suggestion… 2. These would be awesome with a hidden drawstring. They fit well without it, but for someone who’s running with a phone in their pocket, they tend to slide down a tiny bit after a while, which could be easily remedied by adding a drawstring inside of them.  All in all I love the colors, material, and the fact that I don’t have to wear my phone on one of those annoying arm band things! And they look super cute!",32
Lisa McBride,Love them,https://www.amazon.com/gp/customer-reviews/R1BMFA6TXWI27N/ref=cm_cr_getr_d_rvw_ttl?ie=UTF8&ASIN=B0D9W2LL3T,"5.0 "," the United States "," August 6, 2024",Fit Type: 2.5'' High waistedSize: SmallColor: Hot Pink,Verified Purchase,I have these in black and pink. I love them. I have a small and a medium. They both fit and look good but i do like the medium fit a little bit better. Neither really gives me a muffin top but the mediums are a tad bit more comfortable when sitting. Im 5 8 and 130 lbs.,
Erica Mack,Love these!!,https://www.amazon.com/gp/customer-reviews/R1LLX6THNPXJ8K/ref=cm_cr_getr_d_rvw_ttl?ie=UTF8&ASIN=B0D9W2LL3T,"5.0 "," the United States "," April 27, 2023",Fit Type: 2.5'' High waistedSize: MediumColor: Hot Pink,Verified Purchase,"I recently purchased these pink athletic shorts, and I am absolutely in love with them. They are the perfect combination of comfort and style, and I can't recommend them enough.  Firstly, I have to mention how comfortable these shorts are. They are made from a lightweight and breathable fabric that is perfect for running and other athletic activities. They move with my body and don't feel restrictive or tight, which is essential for me when I'm trying to stay active.  But the best part is how cute they look! The pink color is vibrant and fun, and the design is sleek and flattering. I've received so many compliments on these shorts, and they make me feel confident and stylish even when I'm working out.  I've worn these shorts on multiple runs now, and they have held up incredibly well. They don't ride up or chafe, and they stay in place throughout my entire workout. Plus, they have a convenient pocket that's perfect for storing my phone or keys.  Overall, I can confidently say that these pink athletic shorts are the perfect addition to any active wardrobe. They are comfortable, stylish, and great for running or other workouts. If you're looking for a new pair of shorts that will make you look and feel great, then look no further!",19
Zimmerhanzel/Halliburton,Love these,https://www.amazon.com/gp/customer-reviews/R14I28E4NLB6HB/ref=cm_cr_getr_d_rvw_ttl?ie=UTF8&ASIN=B0D9W2LL3T,"5.0 "," the United States "," September 22, 2024",Fit Type: 2'' High waistedSize: LargeColor: Black371,Verified Purchase,"I really like these. The high waist is perfect for my cropped shirts, and the extra length on the back to cover your butt is perfect. I just bought another pair. I got a large and they fit great - 5’10 & 150lbs",
Karma,Best running short!,https://www.amazon.com/gp/customer-reviews/R3DND0FJ7OCZRT/ref=cm_cr_getr_d_rvw_ttl?ie=UTF8&ASIN=B0D9W2LL3T,"5.0 "," the United States "," October 24, 2024",Fit Type: 2.5'' High waistedSize: MediumColor: Black,Verified Purchase,"Perfect fit, lightweight and doesn’t feel uncomfortable while running. Highly recommend these shorts.",
Emily Foster,Comfortable shorts,https://www.amazon.com/gp/customer-reviews/R2SZ8JVLOJZF79/ref=cm_cr_getr_d_rvw_ttl?ie=UTF8&ASIN=B0D9W2LL3T,"5.0 "," the United States "," September 20, 2024",Fit Type: 2.5'' High waistedSize: MediumColor: Black,Verified Purchase,"These shorts fit great and aren’t too short. They do run a little small, I usually buy a small in shorts but got a medium and they fit perfectly. There is only one pocket though, I assumed there were 2 but just one on the left side.",
Tara M.,The best shorts I have ever owned.,https://www.amazon.com/gp/customer-reviews/R31IBS37NELVUV/ref=cm_cr_getr_d_rvw_ttl?ie=UTF8&ASIN=B0D9W2LL3T,"5.0 "," the United States "," August 12, 2024",Fit Type: 2.5'' High waistedSize: X-LargeColor: Bluish Grey,Verified Purchase,"The fit of these shorts are amazing. They stay up and are mid waist which is perfect. No rubbing or chaffing of material. The pocket fits my cell phone and keys and I love that it has a zipper. The colors look exactly as shown on the listing. I have the grey/blue, white and tan. 10/10!",
Karen,Absolutely the best shorts! And I searched!,https://www.amazon.com/gp/customer-reviews/R301W1TRLWTSR7/ref=cm_cr_getr_d_rvw_ttl?ie=UTF8&ASIN=B0D9W2LL3T,"5.0 "," the United States "," June 6, 2024",Fit Type: 2.5'' High waistedSize: LargeColor: White,Verified Purchase,"I ordered probably 10 different styles of workout shorts from Amazon and other places. These were the undisputed winner!  Perfect length to look cute in dance class without showing too much butt or cellulite(!), perfect waist (high enough to cover my stomach w. a cute cropped workout tank), perfect style with a rounded hem that lengthens the leg, perfect amount of give, perfect liner short (that's not too tight) for security and modesty, great colors...and great price! i adore them! I have in three colors and will probably get more. My search is finally over!",2
Ajali Shabazz,THANK YOU to All the Reviewers!,https://www.amazon.com/gp/customer-reviews/R1C8G6VLYX8UQK/ref=cm_cr_getr_d_rvw_ttl?ie=UTF8&ASIN=B0D9W2LL3T,"4.0 "," the United States "," March 28, 2023",Fit Type: 2.5'' High waistedSize: LargeColor: Neongreen,Verified Purchase,"How valuable reviews are, as I learned these run small. Thus, I ordered a large, when I wear a medium, while wondering if I'd made a mistake. BUT NO. Everyone who shared these shorts are tiny were right. Medium would have been quite constricting as the large is very snug. Also, I hate panty lines, so I cut out the inner panty, because I wear thigh length leggings, anyway. Being a modest woman, these shorts are just a tad too short for me, but they wouldn't be so for the average woman - meaning? They're not booty shorts. The backside is actually longer than the front. Overall, they're a good purchase, given the color is bright and cheery, and the cut allows for thicker thighs, which I have. I wish they had one more pocket, though, as I carry my keys, walkman and handkerchief during runs. That's the only truly awkward issue.  Update: I've gone running wearing these shorts and they're just what I needed. There were no bunching issues. while I solved the pocket problem by pinning a cut off toe and foot section of a misfit sock. I just placed another pair in another color in my shopping cart. Good Buy.",23
Mays,Love love love love,https://www.amazon.com/gp/customer-reviews/R3247GSRCTVKWA/ref=cm_cr_getr_d_rvw_ttl?ie=UTF8&ASIN=B0D9W2LL3T,"5.0 "," the United States "," September 7, 2024",Fit Type: 2.5'' High waistedSize: SmallColor: Black,Verified Purchase,Absolutely love these shorts. Great quality. Fits perfect. Love the built in underwear. They don’t ride up. They stay put and keep everything contained. Love a high waist. I have purchased in 3 colors and have multiple pairs of the black. Will buy again and again. I wish it had two pockets but not a deal breaker for me.,
Rachelle,Love!!,https://www.amazon.com/gp/customer-reviews/R1QRE24H81H2BX/ref=cm_cr_getr_d_rvw_ttl?ie=UTF8&ASIN=B0D9W2LL3T,"5.0 "," the United States "," September 6, 2024",Fit Type: 2.5'' High waistedSize: LargeColor: Black,Verified Purchase,"I have these shorts in so many colors. I love the fit and quality of the fabric for the cost. My phone does fit in the pocket, but it looks strange. I could go for a run with my phone in the pocket. You can't really see the built in liner while wearing them. I love, love, LOVE these shorts!",
