Kimbyrle,Add a pocket,https://www.amazon.com/gp/customer-reviews/R9OO6JARBS5MM/ref=cm_cr_getr_d_rvw_ttl?ie=UTF8&ASIN=B0D9W2LL3T,"4.0 "," the United States "," August 15, 2024",Fit Type: 2.5'' High waistedSize: X-LargeColor: Black,Verified Purchase,Love these shorts but this is my petition for them to have 2 pockets. If i had one for keys and one for phone while walking my dog they would be perfect but one pocket = lumpy off kilter weight distribution that sags on the heavier side. Don't need phone and keys? Buy these,
Darth Vator,I like them,https://www.amazon.com/gp/customer-reviews/R1KJF5057G8ARA/ref=cm_cr_getr_d_rvw_ttl?ie=UTF8&ASIN=B0D9W2LL3T,"4.0 "," the United States "," September 9, 2024",Fit Type: 2.5'' High waistedSize: X-LargeColor: Black,Verified Purchase,"I like them for the elastic high waist feature, one pocket on the left, and the fabric being sporty.",
Jessica Long,The BEST workout & Running Shorts,https://www.amazon.com/gp/customer-reviews/R1R4TWV69KHIE7/ref=cm_cr_getr_d_rvw_ttl?ie=UTF8&ASIN=B0D9W2LL3T,"5.0 "," the United States "," October 30, 2024",Fit Type: 2.5'' High waistedSize: MediumColor: Wine Red,Verified Purchase,"I LOVE these shorts. I have almost every color. Great length for long legs. High Waisted for us mamas & the little side pocket fits a phone great. Very comfortable, great quality & material. They don't cut into your stomach - very TTS.",
Michele,Not too bad!,https://www.amazon.com/gp/customer-reviews/R2BRO0YA8BYMZZ/ref=cm_cr_getr_d_rvw_ttl?ie=UTF8&ASIN=B0D9W2LL3T,"4.0 "," the United States "," September 4, 2023",Fit Type: 2.5'' High waistedSize: MediumColor: Black,Verified Purchase,"I can understand if my review title isn’t convincing, but I’ll explain. I’m someone who reads a lot of reviews before I commit, and there were some mixed ones on this item. I wanted a pair of athletic shorts that didn’t cost me $50+ and were high-waisted, so I tried these. The material is lightweight, moisture-wicking, and has decent stretch in it. I personally LOVE the seat coverage of the built-in brief. Too often, shorts with a brief liner ride up when you move and these cover like a full-coverage bottom, so no wedgie worry! Win. Some reviews said the back was too long - I disagree. I have longer legs than torso and a rounder bottom, so I loved the back length. Where I’m a little bummed.. The shorts do ride up in the front, and they will if you have a more quad-dominant leg. Because they’re a nice, longer length with a more flat front (to be more flattering, no doubt!), there’s nowhere else for the fabric to go once you start moving and walking. If I wanted to wear these shorts for a casual, athleisure outfit, the ride would bother me because I’d have to keep pulling them down. Since I plan to work out in them, run, play volleyball, I guess I won’t have to tug them up in front? I am 5’7, 160lbs, and I ordered a medium based on the size chart measurements. I feel this is the most appropriate size, as a L would have been too “balloon-y”. So overall, they’re not too bad! I will probably get other pairs to rotate, just wish that the front didn’t “pooch” out as much.",39
Kate Depp,Comfy and flattering,https://www.amazon.com/gp/customer-reviews/RY5R1AC7Y7OL5/ref=cm_cr_getr_d_rvw_ttl?ie=UTF8&ASIN=B0D9W2LL3T,"5.0 "," the United States "," October 26, 2024",Fit Type: 2.5'' High waistedSize: SmallColor: Black,Verified Purchase,"These are still my favorite shorts I bought. The high waist is flattering covering any tummy muffin too. The legs are almost butterfly cut so it gives my muscle legs room. I wear them around the house, kids events and even to the grocery store.",
Susan Staley,Athletic shorts,https://www.amazon.com/gp/customer-reviews/R1SLQXO4HMGWRU/ref=cm_cr_getr_d_rvw_ttl?ie=UTF8&ASIN=B0D9W2LL3T,"4.0 "," the United States "," August 26, 2024",Fit Type: 2.5'' High waistedSize: MediumColor: Black,Verified Purchase,I ordered these based off reviews and have been very happy with my purchase.  These have been my go to this summer.  The fit is great.,
heather hansard,Cute style,https://www.amazon.com/gp/customer-reviews/R1ANKLAJ1VKR3D/ref=cm_cr_getr_d_rvw_ttl?ie=UTF8&ASIN=B0D9W2LL3T,"5.0 "," the United States "," November 20, 2024",Fit Type: 2.5'' High waistedSize: XX-LargeColor: Black,Verified Purchase,"Cute shorts, runs a little small.",
Amazon Customer,Love these shorts (just not in white),https://www.amazon.com/gp/customer-reviews/R283SFPXFG2Y32/ref=cm_cr_getr_d_rvw_ttl?ie=UTF8&ASIN=B0D9W2LL3T,"4.0 "," the United States "," July 4, 2024",Fit Type: 2.5'' High waistedSize: X-SmallColor: White,Verified Purchase,"I first got these shorts in black and quickly became obsessed with them. They fit perfectly around my waist and I love that they're a little longer in the back. I ordered another pair in white, and was disappointed to find the fabric of the shorts was VERY see-through. Yes, there is the underwear lining in them, but that made it even more noticeable that they are see-through. Overall, highly recommend these shorts, just not in white.",
Hannah,better than brands,https://www.amazon.com/gp/customer-reviews/R3N7VEZALJ0CRJ/ref=cm_cr_getr_d_rvw_ttl?ie=UTF8&ASIN=B0D9W2LL3T,"5.0 "," the United States "," November 7, 2024",Fit Type: 2.5'' High waistedSize: SmallColor: Black,Verified Purchase,I own several athletic brand running shorts and these are by far the comfiest and most flattering on my body. cannot recommend enough!,
Shelby,"Cute shorts, okay fit",https://www.amazon.com/gp/customer-reviews/R2XV8KAOEXMAUZ/ref=cm_cr_getr_d_rvw_ttl?ie=UTF8&ASIN=B0D9W2LL3T,"4.0 "," the United States "," June 23, 2024",Fit Type: 2.5'' High waistedSize: X-LargeColor: Black,Verified Purchase,"These shorts are super cute and very flattering. They are flowy and have a very comfortable waistband. As a typical size 14, I purchased an XL and the fit is fine. However, it’s important to note these are not chafe-friendly and do ride up between the thighs pretty quickly in warm weather. The pocket is very nifty and can surprisingly hold quite a bit, but it does cause the pocket to sag below the line of the bottom hem and stick out below the shorts.",7
Kristina Misegan,Just like picture,https://www.amazon.com/gp/customer-reviews/R2G7CKSJKQTT5M/ref=cm_cr_getr_d_rvw_ttl?ie=UTF8&ASIN=B0D9W2LL3T,"5.0 "," the United States "," November 24, 2024",Fit Type: 2.5'' High waistedSize: XX-LargeColor: Black,Verified Purchase,Comfy!,
Tabitha Little,Made well,https://www.amazon.com/gp/customer-reviews/R33H8EM5SMFVYG/ref=cm_cr_getr_d_rvw_ttl?ie=UTF8&ASIN=B0D9W2LL3T,"4.0 "," the United States "," September 17, 2024",Fit Type: 2.5'' High waistedSize: X-SmallColor: Black,Verified Purchase,Cute and fits as should,
Kellie T,Didn’t fit,https://www.amazon.com/gp/customer-reviews/R2SJJ5BG1QSD9A/ref=cm_cr_getr_d_rvw_ttl?ie=UTF8&ASIN=B0D9W2LL3T,"4.0 "," the United States "," August 16, 2024",Fit Type: 2.5'' High waistedSize: MediumColor: Red,Verified Purchase,"Cute & comfy shorts, but inside liner was too tight on my thighs. The actual shorts fit fine. Returning for a L. 5’1 size 8/29 for reference",
Michelle,Cute but cut a little small.,https://www.amazon.com/gp/customer-reviews/RP0SLS0VJSXC7/ref=cm_cr_getr_d_rvw_ttl?ie=UTF8&ASIN=B0D9W2LL3T,"4.0 "," the United States "," May 30, 2024",Fit Type: 2.5'' High waistedSize: X-LargeColor: Black,Verified Purchase,"I had been looking for my daughter some shirts exactly like these and was so, so hopeful these would fit but unfortunately they were a little too small. She typically wears an xl In women’s so we ordered that and had they been about an inch or so bigger in the waist they would have fit. The material was so lightweight and appeared to be very breathable. I thought they were really cute but just a little too snug to keep. They would be great for a person who wears a size Large.",
jjm,Love them!,https://www.amazon.com/gp/customer-reviews/R2T98M6R4NESB6/ref=cm_cr_getr_d_rvw_ttl?ie=UTF8&ASIN=B0D9W2LL3T,"4.0 "," the United States "," August 2, 2024",Fit Type: 2.5'' High waistedSize: SmallColor: Black351,Verified Purchase,I do love these shorts! I think they are a little shorter than needed especially when I sit down I feel like they look weird but otherwise very comfy and love the high waisted feeling!,
Marissa Brown,Kinda baggy,https://www.amazon.com/gp/customer-reviews/R1BGFZBI442RHU/ref=cm_cr_getr_d_rvw_ttl?ie=UTF8&ASIN=B0D9W2LL3T,"4.0 "," the United States "," July 6, 2024",Fit Type: 2'' High waistedSize: X-SmallColor: Black371,Verified Purchase,I got an XS and it’s still baggier than I wanted but I have that problem with most shorts like this (I have chicken legs). Other than that they feel like the same material as Nike running shorts. The waistband is nice and snug but not too tight and there’s zip-up pockets. Also a liner inside. Pretty happy,
Courtney,Run small,https://www.amazon.com/gp/customer-reviews/R2BBIZPSJRJJLI/ref=cm_cr_getr_d_rvw_ttl?ie=UTF8&ASIN=B0D9W2LL3T,"4.0 "," the United States "," July 7, 2024",Fit Type: 2.5'' High waistedSize: LargeColor: Black,Verified Purchase,I am always a large. Sometimes a large is even too big and these were very snug especially in the butt and thigh area. I am returning them to get an XL which I never buy. They are nice quality and exactly what I wanted for running. Love the thick waist band!,
RobynH,I hope these hold up because they are gorgeous!,https://www.amazon.com/gp/customer-reviews/R1LKH0L32PS5YM/ref=cm_cr_getr_d_rvw_ttl?ie=UTF8&ASIN=B0D9W2LL3T,"4.0 "," the United States "," June 28, 2024",Fit Type: 2.5'' High waistedSize: X-LargeColor: Black,Verified Purchase,"These shorts are very nice with zippered pockets for money and keys.  Perfect for walking.  Elastic top feels great.  I sized up because of the elastic and they drape beautifully.  the back covers the rump.  I got the long ones and may get the shorter ones.  I am impressed and feel comfortable, covered and beautiful!",
CMNR,Great for the price!,https://www.amazon.com/gp/customer-reviews/R2UUGJYD3A7ZHI/ref=cm_cr_getr_d_rvw_ttl?ie=UTF8&ASIN=B0D9W2LL3T,"5.0 "," the United States "," October 21, 2024",Fit Type: 2.5'' High waistedSize: MediumColor: White,Verified Purchase,I've purchased these in multiple colors. The quality is great and the price-point is too. I love the length- not too short but not too long. A zipper pocket is a bonus.,
Emma Hallman,Odd fit,https://www.amazon.com/gp/customer-reviews/RUD5LUK244OAT/ref=cm_cr_getr_d_rvw_ttl?ie=UTF8&ASIN=B0D9W2LL3T,"4.0 "," the United States "," August 1, 2024",Fit Type: 2.5'' High waistedSize: X-LargeColor: Black,Verified Purchase,"I loved that the shorts were on the longer side in the back, but they become tight in the front when sitting down. I think that if you order a size up that might help!",
Evelyn Powell,"Different colors, different stitching in front",https://www.amazon.com/gp/customer-reviews/R10WS8HZ6CZUZ3/ref=cm_cr_getr_d_rvw_ttl?ie=UTF8&ASIN=B0D9W2LL3T,"4.0 "," the United States "," May 23, 2024",Fit Type: 2.5'' High waistedSize: LargeColor: Black,Verified Purchase,"I’ve bought from this brand several times since I love the length for taller people like myself and comfortability. I recently had to buy a new pair of black ones since my washing machine shredded my other ones (could be a quality issue), but I noticed that the stitching in the front is different now than another pair of white ones I bought recently in the same style. I don’t know if they changed the look, but I included pictures of both.",8
Ari,Tight waist band,https://www.amazon.com/gp/customer-reviews/RDGIYK23BV6Q6/ref=cm_cr_getr_d_rvw_ttl?ie=UTF8&ASIN=B0D9W2LL3T,"4.0 "," the United States "," July 26, 2024",Fit Type: 2.5'' High waistedSize: MediumColor: Black,Verified Purchase,"They seem like good shorts and I love the pocket zipper, but the shorts fit around my hips with room but the waist band was extremely tight.",
Craig,great!,https://www.amazon.com/gp/customer-reviews/R1ZCF7AEKFP5VL/ref=cm_cr_getr_d_rvw_ttl?ie=UTF8&ASIN=B0D9W2LL3T,"4.0 "," the United States "," July 31, 2024",Fit Type: 2.5'' High waistedSize: SmallColor: Red,Verified Purchase,I really like these shorts! I think they look great in the front but they’re a little long in the back,
"Did not receive the 6-pack, only 1 Roblox figure was included. Very disappointed",Great running shorts,https://www.amazon.com/gp/customer-reviews/R2MP4AJZNM52MC/ref=cm_cr_getr_d_rvw_ttl?ie=UTF8&ASIN=B0D9W2LL3T,"4.0 "," the United States "," August 12, 2024",Fit Type: 2'' High waistedSize: MediumColor: Black371,Verified Purchase,Great quality for the value. Love the pocket for phone. My new go to shorts for running,
Charity,"Great fit, a bit short",https://www.amazon.com/gp/customer-reviews/R6XHO269T0NSH/ref=cm_cr_getr_d_rvw_ttl?ie=UTF8&ASIN=B0D9W2LL3T,"4.0 "," the United States "," August 11, 2024",Fit Type: 2.5'' High waistedSize: SmallColor: Blue54,Verified Purchase,"The colors are cute and the fit is nice, but for me it's a tad too short.",
Ashley,"The crotch sits awkwardly low, however I'm still keeping them because I still like the fit.",https://www.amazon.com/gp/customer-reviews/R2ERJ3YIUDU8DH/ref=cm_cr_getr_d_rvw_ttl?ie=UTF8&ASIN=B0D9W2LL3T,"4.0 "," the United States "," July 1, 2024",Fit Type: 2.5'' High waistedSize: LargeColor: Neongreen,Verified Purchase,"I love the bright neon green for a pop of color in my walking/working out shorts. They fit great except the crotch sits really low on me. Not enough to make me want to return them, but I feel like they could be a little more flattering.",
Dana ❤️,Like them,https://www.amazon.com/gp/customer-reviews/R37Q2K2E2UEUP5/ref=cm_cr_getr_d_rvw_ttl?ie=UTF8&ASIN=B0D9W2LL3T,"4.0 "," the United States "," August 9, 2024",Fit Type: 2.5'' High waistedSize: MediumColor: Wine Red,Verified Purchase,I may or may not get another one. Depends on how it feels running but so far comfy and cute. Hip and belly flattering but booty flattening in my opinion lol.,7
Grace Weisiger,So comfortable & perfect length,https://www.amazon.com/gp/customer-reviews/R2TKAP4KYV1LTW/ref=cm_cr_getr_d_rvw_ttl?ie=UTF8&ASIN=B0D9W2LL3T,"4.0 "," the United States "," June 25, 2024",Fit Type: 2.5'' High waistedSize: MediumColor: Blue54,Verified Purchase,"I am not a shorts person, but needed more exercise clothes to wear in the summer and am so glad I found these. The thick waist band keeps the shorts in place - they’re snug without digging in or causing those dreaded red marks. Super high quality and flattering - will be ordering in more colors!",
Claire Jakaitis,Thick band,https://www.amazon.com/gp/customer-reviews/R3E03XWQD5KTMC/ref=cm_cr_getr_d_rvw_ttl?ie=UTF8&ASIN=B0D9W2LL3T,"4.0 "," the United States "," July 27, 2024",Fit Type: 2'' High waistedSize: LargeColor: Black371,Verified Purchase,Love the thick band and don’t ride up! Pocket on side does not fit my iPhone 13 though,
Jenna Warkel,the best running shorts ever,https://www.amazon.com/gp/customer-reviews/R2A03QJ8ZO2X9T/ref=cm_cr_getr_d_rvw_ttl?ie=UTF8&ASIN=B0D9W2LL3T,"5.0 "," the United States "," July 18, 2024",Fit Type: 2.5'' High waistedSize: MediumColor: Black,Verified Purchase,i cannot hype these up enough. if you have wide hips and a smaller waist these are for you. i’ve always had trouble with low/mid rise running shorts riding up and needing to constantly pull them down to cover my butt. i haven’t had to adjust these once and they are also SO comfy. they are also super flattering since they aren’t cutting me off on my hips. the zippered pocket was a lovely surprise for me and i already ordered them in another color.,
Amanda,Only shorts I own,https://www.amazon.com/gp/customer-reviews/R16SW5TE6260M2/ref=cm_cr_getr_d_rvw_ttl?ie=UTF8&ASIN=B0D9W2LL3T,"5.0 "," the United States "," September 20, 2024",Fit Type: 2.5'' High waistedSize: SmallColor: Black,Verified Purchase,I don’t ever wear shorts. Even if it is 100 degrees outside. I don’t like my legs so I don’t want to show them. My workouts are in a sauna so it’s extra hot with yoga pants on so I needed shorts. These are the best things ever. I wear them everywhere not just for my workouts. I would highly recommend these shorts!,
Haley Long,Fits small,https://www.amazon.com/gp/customer-reviews/R1AEVBZGDFKV3R/ref=cm_cr_getr_d_rvw_ttl?ie=UTF8&ASIN=B0D9W2LL3T,"4.0 "," the United States "," August 9, 2024",Fit Type: 2.5'' High waistedSize: XX-LargeColor: Black,Verified Purchase,Nice material but they run pretty small. Would definitely size up!,
Amazon Customer,Shorts,https://www.amazon.com/gp/customer-reviews/R6MVUGY61FSAP/ref=cm_cr_getr_d_rvw_ttl?ie=UTF8&ASIN=B0D9W2LL3T,"5.0 "," the United States "," October 10, 2024",Fit Type: 2.5'' High waistedSize: X-SmallColor: Hot Pink,Verified Purchase,Love these so much! I ordered an XS 5ft 2 and 115lbs. They fit perfectly! Love the 2.5” length!,
Aurora,10000000x better than Lulu/FP/Aerie,https://www.amazon.com/gp/customer-reviews/R1XHCKQMEWS5HE/ref=cm_cr_getr_d_rvw_ttl?ie=UTF8&ASIN=B0D9W2LL3T,"5.0 "," the United States "," August 7, 2024",Fit Type: 2.5'' High waistedSize: SmallColor: Coffee,Verified Purchase,"Literally cannot rave enough about how good these shorts are. Everybody asks me where they’re from and are in disbelief when I say Amazon! They fit perfectly, have a good-sized pocket, and come in so many cute colors! They’re great for working out or just for athleisure. The high-rise waistband is nice and stretchy, but sucks in your stomach too. I get the 2.5 inch inseam and they are short enough in the front, but also cover enough in the back. The liner is also great. I literally ONLY wear these shorts now!!",2
Taylor,Love these!!!,https://www.amazon.com/gp/customer-reviews/R2XAYGG7VBRDAR/ref=cm_cr_getr_d_rvw_ttl?ie=UTF8&ASIN=B0D9W2LL3T,"4.0 "," the United States "," September 26, 2023",Fit Type: 2.5'' High waistedSize: MediumColor: Black,Verified Purchase,"I don’t usually write reviews - I’ve tried a ton of Amazon workout gear and honestly hadn’t been impressed until I found these shorts. I’m 5’7” 145 lbs (usually a S in shorts/bottoms) and i sized up to a M hoping the liner wouldn’t dig in when I run. It’s so insanely comfortable. The liner is more of a brief fit and is the softest material. That’s the only main concern I’ve ever had with lululemon, Nike, etc. my only complaints with these shorts are that the material of the actual short part are super thin paper like. It feels sweat wicking but I could still see sweat marks on them. The band is also super thick and is also made of that same sweat wicking material so it isn’t the most comfortable for long runs. Had the band been made of the liner material these would be the holy grail!! Pockets are also deep enough for iPhone + case (and still room in the pocket with zipper zipped!",11
meghan,Favorite High Waisted Shorts,https://www.amazon.com/gp/customer-reviews/RE8PGH451Q5RA/ref=cm_cr_getr_d_rvw_ttl?ie=UTF8&ASIN=B0D9W2LL3T,"5.0 "," the United States "," November 4, 2024",,Verified Purchase,Absolutely love love love these! I have them in so many colors! They are high waisted and comfy in the legs! My go to shorts every time!,2
Amazon Customer,Cute workout shorts,https://www.amazon.com/gp/customer-reviews/R1F6AZ7OAR3DIN/ref=cm_cr_getr_d_rvw_ttl?ie=UTF8&ASIN=B0D9W2LL3T,"4.0 "," the United States "," June 15, 2024",Fit Type: 2.5'' High waistedSize: X-LargeColor: Black,Verified Purchase,"I love these workout shorts! Very comfortable, looks cute on. The elastic around waist is good. Material light and perfect for a sweaty workout. Only thing is the pocket will show if shorts rise. Lined  underwear in the shortsis a plus. I  bought another pair.",
Amazon Customer,The Best Athletic Shorts,https://www.amazon.com/gp/customer-reviews/R2NIAGNOKDW9T6/ref=cm_cr_getr_d_rvw_ttl?ie=UTF8&ASIN=B0D9W2LL3T,"5.0 "," the United States "," July 23, 2024",Fit Type: 2.5'' High waistedSize: MediumColor: Red,Verified Purchase,"The BMJL Women's Athletic Shorts are one of those repeat clothing items for me. I first ordered these in the year 2020 and fell in love. They are high waisted with a thick waist band. The length is not too long, but not too short. They have great coverage! The one side zipper pocket is big enough to hold your iPhone. I am so glad these come in over 20 different colors, as I continue to order more each summer. I will add, however, my grey pair fits slightly tighter for whatever reason. Overall- definitely a 10/10 item!",
Maddie,favorite active shorts,https://www.amazon.com/gp/customer-reviews/R3MZT1TM28P5E/ref=cm_cr_getr_d_rvw_ttl?ie=UTF8&ASIN=B0D9W2LL3T,"5.0 "," the United States "," September 25, 2024",Fit Type: 2.5'' High waistedSize: MediumColor: Black,Verified Purchase,"As a girl with long legs, these are the perfect length. I’m 5’6 chasing a toddler and didn’t feel like I was flaunting it. They also got soaked during a rain shower in Disney and dried super quick. So comfortable, would buy more if I needed them!",
Andrea DeGroot,Great for the mom tummy!,https://www.amazon.com/gp/customer-reviews/R2EHQBL805D1C6/ref=cm_cr_getr_d_rvw_ttl?ie=UTF8&ASIN=B0D9W2LL3T,"5.0 "," the United States "," September 15, 2024",Fit Type: 2.5'' High waistedSize: MediumColor: Black,Verified Purchase,"I bought the black pair first and after how well it hid my mom tummy, I bought 3 more pairs! The quality is great, the fit is great and they do tuck ya in without being so short that your booty hangs out! I am 5'1 and 135lbs for reference. I bought them in Medium!",
Marissa Lewis,4th pair to buy!,https://www.amazon.com/gp/customer-reviews/R2O6L287BEIV5I/ref=cm_cr_getr_d_rvw_ttl?ie=UTF8&ASIN=B0D9W2LL3T,"5.0 "," the United States "," September 14, 2024",Fit Type: 2.5'' High waistedSize: XX-LargeColor: Black,Verified Purchase,I’ve bought 4 pairs and will never go back! I love the fit and quality of these and the single pocket is perfect! And feel like they are a great lulu lemon dupe for the price!,
sherri brown,Great fit,https://www.amazon.com/gp/customer-reviews/RTPBKE1PI386E/ref=cm_cr_getr_d_rvw_ttl?ie=UTF8&ASIN=B0D9W2LL3T,"5.0 "," the United States "," October 31, 2024",Fit Type: 2.5'' High waistedSize: SmallColor: White,Verified Purchase,I love these shorts for working out,
Ashley Landry,"Comfy, and flattering.",https://www.amazon.com/gp/customer-reviews/R13C18JP5RVSBV/ref=cm_cr_getr_d_rvw_ttl?ie=UTF8&ASIN=B0D9W2LL3T,"4.0 "," the United States "," April 24, 2024",Fit Type: 2.5'' High waistedSize: LargeColor: Black,Verified Purchase,"I bought a pair for me and a friend since i ordered the wrong size the first time. We are two completely different body types, and they look great on both of us. Its fitted and holds the tummy in place. Not my favorite to work out in, but definitely to wear around with a t shirt.",
Amy,Love these!,https://www.amazon.com/gp/customer-reviews/R1P6LF8E1LJI02/ref=cm_cr_getr_d_rvw_ttl?ie=UTF8&ASIN=B0D9W2LL3T,"5.0 "," the United States "," October 25, 2024",Fit Type: 2.5'' High waistedSize: MediumColor: Neongreen,Verified Purchase,Great shorts! Perfect length and great waistband that doesn’t roll. I bought multiple colors! Very comfortable as well.,
Beth,Love!!,https://www.amazon.com/gp/customer-reviews/R1HGQLJMSYTTS8/ref=cm_cr_getr_d_rvw_ttl?ie=UTF8&ASIN=B0D9W2LL3T,"5.0 "," the United States "," September 22, 2024",Fit Type: 2.5'' High waistedSize: LargeColor: Sky Blue,Verified Purchase,"Loved them so much, I bought them a second time! Love that the length is slightly longer on the back. The dolphin hem is my favorite style of shorts too, and it has a small pocket, great for cash or a debit card/ID. For reference, I'm 5'5"" and 165-170.",
brett a marsh,So comfortable with perfect coverage.,https://www.amazon.com/gp/customer-reviews/R2E38EL0D9I8XK/ref=cm_cr_getr_d_rvw_ttl?ie=UTF8&ASIN=B0D9W2LL3T,"5.0 "," the United States "," September 22, 2024",Fit Type: 2.5'' High waistedSize: MediumColor: Summergreen,Verified Purchase,"These workout shorts are definitely in my top 3. I love how comfortable they are, fabric is soft, with no binding in the leg area, with the perfect amount of coverage. The color is beautiful. I will definitely be purchasing more from this line. I highly recommend this item!",
Peacefrog01833,Don’t size up,https://www.amazon.com/gp/customer-reviews/R3S302TB5VZCRK/ref=cm_cr_getr_d_rvw_ttl?ie=UTF8&ASIN=B0D9W2LL3T,"4.0 "," the United States "," June 11, 2024",Fit Type: 2.5'' High waistedSize: LargeColor: Coffee,Verified Purchase,These shorts are cute and a nice running material but I made the mistake of sizing up due to other reviews. They are very large on me. I’m typically a size 6/med with thick thighs. I ordered large and should’ve stuck with medium. Lesson learned.,
Brandi M,They're ok - I will keep them,https://www.amazon.com/gp/customer-reviews/R2MDKA24V4TE72/ref=cm_cr_getr_d_rvw_ttl?ie=UTF8&ASIN=B0D9W2LL3T,"4.0 "," the United States "," May 24, 2024",Fit Type: 2.5'' High waistedSize: SmallColor: Khaki,Verified Purchase,I ordered these and 2 other brands off of amazon at the same time.. these are my least favorite. I am a slender built 5'3 120lb and the legs are super wide on my athletic built legs. I will keep them though because they are comfortable.. just not as flattering as the others I bought.,
SJansen,Pocket,https://www.amazon.com/gp/customer-reviews/R3RGJFO7CCR2VM/ref=cm_cr_getr_d_rvw_ttl?ie=UTF8&ASIN=B0D9W2LL3T,"4.0 "," the United States "," July 22, 2024",Fit Type: 2.5'' High waistedSize: LargeColor: Black,Verified Purchase,Love the fit and feel… wish the pocket was on the right side.,
