评论用户,评论概述,评论链接,星级评分,评论地点,评论时间,类型,是否购买,评论详情,觉得该评论有帮助的人数
Kara,My favorite shorts,https://www.amazon.com/gp/customer-reviews/R3BH0KX0I95AVL/ref=cm_cr_arp_d_rvw_ttl?ie=UTF8&ASIN=B0D9W2LL3T,"5.0 "," the United States "," August 29, 2024",Fit Type: 2.5'' High waistedSize: X-LargeColor: Black,Verified Purchase,"I have no less than 10 pairs of these shorts and I recommend them to everyone because of how much I love them. I have a larger mid section with a bit of an apron belly and the wider 2.5” waist band is perfect. It not only provides a bit of compression (without being uncomfortable), but the waistband sits high enough to where it doesn’t give me love handles. They are both comfortable and super flattering and I love that it has a zipper pocket and that the pocket is big enough to put my phone in. I honestly wish they had two zipper pockets, but that’s literally my only “complaint”. I’m 5’7”, weigh around 215 and usually wear between a size 16-18 pants. I prefer the XXL size in these shorts because I feel they are a bit looser and a more comfortable fit, but the XL size fits just fine too.",15
April Horne,These are it!!!!,https://www.amazon.com/gp/customer-reviews/R22E6C8CIH99CA/ref=cm_cr_arp_d_rvw_ttl?ie=UTF8&ASIN=B0D9W2LL3T,"5.0 "," the United States "," August 3, 2024",Fit Type: 2.5'' High waistedSize: LargeColor: Red,Verified Purchase,"I purchased red and white and AM IN LOVE WITH THESE!! Tummy control - check! Length - check! Shows just enough thighs. Very flattering from any POV. I will be buying the others colors for no other reason than I just want them just in case. OH! There’s a pocket on the left side that has a zipper. Large enough to hold your phone, which came in handy when I got on the rides. Light weight. Vibrant colors. Comfy. Cute. GET IT.",13
Kindle Customer,Perfect orange,https://www.amazon.com/gp/customer-reviews/R1YRSFHCI3ZT0N/ref=cm_cr_arp_d_rvw_ttl?ie=UTF8&ASIN=B0D9W2LL3T,"4.0 "," the United States "," August 7, 2024",Fit Type: 2.5'' High waistedSize: SmallColor: Neon Orange013,Verified Purchase,"I'm 4'11"" and 102lbs. I got a small and although they fit, I'm not 100% happy with them. I love the color, the zipper pockets, material (need to see if sweat will show), and that they are high wasted shorts. The backs are a little too long for my liking so I am going to keep trying them on in front of the mirror during my return time frame to see if I'll get over it or not. Since I'm short, they definitely look like puffy mom shorts on me. My fingertips sit right on the front length. They fit the same on the waist when sitting down; I'll need to sit in front of a mirror to see how they look when I sit though. Since the waist is so high and a bit thick, the waist is supportive. They will definitely remind you to sit up straight so that's a plus because slouching is not cute. They are true to size and to a T, so really be honest about your measurements when you order. If you are close going up a size and you know you fluctuate in weight, go up a size, sis.  My husband appreciated that my cheeks were not hanging out like the shorts I usually get at T@rget. They have a runner's liner too so I don't know what he's talking about. Their XL little girl's high waisted running shorts fit better if you want to try those before purchasing these. They are shorter by about 2 inches, same length all around, have lining, and are about ten bucks cheaper.  I'm hoping they are good tennis shorts to hold the balls in my pockets or to dress up cut for my son's games. Orange is one of his school colors and I always go all with my outfits to show support.",5
Kparsons,Forgiving and comfy,https://www.amazon.com/gp/customer-reviews/R3MBF3GG4MICOX/ref=cm_cr_arp_d_rvw_ttl?ie=UTF8&ASIN=B0D9W2LL3T,"5.0 "," the United States "," December 1, 2024",Fit Type: 2.5'' High waistedSize: X-LargeColor: Black,Verified Purchase,I was nervous about the fit of these as I’m postpartum but was pleasantly surprised about the stretch of the waistband. I have a long torso and appreciate the high waist of these. Very comfortable and flattering.,
Meagan,"Stretchy, breathable, and comfortable",https://www.amazon.com/gp/customer-reviews/R4F3U0SZC33A0/ref=cm_cr_arp_d_rvw_ttl?ie=UTF8&ASIN=B0D9W2LL3T,"5.0 "," the United States "," October 11, 2024",Fit Type: 2.5'' High waistedSize: X-LargeColor: Lake Blue,Verified Purchase,"Got an XL, overall fit is exactly what I wanted. Breathable and stretchy for any workout but fitted enough for a day spent out with family. Length was good and not showing too much leg. Quality of material is squat proof but not super thick. Nice thick waistband keeps everything in place and having the one pocket is perfect for running errands or needing both hands free. I have almost every color and want more.",
Mamie Herrmann,Left handed pocket,https://www.amazon.com/gp/customer-reviews/R3T24O78FD3SJC/ref=cm_cr_arp_d_rvw_ttl?ie=UTF8&ASIN=B0D9W2LL3T,"3.0 "," the United States "," August 17, 2024",Fit Type: 2.5'' High waistedSize: MediumColor: Black,Verified Purchase,"They're comfortable and the high waist is nice. I usually wear a small, but ordered a medium based on other reviews, and they're still just a bit snug. The pocket is on the left, which is less than ideal for a right handed person. I'm a runner, but I would not wear these for a longer run.  With the pocket zipped, my phone fits and stays securely in the pocket while I'm running. However, because the pocket is on the outer layer of the shorts, my phone bounced around on my thigh while I was running. Not a show stopper, but certainly annoying. They also make my butt look flat. I'll keep looking for the perfect running shorts, these are not it for me.",
Meghan,Love these shorts,https://www.amazon.com/gp/customer-reviews/R7OWPQ19XAATX/ref=cm_cr_arp_d_rvw_ttl?ie=UTF8&ASIN=B0D9W2LL3T,"5.0 "," the United States "," September 8, 2024",Fit Type: 2.5'' High waistedSize: MediumColor: Darkblue,Verified Purchase,"I find them to be quite comfortable and flattering. The fact that they have a liner in them that makes it so you're not fully ""feeling the breeze"" is great, and of course, it's always nice to have pockets, even if it's only one. The pocket isn't super small either. I initially bought the black pair and actually ended up coming back after a few months to get two more colors, grey and navy, all of which seem to be exactly as shown. I'm not sure if I'm supposed to, but I do put them in both the washer and dryer. They've been through the process multiple times on the regular washer setting and medium heat drying without issue so far. I just make sure to put them with lighter material clothing like t-shirts.",2
Amazon Customer,IM IN LOVE!!,https://www.amazon.com/gp/customer-reviews/R1S8E1VVXQWYV6/ref=cm_cr_arp_d_rvw_ttl?ie=UTF8&ASIN=B0D9W2LL3T,"5.0 "," the United States "," December 14, 2024",Fit Type: 2.5'' High waistedSize: MediumColor: Red,Verified Purchase,DONT WALK RUN! These are the best shorts ever. They are soooo cute!! I normally wear Nike athletic shorts which are pricy but these are better and a better price. They snatch your waist and they are a little longer in the back (which I like). I will be ordered in many more colors.,
Claire,Loved so much I bought more!,https://www.amazon.com/gp/customer-reviews/R2CTQLHKQNR5NA/ref=cm_cr_arp_d_rvw_ttl?ie=UTF8&ASIN=B0D9W2LL3T,"5.0 "," the United States "," January 10, 2025",Fit Type: 2.5'' High waistedSize: MediumColor: Neon Orange013,Verified Purchase,"I have recently lost a little bit of muscle in my legs and my shorts from Athleta, make my legs look skinny and horrible (which is something a good pair of athletic shorts does not do) and these make me feel confident and ready to get in shape, plus the price is great! I have already ordered another color! These are tall girl approved as well (I'm 5'10 around 145).",
landon,Love them,https://www.amazon.com/gp/customer-reviews/R3VOC854DRBRD5/ref=cm_cr_arp_d_rvw_ttl?ie=UTF8&ASIN=B0D9W2LL3T,"5.0 "," the United States "," January 16, 2025",Fit Type: 2.5'' High waistedSize: MediumColor: Hot Pink,Verified Purchase,Love these. Super comfy and the liner doesn’t ride up. I’m 5’8” and 145 lbs and a medium fits great. The band is stretchy and a lot more comfortable than free people brand. I do wish the back was a slight bit shorter but overall I love them.,
Julie Lytle,Color bleeds in the wash,https://www.amazon.com/gp/customer-reviews/R2ND5W3SLLK5PH/ref=cm_cr_getr_d_rvw_ttl?ie=UTF8&ASIN=B0D9W2LL3T,"4.0 "," the United States "," January 18, 2025",Fit Type: 2.5'' High waistedSize: X-LargeColor: Red,Verified Purchase,These fit great and have held up really well but beware the color bleeds when washing. Learn from me and don’t wash with anything white,
Rachel Martin,Light weight,https://www.amazon.com/gp/customer-reviews/R1U0BRJ24D2NUD/ref=cm_cr_getr_d_rvw_ttl?ie=UTF8&ASIN=B0D9W2LL3T,"5.0 "," the United States "," January 2, 2025",,Verified Purchase,Color is perfect. Light weight and comfortable. I would say they run slightly big. Moisture wicking but they do wrinkle easily. Over all I love these shorts,
Laura,Fit well,https://www.amazon.com/gp/customer-reviews/R1HDPCZ4WYL4RD/ref=cm_cr_getr_d_rvw_ttl?ie=UTF8&ASIN=B0D9W2LL3T,"5.0 "," the United States "," January 11, 2025",Fit Type: 2.5'' High waistedSize: XX-LargeColor: Red,Verified Purchase,These shorts fit well.  The material is thin but not see through.,
L. Palmer,Comfortable and Stylish Athletic Shorts for Active Women,https://www.amazon.com/gp/customer-reviews/R157H5UXC6FLUE/ref=cm_cr_getr_d_rvw_ttl?ie=UTF8&ASIN=B0D9W2LL3T,"5.0 "," the United States "," May 23, 2024",Fit Type: 2.5'' High waistedSize: SmallColor: Wine Red,Verified Purchase,"I recently purchased the BMJL Women's Athletic Shorts, and I couldn't be happier with my purchase. Here's why these shorts have become a staple in my active wardrobe:  **Pros:** 1. **Comfortable High Waist:** The high-waisted design is both flattering and functional. It provides excellent support and coverage during workouts without feeling restrictive. Plus, it helps to smooth and shape the midsection for a flattering silhouette. 2. **Breathable Fabric:** The shorts are made from a lightweight and breathable fabric that keeps you cool and comfortable during even the most intense workouts. It wicks away moisture, allowing you to stay dry and focused on your activities. 3. **Convenient Pockets:** The addition of pockets is a game-changer. They're perfect for holding your phone, keys, or other essentials while you're on the go, eliminating the need for a separate bag or armband. 4. **Versatile Style:** These shorts are not only great for workouts but also stylish enough to wear for running errands or lounging at home. The sporty design and elastic waistband add a trendy touch to any casual outfit. 5. **Durable Construction:** Despite their lightweight feel, these shorts are surprisingly durable. The seams are well-constructed, and the fabric holds up well to repeated wear and washing without losing its shape or color. 6. **Wide Range of Sizes:** The shorts are available in a wide range of sizes, making it easy to find the perfect fit for your body type. Plus, the elastic waistband provides some flexibility in sizing for added comfort.  **Cons:** 1. **Sizing Accuracy:** Some users may find that the sizing runs slightly small, so it's worth checking the size chart before ordering to ensure the best fit. 2. **Limited Color Options:** While the available colors are stylish and versatile, a greater variety of color options would be appreciated to suit different preferences and styles.  **Overall:** The BMJL Women's Athletic Shorts are a fantastic choice for active women looking for comfortable and stylish workout gear. Their high-waisted design, breathable fabric, and convenient pockets make them a practical and fashionable choice for any activity. Whether you're hitting the gym, going for a run, or simply running errands, these shorts have you covered in both comfort and style. I highly recommend them to anyone in need of quality athletic wear.",29
Boka,Awesome x2,https://www.amazon.com/gp/customer-reviews/R2YXZ80R2QO6DY/ref=cm_cr_getr_d_rvw_ttl?ie=UTF8&ASIN=B0D9W2LL3T,"5.0 "," the United States "," January 3, 2025",Fit Type: 2.5'' High waistedSize: LargeColor: Black,Verified Purchase,Perfect. Light weight. Has a zipper pocket! The band is absolutely amazing. And flattering. Love these!,
Mercedes Castro,Quality,https://www.amazon.com/gp/customer-reviews/R1HXVV8DV06E0K/ref=cm_cr_getr_d_rvw_ttl?ie=UTF8&ASIN=B0D9W2LL3T,"5.0 "," the United States "," January 5, 2025",Fit Type: 2.5'' High waistedSize: MediumColor: Black,Verified Purchase,I enjoyed these shorts they are soft and the quality is good,
E,Comfy and Functional,https://www.amazon.com/gp/customer-reviews/RUZRF061GC1FX/ref=cm_cr_getr_d_rvw_ttl?ie=UTF8&ASIN=B0D9W2LL3T,"4.0 "," the United States "," October 13, 2024",Fit Type: 2.5'' High waistedSize: X-LargeColor: Black,Verified Purchase,"Perfect length - not too long and not too short. They're super high waisted too, sitting at my belly button. Extremely breathable and didn't hold on to any sweat. The waist band is incredibly stretchy and comfy. I sized up to an XL but could've been fine with my normal size L (but wanted the extra length). The quality seems nice so far, they held up well while rock climbing and the built-in underwear add an extra layer of security. I would have preferred if the underlayer was a tad longer and more like built-in shorts, but I'm surprised how comfy the built-in underwear are. They don't ride up at all while walking!",
Jen Denhart,"color not green AT ALL def gray, but i will keep them",https://www.amazon.com/gp/customer-reviews/R129GDK50SLW3B/ref=cm_cr_getr_d_rvw_ttl?ie=UTF8&ASIN=B0D9W2LL3T,"4.0 "," the United States "," November 4, 2024",Fit Type: 2.5'' High waistedSize: LargeColor: Summergreen,Verified Purchase,"i love these shorts so much, this is my second pair. Was hoping they were more the green that they pictured, but them being gray is fine. JSYK, they are GRAY. But, they fit perfect, true to size. I am 5' 5""/170 lbs and got a size L",
Sydney,The BEST Shorts,https://www.amazon.com/gp/customer-reviews/R1RZJR4BIROC5E/ref=cm_cr_getr_d_rvw_ttl?ie=UTF8&ASIN=B0D9W2LL3T,"5.0 "," the United States "," December 3, 2024",Fit Type: 2.5'' High waistedSize: LargeColor: Black,Verified Purchase,"I love these shorts so much, enough where I have multiple colors. The band is wide, so you feel high waisted and supported. They aren’t extremely short. Comes with built in underwear piece, so you don’t feel exposed. Love them so much!",
Chloe,So comfy,https://www.amazon.com/gp/customer-reviews/R34V9KG6PC23RG/ref=cm_cr_getr_d_rvw_ttl?ie=UTF8&ASIN=B0D9W2LL3T,"5.0 "," the United States "," December 16, 2024",Fit Type: 2.5'' High waistedSize: LargeColor: Hot Pink,Verified Purchase,These shorts are good just to wear or for the gym! Very vibrant color! I would downsize,
B.L.S.,Great shorts,https://www.amazon.com/gp/customer-reviews/RWQFX0DHPI4AI/ref=cm_cr_getr_d_rvw_ttl?ie=UTF8&ASIN=B0D9W2LL3T,"5.0 "," the United States "," December 24, 2024",Fit Type: 2.5'' High waistedSize: LargeColor: Black,Verified Purchase,"Great, runs true to size",
Kilidonia de Acero,Cool & comfortable,https://www.amazon.com/gp/customer-reviews/R3HUVCQGOCOMJK/ref=cm_cr_getr_d_rvw_ttl?ie=UTF8&ASIN=B0D9W2LL3T,"4.0 "," the United States "," July 21, 2024",Fit Type: 2.5'' High waistedSize: SmallColor: Violet,Verified Purchase,"Material is really comfortable and seems like it will stay cool even in the hot Florida weather. Soft violet color is great. These are a size small. They fit fine but are a bit short for me. I ordered the black ones in a size medium because I read in a few other reviews that the black ran smaller than the other colors, but I still found the medium in the black too short for me but also too wide at the bottom, which is why I'm not keeping them in the medium and am keeping these violet ones in small. They're completely comfortable and cute enough to keep, and the inner panty is not too tight even in the small. For reference I'm 5ft 6in, 123 lbs, rather long legged, usual size 4. I would have preferred these just a tad larger but not large enough to exchange them for a medium.",7
Liz Schoch,Very light weight and comfortable lining,https://www.amazon.com/gp/customer-reviews/R3JOQ9CBHQWDF8/ref=cm_cr_getr_d_rvw_ttl?ie=UTF8&ASIN=B0D9W2LL3T,"4.0 "," the United States "," June 14, 2024",Fit Type: 2.5'' High waistedSize: SmallColor: White,Verified Purchase,"For reference I’m 5’4 and around 125lbs. I carry my weight in my midsection so I hate things that are too tight in the tummy. It may not look like it in the photo because these really snatch your waist!  PROS: these look just like the photo. They are very lightweight, the length is perfect, and the lining is a major plus. It doesn’t ride up or feel restrictive.  CONS: the waistband isn’t my favorite. It looks good but it’s just slightly too tight for me and causes a tiny roll if I'm not sucking in. It feels uncomfortable after long wear. I ordered a medium in pink to see if that was better (and it was) but I didn’t like the length of the medium compared to the small. I’m keeping these and doing some stretching of the waistband in hopes of making them more comfy. I also have a few pounds I’m working on loosing so I think I’m going to love them in a few weeks lol.  That being said, I will be buying more colors because if I simply half tuck a tshirt, that fixes the chaffing so I can deal with the tightness (for now). It’s a win for me.",41
Nicole,Awkward,https://www.amazon.com/gp/customer-reviews/R131C7MLT5PUE/ref=cm_cr_getr_d_rvw_ttl?ie=UTF8&ASIN=B0D9W2LL3T,"4.0 "," the United States "," August 20, 2024",Fit Type: 2.5'' High waistedSize: LargeColor: Bluish Grey,Verified Purchase,"The waistband is great, it came up nice and high and not too snug. I was surprised to find it only had one pocket, on the left side. The pocket did have a zipper, so that was nice. I also like the fabric of the inner liner (in some shorts, it's very plasticy). However, when I walked, the fabric bunched up in a boxy, awkward manner at my crotch - it made me wonder if I had put on the shorts backwards. Unfortunately, they were definitely on the correct way, and therefore, I returned them.",2
Amazon Customer,Great for anything,https://www.amazon.com/gp/customer-reviews/R152TN0RHUVHWM/ref=cm_cr_getr_d_rvw_ttl?ie=UTF8&ASIN=B0D9W2LL3T,"5.0 "," the United States "," December 3, 2024",Fit Type: 2.5'' High waistedSize: MediumColor: Black,Verified Purchase,My daughter loves wearing these for any occasion. She especially loves the pockets.,
Katelin Margerett Qualtier,Very cute,https://www.amazon.com/gp/customer-reviews/R1F91URKDSIY4G/ref=cm_cr_getr_d_rvw_ttl?ie=UTF8&ASIN=B0D9W2LL3T,"4.0 "," the United States "," May 22, 2024",Fit Type: 2.5'' High waistedSize: LargeColor: Summerred,Verified Purchase,"These are super high waisted and they have a stretchy, but synching waist band. They are nice and flattering and I like the spanx/shorts underneath. Typically I never buy shorts with an inside liner or a built-in underwear type of thing, but these are supeeerrr comfy and u don’t have to worry about them riding up since the liner underneath keeps you covered! The outside of the shorts material is not very stretchy, even though the waistband and the liner shorts are.  My thighs have definitely grown in size since I bought this pair, so I don’t really wear them much anymore because the way it fits me with bigger thighs makes them pretty dang short… but that’s my thing! If I were to buy them right now, I would size up just so they wouldn’t be so short on my thighs. So keep that in mind if you have thicker thighs since the actual shorts material isn’t the most stretchy",3
Callie,Cute,https://www.amazon.com/gp/customer-reviews/R1WKJWRVW5KN9O/ref=cm_cr_getr_d_rvw_ttl?ie=UTF8&ASIN=B0D9W2LL3T,"4.0 "," the United States "," August 19, 2024",Fit Type: 2.5'' High waistedSize: MediumColor: Royalblue,Verified Purchase,Not sure how I feel about these yet. They are cute and comfortable but the sizing on them seem off. I ending up sizing up but probably could use the smaller size. The length in the back is longer than the front. I’m not sure if I like that look. The shorts came very wrinkled so they need to be ironed before wearing. I want to like these shorts because of comfort but not sure it fits my body.,
T. Woodbury,"Nice, but not true to size",https://www.amazon.com/gp/customer-reviews/R38X7BZB9VN5FM/ref=cm_cr_getr_d_rvw_ttl?ie=UTF8&ASIN=B0D9W2LL3T,"4.0 "," the United States "," September 16, 2024",Fit Type: 2.5'' High waistedSize: LargeColor: Bluish Grey,Verified Purchase,"They are nice, but not a true fit. Warning: size up. These fit a size smaller than all my other shorts of various brands.  Also, if you’re trying to avoid items made in China move on from this brand.",
Fran,Good,https://www.amazon.com/gp/customer-reviews/R1GQ1VSCIPZ5OR/ref=cm_cr_getr_d_rvw_ttl?ie=UTF8&ASIN=B0D9W2LL3T,"4.0 "," the United States "," September 17, 2024",Fit Type: 2.5'' High waistedSize: SmallColor: Bluish Grey,Verified Purchase,Compression is good around waist for running they never fell down. My thighs did gobble up the inseam though so you can chafe if not careful. Pocket isn’t great for running with anything in it because it flops around,
Jenny,Comfy shorts,https://www.amazon.com/gp/customer-reviews/R1KRZSCV8LSA4F/ref=cm_cr_getr_d_rvw_ttl?ie=UTF8&ASIN=B0D9W2LL3T,"4.0 "," the United States "," September 10, 2024",Fit Type: 2.5'' High waistedSize: MediumColor: Black,Verified Purchase,Shorts fit great and look nice with the chunky high wasted band. Only down fall is the zipper on the left side sticks out and looks pointy. Not as form fitting to the hip as the right side of the shorts with no zipper.,
Janelle,Wrong Size?,https://www.amazon.com/gp/customer-reviews/R3356VBOW7Z0H3/ref=cm_cr_getr_d_rvw_ttl?ie=UTF8&ASIN=B0D9W2LL3T,"4.0 "," the United States "," September 1, 2024",Fit Type: 2.5'' High waistedSize: LargeColor: Black,Verified Purchase,"The recommended size for me was L, but it’s a bit big. I wish I got a M size. Other than this, I love the shorts! They’re great for swimming, working out, or doing errands. I’m not a big fan of the underwear, but it’s alright for me.",
Beth Roy,Most comfortable,https://www.amazon.com/gp/customer-reviews/R2U6QQOF3IE6G3/ref=cm_cr_getr_d_rvw_ttl?ie=UTF8&ASIN=B0D9W2LL3T,"4.0 "," the United States "," August 8, 2024",Fit Type: 2.5'' High waistedSize: XX-LargeColor: Black,Verified Purchase,"I LOVE LOVE LOVE these shorts. I have the 2.5 inch inseam and they are perfect for the thick thigh women out there. The high waist really does help shape your waist but doesn’t make you feel like your being squeezed. The only thing I don’t like is the pocket is on the left side. They wash well, they’re light weight and the color is perfect. If I could wear these to work, I would.",2
Kristina Porro,Love these shorts,https://www.amazon.com/gp/customer-reviews/RK9ECGKL9YB7V/ref=cm_cr_getr_d_rvw_ttl?ie=UTF8&ASIN=B0D9W2LL3T,"5.0 "," the United States "," November 26, 2024",Fit Type: 2.5'' High waistedSize: X-LargeColor: Black,Verified Purchase,So cute and comfy and dont weigh anything,
Lorissa,Good quality,https://www.amazon.com/gp/customer-reviews/R35G719JQ89V2U/ref=cm_cr_getr_d_rvw_ttl?ie=UTF8&ASIN=B0D9W2LL3T,"4.0 "," the United States "," August 29, 2024",Fit Type: 2.5'' High waistedSize: X-LargeColor: Black,Verified Purchase,"I like the shorts for when I’m on the go and don’t feel like putting on jeans, good quality, stylish. They are a little long, so be careful with what size you buy. If you’re on the shorter side, you may be in between sizes.",
Good hair,Super cute,https://www.amazon.com/gp/customer-reviews/R2O8T9B0Q8JLUW/ref=cm_cr_getr_d_rvw_ttl?ie=UTF8&ASIN=B0D9W2LL3T,"4.0 "," the United States "," September 19, 2024",Fit Type: 2.5'' High waistedSize: SmallColor: Black,Verified Purchase,I think the shorts are super cute. A little pricey compared to the same ones I found on SHEIN but it’s still good quality!,
Callie,Good shorts but not perfect,https://www.amazon.com/gp/customer-reviews/RDBX2Z0BG80K7/ref=cm_cr_getr_d_rvw_ttl?ie=UTF8&ASIN=B0D9W2LL3T,"4.0 "," the United States "," May 24, 2024",Fit Type: 2.5'' High waistedSize: SmallColor: Red,Verified Purchase,"I like these shorts mostly. But the waistband is so TALL (just the elastic band is at least 3.5-4 inches tall) that it kind of digs into my whole stomach while wearing them. I got the red and the color is awesome! The have a pocket on the left side only (as a right handed person, I found this a bit annoying to use). They have gone through the wash with no issues. No bleeding of fading. The length is great. I walk a lot in our neighborhood and never feel like these are rising up or are too short. It’s just the height of the waistband that annoys me. Maybe I should try a different size (although this is my suggested size based on the size chart).",
donna fletcher,Fits smaller to size,https://www.amazon.com/gp/customer-reviews/RMU8DTMLYFNYU/ref=cm_cr_getr_d_rvw_ttl?ie=UTF8&ASIN=B0D9W2LL3T,"4.0 "," the United States "," September 26, 2024",Fit Type: 2.5'' High waistedSize: LargeColor: Black,Verified Purchase,Shorts run small. Order up a size but quality is great and shorts are comfy,
