Kristin Haartman,Soft and lightweight,https://www.amazon.com/gp/customer-reviews/RZF2H3F929WJS/ref=cm_cr_getr_d_rvw_ttl?ie=UTF8&ASIN=B0CCJ4BJ2G,"5.0 "," the United States "," October 29, 2024",Size: SmallColor: Olive Green,Verified Purchase,I love the thick waistband!,
Mary Morales,2nd season buying.,https://www.amazon.com/gp/customer-reviews/R33P0FWEJAFN8Q/ref=cm_cr_getr_d_rvw_ttl?ie=UTF8&ASIN=B0CCJ4BJ2G,"5.0 "," the United States "," October 27, 2024",Size: MediumColor: Olive Green,Verified Purchase,Very nice fabric. Washes well and wares comfortable.,
Lulu007,G Gradual Women's Joggers High Waisted Yoga Pants with Pockets Loose Leggings for Women,https://www.amazon.com/gp/customer-reviews/RNRZNYP1LZW7B/ref=cm_cr_getr_d_rvw_ttl?ie=UTF8&ASIN=B0CCJ4BJ2G,"4.0 "," the United States "," February 24, 2024",Size: SmallColor: Navy,Verified Purchase,"Buyer beware. A small is definitely a small. I am 5’ 0” tall 144lbs. The pants fit perfect around the waist.  Wish it had more leg room and that they were a little longer. I bought this pair because they resembled an Ideology brand that I purchased through Macy’s, they were close but the material was not as silky and smooth as I would have liked. The pants were delivered in a zippered plastic bag. No other wrapping.",3
colleen leonard,Super comfy,https://www.amazon.com/gp/customer-reviews/R380V3NLY0L8N4/ref=cm_cr_getr_d_rvw_ttl?ie=UTF8&ASIN=B0CCJ4BJ2G,"5.0 "," the United States "," November 10, 2024",Size: XX-LargeColor: Brown,Verified Purchase,Very comfortable. Super comfortable. Washes well,
jazzharris@duck.com,Comfortable and good-looking,https://www.amazon.com/gp/customer-reviews/RCGIJPLS0QRPD/ref=cm_cr_getr_d_rvw_ttl?ie=UTF8&ASIN=B0CCJ4BJ2G,"5.0 "," the United States "," September 5, 2024",Size: LargeColor: Brown,Verified Purchase,"Needed some casual pants for everyday. These are great, They fit just like I want them to, like the photos, and they're very comfortable. The pockets are deep enough that I won't lose what I put in them, and they shipped very fast! Ordering more!",
Wendy,Short,https://www.amazon.com/gp/customer-reviews/R3Q6OH5TRDMPK9/ref=cm_cr_getr_d_rvw_ttl?ie=UTF8&ASIN=B0CCJ4BJ2G,"4.0 "," the United States "," May 21, 2024",Size: LargeColor: Black,Verified Purchase,"I’m 5’5” and these are really short.  Also as another reviewer pointed out, no drawstring to tighten waist as I am loosing weight. I am keeping, but won’t be able to wear long as I loose my weight.",
Murderess Marbie,TTS. Bought a large thinking because of my size 8 big butt I'd need bigger.,https://www.amazon.com/gp/customer-reviews/R2QI3OKZDLXSY8/ref=cm_cr_getr_d_rvw_ttl?ie=UTF8&ASIN=B0CCJ4BJ2G,"5.0 "," the United States "," October 15, 2021",,Verified Purchase,"First these aren't tights or joggers. It's in between. So I made the mistake of getting a size large instead of medium thinking I'd get a comfy style -like some comments suggested. I'm age 40. size 8. 29 waist. 5'6"" at 178 lbs, 41"" hips, but I carry muscle and a ton of extra butt and wide latina hips. So I can have major sizing issues. These fit perfectly on my mom who is size 10. 5'4"" 162lbs. 31 in jeans. Menopausal belly although she is a fit body type everywhere else. So I think go with your pants size rather than the baggy look. TTS if you're an hourglass figure. It does show cellulite but we both don't care about that. Because it's not much at all. She loved them. Soft smooth fabric, excellent quality, holds in the belly a bit and great stretch. Mom wants more colors now. I will see how the medium is on me and review those later. Loved how high the large went up, super high on the waist, so I hope it's the same, but, because I am an hourglass figure the waist width was a bit looser so it caused extra fabric to slide and bunch at the crotch & knees. Otherwise awesome. The color is boss. I LOVE muted lavenders and this is on the lighter side but perfect tone. Will definitely get a few of these for hiking in summer and for around the house. Also great stitching on seams. Strong hold and not tight or bulky at all. Only gripe is that it could be a bit longer on the ankles. And the camel toe seems to not be an issue unless you wear these really tight. But perfect nonetheless. If you're taller than me then these might get short on you but that's not a bad thing really.",38
