Avery,GET THESE!!!,https://www.amazon.com/gp/customer-reviews/R3QY0PY5MZTLXK/ref=cm_cr_getr_d_rvw_ttl?ie=UTF8&ASIN=B0CCJ4BJ2G,"5.0 "," the United States "," August 13, 2024",Size: LargeColor: Black,Verified Purchase,"Buy these!!! I am a personal trainer and have looked for years at all the name brand joggers trying to find a pair that is comfy, light weight, and actually fits my body right. I’m 5’4, athletic build, about 160 pounds. Small waist with a big booty. Joggers never fit me right!! I’m so obsessed with these, literally ordering more in different colors right now!!!  Only thing I’ll say, is to order whatever size leggings you would typically order for these pants. I typically order a medium, but like my joggers to fit a bit bigger, so I ordered up to a large. I do like the way they fit, however, I will be ordering mediums next. I happen to love the loose waistband, but a medium will fit me a little bit better.  Super soft, breathable, not see through, still gives good shape, and great quality for a really great price point!!",18
Donna M,Good Quality,https://www.amazon.com/gp/customer-reviews/R25YV35467HNBC/ref=cm_cr_getr_d_rvw_ttl?ie=UTF8&ASIN=B0CCJ4BJ2G,"3.0 "," the United States "," December 20, 2024",Size: MediumColor: Black,Verified Purchase,These joggers are well made and fit as expected. The material was on the thin side and did not look flattering on me so I returned them.,
Chrissy Obermeyer,Super soft and comfy,https://www.amazon.com/gp/customer-reviews/R1CB7Q5G7740VA/ref=cm_cr_getr_d_rvw_ttl?ie=UTF8&ASIN=B0CCJ4BJ2G,"4.0 "," the United States "," April 11, 2024",Size: MediumColor: Beige,Verified Purchase,"Based on Amazon’s recommendations of a small, I actually got a medium since another pair similar in style to this was too small, so I returned it, and got these- but sized up. I’m glad I did- I wanted the true jogger look of more oversized but not baggy. The waist is a tad bigger than I’d like, and the crotch is a little low- but do I want to pay Lululemon prices? Haha. I’m still deciding on whether to keep these or not, but the color is beautiful, the are soft, are on the thinner side, and definitely not true jogger material (think lululemon material that swishes when you walk)- but they are great for the price. Wear skin colored or super light colored undies with this ivory color for sure! (Just a tip!)",36
karen H.,Perfect!,https://www.amazon.com/gp/customer-reviews/RFFTD26JW19GB/ref=cm_cr_getr_d_rvw_ttl?ie=UTF8&ASIN=B0CCJ4BJ2G,"5.0 "," the United States "," November 12, 2024",Size: XX-LargeColor: Black,Verified Purchase,I have been looking for a pair of joggers in this material because it’s so durable. These are PERFECT! They do not hug the body too tight as leggings do. I’m getting them in every color!,3
Hunter Harper,Perfect,https://www.amazon.com/gp/customer-reviews/R5FMP2BFFKS38/ref=cm_cr_getr_d_rvw_ttl?ie=UTF8&ASIN=B0CCJ4BJ2G,"5.0 "," the United States "," September 12, 2024",Size: LargeColor: Olive Green,Verified Purchase,"These joggers fit so well, they are good quality material, and most importantly the waist is comfortable. Most joggers squeeze my waist and give a muffin top. There is no tight elastic waistband on these like others. I will be ordering more colors. The only con is they came to me smelling strongly of other woman perfume. Like maybe they had been washed and worn my someone? I washed them and the smell is still there but I will try vinegar next time. Only my first time washing and wearing so I cannot say about how they hold up over time. They are a legging material but with a fit like a jogger.",11
stacymae,Amazing lightweight joggers,https://www.amazon.com/gp/customer-reviews/R1LY3F8KO62H90/ref=cm_cr_getr_d_rvw_ttl?ie=UTF8&ASIN=B0CCJ4BJ2G,"5.0 "," the United States "," July 6, 2024",Size: X-LargeColor: Navy,Verified Purchase,"These joggers are perfect for ladies who don’t like wearing shorts in the gym. Super stretchy, and lightweight. Perfect for hot Texas summers. I love riding bikes or hiking in these. They look nice enough to wear out, I took a pair on my trip to Yellowstone and they were awesome there too. I might not wear these in cold climates or the winter but they were a great thin layering piece bundled up in my sleeping bag when it was freezing outside. Highly recommend.  Update: I still adore these pants but FYI they do seem to stretch out quite a bit. I’m ordering my third pair a size smaller so hopefully when they stretch out after a few wears they will fit the way I want them to. My first pair are now pretty saggy/ trying not to weigh my second pair down too much by putting heavy keys and my phone in my pockets like I did with my first pair.",3
Maria,Ehhh not what I was expecting,https://www.amazon.com/gp/customer-reviews/R54ZRDBFH7TAL/ref=cm_cr_getr_d_rvw_ttl?ie=UTF8&ASIN=B0CCJ4BJ2G,"3.0 "," the United States "," December 5, 2024",Size: MediumColor: Mauve Pink,Verified Purchase,"I was looking for warmer joggers to wear during fall and winter. However, these are not it, these are more like leggings, super stretchy, but not what I was expecting.",
Randi,Very comfortable,https://www.amazon.com/gp/customer-reviews/R3CSHLYZD9OXVG/ref=cm_cr_getr_d_rvw_ttl?ie=UTF8&ASIN=B0CCJ4BJ2G,"5.0 "," the United States "," November 26, 2024",Size: LargeColor: Olive Green,Verified Purchase,These pants are super soft and comfortable. be to wear all day without complaint.,
Ashley,Doesn’t attract pet hair!,https://www.amazon.com/gp/customer-reviews/R38QB54C1Y3RAV/ref=cm_cr_getr_d_rvw_ttl?ie=UTF8&ASIN=B0CCJ4BJ2G,"4.0 "," the United States "," June 15, 2024",Size: MediumColor: Black Camo,Verified Purchase,"Really love these pants, very comfortable and don’t collect pet hair. I have two cats, 1 long and short hair and minimally will the hair get caught in the fabric.  These joggers are also really comfortable. I’ve already purchased other colors.  Only downside is they can stretch a little and at 5’3” I wish there was a petite/short option for the length.  But again, great pants- wear them hiking, yoga and day to day!",
Amazon Customer,jogger is well made; fabric is soft and substantial. Love the fit and size .,https://www.amazon.com/gp/customer-reviews/R35KJELYG7HFBI/ref=cm_cr_getr_d_rvw_ttl?ie=UTF8&ASIN=B0CCJ4BJ2G,"5.0 "," the United States "," November 25, 2024",Size: MediumColor: Black Leopard,Verified Purchase,Love the overall design and fit. Use the jogger as my workout outfit.,
K,"Color not as described/listed, Lavender instead of Cosmic Blue",https://www.amazon.com/gp/customer-reviews/R27R1541PJWZ57/ref=cm_cr_getr_d_rvw_ttl?ie=UTF8&ASIN=B0CCJ4BJ2G,"3.0 "," the United States "," September 10, 2024",Size: MediumColor: Cosmic Blue,Verified Purchase,"These are OK, comfortable. I was drawn by the color shown and described as ""Cosmic Blue"". What I received is a lighter color, and the package label clearly says ""Lavender"". I thought it was a mistake, wrong item sent. So I put in a return request to be replaced with the correct item. Another package arrived, same label - ""Lavender"". I have returned the first one and am trying to decide if I'll keep the 2nd or not. Its not a bad color, but not what I expected.  Also to note: I checked out the 1st pair, the legs on it are a bit shorter than on the 2nd pair I rec'd, so the products seem inconsistent, so be careful.",7
Debrabennett,High waisted joggers,https://www.amazon.com/gp/customer-reviews/R43WEVEQ2745/ref=cm_cr_getr_d_rvw_ttl?ie=UTF8&ASIN=B0CCJ4BJ2G,"5.0 "," the United States "," November 23, 2024",Size: X-LargeColor: Black,Verified Purchase,"Love these pants, need in different colors, comfort, size, material thickness",
HP,Love these joggers,https://www.amazon.com/gp/customer-reviews/R3PGP8HGMC8G4H/ref=cm_cr_getr_d_rvw_ttl?ie=UTF8&ASIN=B0CCJ4BJ2G,"4.0 "," the United States "," November 30, 2023",Size: X-SmallColor: Navy,Verified Purchase,"I didn't want to spend money on Lululemon Align Joggers, and these looked fairly close. I've never worn Align joggers, but I just got some Lululemon Fast & Free leggings and the material is very similar. It's a bit shinier than it looks in the images here, the material is really comfortable and these probably the most comfortable and flattering joggers I've gotten from Amazon. I'm always trying to find a really cute and comfy pair and this is the best I've found. They do run big - I usually wear a Small, but bought an XS and there's still extra room and they're a bit loose, but not as much as most joggers. Besides looking and feeling good, my other main issue with most pants in the waist is too tight. I want comfort, not to feel like I'm being squeezed, and these are the only pants that have a waist that isn't too tight without also having overly baggy legs. I'll likely buy another pair in another color!",23
jackie wilson,Happy,https://www.amazon.com/gp/customer-reviews/R2JIEGO7OIPIMQ/ref=cm_cr_getr_d_rvw_ttl?ie=UTF8&ASIN=B0CCJ4BJ2G,"5.0 "," the United States "," October 30, 2024",Size: MediumColor: Dark Grey,Verified Purchase,"True to size. Very soft.  Length-right above angle. High rise waist. I’m 5’6”. I do not like leggings very much. These fit in between leggings and joggers. Not skin tight, but also not loose. Would buy again",
Bri J.,Fit great!,https://www.amazon.com/gp/customer-reviews/R2WB49A06RLOX6/ref=cm_cr_getr_d_rvw_ttl?ie=UTF8&ASIN=B0CCJ4BJ2G,"5.0 "," the United States "," October 20, 2024",Size: SmallColor: Olive Green,Verified Purchase,I love the fit of these! They are soft and so comfortable. Easy to dress up for a business casual look or wear as lounge wear. As a kindergarten teacher they allow for movement and keep me comfortable all day. The material is nice and thick as well so not see through!,3
Christine Heinrich,So Comfortable,https://www.amazon.com/gp/customer-reviews/R2L4GK5Y3R02L5/ref=cm_cr_getr_d_rvw_ttl?ie=UTF8&ASIN=B0CCJ4BJ2G,"5.0 "," the United States "," November 25, 2024",Size: X-LargeColor: Black,Verified Purchase,These pants are super comfortable and fit really well.,
Wandaful,Go-To Joggers in Every Color!,https://www.amazon.com/gp/customer-reviews/R3SDO9PK9NZ7KQ/ref=cm_cr_getr_d_rvw_ttl?ie=UTF8&ASIN=B0CCJ4BJ2G,"5.0 "," the United States "," September 4, 2024",Size: MediumColor: Black,Verified Purchase,"These joggers are hands down my favorite! I have them in two colors, and I wear them all the time. The comfort level is off the charts—soft, cozy, and perfect for lounging or running errands. The fit is amazing, with a flattering cut that isn’t too tight or too loose.  I got my true size, and they fit perfectly, so no need to size up or down. They hold up great in the wash, and the quality is excellent. If you’re looking for joggers that combine style, comfort, and a perfect fit, these are a must-have!",22
HM53,Sizing is off,https://www.amazon.com/gp/customer-reviews/RKLTHIJ7SWKQO/ref=cm_cr_getr_d_rvw_ttl?ie=UTF8&ASIN=B0CCJ4BJ2G,"3.0 "," the United States "," October 31, 2024",Size: XX-LargeColor: Black,Verified Purchase,I usually like my Ggradual leggings but there’s something off in the sizing of this pair. I’m 186# 5’6” and ordered up to XXL because of the Sizing Chart. The XXL waist band is very loose and I think it may stretch more as it’s worn. Will probably return them.,
Val,Loves the material,https://www.amazon.com/gp/customer-reviews/R2NY74N19CTW24/ref=cm_cr_getr_d_rvw_ttl?ie=UTF8&ASIN=B0CCJ4BJ2G,"5.0 "," the United States "," November 20, 2024",Size: SmallColor: White,Verified Purchase,True to size - fit great - loved the white,
JAC,True to size,https://www.amazon.com/gp/customer-reviews/R3M4DOYZG8E1OA/ref=cm_cr_getr_d_rvw_ttl?ie=UTF8&ASIN=B0CCJ4BJ2G,"5.0 "," the United States "," November 23, 2024",Size: XX-LargeColor: Black,Verified Purchase,"Love them, very lightweight n comfy",
Fathom,I love these,https://www.amazon.com/gp/customer-reviews/RU5YTTLTHFI9L/ref=cm_cr_getr_d_rvw_ttl?ie=UTF8&ASIN=B0CCJ4BJ2G,"5.0 "," the United States "," October 9, 2023",Size: SmallColor: Maroon,Verified Purchase,"I am in love with these joggers as well as another pant by Gradual that I use as work pants! I never have issues with the other pant I get, but these the sizing are always a guess. In the joggers, I have 5 pairs in them. I will say sizing is off constantly, you may need to buy then send back and re order. I usually wear a 10-12 in jeans, 8-12 in work pants. In these joggers I tried the small and medium; the small were so tight it was like leggings. I liked the lose fit of the medium, I kept them before recognizing they constantly fall down and I can’t have things in my pocket otherwise they fall right off. I usually wear these just for errands or bloated days. Reading more reviews, giving it 3 months, I ordered three more in size small. One fit perfectly, the other two were so small I sent them back. Waited a few weeks then ordered two in size small, got them today and they both fit perfectly! Ordering two more right now in the last colors.  These joggers are great and super versatile. You can have them as lounge/errands, as adventure days (I wear these hiking, kayaking, long boarding), the solid colors I have: I wear with my work tops/blouses for a more polished look, even adding a blouse with cardigan and dress shoes to run to the office. My favorite is wearing them high waisted with crop tops & sneakers for an easy weekend outfit that fits all the tasks/situations.",19
Miroslava,Super soft,https://www.amazon.com/gp/customer-reviews/R13W75IG90WV3Y/ref=cm_cr_getr_d_rvw_ttl?ie=UTF8&ASIN=B0CCJ4BJ2G,"5.0 "," the United States "," November 9, 2024",Size: LargeColor: Dusty Blue,Verified Purchase,Very comfortable joggers made of super soft and stretchy material . They fit true to size and are lightweight. I will buy more.,
Shannon,True to size fit,https://www.amazon.com/gp/customer-reviews/R3ABSHKMHMLTNU/ref=cm_cr_getr_d_rvw_ttl?ie=UTF8&ASIN=B0CCJ4BJ2G,"4.0 "," the United States "," June 5, 2024",Size: MediumColor: Cosmic Blue,Verified Purchase,These are soft and very comfortable. My only complaint is the leg length. It is a me problem though because I have long legs so it is hard to get something long enough. They land above my ankles and I like them to be a bit longer. I bought them in black as well and love them both. Easy to wash and dry. Live the pockets!,
Karla Waters,Buy them,https://www.amazon.com/gp/customer-reviews/R1X3GHIKY2PGL1/ref=cm_cr_getr_d_rvw_ttl?ie=UTF8&ASIN=B0CCJ4BJ2G,"5.0 "," the United States "," November 18, 2024",Size: SmallColor: Dark Grey,Verified Purchase,Love these.  Now have 3 pair and my favorite comfy pants,
Kelly Perry,So soft,https://www.amazon.com/gp/customer-reviews/R3OPL55J6417H8/ref=cm_cr_getr_d_rvw_ttl?ie=UTF8&ASIN=B0CCJ4BJ2G,"5.0 "," the United States "," October 24, 2024",Size: SmallColor: Black,Verified Purchase,These are so comfortable and fits perfectly. I could have gotten an extra small run a bit big. I got a small Love them and we’ll be getting another pair in a different color.,
Donna j evans,"Nice material, run big",https://www.amazon.com/gp/customer-reviews/R3VXT2S3DX868L/ref=cm_cr_getr_d_rvw_ttl?ie=UTF8&ASIN=B0CCJ4BJ2G,"4.0 "," the United States "," July 25, 2024",Size: SmallColor: Brown,Verified Purchase,I usually wear a medium 6 but ordered these in a small and still too big. Wish they would have worked. Very comfy and cute,
levis2go,Happy w purchase,https://www.amazon.com/gp/customer-reviews/RMIUUWXNKWE4U/ref=cm_cr_getr_d_rvw_ttl?ie=UTF8&ASIN=B0CCJ4BJ2G,"5.0 "," the United States "," September 28, 2024",Size: SmallColor: Maroon,Verified Purchase,"These are nice.  They are soft, stretchy and comfortable as advertised.I'm happy with my purchase.  I ordered a medium and a small and kept the small. I think if you are in between sizes you could size down because of the stretch.  They are a little more fitted though like a legging fit.",
christina,Good fit but length is not accurate,https://www.amazon.com/gp/customer-reviews/RASUH4B8N2LLF/ref=cm_cr_getr_d_rvw_ttl?ie=UTF8&ASIN=B0CCJ4BJ2G,"4.0 "," the United States "," July 18, 2024",Size: X-SmallColor: Black,Verified Purchase,"The fit is good, waist and hip measurement guide is accurate however the length is 30” at best which is ok as an above the ankle jogger.",3
Mandrake's girl,Confortable jogs,https://www.amazon.com/gp/customer-reviews/R2FMHCEGUDA8G8/ref=cm_cr_getr_d_rvw_ttl?ie=UTF8&ASIN=B0CCJ4BJ2G,"4.0 "," the United States "," June 22, 2024",Size: X-SmallColor: Dark Grey,Verified Purchase,Like them a lot but I’m very petite and lean and found them a bit loose and the material a bit thin! The sawing seem in the back of the pants started to shed very quickly after using one time! Save the loose material and look like new!,
Miss Ann B,10 out of 5 stars!!!,https://www.amazon.com/gp/customer-reviews/RE4JJSJ7PMAOA/ref=cm_cr_getr_d_rvw_ttl?ie=UTF8&ASIN=B0CCJ4BJ2G,"5.0 "," the United States "," September 21, 2024",Size: SmallColor: Black Camo,Verified Purchase,"I would truly give these joggers 10 stars, they are the best athleisure wear I’ve ever owned. The fit is amazing, I love that they are pull on vs. a drawstring waist and the front is flat. Incredibly comfortable, they are perfect for travel in any climate. The material is buttery soft. I plan on purchasing these in every color!!",
Megan,The perfect joggers!,https://www.amazon.com/gp/customer-reviews/R3L1K5QQ4N8K6P/ref=cm_cr_getr_d_rvw_ttl?ie=UTF8&ASIN=B0CCJ4BJ2G,"5.0 "," the United States "," October 11, 2024",Size: MediumColor: Black,Verified Purchase,"In the last week, I’ve bought these joggers in 3 different colors because I love them so much! The waist band is super comfy and doesn’t fit uncomfortably or give you muffin top. They’re perfectly sized and adorable for fall!",
M. Meyers,Love these travel pants!,https://www.amazon.com/gp/customer-reviews/R1E5WYXJ3PXON7/ref=cm_cr_getr_d_rvw_ttl?ie=UTF8&ASIN=B0CCJ4BJ2G,"5.0 "," the United States "," September 8, 2024",Size: MediumColor: Black,Verified Purchase,"The best travel pants I’ve ever worn. I wore these on 8 hour plane rides, walked all over France,  washed and hang dried them twice. Super light weight for summer travel.  Great with tennis shoes or flats. I have long legs and they came down about an inch above my ankles.  They are not too baggy and not to tight. Perfect.  I ordered another pair for the trip in olive green.",2
SG,Ordering more!,https://www.amazon.com/gp/customer-reviews/R3A233OTSUNBG3/ref=cm_cr_getr_d_rvw_ttl?ie=UTF8&ASIN=B0CCJ4BJ2G,"5.0 "," the United States "," November 8, 2024",Size: X-LargeColor: Black Tie Dye,Verified Purchase,Great value. Good fit for a tall person. Comfortable active or lounge wear.,
Gigi's Boys,Comfy & cute,https://www.amazon.com/gp/customer-reviews/R2MZCHXMT3GJEI/ref=cm_cr_getr_d_rvw_ttl?ie=UTF8&ASIN=B0CCJ4BJ2G,"5.0 "," the United States "," October 21, 2024",Size: LargeColor: Dark Grey,Verified Purchase,I ordered 2 pairs of these and I really like them.  They are comfortable and cute but not thick so I don't think I'd wear them in real cold weather!!!,
Emma,Great fit and super comfortable!,https://www.amazon.com/gp/customer-reviews/R1L912Z90CLZX6/ref=cm_cr_getr_d_rvw_ttl?ie=UTF8&ASIN=B0CCJ4BJ2G,"5.0 "," the United States "," October 13, 2024",Size: MediumColor: Black,Verified Purchase,"The material is so soft and comfortable. The fit is perfect (5'6"" - 140 lbs, got a medium). I love the hybrid yoga/joggers style, it's not too tight or too loose, and the pockets are so convenient!",
Jo,Good fit but not light weight,https://www.amazon.com/gp/customer-reviews/R37MW6LJ4UISQR/ref=cm_cr_getr_d_rvw_ttl?ie=UTF8&ASIN=B0CCJ4BJ2G,"4.0 "," the United States "," June 25, 2024",Size: XX-LargeColor: Black,Verified Purchase,I was looking for something for summer hiking. They aren’t breathable. I will wear them in the fall or spring. The fit is a bit bigger than I anticipated but they are comfortable. Easy care. Nice pockets. The material is polyester and spandex.,11
Kelly ward,Leggings,https://www.amazon.com/gp/customer-reviews/R9L32JOZFKYJW/ref=cm_cr_getr_d_rvw_ttl?ie=UTF8&ASIN=B0CCJ4BJ2G,"3.0 "," the United States "," October 12, 2024",Size: X-SmallColor: Savannah Red,Verified Purchase,I really wanted this color. Color was great! But size was a bit too large.  They only offered a small and I usually wear an extra small but the measurements listed seemed to be ok. But they are just a little too large,
Amazon Customer,Look great on plus size!,https://www.amazon.com/gp/customer-reviews/R2HT7Z853W77NK/ref=cm_cr_getr_d_rvw_ttl?ie=UTF8&ASIN=B0CCJ4BJ2G,"5.0 "," the United States "," November 7, 2024",Size: X-LargeColor: Grey Sage,Verified Purchase,These are so comfortable and flattering! I absolutely love them!,
lilhoney,Great Pair of Jogging Pants,https://www.amazon.com/gp/customer-reviews/R1E2ACAT4OBPA/ref=cm_cr_getr_d_rvw_ttl?ie=UTF8&ASIN=B0CCJ4BJ2G,"5.0 "," the United States "," October 2, 2024",Size: SmallColor: White,Verified Purchase,"Needed a white pant and did not want a legging or jeans. Comfortable jogger, lightweight and nice material.  I think they’re too nice to workout in but a great dress down pant. (My opinion).  Will purchase another pair.",4
Number1Gal,Just What I Was Looking for,https://www.amazon.com/gp/customer-reviews/RHCF1YJZYUMWJ/ref=cm_cr_getr_d_rvw_ttl?ie=UTF8&ASIN=B0CCJ4BJ2G,"5.0 "," the United States "," August 13, 2023",Size: X-LargeColor: Navy,Verified Purchase,"I bought these 4 weeks post op and still unable to wear a regular waistband.  I've been living in a couple good pairs of leggings, but I don't like wearing leggings in public.  These joggers are nice quality.  It may sound odd, but the fabric makeup is almost like a thicker swimsuit.  I think they run true to size (maybe a bit bigger), but I sized up so I could have something more slacks-like just with the high waist and they were exactly as I wanted.  A couple things to note on fit: I'm 5' 3.5"" and wear size 12 (or Large) pant .  The bulk of my 145lbs in hip/thigh so the XL waist is really baggy, causing the crotch to sag a bit.  Not a big issue for me since I'm not using them for working out.  I may have still been able to have some room in a Lg, but I'm quite happy with this overall. Length for me is comparable to jeans and do not balloon at the ankle.  I wouldn't want them any longer, though.",8
C. Russell,Love!!,https://www.amazon.com/gp/customer-reviews/RY641A2NQWXA1/ref=cm_cr_getr_d_rvw_ttl?ie=UTF8&ASIN=B0CCJ4BJ2G,"5.0 "," the United States "," November 12, 2024",Size: MediumColor: Cosmic Blue,Verified Purchase,"Very cool, comfortable material! True to size.",
KristiKC,Almost Perfect - but too short,https://www.amazon.com/gp/customer-reviews/R350M6KL0S69VB/ref=cm_cr_getr_d_rvw_ttl?ie=UTF8&ASIN=B0CCJ4BJ2G,"4.0 "," the United States "," March 27, 2024",Size: X-SmallColor: Navy,Verified Purchase,"I love the comfort and fit of these joggers, except for the length! The material is soft, they are flattering, but the leg length is just a little too short - which I think is an acceptable look but as a baseball mom, if it is cool enough for pants, I want my legs covered.",4
pj,Lightweight for Zumba,https://www.amazon.com/gp/customer-reviews/RC0HPBZJZMCF7/ref=cm_cr_getr_d_rvw_ttl?ie=UTF8&ASIN=B0CCJ4BJ2G,"5.0 "," the United States "," November 1, 2024",Size: MediumColor: Black,Verified Purchase,"5’8”, 150 lbs. ordered XL cuz didn’t want skin-tight fit. Cut is flattering and fitted, fabric lightweight.",
Alise B.,So comfortable!,https://www.amazon.com/gp/customer-reviews/R3DER1B5U22OYG/ref=cm_cr_getr_d_rvw_ttl?ie=UTF8&ASIN=B0CCJ4BJ2G,"4.0 "," the United States "," June 18, 2024",Size: MediumColor: Black,Verified Purchase,Great versatile pant! Easy to Dress up or dress down. Would size down runs a little big!,
LD,So comfy!,https://www.amazon.com/gp/customer-reviews/RLC81B202LFRX/ref=cm_cr_getr_d_rvw_ttl?ie=UTF8&ASIN=B0CCJ4BJ2G,"4.0 "," the United States "," March 9, 2024",Size: LargeColor: Black,Verified Purchase,"I ordered these on a whim because the price was great. I’m tall (5’11), so pants rarely fit me purchasing online. These might be the comfiest pants I own!!!  The waistband is not tight and the fabric is very flattering. I didn’t give 5 stars because they are maybe a tad short for my long legs and definitely not for cold weather (however, both these complaints are more just a “me” thing:)). Even with those 2 complaints I am keeping them and plan to wear often!",9
ben,Poor fabric,https://www.amazon.com/gp/customer-reviews/R24Z1PKOPAIDBC/ref=cm_cr_getr_d_rvw_ttl?ie=UTF8&ASIN=B0CCJ4BJ2G,"3.0 "," the United States "," October 18, 2024",Size: MediumColor: Light Grey,Verified Purchase,"Poor fabric, and pilling happened after wearing for a very short time.",
Kyle A. Branch,Love these!,https://www.amazon.com/gp/customer-reviews/R94EXWSU2DPZO/ref=cm_cr_getr_d_rvw_ttl?ie=UTF8&ASIN=B0CCJ4BJ2G,"5.0 "," the United States "," September 14, 2024",Size: MediumColor: Black Leopard,Verified Purchase,"These are so cute! They’re a great thicker quality material and shiny but not a tacky shiny if that makes sense. I got so many compliments on them at work. They washed and dried without shrinking or wrinkling. They’re true to size. I bought a medium and I’m 5’6, 155 lbs.",
WSH3584,Stretch ad Conmort,https://www.amazon.com/gp/customer-reviews/R3UO6EJO3T0LM3/ref=cm_cr_getr_d_rvw_ttl?ie=UTF8&ASIN=B0CCJ4BJ2G,"4.0 "," the United States "," May 15, 2024",Size: LargeColor: Dark Grey,Verified Purchase,Not the pants I thought I had ordered but they are very comfortable and lots of leg room. I live in Tick country (NH) so I never wear shorts. These pants are light enough for hiking on warm days and they dry quickly. The ankle cuffs are super comfortable and I wear high socks.,
