评论用户,评论概述,评论链接,星级评分,评论地点,评论时间,类型,是否购买,评论详情,觉得该评论有帮助的人数
Mo,Cute & Comfortable!,https://www.amazon.com/gp/customer-reviews/RM667UK6R47HM/ref=cm_cr_arp_d_rvw_ttl?ie=UTF8&ASIN=B0CCJ4BJ2G,"5.0 "," the United States "," December 27, 2024",Size: SmallColor: Black,Verified Purchase,"These are by far my go to joggers.  The waist is not tight at all but still hold my menopausal belly in which I love.  They fit loose and comfortable.  I would recommend to size down one.  I’m usually a Medium in most joggers.  I have washed and worn these ton with no pilling. I am 5’2, 145lbs and I got the small.",8
catherine palm,Amazing joggers,https://www.amazon.com/gp/customer-reviews/RI7EHQM3SD090/ref=cm_cr_arp_d_rvw_ttl?ie=UTF8&ASIN=B0CCJ4BJ2G,"5.0 "," the United States "," January 5, 2025",Size: MediumColor: Black,Verified Purchase,"The waist band is completely smooth, which is perfect and flattering. Other joggers have an elastic band around the top but these use a compression stretch. Nice fabric and very thick. Highly recommend Also, get your usual size. I ordered a medium and then a small. The small fit better, they may run a tad large even.",3
Alex G.,Very comfortable but waist is inconsistent,https://www.amazon.com/gp/customer-reviews/RMD90ZT4LYNXU/ref=cm_cr_arp_d_rvw_ttl?ie=UTF8&ASIN=B0CCJ4BJ2G,"4.0 "," the United States "," November 26, 2024",Size: LargeColor: Brown,Verified Purchase,I have a few pairs of these pants and I really love to wear them to workout and to the airport. They do not slide down but the sizing is very off. The legs fit but the elastic in the same size with different pairs does vary. Some are made larger and smaller than others (I guess this is amazon fashion?)  They wash well and are not too oversized for when I take barre/pilates classes. They are especially great for the certain days out of the month that I do not want to wear very tight pants to workout.,5
K. Henry,Amazing so far!,https://www.amazon.com/gp/customer-reviews/R2Q037JDVV6D9B/ref=cm_cr_arp_d_rvw_ttl?ie=UTF8&ASIN=B0CCJ4BJ2G,"5.0 "," the United States "," January 9, 2025",Size: LargeColor: Black Leopard,Verified Purchase,"It's only my first day wearing these (in black/animal print), but I've tried what seems like ALLLLL the joggers and leggings out there, so I have a pretty good idea of what works for me or not. I'm 5'6 and they hit just above the ankle, which I like. They're relaxed in the legs but not the the point of being Hammer pants. They actually have more of a tailored look. The waistband is high and not restrictive. It rolled down a bit when I was sitting, but that was easy to fix-- I'd rather have that than a too-tight waistband that digs in or gives me extra rolls around my midsection. The shiny animal print is SO CUUUUUUTE! Can definitely dress them up or down. This morning I wore them out with a collared shirt and sweater, and this afternoon I'm wearing them around the house with a black half-zip sweatshirt. Both look great. It's below freezing in Chicago today, and with a long coat they're fine for going from your car to a building and back. Would wear for running a few errands, but not for extended time outside (like walking from the train to work). I'm hoping these will be a new staple for Fall/Winter/Spring, and maybe on less hot summer days.",
dog lover,Sized down for proper fit,https://www.amazon.com/gp/customer-reviews/R2D8AT9LA58374/ref=cm_cr_arp_d_rvw_ttl?ie=UTF8&ASIN=B0CCJ4BJ2G,"3.0 "," the United States "," December 12, 2024",Size: LargeColor: Black Camo,Verified Purchase,"Like others have mentioned, Amazon recommended a Large but I had to return it and order medium. The medium fit perfectly but after all day wear, it tends to slide down so expect adjustments. I ordered the black cammo and it's buttery soft. I'm 5'4"" and the medium is a perfect length whereas the large was too long.",
Pam Dickert,Soft and stretchy,https://www.amazon.com/gp/customer-reviews/R21L50ZO1CA0T2/ref=cm_cr_arp_d_rvw_ttl?ie=UTF8&ASIN=B0CCJ4BJ2G,"5.0 "," the United States "," October 18, 2024",Size: MediumColor: Navy,Verified Purchase,"Very nice joggers. Super soft and stretchy! As far as sizing. I’ve ordered an extra small, small and medium which all fit. The mediums are just slightly loose in the thigh. The reason I’m ordering the different sizes is I think they run short in the length and I was trying to get them longer without compromising the fit.",10
Megan Sullins,SO COMFORTABLE,https://www.amazon.com/gp/customer-reviews/R520SKKU7LCEZ/ref=cm_cr_arp_d_rvw_ttl?ie=UTF8&ASIN=B0CCJ4BJ2G,"5.0 "," the United States "," January 8, 2025",Size: MediumColor: Maroon,Verified Purchase,"I am the first to admit that I thought joggers looked ridiculous. I absolutely hate when my son wears them. But I saw an influencer wearing these and pairing them with a cute pair of sneakers and a sweater so I decided to give them a try. I love how they fit. I love the elastic waistband. They are not baggy, but very slimming. I am usually a large and purchased a M for that slim fit.",2
Snab468,Ultimate Comfort and Style!,https://www.amazon.com/gp/customer-reviews/R1WVKFNO305CR8/ref=cm_cr_arp_d_rvw_ttl?ie=UTF8&ASIN=B0CCJ4BJ2G,"4.0 "," the United States "," July 23, 2024",Size: SmallColor: Black,Verified Purchase,"I recently tried the G Gradual Women's Joggers, and they have been amazing! These high-waisted yoga pants are perfect for everything from workouts to lounging around. The material is soft and breathable, making them super comfortable for any activity.  The pockets are a fantastic addition, providing enough space to carry essentials like my phone and keys. The high waist offers great support and stays put during workouts, while the loose leggings give a relaxed fit without being too baggy.  These joggers are versatile and stylish, making them a great addition to any wardrobe. Whether I'm hitting the gym, running errands, or just chilling at home, these pants are my new favorite. Highly recommend the G Gradual Women's Joggers for their comfort, practicality, and style!  The only reason I gave 4 stars is because after wearing them.for a while they seem to stretch out a little around the waist. Maybe ordering a size down would do the trick.",17
Brittany,"Great texture, lightweight but really baggy",https://www.amazon.com/gp/customer-reviews/R2570NEAKLDKXX/ref=cm_cr_arp_d_rvw_ttl?ie=UTF8&ASIN=B0CCJ4BJ2G,"4.0 "," the United States "," January 17, 2025",Size: MediumColor: Cosmic Blue,Verified Purchase,I love the feel and weight of these pants. They’re super stretchy which I love HOWEVER they run big! I’m typically a large in yoga pants and ordered a medium in these. Going to return and get a small instead.  They’re baggy around stomach band and very baggy around thighs.,
Donna Darnold,Very comfortable,https://www.amazon.com/gp/customer-reviews/R3308EK40AO825/ref=cm_cr_arp_d_rvw_ttl?ie=UTF8&ASIN=B0CCJ4BJ2G,"5.0 "," the United States "," January 14, 2025",Size: X-LargeColor: Pink,Verified Purchase,"Yes I like these. They fit well with exception to leg length… they were a little too long for me, but I’m 5’2”. I altered them myself. I plan on buying more though in different colors. Love them..they are comfy.",
Amazon Customer,So comfy!,https://www.amazon.com/gp/customer-reviews/R3VFPDL7AQG904/ref=cm_cr_getr_d_rvw_ttl?ie=UTF8&ASIN=B0CCJ4BJ2G,"4.0 "," the United States "," August 21, 2024",Size: X-LargeColor: Black,Verified Purchase,"But I have to say I’m so tired of the size guides being so incredibly wrong!! I had to send these back because I measure 44” in my hips and according to the size guide I even needed to order bigger. Well I got an XL and while super soft and super comfy they were a bit bigger than I’m comfortable with in the waist and my waist measures around 37”, and slightly baggy in thigh bum area. YOU GUYS, the waist sizing doesn’t even go up that high on the inches chart. Seriously what’s the point if they aren’t even going to remotely be somewhat accurate. I have worked from home for the last 4.5 years and have gained a lot of weight, it’s bad enough not having cloths that fit but attempting to order based on the size charts acting like you’re much bigger than you are is down right insulting. My other main measurements just for anyone a similar size that I pray will read this, I stand right about 5’7” and I’m 165lbs. Please do not size up unless you really want super loose fitting. I do think I could have made the XL work provided I wasn’t intending on putting my phone in the pocket when taking my dogs out, however, since that is my intention and there’s no draw string I don’t think it would have been safe not for me, not for my neighbors! Lol to add insult to injury I have to wait to reorder a size large until I get back from an overnight trip with my mom, unfortunately my refund was processed too late in the day for me to get next day processing, I’m bummed! I was really hoping to take a new pair of cozy pants to the hot springs. Alas I shall have to wait, but please ladies I beg you don’t “follow” the chart like I did. I’ll try to add an update once I get the appropriate size.",8
TX Bag Lover,Love these ‘jogger’ style leggings,https://www.amazon.com/gp/customer-reviews/RLZB7LQR5MXM6/ref=cm_cr_getr_d_rvw_ttl?ie=UTF8&ASIN=B0CCJ4BJ2G,"5.0 "," the United States "," December 28, 2024",Size: SmallColor: Green Camo,Verified Purchase,"I’ve purchased these before in a size small and then again in size medium. I’m 5’8” tall, 130 pounds. I prefer the more snug fit of the small actually, but the mediums are quite comfortable too. They’re just more loose. I bought the mediums hoping they would be longer, but they are only about a 1/2 inch longer so it didn’t make a huge difference.",
Amazon Customer,soft but wrinkles,https://www.amazon.com/gp/customer-reviews/R2P9GRTTOC7FH3/ref=cm_cr_getr_d_rvw_ttl?ie=UTF8&ASIN=B0CCJ4BJ2G,"4.0 "," the United States "," January 17, 2025",Size: LargeColor: Deep Lavender,Verified Purchase,nice quality,
Michael Dagostino,Great fit,https://www.amazon.com/gp/customer-reviews/R39ZNNN5LRW3QB/ref=cm_cr_getr_d_rvw_ttl?ie=UTF8&ASIN=B0CCJ4BJ2G,"4.0 "," the United States "," December 28, 2024",Size: MediumColor: Black,Verified Purchase,I wish these were of a thicker material otherwise they are perfect.,
kaseywren,Love the fit not the color.,https://www.amazon.com/gp/customer-reviews/R2GXSCUU2K2QAH/ref=cm_cr_getr_d_rvw_ttl?ie=UTF8&ASIN=B0CCJ4BJ2G,"4.0 "," the United States "," November 24, 2024",Size: LargeColor: Bright Grey,Verified Purchase,I love this brand! I have a couple different styles from them. This one is not my favorite. They are thinner than my others. I think if they were a darker color I may reach for them more often. Overall great fit and decent quality. Love the pockets! I would checkout their other items too,
sandy combs,Cute soft jogger leggings,https://www.amazon.com/gp/customer-reviews/RYKZWNNXQH7K6/ref=cm_cr_getr_d_rvw_ttl?ie=UTF8&ASIN=B0CCJ4BJ2G,"4.0 "," the United States "," November 27, 2024",Size: XX-LargeColor: Black,Verified Purchase,"Soft and cute. I ordered a XXL when a xl would've definitely fit me. I've lost weight and still struggling with what size I need to get,  but I also don't like anything super tight. They will do. If I order another pair I'll definitely get a xl.",
dawn hallmark,Fabric is lightweight,https://www.amazon.com/gp/customer-reviews/R2LVK1L2L6PYB4/ref=cm_cr_getr_d_rvw_ttl?ie=UTF8&ASIN=B0CCJ4BJ2G,"4.0 "," the United States "," December 11, 2024",Size: X-SmallColor: Navy,Verified Purchase,I was expecting the fabric to be thick and warm.  I will wear them to work out instead.,
Becky Neu,Excellent joggers,https://www.amazon.com/gp/customer-reviews/R2SPSEWKMFRD7G/ref=cm_cr_getr_d_rvw_ttl?ie=UTF8&ASIN=B0CCJ4BJ2G,"5.0 "," the United States "," January 17, 2025",Size: SmallColor: Blue,Verified Purchase,Fit is great and they are buttery soft!,
Eff Chynna,I liked these the best of the 5 different brands that I ordered,https://www.amazon.com/gp/customer-reviews/R2X7OA5HP95WC9/ref=cm_cr_getr_d_rvw_ttl?ie=UTF8&ASIN=B0CCJ4BJ2G,"4.0 "," the United States "," August 31, 2024",Size: SmallColor: Black,Verified Purchase,"BC they have the most comfortable, flattering fit, IMO. I am 5'5"", 125lbs; I am more of a ""ruler"" than an ""hourglass"". I wanted to replace some lyocell joggers that have faded and lose their shape after a few minutes of wear. I ordered Small from G Gradual and 4 other top jogger brands sold on Amazon. What sold me on this brand was the comfortable fit... after trying on all 5 brands several times, I started to appreciate that these G Gradual joggers *don't* have a thin elastic band inside at the top of the waist. The waistband is wide and smooth and stretchy like a yoga pant and it makes them so much more comfortable than those with elastic inside- I am often bloated thanks to colitis. The fit on the backside is more flattering with these. Note- they don't have a gathered, drawstring waist either, so it seems like a smoother, leaner fit- and No strings to loop in the front. I'm sending the other 4 back and ordering more G Gradual joggers in other colors. I hope they wash/wear well (fingers crossed)",8
Christina V. Robinson,Nice comfortable pants,https://www.amazon.com/gp/customer-reviews/R38B1CBGAHTG2E/ref=cm_cr_getr_d_rvw_ttl?ie=UTF8&ASIN=B0CCJ4BJ2G,"4.0 "," the United States "," November 22, 2024",Size: X-LargeColor: Black,Verified Purchase,These fit exactly as I hoped - higher waist and good pockets with not too tight or too baggy legs. Fitted at ankles. The fabric was a little thinner than I wanted but it’s still ok.,
Victoria Collings,Great,https://www.amazon.com/gp/customer-reviews/R3JVI1EEBVN8T7/ref=cm_cr_getr_d_rvw_ttl?ie=UTF8&ASIN=B0CCJ4BJ2G,"5.0 "," the United States "," January 14, 2025",Size: X-LargeColor: Olive Green,Verified Purchase,"Fit great, super comfortable and stylish",
Monica,Overall I like them!,https://www.amazon.com/gp/customer-reviews/RAU3L62RN98AF/ref=cm_cr_getr_d_rvw_ttl?ie=UTF8&ASIN=B0CCJ4BJ2G,"4.0 "," the United States "," July 19, 2024",Size: MediumColor: Black,Verified Purchase,"I was looking to buy a few joggers for an upcoming cruise and took a chance on these. I have trouble buying bottoms because my hips are bigger than the rest of me which can make pants really tight or draw attention to my hips.  I noticed right away that the pockets are placed perfectly and do not draw attention to my hips nor do they make my hips look bigger so right away I love that!  The material is nice but it does make noise when you walk. I like that the waistband is flat and doesn't have a string or anything but the waist band rolls down a bit which doesn't really show but I did not notice. Another thing because of the material, I noticed these joggers move a bit. If they were just a tad heavier in weight, they might not move but I am having to tug at them to put them back in place.  Good to have one pair but not ones I would buy multiples of. I am 5'2"", 145 lbs, pearshape figure and the medium fits me pretty well.",
Mandy B,Amazing,https://www.amazon.com/gp/customer-reviews/R2EOM6IXCFVPSI/ref=cm_cr_getr_d_rvw_ttl?ie=UTF8&ASIN=B0CCJ4BJ2G,"5.0 "," the United States "," January 4, 2025",Size: SmallColor: Black,Verified Purchase,These joggers are AMAZING - I love them. So comfy!!! True to size.,
virginia fields,Great fit,https://www.amazon.com/gp/customer-reviews/R1603DT9P1CISU/ref=cm_cr_getr_d_rvw_ttl?ie=UTF8&ASIN=B0CCJ4BJ2G,"5.0 "," the United States "," December 14, 2024",Size: LargeColor: Dark Grey,Verified Purchase,"I love these so much.  Great fit.  I bought a large.  I weigh. 135.  5'2"".  If I was taller they would be too short for my taste.  I love the pockets and the material is very comfortable.",
Brianna,Perfect Pants Postpartum,https://www.amazon.com/gp/customer-reviews/R2YMT0V9Z974BW/ref=cm_cr_getr_d_rvw_ttl?ie=UTF8&ASIN=B0CCJ4BJ2G,"4.0 "," the United States "," November 13, 2024",Size: MediumColor: Grey Sage,Verified Purchase,I need pants that were comfy and casual that weren’t leggings and these are perfect! I got a size medium and they were great.,
tbird,"Thin, stretchy material - I have several pairs!",https://www.amazon.com/gp/customer-reviews/R554GC57UFCJS/ref=cm_cr_getr_d_rvw_ttl?ie=UTF8&ASIN=B0CCJ4BJ2G,"5.0 "," the United States "," December 27, 2024",Size: LargeColor: Brown,Verified Purchase,These are great for shoulder seasons casual wear and for working out!,
Retrogal,Shiny and slick,https://www.amazon.com/gp/customer-reviews/R35KYS9ORG16JT/ref=cm_cr_getr_d_rvw_ttl?ie=UTF8&ASIN=B0CCJ4BJ2G,"4.0 "," the United States "," October 16, 2024",Size: LargeColor: Dark Grey,Verified Purchase,"The fabric was unexpected for me. It has a slight sheen and is very thin. I thought it would be slightly more fleece-like. The fit is fine. True to size.  I’ll keep it, but I wish there was something warmer and thicker.",4
Lisa G.,G Gradual Joggers: A Wardrobe Essential,https://www.amazon.com/gp/customer-reviews/ROTADJ6C4L1WQ/ref=cm_cr_getr_d_rvw_ttl?ie=UTF8&ASIN=B0CCJ4BJ2G,"5.0 "," the United States "," October 6, 2024",Size: MediumColor: Grey Sage,Verified Purchase,"G Gradual has consistently delivered high-quality and comfortable clothing, and their Women’s Joggers High Waisted Yoga Pants are no exception. These joggers are a must-have for any wardrobe, offering unmatched comfort and versatility.  Crafted from a soft and cozy fabric, these joggers feel like a gentle embrace. Their high waist and elastic waistband provide a snug and secure fit, ensuring they stay in place during even the most vigorous workouts or casual outings.  The loose-fitting design of these joggers makes them ideal for various activities. They can be effortlessly dressed with a stylish top and heels or kept casual with a t-shirt and sneakers. Their ability to transition seamlessly from the gym to brunch makes them a true wardrobe chameleon.  The lightweight fabric of these joggers makes them suitable for all seasons. They provide warmth during cooler months and remain breathable in warmer temperatures, making them a valuable addition to any closet.  G Gradual’s Women’s Joggers High-Waisted Yoga Pants are an exceptional investment in enhancing your wardrobe. Their unparalleled comfort, flattering fit, and versatile styling options make them a must-have for women of all ages and activity levels.",10
Robin,Very good except,https://www.amazon.com/gp/customer-reviews/RZF3CCJVDF4C5/ref=cm_cr_getr_d_rvw_ttl?ie=UTF8&ASIN=B0CCJ4BJ2G,"4.0 "," the United States "," September 24, 2024",Size: LargeColor: Black,Verified Purchase,I have a lot of troubl trying to find work out pants that fit me comfortably and these are a dream. They are so comfortable and I love them. Will be buying another color!  After ordering another pair and wearing these joggers to the gym I still like them but the waist does fall down enough that I find I'm constantly pulling them up which I really don't like.,3
Suzanne Cressell,Love these!,https://www.amazon.com/gp/customer-reviews/RIO9ZU3S2A00F/ref=cm_cr_getr_d_rvw_ttl?ie=UTF8&ASIN=B0CCJ4BJ2G,"5.0 "," the United States "," December 18, 2024",Size: SmallColor: Olive Green,Verified Purchase,Comfy for work or play. You can dress them up or down as wanted. So comfy and soft. True to size IMO,2
MJL,Currently my best pants,https://www.amazon.com/gp/customer-reviews/R2G1I1PCQVE8JJ/ref=cm_cr_getr_d_rvw_ttl?ie=UTF8&ASIN=B0CCJ4BJ2G,"5.0 "," the United States "," December 3, 2024",Size: SmallColor: Black Leopard,Verified Purchase,"They are so perfect. They look exactly like the promo photos. They fit well, and the fabric is thick. I'm very pleased. I usually wear Medium for bottom, but I followed everyone's suggestions and got a Small. It's perfect.",
Marlene,Comfort,https://www.amazon.com/gp/customer-reviews/R2OE73A1LV88E8/ref=cm_cr_getr_d_rvw_ttl?ie=UTF8&ASIN=B0CCJ4BJ2G,"4.0 "," the United States "," October 30, 2024",Size: LargeColor: Dark Grey,Verified Purchase,They are so soft and comfortable Gray is a good color I the wide waist. Ordering black next,
Keri Eversmann,Soft but shows flaws,https://www.amazon.com/gp/customer-reviews/RBC6AXPBB4TOH/ref=cm_cr_getr_d_rvw_ttl?ie=UTF8&ASIN=B0CCJ4BJ2G,"4.0 "," the United States "," October 25, 2024",Size: LargeColor: Black,Verified Purchase,The fit was OK but lighter material than I expected & would be for warmer weather.  Shows all your flaws.,
Terri Burress,Good quality,https://www.amazon.com/gp/customer-reviews/R1TY1AVFWGYM76/ref=cm_cr_getr_d_rvw_ttl?ie=UTF8&ASIN=B0CCJ4BJ2G,"5.0 "," the United States "," December 23, 2024",Size: X-SmallColor: Black,Verified Purchase,Very comfortable and fit great,
Diamar,A Flattering Yet Surprisingly Comfy Jogger!,https://www.amazon.com/gp/customer-reviews/R37JLV6UF5HUEJ/ref=cm_cr_getr_d_rvw_ttl?ie=UTF8&ASIN=B0CCJ4BJ2G,"4.0 "," the United States "," August 28, 2024",Size: MediumColor: Brown,Verified Purchase,"These joggers were such a pleasant surprise!  The brown color is perfect for a fall, and the cut of the joggers is flattering yet so comfy when you pull them on!  Not too baggy in the tush area, with a little bit more room in the legs for sitting and just hanging out.  Will definitely order another pair in black for the winter months!",
Sidney Shackelford,Runs short,https://www.amazon.com/gp/customer-reviews/R7X24FCJQD3OQ/ref=cm_cr_getr_d_rvw_ttl?ie=UTF8&ASIN=B0CCJ4BJ2G,"3.0 "," the United States "," January 6, 2025",Size: SmallColor: Navy,Verified Purchase,Ordered size small. I’m 5’6” and the pants were too short for me. It also runs small elsewhere (I am a USA size 2 and these fit in the waist/seat with no allowance for any weight gain). Seemed comfy otherwise.,
Deborah Keown,Love these,https://www.amazon.com/gp/customer-reviews/R17AT52PHYQG1M/ref=cm_cr_getr_d_rvw_ttl?ie=UTF8&ASIN=B0CCJ4BJ2G,"5.0 "," the United States "," December 8, 2024",Size: MediumColor: Black,Verified Purchase,I am 5’4” 137lbs. Bought a medium. Fit is PERFECT! Not clingy and VERY comfortable!,
MomOfThree,Just buy them! They are great!,https://www.amazon.com/gp/customer-reviews/R327T2O57CES07/ref=cm_cr_getr_d_rvw_ttl?ie=UTF8&ASIN=B0CCJ4BJ2G,"5.0 "," the United States "," November 13, 2024",Size: MediumColor: Black,Verified Purchase,"These are by far my most favorite pair of joggers. They look nice and can even be dressed up a bit. They are so comfortable and figure flattering. You can’t go wrong with them. Wish they made this exact style a thicker material for the winter months, but these are phenomenal.",
Cecilia Ferrara,Great jogger,https://www.amazon.com/gp/customer-reviews/R2TQT3R857MNK7/ref=cm_cr_getr_d_rvw_ttl?ie=UTF8&ASIN=B0CCJ4BJ2G,"5.0 "," the United States "," December 12, 2024",Size: SmallColor: Blue,Verified Purchase,Fits perfect great material very comfortable,
Marie clements,Perfect!,https://www.amazon.com/gp/customer-reviews/R127PNNU6APGGK/ref=cm_cr_getr_d_rvw_ttl?ie=UTF8&ASIN=B0CCJ4BJ2G,"5.0 "," the United States "," November 29, 2024",Size: X-LargeColor: Brown,Verified Purchase,"So comfortable! Now have one pair of every color! Dress up or down! Perfect for a retired, now substitute teacher!",
Johanna,The sizing for me was too big,https://www.amazon.com/gp/customer-reviews/R2O2IL0V8F5ZU6/ref=cm_cr_getr_d_rvw_ttl?ie=UTF8&ASIN=B0CCJ4BJ2G,"4.0 "," the United States "," August 17, 2024",Size: XX-LargeColor: Black,Verified Purchase,I usual wear a 16(Xxl) but these were too big and being 5ft too long.  They are comfortable and the quality of material is good. They are washable but I suggest tumble dry low or air dry. They are good for early fall or late spring but not mid winter or tropical summer.,4
Grant G.,Soft but pills,https://www.amazon.com/gp/customer-reviews/R1I1D5OGKRCWLS/ref=cm_cr_getr_d_rvw_ttl?ie=UTF8&ASIN=B0CCJ4BJ2G,"3.0 "," the United States "," January 4, 2025",Size: X-SmallColor: Black,Verified Purchase,Great- comfy and soft- but pills a lot after just 3 washes. Don’t think these will hold up long term.,
SHERRI LOGAN,Not for short ladies,https://www.amazon.com/gp/customer-reviews/R3TFMRRIGZ3SEB/ref=cm_cr_getr_d_rvw_ttl?ie=UTF8&ASIN=B0CCJ4BJ2G,"4.0 "," the United States "," September 18, 2024",Size: X-SmallColor: Grey Sage,Verified Purchase,Loved them but I’m 4”11 & they were too long bunched up around ankles. Had to return.,
dee ann rutens,High quality,https://www.amazon.com/gp/customer-reviews/R3C0WO5ADMWNOS/ref=cm_cr_getr_d_rvw_ttl?ie=UTF8&ASIN=B0CCJ4BJ2G,"5.0 "," the United States "," November 16, 2024",Size: X-LargeColor: Black,Verified Purchase,I rarely write reviews but had to for these. They are awesome. Very high quality and so comfortable.  The fit is perfect.  Lose enough to be flattering and comfortable but not baggy. Buy them!,2
JAM,Comfortable,https://www.amazon.com/gp/customer-reviews/R13AE0ARK2XTOB/ref=cm_cr_getr_d_rvw_ttl?ie=UTF8&ASIN=B0CCJ4BJ2G,"5.0 "," the United States "," November 26, 2024",Size: MediumColor: Black,Verified Purchase,"Love these joggers. Great fit size medium. Lightweight, I’m tall and they fit in the length and don’t roll at the waist. 👍",
