标题,详情
SUUKSESS Women 2 Piece Lounge Sets Going Out Y2K Foldover Pants Matching Pajamas,"Trending Y2k Lounge Sets: Two piece going out matching sets, Athleisure streetwear, Buttery soft pajama sets"
SUUKSESS Women 2 Piece Lounge Sets Going Out Y2K Foldover Pants Matching Pajamas,"Foldover Flare Pants: Classy foldover high waisted pants, Ruched flared pants, Bell bottom yoga pants"
SUUKSESS Women 2 Piece Lounge Sets Going Out Y2K Foldover Pants Matching Pajamas,"Crew Neck Basic Shirts: Short sleeve slim fit tops, Fitted full length crop tops, Casual loungewear tops"
SUUKSESS Women 2 Piece Lounge Sets Going Out Y2K Foldover Pants Matching Pajamas,"Occasions: Perfect as going out street wear, daily lounge wear, layering basic sets or sleep sets"
SUUKSESS Women 2 Piece Lounge Sets Going Out Y2K Foldover Pants Matching Pajamas,"Size: (Our size chart) XS=US 2, S=US 4, M=US 6, L=US 8, XL=US 10"
SUUKSESS Women 2 Piece Lounge Sets Going Out Y2K Foldover Pants Matching Pajamas,
